conversation_history	query	rewrited_query	answer	unique_idx	candidates
['turn 1: Set up a record for Will Smith at Bel-Air Productions, phone 415-333-1212. -> Will Smith’s contact added. See content://contacts/people/will_smith', 'turn 2: Open his details -> Loading Will Smith’s contact information: content://contacts/people/will_smith', 'turn 3: Call him. -> Initiating call to 415-333-1212...']	Add that number to my contacts	Add 415-333-1212 to my contacts	{'plan': 'ACTION_INSERT_CONTACT', 'arguments': {'contact_info': {'phone': '415-333-1212'}}}	ACTION_INSERT_CONTACT-427-ACTION_VIEW_CONTACT-1-dial-1-ACTION_INSERT_CONTACT-1	['ACTION_INSERT_CONTACT', 'ACTION_VIEW_CONTACT', 'ACTION_GET_RINGTONE', 'ACTION_OPEN_CONTENT', 'get_contact_info_from_uri']
['turn 1: Begin video shoot. -> Recording complete! The video is now available at content://device/videos/video123.mp4.', 'turn 2: Retrieve the full contact summary from /contacts/john_doe. -> Full summary for /contacts/john_doe:\nName: John Doe\nPhone: (555) 123-4567\nEmail: john.doe@contact.com\nAddress: 789 Oak Avenue, Springfield, IL', 'turn 3: Call him -> Initiating call to (555) 123-4567...']	Create a contact for this caller	Create a contact for (555) 123-4567	{'plan': 'ACTION_INSERT_CONTACT', 'arguments': {'contact_info': {'phone': '(555) 123-4567'}}}	ACTION_VIDEO_CAPTURE-757-get_contact_info-1_NR-dial-1-ACTION_INSERT_CONTACT-1	['play_music', 'get_contact_info_from_uri', 'open_settings', 'ACTION_SET_ALARM', 'ACTION_INSERT_CONTACT']
['turn 1: Add Lucas Wright to my address book with phone: 321-654-0987 and home address: 456 Maple Street. -> Creating Lucas Wright’s contact: phone 321‑654‑0987 and address 456 Maple Street are filled in.', 'turn 2: Dial him now -> Calling 321-654-0987 now...', 'turn 3: Display my recent call log -> Here’s your recent call log: Lucas Wright +1-321-654-0987 (Outgoing) – Today 9:15 AM; Sarah (Missed) +1-800-123-4567 – Today 8:30 AM; Mike Torres +44-20-7946-0958 (Incoming) – Yesterday 5:20 PM']	Save that missed number as a new contact Sarah Parker	Save +1-800-123-4567 as a new contact Sarah Parker	{'plan': 'ACTION_INSERT_CONTACT', 'arguments': {'contact_info': {'phone': '+1-800-123-4567', 'name': 'Sarah Parker'}}}	ACTION_INSERT_CONTACT-392-dial-1-ACTION_VIEW_CALL_LOG-1-ACTION_INSERT_CONTACT-1	['ACTION_SHOW_TIMERS', 'ACTION_VIEW_PLAYLIST', 'ACTION_CREATE_DOCUMENT', 'ACTION_INSERT_CONTACT', 'INTENT_ACTION_STILL_IMAGE_CAMERA']
"[""turn 1: Can you start playback of 'Thunderstruck'? -> Starting Thunderstruck now."", ""turn 2: Fetch a contact's postal details from my saved contacts. -> Sure thing! Let me pull up your address book. Please select a contact to view their postal details."", 'turn 3: Call 212-999-0000 -> Dialing 212-999-0000...']"	Save that number to my contacts	Save 212-999-0000 to my contacts	{'plan': 'ACTION_INSERT_CONTACT', 'arguments': {'contact_info': {'phone': '212-999-0000'}}}	play_music-1355-ACTION_PICK-1_NR-dial-1-ACTION_INSERT_CONTACT-1	['ACTION_INSERT_EVENT', 'ACTION_INSERT_CONTACT', 'INTENT_ACTION_VIDEO_CAMERA', 'send_message', 'ACTION_SET_RINGTONE']
['turn 1: Hit the number 033-4444-5555 for me. -> Ringing 033-4444-5555 now...', 'turn 2: Extract details from content URI contact://contact/line/@alice. -> LINE ID fetched: @alice.', 'turn 3: Give it a ring -> Initiating call to 033-4444-5555...']	Save that number	Save 033-4444-5555	{'plan': 'ACTION_INSERT_CONTACT', 'arguments': {'contact_info': {'phone': '033-4444-5555'}}}	dial-937-get_contact_info_from_uri-1_NR-dial-1-ACTION_INSERT_CONTACT-1	['ACTION_PICK', 'ACTION_INSERT_CONTACT', 'ACTION_VIEW_SENT_EMAILS', 'ACTION_SET_TIMER', 'ACTION_NAVIGATE_TO_LOCATION']
"[""turn 1: Fire up the device's default still camera application. -> Camera started in photo mode."", 'turn 2: Could you please retrieve the information detailed in contact://details/quincy? -> Details for Quincy: Quincy Adams – quincy.adams@example.org, +1‑212‑555‑0142.', 'turn 3: Call him -> Dialing +1‑212‑555‑0142...']"	Add that number to contacts as Robert Blake	Add +1‑212‑555‑0142 to contacts as Robert Blake	{'plan': 'ACTION_INSERT_CONTACT', 'arguments': {'contact_info': {'name': 'Robert Blake', 'phone': '+1‑212‑555‑0142'}}}	INTENT_ACTION_STILL_IMAGE_CAMERA-856-get_contact_info_from_uri-1_NR-dial-1-ACTION_INSERT_CONTACT-1	['ACTION_SET_ALARM', 'send_email', 'ACTION_INSERT_CONTACT', 'INTENT_ACTION_STILL_IMAGE_CAMERA', 'ACTION_OPEN_CONTENT']
['turn 1: Give me a summary of the contact at content://contacts/people/42. -> Here’s what I found:\n• Name: Michael Lee\n• Phone: 555-987-6543\n• Email: michael.lee42@example.com\n• Address: 321 Oak St, Centerville, OH 45459', 'turn 2: Call him -> Placing a call to 555-987-6543...', 'turn 3: Show me the recent call history -> Call history:\n1. 555-987-6543 (Outgoing) – Today 5:50 PM\n2. Jane Doe +1-415-555-3322 (Missed) – Today 2:30 PM\n3. Support +61-2-9374-4000 (Incoming) – Yesterday 8:00 AM']	Save that support number as a new contact Tech Support	Save +61-2-9374-4000 as a new contact Tech Support	{'plan': 'ACTION_INSERT_CONTACT', 'arguments': {'contact_info': {'name': 'Tech Support', 'phone': '+61-2-9374-4000'}}}	get_contact_info-970-dial-1-ACTION_VIEW_CALL_LOG-1-ACTION_INSERT_CONTACT-1	['ACTION_EDIT_VIDEO', 'dial', 'ACTION_CREATE_DOCUMENT', 'ACTION_PICK', 'ACTION_INSERT_CONTACT']
['turn 1: I need a contact summary for content://com.app.addressbook/contacts/404. -> Contact summary for content://com.app.addressbook/contacts/404: John Smith – Phone: 555-987-6543, Email: john.smith@domain.com, Address: 456 Oak Avenue, Metropolis, NY 10001.', 'turn 2: Retrieve additional info from contact://info/emergency. -> Here’s the emergency info: 911.', 'turn 3: Call it now. -> Calling 911...']	Add it as a contact with name Emergency Services	Add 911 as a contact with name Emergency Services	{'plan': 'ACTION_INSERT_CONTACT', 'arguments': {'contact_info': {'name': 'Emergency Services', 'phone': '911'}}}	get_contact_info-1011-get_contact_info_from_uri-1_NR-dial-1-ACTION_INSERT_CONTACT-1	['ACTION_VIEW_CONTACT', 'ACTION_EDIT_DOCUMENT', 'ACTION_INSERT_CONTACT', 'ACTION_PICK', 'ACTION_VIEW_EVENT']
['turn 1: Could you help me create a contact for Nolan Reed, email nolan.reed@workmail.org and work phone (415) 555-2737? -> Launching contact form for Nolan Reed: email and work phone ((415)\xa0555‑2737) have been filled.', 'turn 2: Call him now -> Connecting to (415) 555-2737...', 'turn 3: What does my call log look like? -> Your call history shows: Nolan Reed +1-415-555-2737 (Outgoing) - Today 2:05 PM; Unknown Caller +1-213-555-0199 (Missed) - Today 11:47 AM; Janet Kim +81-90-1234-5678 (Incoming) - Yesterday 7:30 PM']	Save that missed number as Alex Johnson	Save +1-213-555-0199 as Alex Johnson	{'plan': 'ACTION_INSERT_CONTACT', 'arguments': {'contact_info': {'name': 'Alex Johnson', 'phone': '+1-213-555-0199'}}}	ACTION_INSERT_CONTACT-394-dial-1-ACTION_VIEW_CALL_LOG-1-ACTION_INSERT_CONTACT-1	['ACTION_VIEW_CONTACT', 'get_contact_info', 'send_email', 'send_message', 'ACTION_INSERT_CONTACT']
"[""turn 1: Set up 'Gardening Meetup' June 8, 2024 at 10 AM to 12 PM at Community Garden, details: Planting season prep. -> Gardening Meetup (Planting season prep) scheduled for June\xa08,\xa02024 from 10:00\xa0AM to 12:00\xa0PM at Community Garden. Event URI: content://calendar/event/10"", ""turn 2: Please arrange a 'Coding Workshop' focused on Python at Tech Hub. The event is scheduled to run from 1700900000000 to 1700907200000. -> Your 'Coding Workshop' (Learning session focused on Python) is confirmed at Tech Hub from 1700900000000 to 1700907200000. Event URI: content://calendar/event/7"", 'turn 3: What’s the address for it? -> I’ve got Community Garden here: 256 Greenway Lane, Springfield, IL 62704.']"	Schedule a planting session there this Saturday from 9 AM to 11 AM titled 'Seed Starting' with description 'Begin seeds for community garden'.	Schedule a planting session at 256 Greenway Lane, Springfield, IL 62704 this Saturday from 9 AM to 11 AM titled 'Seed Starting' with description 'Begin seeds for community garden'.	{'plan': 'ACTION_INSERT_EVENT', 'arguments': {'TITLE': 'Seed Starting', 'DESCRIPTION': 'Begin seeds for community garden', 'EVENT_LOCATION': '256 Greenway Lane, Springfield, IL 62704', 'BEGIN_TIME': 1701517200000, 'END_TIME': 1701524400000}}	ACTION_INSERT_EVENT-485-ACTION_INSERT_EVENT-1_NR-search_location-1-ACTION_INSERT_EVENT-1	['get_contact_info', 'ACTION_OPEN_DOCUMENT', 'ACTION_SET_RINGTONE', 'ACTION_INSERT_EVENT', 'ACTION_VIEW_CALL_LOG']
['turn 1: Provide me the address details of contact content://contacts/people/333. -> Sure thing! The address for content://contacts/people/333 is 123 Maple Street, Springfield, IL 62704.', 'turn 2: What is the complete summary for the contact at /contacts/yolanda? -> Here’s a summary for Yolanda:\nName: Yolanda Martinez\nPhone: +1-312-555-0123\nEmail: yolanda.martinez@domain.com\nAddress: 456 Cedar Lane, Chicago, IL 60607', 'turn 3: Show that on a map -> Opening map to 456 Cedar Lane, Chicago, IL 60607 for you.']	Set a dentist appointment there on July 15 from 9 AM to 10 AM titled 'Dental Checkup' with the description 'Routine cleaning'	Set a dentist appointment at 456 Cedar Lane, Chicago, IL 60607 on July 15 from 9 AM to 10 AM titled 'Dental Checkup' with the description 'Routine cleaning'	{'plan': 'ACTION_INSERT_EVENT', 'arguments': {'TITLE': 'Dental Checkup', 'DESCRIPTION': 'Routine cleaning', 'EVENT_LOCATION': '456 Cedar Lane, Chicago, IL 60607', 'BEGIN_TIME': 1710522000000, 'END_TIME': 1710525600000}}	get_contact_info-1008-get_contact_info-1_NR-search_location-1-ACTION_INSERT_EVENT-1	['ACTION_OPEN_CONTENT', 'ACTION_SHOW_ALARMS', 'ACTION_VIEW_WEB_HISTORY', 'ACTION_VIEW_CALL_LOG', 'ACTION_INSERT_EVENT']
"['turn 1: Could you search for the location of the Acropolis in Athens, Greece? -> Sure thing! The Acropolis is located at ""Acropolis, Athens 105 58, Greece.""', ""turn 2: Create an event there on July 10 from 9 AM to 11 AM titled Project Review with description Discuss quarterly goals -> Your event 'Project Review' has been added to July 10, 2023, 9:00 AM–11:00 AM at Acropolis, Athens 105\xa058, Greece. content://calendar/event/201"", 'turn 3: Can you point me to it on the map? -> Marking Acropolis: Acropolis, Athens\xa0105\xa058, Greece on your map now.']"	Create a Sunset Shoot there this Saturday from 6 PM to 8 PM with description 'Capture evening light'	Create a Sunset Shoot at Acropolis, Athens 105 58, Greece this Saturday from 6 PM to 8 PM with description 'Capture evening light'	{'plan': 'ACTION_INSERT_EVENT', 'arguments': {'TITLE': 'Sunset Shoot', 'DESCRIPTION': 'Capture evening light', 'EVENT_LOCATION': 'Acropolis, Athens 105 58, Greece', 'BEGIN_TIME': 1712426400000, 'END_TIME': 1712433600000}}	search_location-1131-ACTION_INSERT_EVENT-1-search_location-1-ACTION_INSERT_EVENT-1	['INTENT_ACTION_VIDEO_CAMERA', 'get_contact_info_from_uri', 'ACTION_EDIT_CONTACT', 'ACTION_INSERT_EVENT', 'ACTION_OPEN_DOCUMENT']
"[""turn 1: Gift suggestions for mechanical engineers this Christmas. -> Opening search for 'gift ideas for mechanical engineers Christmas': Explore toolkits, desktop gadgets, and unique engineering-themed presents."", ""turn 2: I would like to set up an event titled 'Art Exhibition'. It's a public display of local art at Downtown Gallery from 1701100000000 to 1701103600000. -> Art Exhibition at Downtown Gallery has been scheduled from 1701100000000 to 1701103600000. Event URI: content://calendar/event/5"", 'turn 3: Can you find the address of it? -> Downtown Gallery is located at 789 Market St, Metropolis, NY 10001.']"	Add an event there next Monday at 3 PM to 4 PM titled 'Art Planning' with description 'Discuss exhibition layout'.	Add an event at 789 Market St, Metropolis, NY 10001 next Monday at 3 PM to 4 PM titled 'Art Planning' with description 'Discuss exhibition layout'.	{'plan': 'ACTION_INSERT_EVENT', 'arguments': {'TITLE': 'Art Planning', 'DESCRIPTION': 'Discuss exhibition layout', 'EVENT_LOCATION': '789 Market St, Metropolis, NY 10001', 'BEGIN_TIME': 1701508800000, 'END_TIME': 1701512400000}}	web_search-1348-ACTION_INSERT_EVENT-1_NR-search_location-1-ACTION_INSERT_EVENT-1	['ACTION_INSERT_EVENT', 'search_location', 'launch_application', 'send_message', 'INTENT_ACTION_VIDEO_CAMERA']
"[""turn 1: What's the street address of the Sydney Opera House? -> The Sydney Opera House is at Bennelong Point, Sydney NSW\xa02000, Australia."", ""turn 2: Add an event there for a concert tour on August\xa015th from\xa07\xa0pm to\xa09\xa0pm titled 'Opera House Concert' with description 'Attend evening performance'. -> Confirmation: 'Opera House Concert' set for August\xa015,\xa02023, 7:00\xa0PM–9:00\xa0PM at Bennelong Point, Sydney\xa0NSW\xa02000, Australia. content://calendar/event/205"", 'turn 3: Can you locate it on a map? -> Here you go: Bennelong Point, Sydney\xa0NSW\xa02000, Australia is on the map now.']"	Create a Sunset Concert there next Saturday from 6 PM to 8 PM with description Watch the sunset performance	Create a Sunset Concert at Bennelong Point, Sydney NSW 2000, Australia next Saturday from 6 PM to 8 PM with description Watch the sunset performance	{'plan': 'ACTION_INSERT_EVENT', 'arguments': {'TITLE': 'Sunset Concert', 'DESCRIPTION': 'Watch the sunset performance', 'EVENT_LOCATION': 'Bennelong Point, Sydney NSW 2000, Australia', 'BEGIN_TIME': 1713031200000, 'END_TIME': 1713049200000}}	search_location-1137-ACTION_INSERT_EVENT-1-search_location-1-ACTION_INSERT_EVENT-1	['ACTION_EDIT_VIDEO', 'ACTION_EDIT_ALARM', 'ACTION_INSERT_EVENT', 'ACTION_OPEN_CONTENT', 'INTENT_ACTION_STILL_IMAGE_CAMERA']
['turn 1: Show me a list of contact cards so I can pick one. -> Sure—here’s your contact list. Tap the card you’d like to select.', 'turn 2: Can you retrieve complete contact info for /directory/carmen? -> Sure thing! Here’s Carmen’s full contact card:\nName: Carmen Rodriguez\nPhone: +1-415-555-0199\nEmail: carmen.rodriguez@workmail.com\nAddress: 234 Elm Street, San Francisco, CA 94102', 'turn 3: Show it on a map -> Displaying 234 Elm Street, San Francisco, CA 94102 in Maps.']	Schedule a lunch there this Friday from 1 PM to 2 PM titled 'Team Lunch' with the description 'Discuss Q2 targets'	Schedule a lunch at 234 Elm Street, San Francisco, CA 94102 this Friday from 1 PM to 2 PM titled 'Team Lunch' with the description 'Discuss Q2 targets'	{'plan': 'ACTION_INSERT_EVENT', 'arguments': {'TITLE': 'Team Lunch', 'DESCRIPTION': 'Discuss Q2 targets', 'EVENT_LOCATION': '234 Elm Street, San Francisco, CA 94102', 'BEGIN_TIME': 1701378000000, 'END_TIME': 1701381600000}}	ACTION_PICK-531-get_contact_info-1_NR-search_location-1-ACTION_INSERT_EVENT-1	['ACTION_VIEW_WEB_HISTORY', 'ACTION_SET_TIMER', 'ACTION_VIEW_EVENT', 'open_settings', 'ACTION_INSERT_EVENT']
"[""turn 1: I'd like to view entry number 18 in my schedule. -> Lunch with Sarah: June 12, 2024 at 12:30 PM, Bistro Cafe."", 'turn 2: Get me the address details for the contact at /contacts/xavier. -> Xavier’s address: 456 Oak Road, Seattle, WA 98101.', 'turn 3: Open that location -> Launching Maps at 456 Oak Road, Seattle, WA 98101.']"	Create a study session there next Saturday from 2 PM to 4 PM titled 'Exam Prep' with the description 'Review chapters 5 and 6'	Create a study session at 456 Oak Road, Seattle, WA 98101 next Saturday from 2 PM to 4 PM titled 'Exam Prep' with the description 'Review chapters 5 and 6'	{'plan': 'ACTION_INSERT_EVENT', 'arguments': {'TITLE': 'Exam Prep', 'DESCRIPTION': 'Review chapters 5 and 6', 'EVENT_LOCATION': '456 Oak Road, Seattle, WA 98101', 'BEGIN_TIME': 1701855600000, 'END_TIME': 1701862800000}}	ACTION_VIEW_EVENT-1801-get_contact_info-1_NR-search_location-1-ACTION_INSERT_EVENT-1	['web_search', 'search_location', 'ACTION_INSERT_EVENT', 'ACTION_VIEW_SENT_MESSAGES', 'ACTION_SET_ALARM']
"['turn 1: Find me the location of the Colosseum in Rome. -> Here’s the address: Piazza del Colosseo, 1, 00184 Roma RM, Italy.', ""turn 2: Set up a guided tour there on April 15 from 10:00 to 12:00 titled 'Colosseum Tour' with description 'Explore ancient amphitheater'. -> Event 'Colosseum Tour' scheduled for April\xa015,\xa02023, 10:00\xa0AM–12:00\xa0PM at Piazza del Colosseo, 1, 00184 Roma RM, Italy. content://calendar/event/203"", ""turn 3: Could you search for its location? -> Opening the map at Piazza del Colosseo,\xa01,\xa000184\xa0Roma\xa0RM,\xa0Italy (event 'Colosseum Tour').""]"	Add a Post-Tour Dinner there on April 15 from 7 PM to 9 PM with description 'Celebrate after tour'	Add a Post-Tour Dinner at Piazza del Colosseo, 1, 00184 Roma RM, Italy on April 15 from 7 PM to 9 PM with description 'Celebrate after tour'	{'plan': 'ACTION_INSERT_EVENT', 'arguments': {'TITLE': 'Post-Tour Dinner', 'DESCRIPTION': 'Celebrate after tour', 'EVENT_LOCATION': 'Piazza del Colosseo, 1, 00184 Roma RM, Italy', 'BEGIN_TIME': 1713207600000, 'END_TIME': 1713214800000}}	search_location-1142-ACTION_INSERT_EVENT-1-search_location-1-ACTION_INSERT_EVENT-1	['ACTION_INSERT_EVENT', 'ACTION_VIEW_RECENT_APPS', 'ACTION_VIEW_PLAYLIST', 'ACTION_VIEW_EVENT', 'INTENT_ACTION_STILL_IMAGE_CAMERA']
"['turn 1: Launch the editor for the contract stored at content://documents/doc/88. -> Launching the editor for your contract at content://documents/doc/88.', ""turn 2: Please add an event called 'Gardening Workshop' that encourages community gardening. It will be held at City Park from 1701300000000 to 1701305400000. -> Got it! 'Gardening Workshop' encouraging community gardening is set at City Park from 1701300000000 to 1701305400000. Event URI: content://calendar/event/3"", 'turn 3: Where is it exactly? -> City Park is at 1\xa0Palm\xa0Drive, New\xa0Orleans, LA\xa070124. Here’s its spot on the map.']"	Plan a Community Picnic there this Saturday from 12 PM to 2 PM with description Bring snacks and games	Plan a Community Picnic at 1 Palm Drive, New Orleans, LA 70124 this Saturday from 12 PM to 2 PM with description Bring snacks and games	{'plan': 'ACTION_INSERT_EVENT', 'arguments': {'TITLE': 'Community Picnic', 'DESCRIPTION': 'Bring snacks and games', 'EVENT_LOCATION': '1 Palm Drive, New Orleans, LA 70124', 'BEGIN_TIME': 1712404800000, 'END_TIME': 1712412000000}}	ACTION_EDIT_DOCUMENT-1519-ACTION_INSERT_EVENT-1_NR-search_location-1-ACTION_INSERT_EVENT-1	['INTENT_ACTION_VIDEO_CAMERA', 'ACTION_EDIT_DOCUMENT', 'launch_application', 'ACTION_SET_ALARM', 'ACTION_INSERT_EVENT']
['turn 1: Grab web assets: HTML, CSS and JavaScript files. -> Ready to grab web assets—pick your HTML, CSS, and JS files. Multiple selection is enabled.', 'turn 2: Please look up the address of the contact found at /directory/annie. -> Annie’s address is 456 Oak Avenue, Metropolis, NY 10001.', 'turn 3: Show it on the map -> All set! 456 Oak Avenue, Metropolis, NY 10001 is now marked on your map.']	Set up a meeting there next Monday at 10 AM titled Project Kickoff, description Initial planning session, lasting one hour.	Set up a meeting at 456 Oak Avenue, Metropolis, NY 10001 next Monday at 10 AM titled Project Kickoff, description Initial planning session, lasting one hour.	{'plan': 'ACTION_INSERT_EVENT', 'arguments': {'TITLE': 'Project Kickoff', 'DESCRIPTION': 'Initial planning session', 'EVENT_LOCATION': '456 Oak Avenue, Metropolis, NY 10001', 'BEGIN_TIME': 1701693600000, 'END_TIME': 1701697200000}}	ACTION_OPEN_DOCUMENT-164-get_contact_info-1_NR-search_location-1-ACTION_INSERT_EVENT-1	['ACTION_INSERT_EVENT', 'ACTION_EDIT_VIDEO', 'ACTION_SET_ALARM', 'ACTION_VIEW_RECENT_APPS', 'ACTION_INSERT_CONTACT']
"['turn 1: Can I pick a contact’s email via the picker for registration? -> Opening the email selector—please choose the email for registration.', ""turn 2: Set a calendar event for 'Meditation Retreat', a full-day mindfulness practice session. No explicit location is mentioned and it is set from 1702700000000 to 1702707200000. -> 'Meditation Retreat' is now set on December 17, 2023, 9:00\xa0AM–11:00\xa0AM (no location). Access it via content://calendar/event/9."", ""turn 3: Where is it held? -> I’m not finding a set location for 'Meditation Retreat'. Would you like to add one?""]"	Yes—set the 'Meditation Retreat' at Serenity Center, 45 Peace Way, Harmony City, CA on December 17, 2023 from 9:00 AM to 11:00 AM with description 'Full-day mindfulness practice session'.	Yes—set 'Meditation Retreat' at Serenity Center, 45 Peace Way, Harmony City, CA on December 17, 2023 from 9:00 AM to 11:00 AM with description 'Full-day mindfulness practice session'.	{'plan': 'ACTION_INSERT_EVENT', 'arguments': {'TITLE': 'Meditation Retreat', 'DESCRIPTION': 'Full-day mindfulness practice session', 'EVENT_LOCATION': 'Serenity Center, 45 Peace Way, Harmony City, CA', 'BEGIN_TIME': 1702813200000, 'END_TIME': 1702820400000}}	ACTION_PICK-539-ACTION_INSERT_EVENT-1_NR-search_location-1-ACTION_INSERT_EVENT-1	['ACTION_VIEW_RECENT_APPS', 'ACTION_INSERT_EVENT', 'web_search', 'ACTION_NAVIGATE_TO_LOCATION', 'ACTION_EDIT_CONTACT']
"['turn 1: Could you tweak contact content://contacts/people/matthew by changing the phone number to (123) 456-7890? -> Sure thing—Matthew’s phone number is now (123)\xa0456‑7890. You’ll find his updated contact at content://contacts/people/matthew', ""turn 2: Schedule an event 'Workshop on AI' that dives deep into AI trends and technologies. It should be held at Innovation Hub, from 1703800000000 to 1703807200000. -> Your 'Workshop on AI' is set at Innovation Hub from 1703800000000 to 1703807200000. Event ID: content://calendar/event/9"", 'turn 3: Where is it located exactly? -> Here’s Innovation Hub: 321 Tech Way, Silicon Valley, CA 94043.']"	Schedule a deep dive session there on March 5 from 2 PM to 5 PM called 'AI Trends Analysis' with description 'Review the latest AI research and applications'.	Schedule a deep dive session at 321 Tech Way, Silicon Valley, CA 94043 on March 5 from 2 PM to 5 PM called 'AI Trends Analysis' with description 'Review the latest AI research and applications'	{'plan': 'ACTION_INSERT_EVENT', 'arguments': {'TITLE': 'AI Trends Analysis', 'DESCRIPTION': 'Review the latest AI research and applications', 'EVENT_LOCATION': '321 Tech Way, Silicon Valley, CA 94043', 'BEGIN_TIME': 1709656800000, 'END_TIME': 1709667600000}}	ACTION_EDIT_CONTACT-108-ACTION_INSERT_EVENT-1_NR-search_location-1-ACTION_INSERT_EVENT-1	['ACTION_EDIT_VIDEO', 'INTENT_ACTION_VIDEO_CAMERA', 'web_search', 'ACTION_OPEN_CONTENT', 'ACTION_INSERT_EVENT']
"[""turn 1: I'd like to see the phone number and email for content://contacts/people/1035. -> Here’s the phone and email for content://contacts/people/1035, opening now."", 'turn 2: Update its company to Initech -> Company updated to Initech for contact content://contacts/people/1035. You can review it now.', 'turn 3: Can you find that company on a map? -> Here’s Initech on the map: 4120\xa0Friedrich\xa0Lane, Austin, TX\xa078744, USA.']"	Schedule an Onboarding Meeting there next Monday from 3 PM to 5 PM with description 'Welcome new hires'	Schedule an Onboarding Meeting at 4120 Friedrich Lane, Austin, TX 78744, USA next Monday from 3 PM to 5 PM with description 'Welcome new hires'	{'plan': 'ACTION_INSERT_EVENT', 'arguments': {'TITLE': 'Onboarding Meeting', 'DESCRIPTION': 'Welcome new hires', 'EVENT_LOCATION': '4120 Friedrich Lane, Austin, TX 78744, USA', 'BEGIN_TIME': 1712588400000, 'END_TIME': 1712595600000}}	ACTION_VIEW_CONTACT-786-ACTION_EDIT_CONTACT-1-search_location-1-ACTION_INSERT_EVENT-1	['INTENT_ACTION_VIDEO_CAMERA', 'get_contact_info_from_uri', 'ACTION_VIEW_CONTACT', 'ACTION_INSERT_EVENT', 'get_contact_info']
"['turn 1: Show my recent web visits. -> Here’s your recent web visits: WhatsApp Web; BBC Sport (live scores); Etsy (handmade crafts); The Verge (tech news)', ""turn 2: Could you please create an event for a 'Client Meeting'? The discussion will be about contract details at Downtown Office from 1700600000000 to 1700603600000. -> Client Meeting about contract details has been scheduled at Downtown Office from 1700600000000 to 1700603600000. Event URI: content://calendar/event/9"", 'turn 3: Where’s it located? -> Downtown Office can be found at 1500 Corporate Blvd, Metropolis, NY 10002.']"	Set up a contract review there next Wednesday from 10 AM to 11 AM titled 'Contract Review' with description 'Review client contract provisions'.	Set up a contract review at 1500 Corporate Blvd, Metropolis, NY 10002 next Wednesday from 10 AM to 11 AM titled 'Contract Review' with description 'Review client contract provisions'.	{'plan': 'ACTION_INSERT_EVENT', 'arguments': {'TITLE': 'Contract Review', 'DESCRIPTION': 'Review client contract provisions', 'EVENT_LOCATION': '1500 Corporate Blvd, Metropolis, NY 10002', 'BEGIN_TIME': 1701866400000, 'END_TIME': 1701870000000}}	ACTION_VIEW_WEB_HISTORY-2070-ACTION_INSERT_EVENT-1_NR-search_location-1-ACTION_INSERT_EVENT-1	['ACTION_EDIT_ALARM', 'ACTION_INSERT_EVENT', 'web_search', 'ACTION_EDIT_DOCUMENT', 'ACTION_VIEW_PLAYLIST']
