conversation_history	query	rewrited_query	answer	unique_idx	candidates
"[""turn 1: Text my colleague with ID 7890 the message 'Project deadline extended to next Monday. Check your email for details.' Use their contact +1 (800) 555-0000. -> Project update delivered to +18005550000."", 'turn 2: Call them now -> Dialing +18005550000 now...', ""turn 3: Add it to my contacts -> Got it. I've saved +18005550000 as a new contact. You can find it here: content://contacts/people/101""]"	Add name 'Acme Support' and company 'Acme Corp' to it.	Add name 'Acme Support' and company 'Acme Corp' to content://contacts/people/101.	{'plan': 'ACTION_EDIT_CONTACT', 'arguments': {'contact_uri': 'content://contacts/people/101', 'contact_info': {'name': 'Acme Support', 'company': 'Acme Corp'}}}	send_message-1245-dial-1-ACTION_INSERT_CONTACT-1-ACTION_EDIT_CONTACT-1	['ACTION_PICK', 'ACTION_EDIT_CONTACT', 'ACTION_VIEW_SENT_EMAILS', 'dial', 'ACTION_SET_RINGTONE']
"['turn 1: Can I get the home email at content://contacts/333/data/email_home? -> Absolutely—home email is homeowner@domain.com.', ""turn 2: Let me see an email from my contact list. -> Sure thing. Here's the email you selected: content://contacts/email/333"", ""turn 3: View its details -> Here's the email entry you selected: content://contacts/email/333.""]"	Update it to change the email to newaddress@domain.com and set the name to Home Owner	Update content://contacts/email/333 to change the email to newaddress@domain.com and set the name to Home Owner	{'plan': 'ACTION_EDIT_CONTACT', 'arguments': {'contact_uri': 'content://contacts/email/333', 'contact_info': {'email': 'newaddress@domain.com', 'name': 'Home Owner'}}}	get_contact_info_from_uri-1057-ACTION_PICK-1_NR-ACTION_VIEW_CONTACT-1-ACTION_EDIT_CONTACT-1	['play_video', 'ACTION_EDIT_CONTACT', 'ACTION_OPEN_CONTENT', 'ACTION_GET_CONTENT', 'ACTION_INSERT_CONTACT']
"[""turn 1: I want a WAV audio file titled audio_sample.wav. -> I've created your WAV file 'audio_sample.wav'. You can open it at content://documents/audio_sample.wav"", ""turn 2: Play it -> Now playing 'audio_sample.wav' from content://documents/audio_sample.wav."", 'turn 3: Could you pull up an email address from my directory? -> I’ve got an email address for you: content://contacts/email/8']"	Update her name to Elizabeth Taylor	Update the name of content://contacts/email/8 to Elizabeth Taylor	{'plan': 'ACTION_EDIT_CONTACT', 'arguments': {'contact_uri': 'content://contacts/email/8', 'contact_info': {'name': 'Elizabeth Taylor'}}}	ACTION_CREATE_DOCUMENT-35-ACTION_OPEN_CONTENT-1-ACTION_PICK-1_NR-ACTION_EDIT_CONTACT-1	['ACTION_OPEN_DOCUMENT', 'ACTION_VIEW_SENT_MESSAGES', 'dial', 'ACTION_EDIT_CONTACT', 'open_settings']
"['turn 1: Show me the input method settings. -> Input method settings opened successfully—choose your preferred input method.', 'turn 2: Access general system settings for configuration purposes. -> General settings have been opened. Feel free to adjust your configuration.', ""turn 3: Please call up a contact's email address from my records. -> Sure—launching email address picker now. Pick the contact email you need… Selected: content://contacts/email/15""]"	Replace its email with sara.lee@newmail.com	Replace content://contacts/email/15 email with sara.lee@newmail.com	{'plan': 'ACTION_EDIT_CONTACT', 'arguments': {'contact_uri': 'content://contacts/email/15', 'contact_info': {'email': 'sara.lee@newmail.com'}}}	open_settings-1100-open_settings-1_NR-ACTION_PICK-1_NR-ACTION_EDIT_CONTACT-1	['ACTION_VIEW_RECENT_APPS', 'ACTION_EDIT_CONTACT', 'ACTION_VIEW_PLAYLIST', 'send_message', 'ACTION_VIEW_CALL_LOG']
"[""turn 1: Please play Eminem's 'Lose Yourself'. -> Now spinning Lose Yourself by Eminem."", ""turn 2: Could you look for reliable sources that discuss the causes of urban pollution? -> Looking up 'causes of urban pollution sources'... Found studies on traffic emissions, industrial pollutants, and urban planning impacts."", ""turn 3: Choose a person's address from my set of saved contacts. -> Address successfully picked: content://contacts/address/19""]"	Change its street to 456 Oak Avenue	Change content://contacts/address/19's street to 456 Oak Avenue	{'plan': 'ACTION_EDIT_CONTACT', 'arguments': {'contact_uri': 'content://contacts/address/19', 'contact_info': {'address': '456 Oak Avenue'}}}	play_music-1358-web_search-1_NR-ACTION_PICK-1_NR-ACTION_EDIT_CONTACT-1	['ACTION_GET_CONTENT', 'get_contact_info_from_uri', 'ACTION_EDIT_ALARM', 'launch_application', 'ACTION_EDIT_CONTACT']
['turn 1: Switch default ringtone to classic tune located here: content://com.android.externalstorage.documents/tree/primary%3AMusic%2Fclassic_tune.mp3 -> Classic tune is now set as your ringtone. Enjoy!', 'turn 2: I want to choose a person by hand from my contacts. -> Contact URI: content://contacts/people/5', 'turn 3: Pick out an email on my contact list. -> Okay, here’s the email you picked: content://contacts/email/5']	Change its email address to newemail@example.com	Change content://contacts/email/5's email address to newemail@example.com	{'plan': 'ACTION_EDIT_CONTACT', 'arguments': {'contact_uri': 'content://contacts/email/5', 'contact_info': {'email': 'newemail@example.com'}}}	ACTION_SET_RINGTONE-1611-ACTION_PICK-1_NR-ACTION_PICK-1_NR-ACTION_EDIT_CONTACT-1	['send_message', 'ACTION_EDIT_CONTACT', 'ACTION_VIEW_SENT_EMAILS', 'ACTION_NAVIGATE_TO_LOCATION', 'ACTION_IMAGE_CAPTURE']
"['turn 1: Please deliver the PDF report (https://reports.example.com/q1.pdf) to CFO at +49 151 76543210. -> Successfully sent the PDF report to +4915176543210.', ""turn 2: Can you list that PDF report I sent to the CFO and my recent sent messages? -> Here's a rundown of your recent messages: CFO +4915176543210 – 'PDF report delivered: https://reports.example.com/q1.pdf'."", 'turn 3: Can you help me pick a contact from my saved directory? -> Contact selection complete: content://contacts/people/21']"	Add their company as Acme Corp and address as 789 Pine Road	Add content://contacts/people/21's company as Acme Corp and address as 789 Pine Road	{'plan': 'ACTION_EDIT_CONTACT', 'arguments': {'contact_uri': 'content://contacts/people/21', 'contact_info': {'company': 'Acme Corp', 'address': '789 Pine Road'}}}	send_message-1282-ACTION_VIEW_SENT_MESSAGES-1-ACTION_PICK-1_NR-ACTION_EDIT_CONTACT-1	['ACTION_VIEW_CALL_LOG', 'search_location', 'get_contact_info_from_uri', 'ACTION_INSERT_EVENT', 'ACTION_EDIT_CONTACT']
['turn 1: Phone the helpline on 777-8888. -> Calling 777-8888...', 'turn 2: Save it to my address book. -> Contact for 777-8888 saved. (URI: content://contacts/people/7778888)', 'turn 3: Show me its details -> Displaying the details for content://contacts/people/7778888']	Add its address as 456 Maple Avenue	Add content://contacts/people/7778888's address as 456 Maple Avenue	{'plan': 'ACTION_EDIT_CONTACT', 'arguments': {'contact_uri': 'content://contacts/people/7778888', 'contact_info': {'address': '456 Maple Avenue'}}}	dial-925-ACTION_INSERT_CONTACT-1-ACTION_VIEW_CONTACT-1-ACTION_EDIT_CONTACT-1	['INTENT_ACTION_VIDEO_CAMERA', 'play_music', 'ACTION_EDIT_CONTACT', 'ACTION_VIEW_WEB_HISTORY', 'ACTION_OPEN_CONTENT']
['turn 1: I want information on timers still running. -> Running timers: 30 seconds - Exercise, 12 minutes - Rice, 50 minutes - Study session.', 'turn 2: Start a 2-hour timer -> All set! 2-hour timer is ticking away.', 'turn 3: Help me extract a phone number from my contact list. -> Phone detail extracted: content://contacts/phone/33']	Fill its address with 123 Main St	Fill content://contacts/phone/33's address with 123 Main St	{'plan': 'ACTION_EDIT_CONTACT', 'arguments': {'contact_uri': 'content://contacts/phone/33', 'contact_info': {'address': '123 Main St'}}}	ACTION_SHOW_TIMERS-1884-ACTION_SET_TIMER-1-ACTION_PICK-1_NR-ACTION_EDIT_CONTACT-1	['ACTION_EDIT_CONTACT', 'ACTION_VIDEO_CAPTURE', 'ACTION_GET_CONTENT', 'ACTION_VIEW_RECENT_APPS', 'ACTION_VIEW_CONTACT']
"['turn 1: Please pick multiple ZIP archives from local storage. -> Sure thing! Here are the ZIP archives you selected:\n- content://downloads/backups/backup_jan.zip\n- content://downloads/backups/backup_feb.zip', ""turn 2: Open the second one -> Opening archive 'backup_feb.zip' at content://downloads/backups/backup_feb.zip."", 'turn 3: Help me select a mailing address from my saved contacts. -> Alright—launching the address picker. Please select an entry… Here’s what you chose: content://contacts/addresses/27']"	Change its address to 456 Elm St, Springfield, IL 62705.	Change content://contacts/addresses/27's address to 456 Elm St, Springfield, IL 62705.	{'plan': 'ACTION_EDIT_CONTACT', 'arguments': {'contact_uri': 'content://contacts/addresses/27', 'contact_info': {'address': '456 Elm St, Springfield, IL 62705'}}}	ACTION_OPEN_DOCUMENT-121-ACTION_OPEN_CONTENT-1-ACTION_PICK-1_NR-ACTION_EDIT_CONTACT-1	['INTENT_ACTION_VIDEO_CAMERA', 'ACTION_EDIT_CONTACT', 'ACTION_VIEW_CALL_LOG', 'ACTION_OPEN_CONTENT', 'get_contact_info']
['turn 1: Execute script install.sh from content://scripts/install.sh -> Opening script install.sh at content://scripts/install.sh.', 'turn 2: I need to dial someone soon; select their phone number from my phonebook. -> Dialer contact selector is up. You picked content://contacts/phone/55.', 'turn 3: Show me the details for it -> Opening the requested record: content://contacts/phone/55 — showing contact details now.']	Update it with company 'TechCorp' and set email to user55@techcorp.com	Update content://contacts/phone/55 with company 'TechCorp' and set email to user55@techcorp.com	{'plan': 'ACTION_EDIT_CONTACT', 'arguments': {'contact_uri': 'content://contacts/phone/55', 'contact_info': {'company': 'TechCorp', 'email': 'user55@techcorp.com'}}}	ACTION_OPEN_CONTENT-251-ACTION_PICK-1_NR-ACTION_VIEW_CONTACT-1-ACTION_EDIT_CONTACT-1	['ACTION_EDIT_DOCUMENT', 'ACTION_GET_CONTENT', 'ACTION_VIDEO_CAPTURE', 'ACTION_VIEW_WEB_HISTORY', 'ACTION_EDIT_CONTACT']
"['turn 1: Hey, start a 1 hour timer named hourly check. -> All set: your “hourly check” timer is ticking for 1 hour.', 'turn 2: I want to browse files and pick a PDF document. -> Sure thing! Opening the file picker for PDFs—go ahead and choose the document you want.', ""turn 3: I need a quick selection of a contact's detail. -> Done! Selected contact URI: content://contacts/people/27""]"	Rename it to Jane Smith and add phone number 010-5555-6666	Rename content://contacts/people/27 to Jane Smith and add phone number 010-5555-6666	{'plan': 'ACTION_EDIT_CONTACT', 'arguments': {'contact_uri': 'content://contacts/people/27', 'contact_info': {'name': 'Jane Smith', 'phone': '010-5555-6666'}}}	ACTION_SET_TIMER-653-ACTION_OPEN_DOCUMENT-1_NR-ACTION_PICK-1_NR-ACTION_EDIT_CONTACT-1	['ACTION_VIEW_CALL_LOG', 'ACTION_SET_ALARM', 'ACTION_PICK', 'web_search', 'ACTION_EDIT_CONTACT']
['turn 1: Dial +1 (202) 555-0187 to reach the DC office. -> Connecting to +1 (202) 555-0187...', 'turn 2: Let me see the history of my outgoing and incoming calls -> Call history: Michael +1-646-555-0666 (Incoming) - Today 7:15 AM; Scarlett +1-312-555-0444 (Missed) - Yesterday 6:00 PM; Benjamin +1-415-555-0999 (Outgoing) - Last Monday 2:30 PM', 'turn 3: Save that number as Michael Johnson -> Great! Michael Johnson is now saved in your contacts. (content://contacts/people/michael_johnson)']	Add company to it. 'Acme Corp'	Add company to content://contacts/people/michael_johnson. 'Acme Corp'	{'plan': 'ACTION_EDIT_CONTACT', 'arguments': {'contact_uri': 'content://contacts/people/michael_johnson', 'contact_info': {'company': 'Acme Corp'}}}	dial-966-ACTION_VIEW_CALL_LOG-1-ACTION_INSERT_CONTACT-1-ACTION_EDIT_CONTACT-1	['ACTION_EDIT_CONTACT', 'search_location', 'send_email', 'ACTION_VIEW_EVENT', 'ACTION_EDIT_ALARM']
"[""turn 1: Can you get the video camera up and running? -> You're all set—the video camera is open."", 'turn 2: Go ahead and record it. -> All done! Video saved at content://example/new_video.mp4.', 'turn 3: Please retrieve a mobile phone number from my contacts for me. -> No problem—bringing up phone number selection. Once you pick one, I’ll grab it for you. Chosen phone URI: content://contacts/phone/21']"	Change its phone number to +1-202-555-0175	Change content://contacts/phone/21's phone number to +1-202-555-0175	{'plan': 'ACTION_EDIT_CONTACT', 'arguments': {'contact_uri': 'content://contacts/phone/21', 'contact_info': {'phone': '+1-202-555-0175'}}}	INTENT_ACTION_VIDEO_CAMERA-912-ACTION_VIDEO_CAPTURE-1-ACTION_PICK-1_NR-ACTION_EDIT_CONTACT-1	['ACTION_EDIT_CONTACT', 'ACTION_INSERT_CONTACT', 'ACTION_OPEN_DOCUMENT', 'open_settings', 'ACTION_VIDEO_CAPTURE']
"[""turn 1: Send a quick reminder to John at +15551234567 saying 'Don't forget the meeting at 3pm today.' -> Your reminder has been sent to +15551234567."", 'turn 2: Give him a quick call -> Initiating call to +15551234567...', 'turn 3: I need to dial someone soon; select their phone number from my phonebook. -> Please pick a phone number from your phonebook.']"	Edit the contact at content://contacts/people/john to update his phone number to +15557654321	Edit the contact at content://contacts/people/john to update the phone number of John at +15551234567 to +15557654321	{'plan': 'ACTION_EDIT_CONTACT', 'arguments': {'contact_uri': 'content://contacts/people/john', 'contact_info': {'phone': '+15557654321'}}}	send_message-1241-dial-1-ACTION_PICK-1_NR-ACTION_EDIT_CONTACT-1	['ACTION_SHOW_ALARMS', 'launch_application', 'ACTION_SET_ALARM', 'ACTION_VIEW_WEB_HISTORY', 'ACTION_EDIT_CONTACT']
"['turn 1: Please adjust alarm 40 to 10:10, schedule it daily. -> Alarm 40 has been adjusted to 10:10 and is now scheduled to go off every day.', ""turn 2: Check the internet for discoveries of exoplanets reported in the last year. -> Searching 'exoplanets discovery last year'... Highlights include TESS findings and NASA reports on dozens of new exoplanets."", 'turn 3: I want to pick one of the contacts from my phone; please show me a contact entry. -> Alright, here’s the contact entry you picked: content://contacts/people/7']"	Update its company to OpenAI	Update content://contacts/people/7's company to OpenAI	{'plan': 'ACTION_EDIT_CONTACT', 'arguments': {'contact_uri': 'content://contacts/people/7', 'contact_info': {'company': 'OpenAI'}}}	ACTION_EDIT_ALARM-1674-web_search-1_NR-ACTION_PICK-1_NR-ACTION_EDIT_CONTACT-1	['ACTION_EDIT_CONTACT', 'ACTION_IMAGE_CAPTURE', 'INTENT_ACTION_STILL_IMAGE_CAMERA', 'ACTION_SET_RINGTONE', 'ACTION_EDIT_ALARM']
['turn 1: Fetch the details for the person whose contact is content://contacts/people/1033. -> Here you go: details for content://contacts/people/1033 are now open.', 'turn 2: Add work email work@example.com to it -> Work email added successfully! You can see it at content://contacts/people/1033', 'turn 3: Show me its contact card -> Here’s the contact card for content://contacts/people/1033']	Change its name to Jane Doe	Change content://contacts/people/1033's name to Jane Doe	{'plan': 'ACTION_EDIT_CONTACT', 'arguments': {'contact_uri': 'content://contacts/people/1033', 'contact_info': {'name': 'Jane Doe'}}}	ACTION_VIEW_CONTACT-784-ACTION_EDIT_CONTACT-1-ACTION_VIEW_CONTACT-1-ACTION_EDIT_CONTACT-1	['ACTION_VIEW_WEB_HISTORY', 'ACTION_EDIT_DOCUMENT', 'ACTION_VIEW_CALL_LOG', 'send_email', 'ACTION_EDIT_CONTACT']
['turn 1: Please take a photo and let the system decide where to save it. -> Got it. Photo taken and stored at content://media/internal/photos/IMG_20230615_100200.jpg.', 'turn 2: Select a personal contact entry from my list. -> Personal contacts shown. You chose content://contacts/people/27.', 'turn 3: Can you display its full information? -> Here you go: displaying full contact profile from content://contacts/people/27.']	Edit it to update its phone number to 555-1234	Edit content://contacts/people/27 to update content://contacts/people/27's phone number to 555-1234	{'plan': 'ACTION_EDIT_CONTACT', 'arguments': {'contact_uri': 'content://contacts/people/27', 'contact_info': {'phone': '555-1234'}}}	ACTION_IMAGE_CAPTURE-370-ACTION_PICK-1_NR-ACTION_VIEW_CONTACT-1-ACTION_EDIT_CONTACT-1	['ACTION_CREATE_DOCUMENT', 'ACTION_SHOW_TIMERS', 'ACTION_VIEW_CALL_LOG', 'ACTION_EDIT_CONTACT', 'web_search']
"[""turn 1: Show the playlist called 'Summer Chillout'. -> Playlist 'Summer Chillout': Sunset Lover; Ocean Eyes; Island in the Sun."", ""turn 2: Play it on Apple Music. -> Here we go! Playing your 'Summer Chillout' playlist on Apple Music: Sunset Lover, Ocean Eyes, Island in the Sun."", ""turn 3: I'm looking for someone's email contact details. -> Here’s the email you requested: content://contacts/email/34""]"	Edit their email to new_email@example.com	Edit content://contacts/email/34 to new_email@example.com	{'plan': 'ACTION_EDIT_CONTACT', 'arguments': {'contact_uri': 'content://contacts/email/34', 'contact_info': {'email': 'new_email@example.com'}}}	ACTION_VIEW_PLAYLIST-2144-play_music-1-ACTION_PICK-1_NR-ACTION_EDIT_CONTACT-1	['ACTION_IMAGE_CAPTURE', 'send_message', 'ACTION_EDIT_CONTACT', 'ACTION_NAVIGATE_TO_LOCATION', 'ACTION_EDIT_DOCUMENT']
"[""turn 1: Extract the author's email given content://contacts/404/data/email_author. -> The author's email address is emma.stone@authorhub.net."", 'turn 2: Fetch the contact summary for /directory/linda_contact. -> Contact summary for Linda: Linda Johnson – Phone: 321‑654‑0987, Email: linda.johnson@company.com.', 'turn 3: View it. -> Contact info for /directory/linda_contact is now displayed.']"	Change its email to linda.j@newco.com	Change /directory/linda_contact's email to linda.j@newco.com	{'plan': 'ACTION_EDIT_CONTACT', 'arguments': {'contact_uri': '/directory/linda_contact', 'contact_info': {'email': 'linda.j@newco.com'}}}	get_contact_info_from_uri-1076-get_contact_info-1_NR-ACTION_VIEW_CONTACT-1-ACTION_EDIT_CONTACT-1	['ACTION_EDIT_DOCUMENT', 'ACTION_EDIT_CONTACT', 'launch_application', 'ACTION_GET_CONTENT', 'play_music']
"['turn 1: I want to view my currently scheduled alarms. -> Displaying all alarms: [alarm_id: 1 - 5:15 AM, Workout; alarm_id: 2 - 8:00 AM, Team Meeting; alarm_id: 3 - 1:00 PM, Lunch Break; alarm_id: 4 - 8:30 PM, Wind Down]', ""turn 2: Set one for 10:15 PM labeled Wind Down and skip confirmation. -> All set! Alarm (alarm_id: alarm_208) scheduled for 10:15 PM: 'Wind Down' (no confirmation prompt)."", ""turn 3: Schedule a 'Kids Playdate' event described as an afternoon of fun at the park. The location is Local Playground and it should take place from 1702300000000 to 1702303600000. -> Your 'Kids Playdate' is all set for December 12 at Local Playground. Check it here: content://calendar/event/6""]"	Show me that event.	Show me content://calendar/event/6.	{'plan': 'ACTION_VIEW_EVENT', 'arguments': {'event_uri': 'content://calendar/event/6'}}	ACTION_SHOW_ALARMS-656-ACTION_SET_ALARM-1-ACTION_INSERT_EVENT-1_NR-ACTION_VIEW_EVENT-1	['ACTION_VIDEO_CAPTURE', 'ACTION_OPEN_DOCUMENT', 'ACTION_VIEW_EVENT', 'ACTION_SET_ALARM', 'ACTION_CREATE_DOCUMENT']
"['turn 1: Load up the video capture app. -> Successfully opened the video camera app.', 'turn 2: Record the video now and save it to content://example/uri. -> Recording now. The video will be saved to content://example/uri once you finish.', ""turn 3: Organize an event titled 'Coding Bootcamp' that is an intensive programming course covering Python and JavaScript. It should be held at Tech Center from 1702600000000 to 1702607200000. -> Success! 'Coding Bootcamp' is now on your calendar for December 15 at Tech Center. Details: content://calendar/event/3""]"	I'd like to view the full details of it.	I'd like to view the full details of content://calendar/event/3.	{'plan': 'ACTION_VIEW_EVENT', 'arguments': {'event_uri': 'content://calendar/event/3'}}	INTENT_ACTION_VIDEO_CAMERA-908-ACTION_VIDEO_CAPTURE-1-ACTION_INSERT_EVENT-1_NR-ACTION_VIEW_EVENT-1	['ACTION_EDIT_DOCUMENT', 'ACTION_VIEW_EVENT', 'ACTION_VIEW_WEB_HISTORY', 'ACTION_GET_RINGTONE', 'play_music']
"['turn 1: Capture a quick video snippet to content://snippets/clip.mp4. -> Recording a quick snippet—saving it to content://snippets/clip.mp4.', 'turn 2: Would you kindly open the Clock app? I need to set an alarm. -> Clock app opened successfully. You can set your alarm now.', ""turn 3: Set up a 'Weekly Sync-Up' event for an internal discussion on team progress and updates. There is no location. It should run from 1703500000000 to 1703503600000. -> Weekly Sync-Up is booked from 1703500000000 to 1703503600000. Find it here: content://calendar/event/104.""]"	Can you show me its details?	Can you show me content://calendar/event/104 details?	{'plan': 'ACTION_VIEW_EVENT', 'arguments': {'event_uri': 'content://calendar/event/104'}}	ACTION_VIDEO_CAPTURE-751-launch_application-1_NR-ACTION_INSERT_EVENT-1_NR-ACTION_VIEW_EVENT-1	['launch_application', 'ACTION_IMAGE_CAPTURE', 'ACTION_VIEW_CALL_LOG', 'ACTION_VIDEO_CAPTURE', 'ACTION_VIEW_EVENT']
"[""turn 1: Can you fetch all the timers I've set? -> You have 3 timers running: 2 minutes - Tea, 15 minutes - Laundry, 30 minutes - Coding."", 'turn 2: Open my camera app in still-image mode, please. -> Still image camera application opened successfully.', ""turn 3: Input a calendar event for 'Business Strategy Meeting' intended to review our growth plans at the Main Office Conference Room. It should be scheduled from 1703200000000 to 1703207200000. -> Business Strategy Meeting (Review growth plans) at Main Office Conference Room is on for 1703200000000–1703207200000. See it: content://calendar/event/107.""]"	Display that meeting.	Display content://calendar/event/107.	{'plan': 'ACTION_VIEW_EVENT', 'arguments': {'event_uri': 'content://calendar/event/107'}}	ACTION_SHOW_TIMERS-1880-INTENT_ACTION_STILL_IMAGE_CAMERA-1_NR-ACTION_INSERT_EVENT-1_NR-ACTION_VIEW_EVENT-1	['ACTION_VIDEO_CAPTURE', 'ACTION_VIEW_EVENT', 'ACTION_INSERT_CONTACT', 'ACTION_EDIT_ALARM', 'ACTION_OPEN_DOCUMENT']
"[""turn 1: Display the playlist 'Hip Hop Underground'. -> Here are the songs in 'Hip Hop Underground': Shook Ones Pt. II; The Message; C.R.E.A.M."", ""turn 2: Play the middle track. -> Starting 'The Message' now. Enjoy the beat!"", ""turn 3: I need to log an event named 'Virtual Conference' with an online meeting featuring global speakers. Since it's virtual, no physical location is needed. It runs from 1702200000000 to 1702207200000. -> 'Virtual Conference' created for December 11 as an online event. Access it here: content://calendar/event/7""]"	Open that event.	Open content://calendar/event/7.	{'plan': 'ACTION_VIEW_EVENT', 'arguments': {'event_uri': 'content://calendar/event/7'}}	ACTION_VIEW_PLAYLIST-2138-play_music-1-ACTION_INSERT_EVENT-1_NR-ACTION_VIEW_EVENT-1	['ACTION_VIEW_EVENT', 'ACTION_INSERT_EVENT', 'ACTION_VIEW_CONTACT', 'open_settings', 'web_search']
"['turn 1: What have I been clicking around recently? -> Recent sites visited: Google search (best noise cancelling headphones); Wikipedia | Active Noise Control; YouTube video on Sony WH-1000XM4; Amazon Bose QuietComfort 35 II page; OpenAI Blog GPT-4 Release; Reddit r/headphones.', ""turn 2: Search that Amazon page again. -> Search results for 'Bose QuietComfort 35 II Amazon': Amazon product listing featuring Bose QC35 II headphones, detailed specs, current pricing, and verified customer reviews."", ""turn 3: Create an event titled 'Music Rehearsal' for a band practice session. It will take place at Studio 7 starting at 1701500000000 and ending at 1701503600000. -> Done! ‘Music Rehearsal’ is on November 21 at Studio 7. You can open it here: content://calendar/event/11""]"	Open it for me.	Open content://calendar/event/11 for me.	{'plan': 'ACTION_VIEW_EVENT', 'arguments': {'event_uri': 'content://calendar/event/11'}}	ACTION_VIEW_WEB_HISTORY-2087-web_search-1-ACTION_INSERT_EVENT-1_NR-ACTION_VIEW_EVENT-1	['open_settings', 'ACTION_SHOW_ALARMS', 'ACTION_VIEW_EVENT', 'ACTION_VIEW_SENT_EMAILS', 'ACTION_VIEW_CONTACT']
"['turn 1: Switch on the airplane mode screen for me, please. -> Airplane mode settings screen is now open.', 'turn 2: Search for the nearest airport. -> The closest airport is Springfield Regional, 1 Airport Drive, Springfield.', ""turn 3: Schedule a Flight Prep Meeting there next Wednesday from 1 PM to 2 PM to discuss travel plans -> Your 'Flight Prep Meeting' is on the books for next Wednesday, 1:00 PM–2:00 PM at Springfield Regional, 1 Airport Drive. Access it here: content://calendar/event/7""]"	Open that event on my calendar.	Open content://calendar/event/7 on my calendar.	{'plan': 'ACTION_VIEW_EVENT', 'arguments': {'event_uri': 'content://calendar/event/7'}}	open_settings-1079-search_location-1-ACTION_INSERT_EVENT-1-ACTION_VIEW_EVENT-1	['ACTION_SET_RINGTONE', 'web_search', 'ACTION_VIEW_PLAYLIST', 'ACTION_VIEW_EVENT', 'search_location']
"['turn 1: Pull up the appointment associated with ID 67. -> Event 67: Performance Review at 1:00\xa0PM on May 28, Location: Manager’s Office.', 'turn 2: Get directions to that office -> Getting directions to Manager’s Office. Off we go!', ""turn 3: Please register an event 'Charity Walk' described as a community fundraising activity at Central Park, starting at 1703100000000 and ending at 1703105400000. -> Charity Walk will take place at Central Park from 1703100000000 to 1703105400000. Your event link: content://calendar/event/108.""]"	Open that event in my calendar.	Open content://calendar/event/108 in my calendar.	{'plan': 'ACTION_VIEW_EVENT', 'arguments': {'event_uri': 'content://calendar/event/108'}}	ACTION_VIEW_EVENT-1792-ACTION_NAVIGATE_TO_LOCATION-1-ACTION_INSERT_EVENT-1_NR-ACTION_VIEW_EVENT-1	['dial', 'get_contact_info_from_uri', 'ACTION_IMAGE_CAPTURE', 'ACTION_VIEW_EVENT', 'ACTION_EDIT_CONTACT']
