conversation_history	query	rewrited_query	answer	unique_idx	candidates
"['turn 1: Could you bring forward my recently opened apps? -> Your recent apps are: Chrome; YouTube; Docs; Sheets', 'turn 2: I am interested in seeing the timers that are currently on. -> Active timers list: [5 minutes – Stretch break, 25 minutes – Focus session, 3 minutes – Email check]', ""turn 3: I would like to add an event called 'Sculpture Workshop'. The description is 'Learn sculpting basics under expert guidance'. It will be hosted at the Art Institute from 1702500000000 to 1702505400000. -> Done – 'Sculpture Workshop' has been added on December 14 at Art Institute. Check it out: content://calendar/event/4""]"	Can you locate it for me?	Can you locate content://calendar/event/4 for me?	{'plan': 'search_location', 'arguments': {'query': 'content://calendar/event/4'}}	ACTION_VIEW_RECENT_APPS-2209-ACTION_SHOW_TIMERS-1_NR-ACTION_INSERT_EVENT-1_NR-search_location-1	['play_music', 'search_location', 'get_contact_info_from_uri', 'ACTION_PICK', 'ACTION_OPEN_DOCUMENT']
['turn 1: Make a call to 030-1234-5678 now! -> Placing a call to 030-1234-5678...', 'turn 2: What calls have I made and received recently? -> Recent calls: 030-1234-5678 (Outgoing) - Today 2:30 PM; 212-555-0182 (Missed) - Today 1:15 PM; Dad +1-415-555-0198 (Incoming) - Sep 12, 6:45 PM', 'turn 3: Save that missed number as a new contact named Dentist -> Done. Dentist (212-555-0182) has been added to your address book.']	Search for her on the map	Search for Dentist on the map	{'plan': 'search_location', 'arguments': {'query': 'Dentist'}}	dial-928-ACTION_VIEW_CALL_LOG-1-ACTION_INSERT_CONTACT-1-search_location-1	['launch_application', 'open_settings', 'ACTION_OPEN_DOCUMENT', 'search_location', 'web_search']
"['turn 1: Ring up Dr. Mills at (212) 555-3344. -> Connecting you to (212) 555-3344...', ""turn 2: Show my recent call logs. -> Here's what I found: Dr. Mills +1-212-555-3344 (Missed) - Today 9:30 AM; Bob +1-872-1285 (Outgoing) - Yesterday 4:10 PM; Carol +44 20 7946 0958 (Incoming) - Sep 11, 11:00 AM"", 'turn 3: Save that incoming number as a new contact Carol -> Sure thing, Carol at +44 20 7946 0958 is now saved in your contacts.']"	Show her location on the map	Show Carol's location on the map	{'plan': 'search_location', 'arguments': {'query': 'Carol'}}	dial-929-ACTION_VIEW_CALL_LOG-1-ACTION_INSERT_CONTACT-1-search_location-1	['ACTION_OPEN_CONTENT', 'search_location', 'ACTION_SET_ALARM', 'ACTION_EDIT_VIDEO', 'ACTION_EDIT_DOCUMENT']
"['turn 1: I want to view my currently scheduled alarms. -> Displaying all alarms: [alarm_id: 1 - 5:15 AM, Workout; alarm_id: 2 - 8:00 AM, Team Meeting; alarm_id: 3 - 1:00 PM, Lunch Break; alarm_id: 4 - 8:30 PM, Wind Down]', ""turn 2: Set one for 10:15 PM labeled Wind Down and skip confirmation. -> All set! Alarm (alarm_id: alarm_208) scheduled for 10:15 PM: 'Wind Down' (no confirmation prompt)."", ""turn 3: Schedule a 'Kids Playdate' event described as an afternoon of fun at the park. The location is Local Playground and it should take place from 1702300000000 to 1702303600000. -> Your 'Kids Playdate' is all set for December 12 at Local Playground. Check it here: content://calendar/event/6""]"	Where exactly is it located?	Where exactly is Local Playground located?	{'plan': 'search_location', 'arguments': {'query': 'Local Playground'}}	ACTION_SHOW_ALARMS-656-ACTION_SET_ALARM-1-ACTION_INSERT_EVENT-1_NR-search_location-1	['ACTION_SET_ALARM', 'launch_application', 'ACTION_GET_RINGTONE', 'search_location', 'ACTION_PICK']
"['turn 1: Retrieve the mobile phone number for content://com.example.contacts/345. -> Mobile number for content://com.example.contacts/345 is 415-555-0123.', 'turn 2: Run the Messaging app so I can reply to my friend. -> Messaging is now open. Go ahead and send your reply.', ""turn 3: Set up a reminder for 'Book Club Discussion'. It is a group discussion about the monthly book pick with no particular location. Please schedule it from 1701600000000 to 1701603600000. -> Great! ‘Book Club Discussion’ has been scheduled on November 22. View details: content://calendar/event/10""]"	Find a nearby coffee shop for it.	Find a nearby coffee shop for 'Book Club Discussion'.	{'plan': 'search_location', 'arguments': {'query': 'coffee shop near Book Club Discussion'}}	get_contact_info-1014-launch_application-1_NR-ACTION_INSERT_EVENT-1_NR-search_location-1	['search_location', 'web_search', 'play_video', 'ACTION_GET_RINGTONE', 'ACTION_SHOW_ALARMS']
['turn 1: Please load content://documents/doc/638. -> The file at content://documents/doc/638 has been loaded. You can start editing as soon as you like.', 'turn 2: I want to know the address for the contact listed at /user/profile/jack. -> Jack’s address is 456 Oak Avenue, Building 12, Floor 3, New York, NY 10001.', 'turn 3: Update that contact with a new address 789 Birch Road, Floor 2, New York, NY 10001 -> Your update is complete! Jack’s contact now shows the new address at 789 Birch Road, Floor 2. Record saved at /user/profile/jack.']	Where is it located on the map?	Where is 789 Birch Road, Floor 2, New York, NY 10001 located on the map?	{'plan': 'search_location', 'arguments': {'query': '789 Birch Road, Floor 2, New York, NY 10001'}}	ACTION_EDIT_DOCUMENT-1564-get_contact_info-1_NR-ACTION_EDIT_CONTACT-1-search_location-1	['search_location', 'ACTION_VIEW_EVENT', 'ACTION_OPEN_DOCUMENT', 'ACTION_NAVIGATE_TO_LOCATION', 'ACTION_SHOW_TIMERS']
['turn 1: Please video record our meeting. -> Starting video recording for your meeting now.', 'turn 2: Can you help me pick a contact from my saved directory? -> Sure—contact picker opened. You selected content://contacts/people/12.', 'turn 3: Update its phone number to 555-6789. -> Phone number for the contact has been changed to 555-6789. (content://contacts/people/12)']	Locate it on the map?	Locate content://contacts/people/12 on the map?	{'plan': 'search_location', 'arguments': {'query': 'content://contacts/people/12'}}	ACTION_VIDEO_CAPTURE-750-ACTION_PICK-1_NR-ACTION_EDIT_CONTACT-1-search_location-1	['INTENT_ACTION_VIDEO_CAMERA', 'play_music', 'search_location', 'launch_application', 'ACTION_SHOW_TIMERS']
"['turn 1: Read out my alarm list, please. -> Here’s your alarm lineup: [alarm_id: 1 - 6:00 AM, Morning Run; alarm_id: 2 - 6:15 AM, Meditate; alarm_id: 3 - 6:45 AM, Breakfast; alarm_id: 4 - 7:30 AM, Office]', ""turn 2: Keep it at the same time but use the silent ringtone and set it without confirmation -> Alarm 4 'Office' remains at 7:30 AM with the silent ringtone enabled."", ""turn 3: Add an event named 'Dance Class' for a hip-hop session at City Dance Studio. It should start at 1700800000000 and end at 1700805400000. -> Got it! 'Dance Class' (Hip‑hop session) at City Dance Studio from 1700800000000 to 1700805400000 has been added. (content://calendar/event/8)""]"	Where is it located on the map?	Where is City Dance Studio located on the map?	{'plan': 'search_location', 'arguments': {'query': 'City Dance Studio'}}	ACTION_SHOW_ALARMS-695-ACTION_EDIT_ALARM-1-ACTION_INSERT_EVENT-1_NR-search_location-1	['dial', 'search_location', 'ACTION_NAVIGATE_TO_LOCATION', 'ACTION_PICK', 'INTENT_ACTION_STILL_IMAGE_CAMERA']
"[""turn 1: Let me look at my sent email list. -> Your sent folder contains: to gina@example.com - 'Budget Report'; to harry@example.com - 'Weekly Sync'; to iris@example.com - 'Proposal Draft'."", 'turn 2: Please get the address details for the contact with URI /contact/info/sara. -> Sara’s address on file is 128 Cherry Lane, Maple Town, CA 90210.', ""turn 3: Update that contact's address to 500 Elm Street, Gotham City, NY 10001 -> Address for /contact/info/sara has been changed to 500 Elm Street, Gotham City, NY 10001.""]"	Show me its location on the map.	Show me 500 Elm Street, Gotham City, NY 10001 location on the map.	{'plan': 'search_location', 'arguments': {'query': '500 Elm Street, Gotham City, NY 10001'}}	ACTION_VIEW_SENT_EMAILS-1967-get_contact_info-1_NR-ACTION_EDIT_CONTACT-1-search_location-1	['ACTION_VIEW_SENT_EMAILS', 'ACTION_VIEW_PLAYLIST', 'ACTION_SET_ALARM', 'search_location', 'ACTION_INSERT_EVENT']
"['turn 1: Access content://contacts/people/777 and return all details. -> All details for content://contacts/people/777:\nName: Sarah Lee\nPhone: (310) 555-7890\nEmail: sarah.lee@company.com\nAddress: 321 Elm Street, Beverly Hills, CA 90212.', 'turn 2: View it -> Showing all details for content://contacts/people/777:\nName: Sarah Lee\nPhone: (310) 555-7890\nEmail: sarah.lee@company.com\nAddress: 321 Elm Street, Beverly Hills, CA 90212', ""turn 3: Please schedule an event called 'Fitness Bootcamp'. It's described as an intense morning workout session at a local fitness center from 1701800000000 to 1701803600000. -> All set! ‘Fitness Bootcamp’ has been added to your calendar on November 24 at the Local fitness center. You can view it here: content://calendar/event/8""]"	What's its exact address?	What's the exact address of the Local fitness center?	{'plan': 'search_location', 'arguments': {'query': 'Local fitness center'}}	get_contact_info-1013-ACTION_VIEW_CONTACT-1-ACTION_INSERT_EVENT-1_NR-search_location-1	['ACTION_VIEW_SENT_MESSAGES', 'ACTION_SET_RINGTONE', 'send_email', 'search_location', 'ACTION_IMAGE_CAPTURE']
['turn 1: Give me the ringtone selection screen. -> Got it. Opening the ringtone selection interface.', 'turn 2: I require an address of one of my acquaintances; fetch me the postal info. -> All done! Address URI: content://contacts/address/42', 'turn 3: Change that postal address to 742 Evergreen Terrace, Springfield -> Done! The address has been updated to “742 Evergreen Terrace, Springfield.” You can view it here: content://contacts/address/42']	Show me that address on the map.	Show me content://contacts/address/42 on the map.	{'plan': 'search_location', 'arguments': {'query': 'content://contacts/address/42'}}	ACTION_GET_RINGTONE-307-ACTION_PICK-1_NR-ACTION_EDIT_CONTACT-1-search_location-1	['ACTION_VIDEO_CAPTURE', 'ACTION_OPEN_CONTENT', 'search_location', 'ACTION_INSERT_CONTACT', 'ACTION_NAVIGATE_TO_LOCATION']
['turn 1: Add Lucas Wright to my address book with phone: 321-654-0987 and home address: 456 Maple Street. -> Creating Lucas Wright’s contact: phone 321‑654‑0987 and address 456 Maple Street are filled in.', 'turn 2: Dial him now -> Calling 321-654-0987 now...', 'turn 3: Add that number to my contacts -> Creating a new contact entry: telephone 321-654-0987 is pre-populated.']	Open that address on map	Open 456 Maple Street on map	{'plan': 'search_location', 'arguments': {'query': '456 Maple Street'}}	ACTION_INSERT_CONTACT-392-dial-1-ACTION_INSERT_CONTACT-1-search_location-1	['send_message', 'dial', 'ACTION_IMAGE_CAPTURE', 'ACTION_VIEW_SENT_MESSAGES', 'search_location']
"[""turn 1: Alarm 26 should be at 16:35 every Wednesday with 'uri://pop_tune' ringtone. -> Alarm 26 updated to 4:35\xa0PM every Wednesday using the 'uri://pop_tune' ringtone."", 'turn 2: Help me select a mailing address from my saved contacts. -> There you go! Mailing address selected: content://contacts/address/15', 'turn 3: Change it to 456 Elm St and add phone 555-6789 -> All done—address set to “456 Elm St” and phone number 555-6789 added. View it at content://contacts/address/15']"	Where is that on the map?	Where is content://contacts/address/15 on the map?	{'plan': 'search_location', 'arguments': {'query': 'content://contacts/address/15'}}	ACTION_EDIT_ALARM-1660-ACTION_PICK-1_NR-ACTION_EDIT_CONTACT-1-search_location-1	['play_video', 'ACTION_IMAGE_CAPTURE', 'ACTION_EDIT_DOCUMENT', 'search_location', 'ACTION_VIEW_PLAYLIST']
"['turn 1: Call the front desk at +81-3-1234-5678. -> Calling +81-3-1234-5678 now...', ""turn 2: Give me the list of my recent calls. -> Here's your recent call log: +81-3-1234-5678 (Outgoing) - Today 3:50 PM; 020-7946-0958 (Incoming) - Today 10:10 AM; +1-800-123-4567 (Missed) - Yesterday 7:00 PM"", ""turn 3: Save that missed number as a new contact Support -> New contact 'Support' (+1-800-123-4567) saved successfully.""]"	Locate it on a map.	Locate +1-800-123-4567 on a map.	{'plan': 'search_location', 'arguments': {'query': '+1-800-123-4567'}}	dial-933-ACTION_VIEW_CALL_LOG-1-ACTION_INSERT_CONTACT-1-search_location-1	['ACTION_EDIT_DOCUMENT', 'search_location', 'ACTION_PICK', 'ACTION_OPEN_DOCUMENT', 'INTENT_ACTION_STILL_IMAGE_CAMERA']
"[""turn 1: Please change Kate's phone from 9876543210 to 0123456789 at content://contacts/people/kate_l. -> Done! Kate’s phone number has been updated to 0123456789."", 'turn 2: Open that contact’s info. -> All set—here’s Kate L.’s contact info (content://contacts/people/kate_l).', 'turn 3: Add her address 123 Elm Street, Springfield -> Success! Added “123 Elm Street, Springfield” to Kate L.’s contact. Updated URI: content://contacts/people/kate_l']"	Find that on a map.	Find 123 Elm Street, Springfield on a map.	{'plan': 'search_location', 'arguments': {'query': '123 Elm Street, Springfield'}}	ACTION_EDIT_CONTACT-67-ACTION_VIEW_CONTACT-1-ACTION_EDIT_CONTACT-1-search_location-1	['ACTION_VIEW_WEB_HISTORY', 'search_location', 'ACTION_SET_ALARM', 'ACTION_EDIT_CONTACT', 'ACTION_VIEW_SENT_EMAILS']
"['turn 1: Locate the Sagrada Familia church in Barcelona for me. -> Dropping a pin at Sagrada Família, Carrer de Mallorca, 401, 08013 Barcelona, Spain. Check it out!', ""turn 2: Please call up a contact's email address from my records. -> Alrighty! Email selected here: content://contacts/email/108"", 'turn 3: Change its company to Acme Corp and add phone 555-1234 -> All set—Acme Corp and phone number 555-1234 have been added. Updated record: content://contacts/email/108']"	Where is that company located?	Where is Acme Corp located?	{'plan': 'search_location', 'arguments': {'query': 'Acme Corp'}}	search_location-1168-ACTION_PICK-1_NR-ACTION_EDIT_CONTACT-1-search_location-1	['ACTION_VIEW_WEB_HISTORY', 'ACTION_GET_RINGTONE', 'search_location', 'send_email', 'ACTION_PICK']
['turn 1: Open the font file content://fonts/arial.ttf -> Loading font file arial.ttf from content://fonts/arial.ttf.', 'turn 2: I require a contact from my people directory – please pull up one. -> Contact list opened. Your selection: content://contacts/people/30.', 'turn 3: Set its company to OpenAI -> Company field updated to ‘OpenAI’. (content://contacts/people/30)']	Where is that company located?	Where is OpenAI located?	{'plan': 'search_location', 'arguments': {'query': 'OpenAI'}}	ACTION_OPEN_CONTENT-252-ACTION_PICK-1_NR-ACTION_EDIT_CONTACT-1-search_location-1	['search_location', 'ACTION_EDIT_ALARM', 'ACTION_NAVIGATE_TO_LOCATION', 'web_search', 'ACTION_CREATE_DOCUMENT']
['turn 1: Please take a photo and let the system decide where to save it. -> Got it. Photo taken and stored at content://media/internal/photos/IMG_20230615_100200.jpg.', 'turn 2: Select a personal contact entry from my list. -> Personal contacts shown. You chose content://contacts/people/27.', 'turn 3: Add an address to it: 123 Maple Street, Springfield -> Address added: 123 Maple Street, Springfield. (content://contacts/people/27)']	Can you find that on a map?	Can you find 123 Maple Street, Springfield on a map?	{'plan': 'search_location', 'arguments': {'query': '123 Maple Street, Springfield'}}	ACTION_IMAGE_CAPTURE-370-ACTION_PICK-1_NR-ACTION_EDIT_CONTACT-1-search_location-1	['ACTION_VIEW_CALL_LOG', 'ACTION_VIEW_PLAYLIST', 'search_location', 'ACTION_EDIT_DOCUMENT', 'launch_application']
"[""turn 1: Send a quick reminder to John at +15551234567 saying 'Don't forget the meeting at 3pm today.' -> Your reminder has been sent to +15551234567."", 'turn 2: Give him a quick call -> Initiating call to +15551234567...', 'turn 3: Create a new contact with that number -> Initiating contact setup: +15551234567 is entered.']"	Find their address using the map app	Find +15551234567's address using the map app	{'plan': 'search_location', 'arguments': {'query': '+15551234567'}}	send_message-1241-dial-1-ACTION_INSERT_CONTACT-1-search_location-1	['ACTION_IMAGE_CAPTURE', 'search_location', 'launch_application', 'ACTION_VIEW_EVENT', 'ACTION_VIEW_SENT_EMAILS']
"['turn 1: Present the list of timers in progress. -> Totals: 3 timers ongoing—40 minutes for Code review, 10 minutes for Moisture sensor, and 20 minutes for Nap.', 'turn 2: Set a 30-minute timer for it -> Nap timer activated for 30 minutes. Sweet dreams!', ""turn 3: Set a calendar event for 'Meditation Retreat', a full-day mindfulness practice session. No explicit location is mentioned and it is set from 1702700000000 to 1702707200000. -> All set! 'Meditation Retreat' is scheduled for December 16. You’ll find the event here: content://calendar/event/2""]"	What’s the exact location for it?	What’s the exact location for content://calendar/event/2?	{'plan': 'search_location', 'arguments': {'query': 'content://calendar/event/2'}}	ACTION_SHOW_TIMERS-1865-ACTION_SET_TIMER-1-ACTION_INSERT_EVENT-1_NR-search_location-1	['search_location', 'ACTION_CREATE_DOCUMENT', 'ACTION_EDIT_VIDEO', 'ACTION_GET_CONTENT', 'ACTION_PICK']
['turn 1: Please extract the address for the person stored at content://contacts/people/2718. -> Here’s the address: 2718 Pine Lane, Rivertown, TX 75001.', 'turn 2: Show that contact -> Alright—bringing up the contact at content://contacts/people/2718. You should see the full profile now.', 'turn 3: Edit it to update the phone number to 555-123-4567 -> Got it—555-123-4567 is now saved as the phone for content://contacts/people/2718.']	Where is it on the map?	Where is 2718 Pine Lane, Rivertown, TX 75001 on the map?	{'plan': 'search_location', 'arguments': {'query': '2718 Pine Lane, Rivertown, TX 75001'}}	get_contact_info-975-ACTION_VIEW_CONTACT-1-ACTION_EDIT_CONTACT-1-search_location-1	['ACTION_OPEN_CONTENT', 'ACTION_NAVIGATE_TO_LOCATION', 'search_location', 'ACTION_EDIT_DOCUMENT', 'ACTION_VIEW_CALL_LOG']
"['turn 1: Open the memory card options, please. -> Memory card settings opened — you can now manage your external storage.', 'turn 2: Find the nearest gas station -> Sure thing. The nearest gas station is Shell, 842 Elm Street, Springfield.', ""turn 3: Create an event called Fill Up at it tomorrow at 3 PM and ending at 3:30 PM with description Fill the tank -> Sure—I've added 'Fill Up at Shell' to your calendar for tomorrow from 3:00 PM to 3:30 PM at 842 Elm Street, Springfield. You can view it here: content://calendar/event/1""]"	Can you show me where that is on the map?	Can you show me where 842 Elm Street, Springfield is on the map?	{'plan': 'search_location', 'arguments': {'query': '842 Elm Street, Springfield'}}	open_settings-1088-search_location-1-ACTION_INSERT_EVENT-1-search_location-1	['ACTION_SET_ALARM', 'ACTION_VIEW_WEB_HISTORY', 'ACTION_INSERT_EVENT', 'ACTION_VIDEO_CAPTURE', 'search_location']
"['turn 1: Launch internal storage settings so I can free up some space. -> Internal storage settings opened successfully. You can now free up space.', 'turn 2: Search for a coffee shop nearby -> Got it! There’s a coffee shop called Café Aroma at 58 Maple Avenue, Springfield.', ""turn 3: Set a meeting there next Monday at 10 AM titled Coffee Break with description Catch up over coffee ending at 11 AM -> All set! Your 'Coffee Break' event is scheduled next Monday, 10:00 AM–11:00 AM at 58 Maple Avenue, Springfield. Check it out: content://calendar/event/2""]"	Could you map that meeting location?	Could you map 58 Maple Avenue, Springfield?	{'plan': 'search_location', 'arguments': {'query': '58 Maple Avenue, Springfield'}}	open_settings-1087-search_location-1-ACTION_INSERT_EVENT-1-search_location-1	['ACTION_SET_ALARM', 'ACTION_PICK', 'search_location', 'ACTION_VIEW_EVENT', 'ACTION_OPEN_CONTENT']
"['turn 1: Phone the helpline on 777-8888. -> Calling 777-8888...', 'turn 2: Save it to my address book. -> Contact for 777-8888 saved. (URI: content://contacts/people/7778888)', ""turn 3: Name it 'Helpline Support'. -> Updated contact name to ‘Helpline Support’. (content://contacts/people/7778888)""]"	Open that address in maps	Open content://contacts/people/7778888 address in maps	{'plan': 'ACTION_NAVIGATE_TO_LOCATION', 'arguments': {'location': 'content://contacts/people/7778888'}}	dial-925-ACTION_INSERT_CONTACT-1-ACTION_EDIT_CONTACT-1-ACTION_NAVIGATE_TO_LOCATION-1	['ACTION_VIEW_RECENT_APPS', 'ACTION_GET_RINGTONE', 'ACTION_GET_CONTENT', 'get_contact_info', 'ACTION_NAVIGATE_TO_LOCATION']
['turn 1: Choose several PPT slideshows. -> Got it! Feel free to pick multiple PowerPoint slideshow files (.ppt).', 'turn 2: Access the internal storage settings for my device, please. -> Internal storage settings are now open—manage your device storage as needed.', 'turn 3: Show me a complete summary for /data/alex. -> Here’s the contact summary for /data/alex:\n• Name: Alex Turner\n• Phone: 555-482-1010\n• Email: alex.turner@mobilemail.com\n• Address: 123 Cedar Road, Apt. 5']	Take me there.	Take me to 123 Cedar Road, Apt. 5.	{'plan': 'ACTION_NAVIGATE_TO_LOCATION', 'arguments': {'location': '123 Cedar Road, Apt. 5'}}	ACTION_OPEN_DOCUMENT-153-open_settings-1_NR-get_contact_info-1_NR-ACTION_NAVIGATE_TO_LOCATION-1	['ACTION_NAVIGATE_TO_LOCATION', 'ACTION_SHOW_TIMERS', 'ACTION_GET_RINGTONE', 'ACTION_SET_ALARM', 'ACTION_GET_CONTENT']
"[""turn 1: Let me look at my sent email list. -> Your sent folder contains: to gina@example.com - 'Budget Report'; to harry@example.com - 'Weekly Sync'; to iris@example.com - 'Proposal Draft'."", 'turn 2: Please get the address details for the contact with URI /contact/info/sara. -> Sara’s address on file is 128 Cherry Lane, Maple Town, CA 90210.', ""turn 3: Update that contact's address to 500 Elm Street, Gotham City, NY 10001 -> Address for /contact/info/sara has been changed to 500 Elm Street, Gotham City, NY 10001.""]"	Open it in maps	Open 500 Elm Street, Gotham City, NY 10001 in maps	{'plan': 'ACTION_NAVIGATE_TO_LOCATION', 'arguments': {'location': '500 Elm Street, Gotham City, NY 10001'}}	ACTION_VIEW_SENT_EMAILS-1967-get_contact_info-1_NR-ACTION_EDIT_CONTACT-1-ACTION_NAVIGATE_TO_LOCATION-1	['search_location', 'play_music', 'ACTION_VIDEO_CAPTURE', 'ACTION_NAVIGATE_TO_LOCATION', 'INTENT_ACTION_VIDEO_CAMERA']
"['turn 1: Search for 500 Terry Francois Boulevard, San Francisco, CA. -> Got it: 500 Terry Francois Blvd, San Francisco, CA 94158, USA.', 'turn 2: Email that to assistant@example.com and ask them to schedule a site visit. -> Message sent to assistant@example.com to schedule the site visit.', ""turn 3: Could you please create an event for a 'Client Meeting'? The discussion will be about contract details at Downtown Office from 1700600000000 to 1700603600000. -> Your calendar now includes 'Client Meeting'—Discussion about contract details at Downtown Office, 1700600000000–1700603600000. Check it here: content://calendar/event/9""]"	Show me the route there	Show me the route to 500 Terry Francois Blvd, San Francisco, CA 94158, USA	{'plan': 'ACTION_NAVIGATE_TO_LOCATION', 'arguments': {'location': '500 Terry Francois Blvd, San Francisco, CA 94158, USA'}}	search_location-1138-send_email-1-ACTION_INSERT_EVENT-1_NR-ACTION_NAVIGATE_TO_LOCATION-1	['get_contact_info_from_uri', 'ACTION_VIEW_EVENT', 'ACTION_SET_TIMER', 'open_settings', 'ACTION_NAVIGATE_TO_LOCATION']
"['turn 1: Could you bring forward my recently opened apps? -> Your recent apps are: Chrome; YouTube; Docs; Sheets', 'turn 2: I am interested in seeing the timers that are currently on. -> Active timers list: [5 minutes – Stretch break, 25 minutes – Focus session, 3 minutes – Email check]', ""turn 3: I would like to add an event called 'Sculpture Workshop'. The description is 'Learn sculpting basics under expert guidance'. It will be hosted at the Art Institute from 1702500000000 to 1702505400000. -> Done – 'Sculpture Workshop' has been added on December 14 at Art Institute. Check it out: content://calendar/event/4""]"	Guide me there	Guide me to the Art Institute.	{'plan': 'ACTION_NAVIGATE_TO_LOCATION', 'arguments': {'location': 'Art Institute'}}	ACTION_VIEW_RECENT_APPS-2209-ACTION_SHOW_TIMERS-1_NR-ACTION_INSERT_EVENT-1_NR-ACTION_NAVIGATE_TO_LOCATION-1	['ACTION_SET_RINGTONE', 'ACTION_NAVIGATE_TO_LOCATION', 'web_search', 'get_contact_info', 'get_contact_info_from_uri']
"['turn 1: Load up the video capture app. -> Successfully opened the video camera app.', 'turn 2: Record the video now and save it to content://example/uri. -> Recording now. The video will be saved to content://example/uri once you finish.', ""turn 3: Organize an event titled 'Coding Bootcamp' that is an intensive programming course covering Python and JavaScript. It should be held at Tech Center from 1702600000000 to 1702607200000. -> Success! 'Coding Bootcamp' is now on your calendar for December 15 at Tech Center. Details: content://calendar/event/3""]"	Drive me to it	Drive me to Tech Center	{'plan': 'ACTION_NAVIGATE_TO_LOCATION', 'arguments': {'location': 'Tech Center'}}	INTENT_ACTION_VIDEO_CAMERA-908-ACTION_VIDEO_CAPTURE-1-ACTION_INSERT_EVENT-1_NR-ACTION_NAVIGATE_TO_LOCATION-1	['ACTION_VIEW_CONTACT', 'ACTION_EDIT_DOCUMENT', 'ACTION_VIEW_SENT_MESSAGES', 'ACTION_NAVIGATE_TO_LOCATION', 'ACTION_SET_TIMER']
