conversation_history	query	rewrited_query	answer	unique_idx	candidates
"['turn 1: Could you set a 10-minute timer? -> All set! Your 10-minute timer is now running.', ""turn 2: I'm selecting multiple images. Help me pick several image files at once. -> Absolutely! Launching your gallery so you can multi-select the images you want."", ""turn 3: Could you make a new image file there named VacationCollage.jpg -> Voilà—your new gallery image 'VacationCollage.jpg' is ready at content://documents/VacationCollage.jpg. Enjoy!""]"	Could you open it?	Could you open content://documents/VacationCollage.jpg?	{'plan': 'ACTION_OPEN_CONTENT', 'arguments': {'uri': 'content://documents/VacationCollage.jpg'}}	ACTION_SET_TIMER-599-ACTION_OPEN_DOCUMENT-1_NR-ACTION_CREATE_DOCUMENT-1-ACTION_OPEN_CONTENT-1	['ACTION_OPEN_CONTENT', 'ACTION_VIEW_EVENT', 'ACTION_VIEW_SENT_MESSAGES', 'ACTION_VIEW_SENT_EMAILS', 'ACTION_SET_TIMER']
"[""turn 1: View 'Acoustic Morning'. -> Opening 'Acoustic Morning': Banana Pancakes; Better Together; Heartbeats."", 'turn 2: Kick off the still photo app on my device. -> Still photo mode opened successfully.', ""turn 3: Show me the latest picture from my camera roll -> All set! I've grabbed your most recent image: content://temp/last_photo.jpg""]"	Display it	Display content://temp/last_photo.jpg	{'plan': 'ACTION_OPEN_CONTENT', 'arguments': {'uri': 'content://temp/last_photo.jpg'}}	ACTION_VIEW_PLAYLIST-2146-INTENT_ACTION_STILL_IMAGE_CAMERA-1_NR-ACTION_GET_CONTENT-1-ACTION_OPEN_CONTENT-1	['dial', 'ACTION_SHOW_ALARMS', 'launch_application', 'ACTION_INSERT_CONTACT', 'ACTION_OPEN_CONTENT']
"['turn 1: Lay out my recent internet footsteps. -> Your web log shows: Google search for best noise-cancelling headphones; Wikipedia: Active Noise Control; YouTube: Sony WH-1000XM4 Review; Amazon: Bose QuietComfort 35 II; OpenAI Blog: GPT-4 Release Highlights; Reddit: r/headphones.', ""turn 2: Show me a selection dialog where I can pick multiple plain text files. -> Absolutely—here's your text file picker with multi-select enabled. Choose all the files you need."", ""turn 3: Then create one as a text file named TodoList.txt. -> Your text file 'TodoList.txt' with multi-select support is created at content://documents/TodoList.txt.""]"	Please open it now.	Please open content://documents/TodoList.txt now.	{'plan': 'ACTION_OPEN_CONTENT', 'arguments': {'uri': 'content://documents/TodoList.txt'}}	ACTION_VIEW_WEB_HISTORY-2090-ACTION_OPEN_DOCUMENT-1_NR-ACTION_CREATE_DOCUMENT-1-ACTION_OPEN_CONTENT-1	['ACTION_INSERT_CONTACT', 'ACTION_GET_RINGTONE', 'ACTION_VIDEO_CAPTURE', 'ACTION_OPEN_CONTENT', 'ACTION_VIEW_SENT_EMAILS']
"['turn 1: Provide me with the active timer list. -> Your active timers: 10 minutes - Workout, 5 minutes - Tea, 20 minutes - Baking.', ""turn 2: Help me pick a single plain text document from my storage. -> Certainly. Here's the file browser for text documents—pick the one you’d like."", ""turn 3: If none of those text documents work, create one named MeetingNotes.txt. -> New document 'MeetingNotes.txt' is ready at content://documents/MeetingNotes.txt. You can now jot down your meeting notes.""]"	Open it to start writing.	Open content://documents/MeetingNotes.txt to start writing.	{'plan': 'ACTION_OPEN_CONTENT', 'arguments': {'uri': 'content://documents/MeetingNotes.txt'}}	ACTION_SHOW_TIMERS-1883-ACTION_OPEN_DOCUMENT-1_NR-ACTION_CREATE_DOCUMENT-1-ACTION_OPEN_CONTENT-1	['play_music', 'ACTION_EDIT_DOCUMENT', 'ACTION_VIEW_RECENT_APPS', 'ACTION_INSERT_CONTACT', 'ACTION_OPEN_CONTENT']
"[""turn 1: Common symptoms associated with type 2 diabetes. -> Searching for 'common symptoms of type 2 diabetes'... Preview: fatigue, frequent urination, increased thirst, blurred vision and slow-healing wounds are commonly listed."", 'turn 2: I want to choose one PDF document for permanent access. Please open the file chooser. -> Opening the PDF-only picker. Choose a single PDF document for permanent access.', ""turn 3: Alright, let's make a new one and call it Report.pdf. -> Your permanent PDF 'Report.pdf' has been created at content://documents/Report.pdf. It’s saved and ready for long‑term access.""]"	Open that PDF for review	Open content://documents/Report.pdf for review	{'plan': 'ACTION_OPEN_CONTENT', 'arguments': {'uri': 'content://documents/Report.pdf'}}	web_search-1326-ACTION_OPEN_DOCUMENT-1_NR-ACTION_CREATE_DOCUMENT-1-ACTION_OPEN_CONTENT-1	['send_message', 'ACTION_SHOW_ALARMS', 'ACTION_GET_CONTENT', 'ACTION_OPEN_CONTENT', 'send_email']
"['turn 1: Show me the contract PDF at content://docs/contract.pdf -> Contract PDF is ready for you at content://docs/contract.pdf.', ""turn 2: I want to shoot a photo; please launch the still mode camera on my phone. -> Your phone's still image camera is now open and ready."", 'turn 3: I want to select one document that is in text format. Open my document picker. -> Here’s the text file picker—go ahead and choose a document.']"	Open it	Open content://docs/contract.pdf	{'plan': 'ACTION_OPEN_CONTENT', 'arguments': {'uri': 'content://docs/contract.pdf'}}	ACTION_OPEN_CONTENT-269-INTENT_ACTION_STILL_IMAGE_CAMERA-1_NR-ACTION_OPEN_DOCUMENT-1_NR-ACTION_OPEN_CONTENT-1	['ACTION_SHOW_ALARMS', 'ACTION_GET_RINGTONE', 'ACTION_OPEN_DOCUMENT', 'ACTION_VIEW_WEB_HISTORY', 'ACTION_OPEN_CONTENT']
"['turn 1: I need to speak with tech support: 1800-123-000. -> Dialing tech support at 1800-123-000 now...', 'turn 2: I need to select an image from my device for an upcoming editing session. -> On it! Opening your photo gallery picker—select the image you want to edit.', ""turn 3: Create a new image file named EditedImage.jpg -> Here's your new image file 'EditedImage.jpg': content://documents/EditedImage.jpg.""]"	Open it for editing.	Open content://documents/EditedImage.jpg for editing.	{'plan': 'ACTION_OPEN_CONTENT', 'arguments': {'uri': 'content://documents/EditedImage.jpg'}}	dial-934-ACTION_OPEN_DOCUMENT-1_NR-ACTION_CREATE_DOCUMENT-1-ACTION_OPEN_CONTENT-1	['launch_application', 'ACTION_EDIT_CONTACT', 'ACTION_OPEN_CONTENT', 'ACTION_OPEN_DOCUMENT', 'ACTION_VIEW_SENT_EMAILS']
"['turn 1: Please list running timers. -> Active timers: 1 hour - Laundry, 10 minutes - Meditation.', ""turn 2: Set up the phone's photo mode to take a picture. -> Photo mode camera has been opened."", 'turn 3: Open my gallery and select the picture I just snapped. -> Browsing your gallery for the photo you just took... Got it: content://temp/photo123.jpg']"	Open that image	Open content://temp/photo123.jpg image	{'plan': 'ACTION_OPEN_CONTENT', 'arguments': {'uri': 'content://temp/photo123.jpg', 'mime_type': 'image/jpeg'}}	ACTION_SHOW_TIMERS-1881-INTENT_ACTION_STILL_IMAGE_CAMERA-1_NR-ACTION_GET_CONTENT-1-ACTION_OPEN_CONTENT-1	['ACTION_NAVIGATE_TO_LOCATION', 'INTENT_ACTION_VIDEO_CAMERA', 'ACTION_IMAGE_CAPTURE', 'ACTION_OPEN_CONTENT', 'ACTION_VIEW_PLAYLIST']
"['turn 1: Choose a Markdown document to edit. -> Opening your documents—select a Markdown (.md) file to edit.', ""turn 2: Summon the device's camera app for a still photograph. -> Camera ready in still image mode."", 'turn 3: Choose the image I just shot -> Image selection complete—here’s what you just captured: content://temp/photo128.jpg']"	Show me that capture	Show me content://temp/photo128.jpg	{'plan': 'ACTION_OPEN_CONTENT', 'arguments': {'uri': 'content://temp/photo128.jpg'}}	ACTION_OPEN_DOCUMENT-163-INTENT_ACTION_STILL_IMAGE_CAMERA-1_NR-ACTION_GET_CONTENT-1-ACTION_OPEN_CONTENT-1	['ACTION_SHOW_TIMERS', 'ACTION_VIEW_WEB_HISTORY', 'ACTION_VIEW_PLAYLIST', 'ACTION_GET_CONTENT', 'ACTION_OPEN_CONTENT']
"['turn 1: Open content://files/lecture.mp4 without any edits. -> Opening lecture.mp4 in the video editor now. Let me know if you want to trim or mute anything once it’s loaded!', 'turn 2: Provide a file selection for multiple images; I need to choose several. -> Okay, opening the image picker—select the pictures you need.', ""turn 3: If there aren’t any images, create one named GalleryPic1.jpg. -> No images were found—so I created 'GalleryPic1.jpg' at content://documents/GalleryPic1.jpg. You can view it right away.""]"	Display it now	Display content://documents/GalleryPic1.jpg now	{'plan': 'ACTION_OPEN_CONTENT', 'arguments': {'uri': 'content://documents/GalleryPic1.jpg'}}	ACTION_EDIT_VIDEO-1730-ACTION_OPEN_DOCUMENT-1_NR-ACTION_CREATE_DOCUMENT-1-ACTION_OPEN_CONTENT-1	['launch_application', 'ACTION_IMAGE_CAPTURE', 'ACTION_SET_RINGTONE', 'ACTION_OPEN_CONTENT', 'ACTION_PICK']
"[""turn 1: Hey, let's fix Natalie Reed's phone and address in content://contacts/people/natalie_r. New phone: 555-0001, address: 123 Oak Lane. -> Got it! Opening the contact editor for Natalie Reed (URI: content://contacts/people/natalie_r) with phone 555-0001 and address 123 Oak Lane."", ""turn 2: I'd like to capture a moment; please start the still-image camera. -> Your still camera is up; let's capture a great shot."", 'turn 3: Choose the last photo -> Got it – here’s your last photo: content://temp/last_capture.jpg']"	Open that image	Open content://temp/last_capture.jpg image	{'plan': 'ACTION_OPEN_CONTENT', 'arguments': {'uri': 'content://temp/last_capture.jpg'}}	ACTION_EDIT_CONTACT-89-INTENT_ACTION_STILL_IMAGE_CAMERA-1_NR-ACTION_GET_CONTENT-1-ACTION_OPEN_CONTENT-1	['dial', 'ACTION_OPEN_CONTENT', 'ACTION_SET_RINGTONE', 'get_contact_info', 'send_message']
"[""turn 1: Expose my device's recent app history. -> Your recent applications: Calendar; Gmail; Spotify; Photos."", 'turn 2: I need to open both text and PDF files, and I want to be able to select multiple documents. -> Okay, launching the file picker for both text and PDF documents. Feel free to select as many as you like.', ""turn 3: Also, create one as a PDF named CombinedReport.pdf. -> Done! Here's your freshly created PDF 'CombinedReport.pdf': content://documents/CombinedReport.pdf.""]"	Open it to confirm its contents	Open content://documents/CombinedReport.pdf to confirm its contents	{'plan': 'ACTION_OPEN_CONTENT', 'arguments': {'uri': 'content://documents/CombinedReport.pdf'}}	ACTION_VIEW_RECENT_APPS-2214-ACTION_OPEN_DOCUMENT-1_NR-ACTION_CREATE_DOCUMENT-1-ACTION_OPEN_CONTENT-1	['ACTION_OPEN_DOCUMENT', 'ACTION_SET_TIMER', 'ACTION_SET_RINGTONE', 'ACTION_OPEN_CONTENT', 'ACTION_PICK']
"['turn 1: Open the contract at content://documents/doc/636. -> Sure thing! Your contract (content://documents/doc/636) is now open for editing.', ""turn 2: Could you start the device's normal photo shooting mode? -> Still photo capture mode launched."", 'turn 3: Choose the last image from the camera -> Your chosen photo is now available at content://temp/20240615_101200.jpg']"	Let me view that image	Let me view content://temp/20240615_101200.jpg	{'plan': 'ACTION_OPEN_CONTENT', 'arguments': {'uri': 'content://temp/20240615_101200.jpg'}}	ACTION_EDIT_DOCUMENT-1562-INTENT_ACTION_STILL_IMAGE_CAMERA-1_NR-ACTION_GET_CONTENT-1-ACTION_OPEN_CONTENT-1	['ACTION_OPEN_CONTENT', 'ACTION_SET_ALARM', 'web_search', 'send_message', 'ACTION_VIEW_CALL_LOG']
"['turn 1: Could you launch the MX Player to play this segment: rtsp://example.com/segment.sdp -> MX Player is streaming rtsp://example.com/segment.sdp now. Playback has started.', 'turn 2: From my device, I want to open a single image file for persistent use. -> Alright, opening your images—please select one file for ongoing use.', ""turn 3: Since there's no suitable image, create a new one named Photo.png. -> No image matched your needs, so 'Photo.png' has been created: content://images/Photo.png. You can now add your own picture.""]"	Open it for editing.	Open content://images/Photo.png for editing.	{'plan': 'ACTION_OPEN_CONTENT', 'arguments': {'uri': 'content://images/Photo.png'}}	play_video-1437-ACTION_OPEN_DOCUMENT-1_NR-ACTION_CREATE_DOCUMENT-1-ACTION_OPEN_CONTENT-1	['ACTION_OPEN_CONTENT', 'open_settings', 'send_email', 'INTENT_ACTION_STILL_IMAGE_CAMERA', 'search_location']
['turn 1: Show me the way to 350 Fifth Avenue, New York, NY. -> 350 Fifth Avenue, New York, NY navigation initiated. Follow the turn-by-turn instructions.', 'turn 2: I need to select documents in both text and PDF formats. I plan to pick more than one file; please enable multiple selections. -> Multiple-document selector: files chosen are\n– content://storage/docs/meeting.txt\n– content://storage/docs/summary.pdf', 'turn 3: Create a new PDF from that summary named CombinedSummary.pdf -> Created a fresh PDF named CombinedSummary.pdf at content://documents/CombinedSummary.pdf. Feel free to update or merge content.']	Open it for review.	Open content://documents/CombinedSummary.pdf for review.	{'plan': 'ACTION_OPEN_CONTENT', 'arguments': {'uri': 'content://documents/CombinedSummary.pdf'}}	ACTION_NAVIGATE_TO_LOCATION-1760-ACTION_OPEN_DOCUMENT-1_NR-ACTION_CREATE_DOCUMENT-1-ACTION_OPEN_CONTENT-1	['ACTION_OPEN_CONTENT', 'ACTION_VIEW_SENT_EMAILS', 'ACTION_SET_ALARM', 'ACTION_VIEW_EVENT', 'play_video']
"['turn 1: Insert Sarah Connor with phone 610-555-1212, email sarah.connor@resistance.net. -> Sarah Connor’s contact entry is live! content://contacts/people/sarah_connor', ""turn 2: Need a dialog to choose a PDF document; I'm only selecting one file. -> Understood—opening the PDF selector. Please pick the single document you want."", ""turn 3: Go ahead and create one as a PDF named Invoice.pdf. -> Your new PDF 'Invoice.pdf' is ready: content://documents/Invoice.pdf.""]"	Show me that PDF	Show me content://documents/Invoice.pdf.	{'plan': 'ACTION_OPEN_CONTENT', 'arguments': {'uri': 'content://documents/Invoice.pdf'}}	ACTION_INSERT_CONTACT-426-ACTION_OPEN_DOCUMENT-1_NR-ACTION_CREATE_DOCUMENT-1-ACTION_OPEN_CONTENT-1	['ACTION_SHOW_TIMERS', 'ACTION_SET_ALARM', 'ACTION_OPEN_CONTENT', 'ACTION_VIEW_CALL_LOG', 'web_search']
"[""turn 1: Adjust alarm 15 to 09:55, label 'Call Mom', vibrate off. -> Updated Alarm 15 to 9:55\xa0AM with label 'Call Mom' and vibration turned off."", 'turn 2: Open a plain text file from my documents — just one file, please. -> Opening the plain text document picker—please select one file.', ""turn 3: Okay, let's create a new one and name it Draft.txt. -> Got it—your new text file 'Draft.txt' is ready at content://documents/Draft.txt. Start typing whenever you like.""]"	Open it so I can start editing	Open content://documents/Draft.txt so I can start editing	{'plan': 'ACTION_OPEN_CONTENT', 'arguments': {'uri': 'content://documents/Draft.txt'}}	ACTION_EDIT_ALARM-1656-ACTION_OPEN_DOCUMENT-1_NR-ACTION_CREATE_DOCUMENT-1-ACTION_OPEN_CONTENT-1	['ACTION_SET_TIMER', 'open_settings', 'search_location', 'ACTION_OPEN_CONTENT', 'send_email']
"['turn 1: Can you take me to Uluru, Northern Territory, Australia? -> Route to Uluru, Northern Territory, Australia has been started in Maps.', ""turn 2: Access the still image capture app now. -> Still image capture app opened—you're all set to take photos."", 'turn 3: Pick that newest picture -> Here’s the newest picture you grabbed: content://temp/newest_pic.jpg']"	Open that new picture.	Open content://temp/newest_pic.jpg.	{'plan': 'ACTION_OPEN_CONTENT', 'arguments': {'uri': 'content://temp/newest_pic.jpg'}}	ACTION_NAVIGATE_TO_LOCATION-1756-INTENT_ACTION_STILL_IMAGE_CAMERA-1_NR-ACTION_GET_CONTENT-1-ACTION_OPEN_CONTENT-1	['play_video', 'ACTION_OPEN_CONTENT', 'ACTION_GET_CONTENT', 'launch_application', 'ACTION_OPEN_DOCUMENT']
"['turn 1: Could you launch the device’s video camera for me? -> Video camera launched successfully.', 'turn 2: Select a video to attach. -> Opening your video gallery—please tap a clip to attach.', ""turn 3: Create one as a text file named ClipNotes.txt -> Your file 'ClipNotes.txt' has been created at content://documents/ClipNotes.txt.""]"	Open it for me now	Open content://documents/ClipNotes.txt for me now	{'plan': 'ACTION_OPEN_CONTENT', 'arguments': {'uri': 'content://documents/ClipNotes.txt'}}	INTENT_ACTION_VIDEO_CAMERA-878-ACTION_GET_CONTENT-1-ACTION_CREATE_DOCUMENT-1-ACTION_OPEN_CONTENT-1	['ACTION_VIDEO_CAPTURE', 'dial', 'ACTION_INSERT_EVENT', 'ACTION_OPEN_CONTENT', 'ACTION_VIEW_RECENT_APPS']
"['turn 1: Do a quick retrieval of my call logs. -> Recent call logs: Victor +1-702-555-0111 (Incoming) - Today 1:00 PM; Wendy +1-213-555-0144 (Missed) - Today 6:30 AM; Xavier +1-512-555-0162 (Outgoing) - Yesterday 9:10 PM', 'turn 2: I want to select one document that is in text format. Open my document picker. -> No problem—launching the text document picker. Go ahead and pick the file you’d like.', ""turn 3: If none are available, create a new text document named Diary.txt -> Got it. Created a new text document named 'Diary.txt': content://documents/Diary.txt""]"	Open it for review	Open content://documents/Diary.txt for review	{'plan': 'ACTION_OPEN_CONTENT', 'arguments': {'uri': 'content://documents/Diary.txt'}}	ACTION_VIEW_CALL_LOG-1938-ACTION_OPEN_DOCUMENT-1_NR-ACTION_CREATE_DOCUMENT-1-ACTION_OPEN_CONTENT-1	['ACTION_OPEN_CONTENT', 'play_music', 'dial', 'play_video', 'ACTION_INSERT_CONTACT']
"['turn 1: Recording time, store as content://timelapse/tl_video.mp4. -> Got it—starting video capture now and saving to content://timelapse/tl_video.mp4.', 'turn 2: Please allow me to choose a single PDF file from my list; one is enough. -> Opening the PDF file chooser—select a single PDF document.', ""turn 3: Sure, create a new PDF and call it Invoice.pdf. -> All done! Your PDF 'Invoice.pdf' is created at content://documents/Invoice.pdf. You can review it anytime.""]"	Open it so I can check it	Open content://documents/Invoice.pdf so I can check it	{'plan': 'ACTION_OPEN_CONTENT', 'arguments': {'uri': 'content://documents/Invoice.pdf'}}	ACTION_VIDEO_CAPTURE-746-ACTION_OPEN_DOCUMENT-1_NR-ACTION_CREATE_DOCUMENT-1-ACTION_OPEN_CONTENT-1	['send_email', 'ACTION_OPEN_CONTENT', 'ACTION_OPEN_DOCUMENT', 'send_message', 'play_video']
"[""turn 1: I'd like to listen to 'Hotel California' by The Eagles on Apple Music tonight. Could you play it? -> Tuning into Hotel California by The Eagles on Apple Music."", 'turn 2: Could you please provide a way to select my PDF file? -> Certainly—opening the PDF picker now. Please choose your file.', ""turn 3: If I don't see it, create a new PDF document named Report.pdf -> All set—your PDF 'Report.pdf' is now available at content://documents/Report.pdf.""]"	Open it so I can review the report	Open content://documents/Report.pdf so I can review the report	{'plan': 'ACTION_OPEN_CONTENT', 'arguments': {'uri': 'content://documents/Report.pdf'}}	play_music-1353-ACTION_OPEN_DOCUMENT-1_NR-ACTION_CREATE_DOCUMENT-1-ACTION_OPEN_CONTENT-1	['dial', 'ACTION_OPEN_CONTENT', 'ACTION_SET_RINGTONE', 'ACTION_VIEW_CONTACT', 'send_message']
['turn 1: Could you arrange a 2.75-hour timer? -> Timer set for 2 hours and 45 minutes.', 'turn 2: I need the still photography app from my phone, please open it. -> The camera app has started in photo mode.', 'turn 3: Choose the recent picture. -> Got it—your most recent photo: content://temp/recent_image.jpg']	Show me that image	Show me content://temp/recent_image.jpg	{'plan': 'ACTION_OPEN_CONTENT', 'arguments': {'uri': 'content://temp/recent_image.jpg', 'mime_type': 'image/jpeg'}}	ACTION_SET_TIMER-651-INTENT_ACTION_STILL_IMAGE_CAMERA-1_NR-ACTION_GET_CONTENT-1-ACTION_OPEN_CONTENT-1	['launch_application', 'ACTION_EDIT_DOCUMENT', 'ACTION_OPEN_CONTENT', 'ACTION_SHOW_TIMERS', 'ACTION_VIEW_CALL_LOG']
['turn 1: Could you forward me the annual report at file:///annual_report.pdf to cfo@enterprise.com? -> Annual report forwarded to cfo@enterprise.com successfully.', 'turn 2: Begin the photo capturing tool on my device as a still image camera. -> Still image camera is open—ready for your picture.', 'turn 3: Choose the most recent photo from my gallery. -> On it! Selected the most recent gallery photo: content://temp/photo_latest.jpg']	Bring up that photo	Bring up content://temp/photo_latest.jpg	{'plan': 'ACTION_OPEN_CONTENT', 'arguments': {'uri': 'content://temp/photo_latest.jpg'}}	send_email-1220-INTENT_ACTION_STILL_IMAGE_CAMERA-1_NR-ACTION_GET_CONTENT-1-ACTION_OPEN_CONTENT-1	['ACTION_EDIT_ALARM', 'ACTION_EDIT_CONTACT', 'ACTION_VIEW_RECENT_APPS', 'ACTION_OPEN_CONTENT', 'ACTION_VIEW_WEB_HISTORY']
"['turn 1: Launch the still camera so I can take a shot. -> Still-image camera opened.', ""turn 2: I'm looking for image files to attach to my report. Could you let me choose multiple images? -> All good! Two images ready for you:\n• content://images/img001.jpg\n• content://images/img002.png"", ""turn 3: Create a new text document to list those images called ImageList.txt -> Here’s your new text file 'ImageList.txt': content://documents/ImageList.txt. You can now paste in the image URIs.""]"	Open it now.	Open content://documents/ImageList.txt now.	{'plan': 'ACTION_OPEN_CONTENT', 'arguments': {'uri': 'content://documents/ImageList.txt'}}	INTENT_ACTION_STILL_IMAGE_CAMERA-854-ACTION_OPEN_DOCUMENT-1_NR-ACTION_CREATE_DOCUMENT-1-ACTION_OPEN_CONTENT-1	['ACTION_OPEN_DOCUMENT', 'ACTION_SHOW_TIMERS', 'ACTION_GET_RINGTONE', 'ACTION_VIEW_SENT_EMAILS', 'ACTION_OPEN_CONTENT']
"[""turn 1: Let me see the recent apps I've used. -> You recently opened: Messages; Chrome; YouTube; Maps; Gmail"", 'turn 2: I want to shoot a picture: launch the photo camera. -> Opening the camera in still image mode now.', 'turn 3: Select all the images I just took -> Here are your recent shots: content://temp/image_001.jpg, content://temp/image_002.jpg, content://temp/image_003.jpg']"	Display the first one.	Display content://temp/image_001.jpg.	{'plan': 'ACTION_OPEN_CONTENT', 'arguments': {'uri': 'content://temp/image_001.jpg'}}	ACTION_VIEW_RECENT_APPS-2199-INTENT_ACTION_STILL_IMAGE_CAMERA-1_NR-ACTION_GET_CONTENT-1-ACTION_OPEN_CONTENT-1	['ACTION_IMAGE_CAPTURE', 'ACTION_VIEW_EVENT', 'ACTION_OPEN_CONTENT', 'ACTION_GET_CONTENT', 'ACTION_PICK']
"['turn 1: Plan to use the electronic beats file: content://storage/emulated/0/Music/electronic_beats.ogg -> All set—""electronic_beats.ogg"" is now your ringtone.', 'turn 2: I wish to pick multiple documents—one in PDF and one in plain text. Let me choose them together. -> Alright, launching the file selector for PDFs and plain text. You can pick multiple docs at once.', ""turn 3: Create a new PDF file named Presentation.pdf -> Voila! Your presentation PDF 'Presentation.pdf' is live here: content://documents/Presentation.pdf.""]"	Open it so I can review it.	Open content://documents/Presentation.pdf so I can review it.	{'plan': 'ACTION_OPEN_CONTENT', 'arguments': {'uri': 'content://documents/Presentation.pdf'}}	ACTION_SET_RINGTONE-1607-ACTION_OPEN_DOCUMENT-1_NR-ACTION_CREATE_DOCUMENT-1-ACTION_OPEN_CONTENT-1	['ACTION_OPEN_CONTENT', 'ACTION_IMAGE_CAPTURE', 'ACTION_SET_RINGTONE', 'ACTION_VIEW_WEB_HISTORY', 'INTENT_ACTION_VIDEO_CAMERA']
"[""turn 1: I want to choose a single PDF report. -> Here's the report you selected: content://docs/annual_report.pdf"", 'turn 2: Could you let me pick a single text file from my device? -> Sure—opening your text files. Pick one to proceed.', ""turn 3: Alright, let's make a new text file called Notes.txt. -> Done—'Notes.txt' has been created at content://documents/Notes.txt. Ready when you are to start typing.""]"	Open it and display its contents.	Open content://documents/Notes.txt and display its contents.	{'plan': 'ACTION_OPEN_CONTENT', 'arguments': {'uri': 'content://documents/Notes.txt'}}	ACTION_GET_CONTENT-174-ACTION_OPEN_DOCUMENT-1_NR-ACTION_CREATE_DOCUMENT-1-ACTION_OPEN_CONTENT-1	['ACTION_OPEN_CONTENT', 'ACTION_EDIT_DOCUMENT', 'get_contact_info', 'ACTION_INSERT_CONTACT', 'ACTION_SHOW_ALARMS']
"['turn 1: Fetch only email from content://org.addressbook/entries/222. -> Here’s the email for content://org.addressbook/entries/222: jane.doe@example.com.', 'turn 2: Could I select one image only? I just need access to a single image document. -> Launching the image document picker—please select one image.', ""turn 3: Great, create a new one of those and name it Picture.jpg. -> New image file 'Picture.jpg' created at content://documents/Picture.jpg. Let me know if you’d like to open it.""]"	Display it	Display content://documents/Picture.jpg	{'plan': 'ACTION_OPEN_CONTENT', 'arguments': {'uri': 'content://documents/Picture.jpg'}}	get_contact_info-1010-ACTION_OPEN_DOCUMENT-1_NR-ACTION_CREATE_DOCUMENT-1-ACTION_OPEN_CONTENT-1	['ACTION_GET_CONTENT', 'ACTION_INSERT_EVENT', 'ACTION_VIEW_WEB_HISTORY', 'ACTION_OPEN_CONTENT', 'ACTION_VIEW_SENT_MESSAGES']
"['turn 1: I want to inspect my current alarms. -> Current alarms set: [alarm_id: 1 - 6:45 AM, Weekday Wake-up; alarm_id: 2 - 7:30 AM, Gym; alarm_id: 3 - 8:00 AM, Standup Meeting; alarm_id: 4 - 5:00 PM, Yoga]', 'turn 2: Enable the camera to operate in still image mode for a photo. -> Still image camera activated. Ready to snap!', ""turn 3: Pick the most recent image from my gallery -> Here's the latest photo you picked: content://temp/recent_image.jpg""]"	Open that image	Open content://temp/recent_image.jpg	{'plan': 'ACTION_OPEN_CONTENT', 'arguments': {'uri': 'content://temp/recent_image.jpg'}}	ACTION_SHOW_ALARMS-694-INTENT_ACTION_STILL_IMAGE_CAMERA-1_NR-ACTION_GET_CONTENT-1-ACTION_OPEN_CONTENT-1	['play_music', 'ACTION_GET_CONTENT', 'dial', 'ACTION_EDIT_VIDEO', 'ACTION_OPEN_CONTENT']
