conversation_history	query	rewrited_query	answer	unique_idx	candidates
['turn 1: Can you display the Date & Time settings? I need to adjust the clock. -> Date & Time settings opened—feel free to adjust your clock.', 'turn 2: Let me access a TXT document for long-term management from my device. -> Alright, launching the document browser so you can select a text file (.txt) for long-term access.', 'turn 3: I need to capture a live moment, kindly open the video recording application. -> Camera in video mode—ready to capture that live moment.', 'turn 4: Select multiple videos from the ones just recorded -> All done! Here are your selected recordings: content://camera/new_recording1.mp4, content://camera/new_recording2.mp4, content://camera/new_recording3.mp4']	Could you open content://reports/monthly to edit it? I want to add 'Update for March' before starting.	Could you open content://reports/monthly to edit it? I want to add 'Update for March' before starting.	{'plan': 'ACTION_EDIT_DOCUMENT', 'arguments': {'document_uri': 'content://reports/monthly', 'content': 'Update for March'}}	open_settings-1098-ACTION_OPEN_DOCUMENT-1_NR-INTENT_ACTION_VIDEO_CAMERA-1_NR-ACTION_GET_CONTENT-1-ACTION_EDIT_DOCUMENT-1_NR	['ACTION_EDIT_DOCUMENT', 'ACTION_SHOW_TIMERS', 'ACTION_GET_RINGTONE', 'ACTION_OPEN_CONTENT', 'ACTION_SET_RINGTONE']
"['turn 1: Display the alarms on my device, please. -> Here are your active alarms: [alarm_id: 1 - 6:00 AM, Sunrise Run; alarm_id: 2 - 9:30 AM, Project Check‑in; alarm_id: 3 - 12:30 PM, Lunch with Crew; alarm_id: 4 - 4:00 PM, Coffee Break; alarm_id: 5 - 10:00 PM, Reading Time]', ""turn 2: Turn off vibration for the coffee break alarm at 4:00 PM -> Done! 'Coffee Break' alarm_no4 at 4:00\xa0PM will no longer vibrate."", 'turn 3: Can you list them? -> Listing all alarms: [alarm_id: 1 - 6:00 AM, Sunrise Run; alarm_id: 2 - 9:30 AM, Project Check‑in; alarm_id: 3 - 12:30 PM, Lunch with Crew; alarm_id: 4 - 4:00 PM, Coffee Break; alarm_id: 5 - 10:00 PM, Reading Time]', 'turn 4: Please allow me to choose a single PDF file from my list; one is enough. -> Absolutely—here’s the PDF picker. Go ahead and select one file.']"	I need to modify the document at content://texts/story; no additional content is required.	I need to modify the document at content://texts/story; no additional content is required.	{'plan': 'ACTION_EDIT_DOCUMENT', 'arguments': {'document_uri': 'content://texts/story'}}	ACTION_SHOW_ALARMS-657-ACTION_EDIT_ALARM-1-ACTION_SHOW_ALARMS-1-ACTION_OPEN_DOCUMENT-1_NR-ACTION_EDIT_DOCUMENT-1_NR	['ACTION_EDIT_DOCUMENT', 'ACTION_PICK', 'ACTION_EDIT_CONTACT', 'ACTION_EDIT_VIDEO', 'ACTION_VIEW_PLAYLIST']
"['turn 1: Could you send a motivational quote to my friend Lisa at 555-987-6543? -> Motivational quote sent to 555-987-6543.', 'turn 2: Email the same motivational quote to lisa@example.com -> Motivational quote has been emailed to lisa@example.com.', ""turn 3: Show me those emails. -> Sent emails:\n• to lisa@example.com - 'Motivational quote'"", ""turn 4: Fetch the contact information from the following URI: 'contact://social/twitter/@user'. -> You can find the Twitter profile here: https://twitter.com/user.""]"	Edit the file at content://files/essay and load it with 'Thesis revision in progress'.	Edit the file at content://files/essay and load it with 'Thesis revision in progress'.	{'plan': 'ACTION_EDIT_DOCUMENT', 'arguments': {'document_uri': 'content://files/essay', 'content': 'Thesis revision in progress'}}	send_message-1242-send_email-1-ACTION_VIEW_SENT_EMAILS-1-get_contact_info_from_uri-1_NR-ACTION_EDIT_DOCUMENT-1_NR	['get_contact_info_from_uri', 'ACTION_EDIT_DOCUMENT', 'web_search', 'ACTION_SET_ALARM', 'play_video']
"['turn 1: Pop up the list of apps accessed recently. -> Recent apps: Spotify; Audible; Podcasts; Music', ""turn 2: Can you record an event 'Language Class'? The session on Spanish will be held at Community Hall from 1702100000000 to 1702103600000. -> Your 'Language Class' event is confirmed for December 9, 2023 at Community Hall. See details: content://calender/event/6"", 'turn 3: Open WhatsApp so I can send a quick message to my friend. -> WhatsApp launched—you can send your message now.', 'turn 4: Which recent apps have I accessed since I opened it? -> Since launching WhatsApp, you’ve accessed: Messenger; Telegram; Skype; Slack.']"	Kindly create an alarm at 19:05 with the label 'Gym' that repeats on Friday and Saturday.	Kindly create an alarm at 19:05 with the label 'Gym' that repeats on Friday and Saturday.	{'plan': 'ACTION_SET_ALARM', 'arguments': {'EXTRA_HOUR': 19, 'EXTRA_MINUTES': 5, 'EXTRA_MESSAGE': 'Gym', 'EXTRA_DAYS': ['Friday', 'Saturday']}}	ACTION_VIEW_RECENT_APPS-2208-ACTION_INSERT_EVENT-1_NR-launch_application-1_NR-ACTION_VIEW_RECENT_APPS-1-ACTION_SET_ALARM-1_NR	['open_settings', 'get_contact_info_from_uri', 'ACTION_SET_RINGTONE', 'ACTION_SET_ALARM', 'play_video']
"[""turn 1: Alarm 26 should be at 16:35 every Wednesday with 'uri://pop_tune' ringtone. -> Alarm 26 updated to 4:35\xa0PM every Wednesday using the 'uri://pop_tune' ringtone."", 'turn 2: Help me select a mailing address from my saved contacts. -> There you go! Mailing address selected: content://contacts/address/15', 'turn 3: Find a valid email for any of my contacts. -> Got it—email address chosen: content://contacts/email/9', ""turn 4: Change its email to john.doe@newmail.com -> Great! John Doe's email (content://contacts/email/9) is now set to john.doe@newmail.com.""]"	Set an alarm for 11:30 AM with the note 'Meeting Reminder'.	Set an alarm for 11:30 AM with the note 'Meeting Reminder'.	{'plan': 'ACTION_SET_ALARM', 'arguments': {'EXTRA_HOUR': 11, 'EXTRA_MINUTES': 30, 'EXTRA_MESSAGE': 'Meeting Reminder'}}	ACTION_EDIT_ALARM-1660-ACTION_PICK-1_NR-ACTION_PICK-1_NR-ACTION_EDIT_CONTACT-1-ACTION_SET_ALARM-1_NR	['ACTION_SHOW_TIMERS', 'ACTION_EDIT_VIDEO', 'search_location', 'INTENT_ACTION_STILL_IMAGE_CAMERA', 'ACTION_SET_ALARM']
['turn 1: Retrieve an overview of contact content://profiles/contacts/2022. -> Contact details:\nName: Alex Johnson\nPhone: 315-555-0198\nEmail: alex.johnson@domain.com\nAddress: 456 Elm St, Metropolis, CA 90001.', 'turn 2: Show me that profile -> Got it! Displaying content://profiles/contacts/2022:\nName: Alex Johnson\nPhone: 315-555-0198\nEmail: alex.johnson@domain.com\nAddress: 456 Elm St, Metropolis, CA 90001', 'turn 3: Please enable the video camera on my phone for a recording session. -> Video camera opened successfully—feel free to start your recording.', 'turn 4: Let me choose a video clip from my recent recordings -> Loaded your recent recordings—pick the one you want. You picked: content://camera/recent/video_clip1.mp4']	Initiate an alarm at 20:40 with a ringtone from https://example.org/ringtone.mp3.	Initiate an alarm at 20:40 with a ringtone from https://example.org/ringtone.mp3.	{'plan': 'ACTION_SET_ALARM', 'arguments': {'EXTRA_HOUR': 20, 'EXTRA_MINUTES': 40, 'EXTRA_RINGTONE': 'https://example.org/ringtone.mp3'}}	get_contact_info-1021-ACTION_VIEW_CONTACT-1-INTENT_ACTION_VIDEO_CAMERA-1_NR-ACTION_GET_CONTENT-1-ACTION_SET_ALARM-1_NR	['ACTION_SET_ALARM', 'ACTION_VIEW_CALL_LOG', 'ACTION_GET_CONTENT', 'send_email', 'ACTION_VIEW_EVENT']
"[""turn 1: I want to check my browser history. -> Got it, here's your browser history: Slack (workspace chat); NASA (news & updates); Wikipedia (Quantum Mechanics); Rotten Tomatoes (movie reviews)"", ""turn 2: Set an alarm at 15:45 for 'Afternoon Workout' that repeats every Monday, Wednesday, and Friday. -> Alarm set for alarm_id: alarm_no8 - 3:45 PM: Afternoon Workout (repeats on Monday, Wednesday, Friday)."", ""turn 3: Fetch a contact's postal details from my saved contacts. -> All set—postal address selected: content://contacts/address/42"", 'turn 4: Update its address to 123 New Road, London -> Success! The address for content://contacts/address/42 is now 123 New Road, London.']"	Could you set an alarm at 5:50 AM that goes off only on Sundays?	Could you set an alarm at 5:50 AM that goes off only on Sundays?	{'plan': 'ACTION_SET_ALARM', 'arguments': {'EXTRA_HOUR': 5, 'EXTRA_MINUTES': 50, 'EXTRA_DAYS': ['Sunday']}}	ACTION_VIEW_WEB_HISTORY-2071-ACTION_SET_ALARM-1_NR-ACTION_PICK-1_NR-ACTION_EDIT_CONTACT-1-ACTION_SET_ALARM-1_NR	['ACTION_INSERT_CONTACT', 'ACTION_GET_CONTENT', 'send_email', 'ACTION_SET_ALARM', 'ACTION_VIEW_WEB_HISTORY']
"['turn 1: Timer for 20 seconds, message quick exercise. -> Timer set for 20 seconds: quick exercise.', ""turn 2: List the timers I'm running. -> Currently active timers: [20 seconds – quick exercise]"", 'turn 3: Get me the contact summary for /contacts/henry. -> Here’s Henry’s contact summary: Henry Davis – Phone: 415‑555‑0142; Email: henry.davis@example.com.', 'turn 4: Register an event \'Product Launch Meeting\' with the description \'Final preparations for the launch event\'. The meeting is at Main Office, and it should run from 1701300000000 to 1701305400000. -> ""Product Launch Meeting"" at Main Office is on your calendar from 1701300000000 to 1701305400000. Access it here: content://calendar/event/8']"	Please set an alarm at 16:15 using the sound from http://mysite.com/sound.mp3.	Please set an alarm at 16:15 using the sound from http://mysite.com/sound.mp3.	{'plan': 'ACTION_SET_ALARM', 'arguments': {'EXTRA_HOUR': 16, 'EXTRA_MINUTES': 15, 'EXTRA_RINGTONE': 'http://mysite.com/sound.mp3'}}	ACTION_SET_TIMER-608-ACTION_SHOW_TIMERS-1-get_contact_info-1_NR-ACTION_INSERT_EVENT-1_NR-ACTION_SET_ALARM-1_NR	['INTENT_ACTION_STILL_IMAGE_CAMERA', 'ACTION_SET_ALARM', 'play_music', 'open_settings', 'ACTION_VIEW_EVENT']
"['turn 1: Kickstart the still image camera. -> Camera app is now open and ready for still photos.', ""turn 2: Tell me which sites I accessed in the last few hours by showing my web history. -> Sure, you visited: CNN – Latest headlines; The Verge – Tech news roundup; Weather.com – Today's forecast; BBC News – World update; NYTimes – Market analysis."", ""turn 3: Search the fourth one again. -> Search results for 'BBC News – World update': Headline stories, global analysis, and live news reports."", ""turn 4: I need details on the timers that haven't finished yet. -> Timers still pending completion: [8 minutes - Video export, 3 minutes - File backup, 18 minutes - Download]""]"	I want an alarm at 22:40 with a custom ringtone from http://sound.com/alert.mp3, and please do not show the UI pop-up.	I want an alarm at 22:40 with a custom ringtone from http://sound.com/alert.mp3, and please do not show the UI pop-up.	{'plan': 'ACTION_SET_ALARM', 'arguments': {'EXTRA_HOUR': 22, 'EXTRA_MINUTES': 40, 'EXTRA_RINGTONE': 'http://sound.com/alert.mp3', 'EXTRA_SKIP_UI': True}}	INTENT_ACTION_STILL_IMAGE_CAMERA-860-ACTION_VIEW_WEB_HISTORY-1_NR-web_search-1-ACTION_SHOW_TIMERS-1_NR-ACTION_SET_ALARM-1_NR	['ACTION_INSERT_EVENT', 'ACTION_VIEW_SENT_EMAILS', 'ACTION_SHOW_ALARMS', 'launch_application', 'ACTION_SET_ALARM']
"[""turn 1: Bring my 'Travel Tunes' playlist into view. -> Travel Tunes playlist ready—On the Road Again; Homeward Bound; Life Is a Highway."", ""turn 2: Play the second one. -> Playing 'Homeward Bound' now. Enjoy the music!"", 'turn 3: What songs are in it? -> Travel Tunes line‑up: On the Road Again; Homeward Bound; Life Is a Highway.', ""turn 4: Play the first track -> Now playing 'On the Road Again'—safe travels!""]"	Can you set an alarm for 13:05 labeled 'Lunchtime' and disable vibrations?	Can you set an alarm for 13:05 labeled 'Lunchtime' and disable vibrations?	{'plan': 'ACTION_SET_ALARM', 'arguments': {'EXTRA_HOUR': 13, 'EXTRA_MINUTES': 5, 'EXTRA_MESSAGE': 'Lunchtime', 'EXTRA_VIBRATE': False}}	ACTION_VIEW_PLAYLIST-2140-play_music-1-ACTION_VIEW_PLAYLIST-1-play_music-1-ACTION_SET_ALARM-1_NR	['ACTION_GET_RINGTONE', 'ACTION_SET_ALARM', 'search_location', 'play_video', 'ACTION_GET_CONTENT']
"['turn 1: Read out my alarm list, please. -> Here’s your alarm lineup: [alarm_id: 1 - 6:00 AM, Morning Run; alarm_id: 2 - 6:15 AM, Meditate; alarm_id: 3 - 6:45 AM, Breakfast; alarm_id: 4 - 7:30 AM, Office]', ""turn 2: Keep it at the same time but use the silent ringtone and set it without confirmation -> Alarm 4 'Office' remains at 7:30 AM with the silent ringtone enabled."", ""turn 3: Add an event named 'Dance Class' for a hip-hop session at City Dance Studio. It should start at 1700800000000 and end at 1700805400000. -> Got it! 'Dance Class' (Hip‑hop session) at City Dance Studio from 1700800000000 to 1700805400000 has been added. (content://calendar/event/8)"", 'turn 4: Where is it located on the map? -> You can find City Dance Studio at 33 Dance Ln, Springfield, IL 62704.']"	Change the ringtone on my device to content://media/echo_chime.	Change the ringtone on my device to content://media/echo_chime.	{'plan': 'ACTION_SET_RINGTONE', 'arguments': {'ringtone_uri': 'content://media/echo_chime'}}	ACTION_SHOW_ALARMS-695-ACTION_EDIT_ALARM-1-ACTION_INSERT_EVENT-1_NR-search_location-1-ACTION_SET_RINGTONE-1_NR	['web_search', 'ACTION_SET_RINGTONE', 'open_settings', 'ACTION_VIEW_RECENT_APPS', 'launch_application']
"['turn 1: Could you change the company of contact content://contacts/people/steph to GameWorks and update the address to 50 Arcade Dr? -> Opening the editor for Steph (content://contacts/people/steph) with company GameWorks and address 50 Arcade Dr.', 'turn 2: I want to launch a file picker to select a PDF document from my cloud storage. -> Picker ready. You selected: content://drive/Proposal.pdf', ""turn 3: Forward it to +1 (555) 333-0000 saying 'Here's the proposal for your review.' -> Proposal sent to +1 (555) 333-0000."", 'turn 4: Can you show the texts I recently sent? -> Sent SMS/MMS: +1 (555) 333-0000 – ""Here\'s the proposal for your review.""']"	Please select content://media/glittering_tone as the ringtone for my device.	Please select content://media/glittering_tone as the ringtone for my device.	{'plan': 'ACTION_SET_RINGTONE', 'arguments': {'ringtone_uri': 'content://media/glittering_tone'}}	ACTION_EDIT_CONTACT-91-ACTION_OPEN_DOCUMENT-1_NR-send_message-1-ACTION_VIEW_SENT_MESSAGES-1-ACTION_SET_RINGTONE-1_NR	['ACTION_SET_RINGTONE', 'ACTION_VIEW_SENT_EMAILS', 'web_search', 'ACTION_NAVIGATE_TO_LOCATION', 'ACTION_SHOW_TIMERS']
"[""turn 1: Please play 'Stairway to Heaven'. -> Got it! Now playing: Stairway to Heaven."", ""turn 2: Show me the track list for this playlist. -> Playlist 'Stairway to Heaven': Stairway to Heaven; Whole Lotta Love; Kashmir"", ""turn 3: Play the second one -> Playing 'Whole Lotta Love' now."", ""turn 4: I'd like to see the track list in it. -> Here are the tracks for 'Stairway to Heaven': Stairway to Heaven; Whole Lotta Love; Kashmir.""]"	Switch my phone's ringtone over to content://media/fantasy_rhythm.	Switch my phone's ringtone over to content://media/fantasy_rhythm.	{'plan': 'ACTION_SET_RINGTONE', 'arguments': {'ringtone_uri': 'content://media/fantasy_rhythm'}}	play_music-1382-ACTION_VIEW_PLAYLIST-1-play_music-1-ACTION_VIEW_PLAYLIST-1-ACTION_SET_RINGTONE-1_NR	['ACTION_EDIT_CONTACT', 'ACTION_SET_RINGTONE', 'web_search', 'ACTION_VIEW_CONTACT', 'ACTION_VIDEO_CAPTURE']
"[""turn 1: Bring up the list of pages I've been to. -> I’ve got your recent pages: Spotify Web Player; LinkedIn (feed); Hacker News; Gmail (inbox)"", 'turn 2: Hey, please activate the video recording mode on my device. -> Activating video recording mode… camera is live!', 'turn 3: Display a summary of my currently running timers. -> Summary of active timers: [2 minutes – Cough syrup reminder, 10 minutes – Screen break, 25 minutes – Potato roast].', 'turn 4: Add another one like the second one for eye rest -> Your 10-minute Screen break for eye rest timer is all set.']"	Please update my incoming ringtone using the audio file at content://media/first_note.	Please update my incoming ringtone using the audio file at content://media/first_note.	{'plan': 'ACTION_SET_RINGTONE', 'arguments': {'ringtone_uri': 'content://media/first_note'}}	ACTION_VIEW_WEB_HISTORY-2065-INTENT_ACTION_VIDEO_CAMERA-1_NR-ACTION_SHOW_TIMERS-1_NR-ACTION_SET_TIMER-1-ACTION_SET_RINGTONE-1_NR	['ACTION_VIEW_CONTACT', 'ACTION_VIEW_CALL_LOG', 'ACTION_SET_RINGTONE', 'ACTION_CREATE_DOCUMENT', 'get_contact_info_from_uri']
['turn 1: Load the details for the workshop scheduled in event 1234. -> Marketing Workshop – July 20, 2024 at 9:30 AM in Innovation Center, Room 210.', 'turn 2: Commence the still picture camera so I can snap a shot. -> Your camera is open in photo mode—ready to snap!', 'turn 3: Pick the shot I just captured -> Here’s the photo you just took: content://temp/recent_photo.jpg', 'turn 4: Open it for me. -> Now opening content://temp/recent_photo.jpg for you.']	Set up the ringtone with URI content://media/pulse_tune for my incoming calls.	Set up the ringtone with URI content://media/pulse_tune for my incoming calls.	{'plan': 'ACTION_SET_RINGTONE', 'arguments': {'ringtone_uri': 'content://media/pulse_tune'}}	ACTION_VIEW_EVENT-1799-INTENT_ACTION_STILL_IMAGE_CAMERA-1_NR-ACTION_GET_CONTENT-1-ACTION_OPEN_CONTENT-1-ACTION_SET_RINGTONE-1_NR	['ACTION_OPEN_CONTENT', 'ACTION_GET_RINGTONE', 'ACTION_SHOW_TIMERS', 'ACTION_SET_RINGTONE', 'ACTION_SET_TIMER']
"['turn 1: Schedule \'Thanksgiving Dinner\' on November 22, 2024 from 11:00 AM to 1:00 PM at Mom\'s House for a family gathering. -> Your ""Thanksgiving Dinner"" is confirmed for November 22, 2024 at 11:00\xa0AM at Mom’s House. Tap here for details: content://calendar/event/8', ""turn 2: View its details for me. -> Thanksgiving Dinner: November 22, 2024 from 11:00 AM to 1:00 PM at Mom's House."", ""turn 3: Navigate to that house -> Navigation to Mom's House is now in progress. Enjoy the trip!"", ""turn 4: Set an alarm for 11:30 AM with the note 'Meeting Reminder'. -> Alarm set for alarm_id: alarm_216 - 11:30 AM: Meeting Reminder.""]"	Assign my ringtone as content://media/ethereal_sound.	Assign my ringtone as content://media/ethereal_sound.	{'plan': 'ACTION_SET_RINGTONE', 'arguments': {'ringtone_uri': 'content://media/ethereal_sound'}}	ACTION_INSERT_EVENT-443-ACTION_VIEW_EVENT-1-ACTION_NAVIGATE_TO_LOCATION-1-ACTION_SET_ALARM-1_NR-ACTION_SET_RINGTONE-1_NR	['ACTION_NAVIGATE_TO_LOCATION', 'ACTION_GET_CONTENT', 'play_video', 'ACTION_SET_RINGTONE', 'dial']
['turn 1: Could you ring Beijing office +86 10 8888 6666? -> Calling the Beijing office at +86 10 8888 6666...', 'turn 2: Can you display the active countdown timers for me? -> Currently running countdowns:\n- 4 minutes remaining: Pasta\n- 20 minutes remaining: Laundry cycle\n- 30 minutes remaining: Workout interval', 'turn 3: I need to record a vlog, can you launch the video recording camera? -> Video camera app is now open.', 'turn 4: Begin recording my vlog -> Camera’s rolling—let’s get that vlog started!']	Establish content://media/cool_jingle as the new default ringtone on my device.	Establish content://media/cool_jingle as the new default ringtone on my device.	{'plan': 'ACTION_SET_RINGTONE', 'arguments': {'ringtone_uri': 'content://media/cool_jingle'}}	dial-942-ACTION_SHOW_TIMERS-1_NR-INTENT_ACTION_VIDEO_CAMERA-1_NR-ACTION_VIDEO_CAPTURE-1-ACTION_SET_RINGTONE-1_NR	['ACTION_NAVIGATE_TO_LOCATION', 'ACTION_INSERT_CONTACT', 'ACTION_SET_RINGTONE', 'ACTION_INSERT_EVENT', 'web_search']
"[""turn 1: Text my colleague with ID 7890 the message 'Project deadline extended to next Monday. Check your email for details.' Use their contact +1 (800) 555-0000. -> Project update delivered to +18005550000."", 'turn 2: Call them now -> Dialing +18005550000 now...', 'turn 3: Show the history of my calls. -> Here’s your call history: +1 (800) 555-0000 (Outgoing) - Just now', ""turn 4: Save that number as Tech Support -> Great—'Tech Support' (+1 (800) 555-0000) has been stored. See it here: content://contacts/people/tech_support_us""]"	I need to check what timers are still ticking. Could you display them?	I need to check what timers are still ticking. Could you display them?	{'plan': 'ACTION_SHOW_TIMERS', 'arguments': {}}	send_message-1245-dial-1-ACTION_VIEW_CALL_LOG-1-ACTION_INSERT_CONTACT-1-ACTION_SHOW_TIMERS-1_NR	['ACTION_EDIT_VIDEO', 'web_search', 'ACTION_OPEN_CONTENT', 'ACTION_SHOW_TIMERS', 'get_contact_info_from_uri']
"['turn 1: Open internal storage; I want to clear some cached data. -> Internal storage settings opened—go ahead and clear your cached data.', ""turn 2: Search online for practical dieting tips for maintaining a healthy lifestyle. -> Search results for 'practical dieting tips healthy lifestyle': Discover balanced meal strategies, portion control advice, and sustainable nutrition plans."", 'turn 3: Can I see my recently visited pages? -> These are your most recent sites: Google Search “practical dieting tips healthy lifestyle” (google.com/search?q=practical+dieting+tips+healthy+lifestyle); Healthline – Diet Tips & Tricks (healthline.com/nutrition/diet-tips); MyFitnessPal Blog – Balanced Meal Strategies (blog.myfitnesspal.com/balanced-meals); WebMD – Portion Control Advice (webmd.com/diet/portion-control).', ""turn 4: I'm searching for a text document to open; nothing fancy, just one file will do. -> On it—opening the plain text file picker. Please choose the single document you need.""]"	Would it be possible to see which timers are still active?	Would it be possible to see which timers are still active?	{'plan': 'ACTION_SHOW_TIMERS', 'arguments': {}}	open_settings-1104-web_search-1_NR-ACTION_VIEW_WEB_HISTORY-1-ACTION_OPEN_DOCUMENT-1_NR-ACTION_SHOW_TIMERS-1_NR	['web_search', 'ACTION_SHOW_TIMERS', 'ACTION_OPEN_CONTENT', 'ACTION_VIEW_SENT_EMAILS', 'ACTION_INSERT_EVENT']
"['turn 1: Insert Sarah Connor with phone 610-555-1212, email sarah.connor@resistance.net. -> Sarah Connor’s contact entry is live! content://contacts/people/sarah_connor', ""turn 2: Need a dialog to choose a PDF document; I'm only selecting one file. -> Understood—opening the PDF selector. Please pick the single document you want."", ""turn 3: Email it to boss@example.com with subject 'PDF Proposal' and body 'Please review the attached proposal.' -> PDF Proposal has been sent to boss@example.com."", 'turn 4: Show me any timer that is still running at this moment. -> Still-running timers: [6 minutes - Oven preheat, 14 minutes - Tea steep]']"	Show me the active timers list.	Show me the active timers list.	{'plan': 'ACTION_SHOW_TIMERS', 'arguments': {}}	ACTION_INSERT_CONTACT-426-ACTION_OPEN_DOCUMENT-1_NR-send_email-1-ACTION_SHOW_TIMERS-1_NR-ACTION_SHOW_TIMERS-1_NR	['ACTION_CREATE_DOCUMENT', 'ACTION_SHOW_TIMERS', 'ACTION_INSERT_CONTACT', 'ACTION_SHOW_ALARMS', 'ACTION_VIDEO_CAPTURE']
"[""turn 1: Switch the default ringtone to the 'Harmony' track located in my Music folder: content://storage/emulated/0/Music/Harmony.mp3 -> Great choice! Your default ringtone is now 'Harmony' (content://storage/emulated/0/Music/Harmony.mp3)."", ""turn 2: I’d like to choose a different one than that. -> All set—'Serenade' is now your ringtone (content://storage/emulated/0/Music/Serenade.mp3)"", 'turn 3: Get me an image file from my local archive. -> Sure—opening your image browser. Tap an image to grant persistent access.', ""turn 4: Make one as an image file and call it HolidayPhoto.jpg. -> 'HolidayPhoto.jpg' is ready in your files at content://images/HolidayPhoto.jpg.""]"	Show active timers please.	Show active timers please.	{'plan': 'ACTION_SHOW_TIMERS', 'arguments': {}}	ACTION_SET_RINGTONE-1567-ACTION_GET_RINGTONE-1-ACTION_OPEN_DOCUMENT-1_NR-ACTION_CREATE_DOCUMENT-1-ACTION_SHOW_TIMERS-1_NR	['ACTION_EDIT_VIDEO', 'play_music', 'ACTION_SHOW_TIMERS', 'ACTION_SET_ALARM', 'launch_application']
"[""turn 1: Please change alarm 23 to 05:40, label it 'Class', and run every Monday to Friday. -> Alarm 23 set for 5:40\xa0AM, labeled 'Class', repeating Monday through Friday."", 'turn 2: List all of my alarms, please. -> All set alarms: [alarm_id: 23 – 5:40\xa0AM Mon–Fri, alarm_id: 15 – 9:55\xa0AM ‘Call Mom’, alarm_id: 35 – 5:05\xa0AM ‘Sunrise’, alarm_id: 8 – 1:05\xa0PM, alarm_id: 33 – 4:44\xa0AM].', 'turn 3: Set it to 5:15 AM and turn vibration on. -> Alarm 23 updated to 5:15\xa0AM on weekdays with vibration enabled.', ""turn 4: Can you search for global political events happening this week? -> Search results for 'global political events this week': Details on international summits, election updates, and bilateral talks shaping global policy.""]"	I need details on the timers that haven't finished yet.	I need details on the timers that haven't finished yet.	{'plan': 'ACTION_SHOW_TIMERS', 'arguments': {}}	ACTION_EDIT_ALARM-1655-ACTION_SHOW_ALARMS-1-ACTION_EDIT_ALARM-1-web_search-1_NR-ACTION_SHOW_TIMERS-1_NR	['ACTION_VIDEO_CAPTURE', 'open_settings', 'ACTION_SET_ALARM', 'ACTION_SHOW_TIMERS', 'ACTION_INSERT_CONTACT']
['turn 1: I want to see which apps I opened recently. -> Recently opened apps: Chrome; Calendar; YouTube; Drive; Messages', 'turn 2: Bring up the fourth app. -> Drive app opened successfully. Access your files now!', 'turn 3: Bring up the list of my recent apps. -> Your recent apps are: Chrome; Calendar; YouTube; Drive; Messages.', 'turn 4: I need an alarm at 8:25 AM with no additional settings. -> Alarm set for alarm_id: alarm_215 - 8:25 AM.']	What timers are counting down right now?	What timers are counting down right now?	{'plan': 'ACTION_SHOW_TIMERS', 'arguments': {}}	ACTION_VIEW_RECENT_APPS-2194-launch_application-1-ACTION_VIEW_RECENT_APPS-1-ACTION_SET_ALARM-1_NR-ACTION_SHOW_TIMERS-1_NR	['INTENT_ACTION_VIDEO_CAMERA', 'ACTION_SHOW_TIMERS', 'ACTION_NAVIGATE_TO_LOCATION', 'ACTION_VIEW_PLAYLIST', 'ACTION_VIEW_WEB_HISTORY']
