conversation_history	query	rewrited_query	answer	unique_idx	candidates
"[""turn 1: Load 'Summer BBQ' for me. -> Playlist 'Summer BBQ': Kool & The Gang – Celebration; Earth, Wind & Fire – September; Bruno Mars – Uptown Funk; Daft Punk – Get Lucky"", ""turn 2: Play that Bruno Mars song -> Here we go: 'Uptown Funk' is playing."", ""turn 3: I'd like to see what's on it. -> You’ll find in 'Summer BBQ': Kool & The Gang – Celebration; Earth, Wind & Fire – September; Bruno Mars – Uptown Funk; Daft Punk – Get Lucky."", ""turn 4: Play Get Lucky on Spotify -> Great choice! 'Get Lucky' is now playing on Spotify.""]"	I require an address of one of my acquaintances; fetch me the postal info.	I require an address of one of my acquaintances; fetch me the postal info.	{'plan': 'ACTION_PICK', 'arguments': {'data_type': 'address'}}	ACTION_VIEW_PLAYLIST-2128-play_music-1-ACTION_VIEW_PLAYLIST-1-play_music-1-ACTION_PICK-1_NR	['launch_application', 'ACTION_SET_ALARM', 'ACTION_PICK', 'ACTION_VIEW_PLAYLIST', 'ACTION_SET_TIMER']
['turn 1: Create an XML config file named settings.xml. -> Your XML file settings.xml is now available at content://documents/settings.xml.', 'turn 2: Boot up the digital camera app for taking a static image. -> Still image camera is up. Ready to shoot.', 'turn 3: Show me the photo I just captured -> Photo you captured moments ago: content://temp/photo131.jpg', 'turn 4: Show me that photo -> Taking you straight to content://temp/photo131.jpg.']	I need to choose a person's email address from my contacts.	I need to choose a person's email address from my contacts.	{'plan': 'ACTION_PICK', 'arguments': {'data_type': 'email'}}	ACTION_CREATE_DOCUMENT-14-INTENT_ACTION_STILL_IMAGE_CAMERA-1_NR-ACTION_GET_CONTENT-1-ACTION_OPEN_CONTENT-1-ACTION_PICK-1_NR	['ACTION_SET_ALARM', 'dial', 'ACTION_PICK', 'ACTION_SHOW_TIMERS', 'ACTION_VIEW_RECENT_APPS']
"[""turn 1: I want to select my wake‑up melody from the device's tones. -> Alright, opening the device's ringtone selection menu now."", 'turn 2: Make content://media/wakeup_tune.mp3 my alarm sound -> Your alarm sound has been changed to content://media/wakeup_tune.mp3.', 'turn 3: Show me another tune besides it. -> Okay—launching the ringtone picker so you can find a different wake‑up melody.', ""turn 4: Set content://media/energetic_melody.mp3 as my ringtone -> Perfect! 'energetic_melody.mp3' is now set as your ringtone.""]"	I want to see my device's storage usage details; please open the internal storage settings.	I want to see my device's storage usage details; please open the internal storage settings.	{'plan': 'open_settings', 'arguments': {'setting_type': 'internal_storage'}}	ACTION_GET_RINGTONE-317-ACTION_SET_RINGTONE-1-ACTION_GET_RINGTONE-1-ACTION_SET_RINGTONE-1-open_settings-1_NR	['ACTION_SHOW_TIMERS', 'get_contact_info_from_uri', 'open_settings', 'search_location', 'ACTION_VIEW_CALL_LOG']
"[""turn 1: Bring up the 'Classic Blues' playlist. -> Here’s 'Classic Blues': The Thrill Is Gone; Sweet Home Chicago; Stormy Monday."", ""turn 2: Hit that one -> Now playing 'The Thrill Is Gone'."", ""turn 3: Can you display the songs in that playlist? -> Displaying 'Classic Blues': The Thrill Is Gone; Sweet Home Chicago; Stormy Monday."", ""turn 4: Play the second one. -> Gotcha! 'Sweet Home Chicago' is on the way.""]"	Access the wireless and network options; my connection seems unstable.	Access the wireless and network options; my connection seems unstable.	{'plan': 'open_settings', 'arguments': {'setting_type': 'wireless'}}	ACTION_VIEW_PLAYLIST-2148-play_music-1-ACTION_VIEW_PLAYLIST-1-play_music-1-open_settings-1_NR	['ACTION_GET_RINGTONE', 'ACTION_GET_CONTENT', 'open_settings', 'ACTION_EDIT_DOCUMENT', 'get_contact_info_from_uri']
"[""turn 1: Alarm 35: set 05:05 as 'Sunrise', no UI prompt. -> Alarm 35 updated to 5:05\xa0AM, labeled “Sunrise,” and set without any prompts."", 'turn 2: What alarms are set at the moment? -> Listing all alarms now: [alarm_id: 35 at 5:05\xa0AM ‘Sunrise’, alarm_id: 34 at 12:12\xa0PM (‘Midday Tone’), alarm_id: 23 at 5:40\xa0AM ‘Class’ (Mon–Fri), alarm_id: 36 at 8:00\xa0PM (Fri & Sat)].', ""turn 3: Also repeat the 5:40 AM Class alarm on weekends. -> Alarm 23 now rings at 5:40\xa0AM every day, labeled 'Class'."", ""turn 4: What alarms do I currently have? -> Here's your alarm lineup: [alarm_id: 35 - 5:05 AM (“Sunrise”), alarm_id: 34 - 12:12 PM (“Midday Tone”), alarm_id: 23 - 5:40 AM (“Class”, daily), alarm_id: 36 - 8:00 PM (Fridays & Saturdays)]""]"	I want to review my device's safety features; please open the security settings.	I want to review my device's safety features; please open the security settings.	{'plan': 'open_settings', 'arguments': {'setting_type': 'security'}}	ACTION_EDIT_ALARM-1669-ACTION_SHOW_ALARMS-1-ACTION_EDIT_ALARM-1-ACTION_SHOW_ALARMS-1-open_settings-1_NR	['open_settings', 'ACTION_INSERT_CONTACT', 'web_search', 'ACTION_EDIT_CONTACT', 'ACTION_GET_RINGTONE']
"['turn 1: Show me the ringtone selection menu. -> Here you go! The ringtone picker is up—pick your favorite tune.', 'turn 2: Set content://media/ringtone_chime.mp3 as my default ringtone -> Okay, your default ringtone is content://media/ringtone_chime.mp3.', 'turn 3: I want a different one than that. -> Sure—opening the ringtone picker again so you can choose a new one.', ""turn 4: Set content://media/summer_breeze.mp3 as my ringtone -> Good news! 'summer_breeze.mp3' is now your ringtone.""]"	Show me my Wi-Fi settings to check my connection status.	Show me my Wi-Fi settings to check my connection status.	{'plan': 'open_settings', 'arguments': {'setting_type': 'wifi'}}	ACTION_GET_RINGTONE-318-ACTION_SET_RINGTONE-1-ACTION_GET_RINGTONE-1-ACTION_SET_RINGTONE-1-open_settings-1_NR	['ACTION_GET_CONTENT', 'ACTION_VIEW_WEB_HISTORY', 'open_settings', 'ACTION_EDIT_CONTACT', 'ACTION_VIDEO_CAPTURE']
['turn 1: List out all my alarms right now. -> Listing all alarms now: [alarm_id: 1 - 5:55 AM, Hydration Reminder; alarm_id: 2 - 6:25 AM, Yoga; alarm_id: 3 - 7:10 AM, Team Sync; alarm_id: 4 - 8:00 AM, Review Emails; alarm_id: 5 - 9:00 AM, Client Update]', 'turn 2: Change its ringtone to the weekend tune and reschedule it for 10:30 PM. -> All set! Alarm 1 (Hydration Reminder) has been updated to 10:30\xa0PM with the “weekend tune” ringtone.', 'turn 3: Could you show all of them? -> Your five alarms are: [alarm_id: 1 - 5:55 AM, Hydration Reminder; alarm_id: 2 - 6:25 AM, Yoga; alarm_id: 3 - 7:10 AM, Team Sync; alarm_id: 4 - 8:00 AM, Review Emails; alarm_id: 5 - 9:00 AM, Client Update]', 'turn 4: Set that one for 7:45 AM and make it repeat on Monday, Wednesday, Friday with vibration disabled. -> Your alarm (ID: alarm_1) is now set for 7:45 AM, repeats on Monday, Wednesday, Friday, and vibration is disabled.']	Navigate to the display configuration page for screen adjustments.	Navigate to the display configuration page for screen adjustments.	{'plan': 'open_settings', 'arguments': {'setting_type': 'display'}}	ACTION_SHOW_ALARMS-701-ACTION_EDIT_ALARM-1-ACTION_SHOW_ALARMS-1-ACTION_EDIT_ALARM-1-open_settings-1_NR	['ACTION_VIEW_WEB_HISTORY', 'send_email', 'web_search', 'dial', 'open_settings']
"['turn 1: Insert Sarah Connor with phone 610-555-1212, email sarah.connor@resistance.net. -> Sarah Connor’s contact entry is live! content://contacts/people/sarah_connor', ""turn 2: Need a dialog to choose a PDF document; I'm only selecting one file. -> Understood—opening the PDF selector. Please pick the single document you want."", ""turn 3: Go ahead and create one as a PDF named Invoice.pdf. -> Your new PDF 'Invoice.pdf' is ready: content://documents/Invoice.pdf."", ""turn 4: Edit that invoice to add today's date and the total amount -> Editing content://documents/Invoice.pdf now. I’ve inserted today’s date and the total amount—feel free to review or adjust.""]"	I would like to change my language preferences. Could you open the language & input settings?	I would like to change my language preferences. Could you open the language & input settings?	{'plan': 'open_settings', 'arguments': {'setting_type': 'locale'}}	ACTION_INSERT_CONTACT-426-ACTION_OPEN_DOCUMENT-1_NR-ACTION_CREATE_DOCUMENT-1-ACTION_EDIT_DOCUMENT-1-open_settings-1_NR	['get_contact_info_from_uri', 'ACTION_VIEW_PLAYLIST', 'INTENT_ACTION_STILL_IMAGE_CAMERA', 'open_settings', 'ACTION_VIEW_EVENT']
"['turn 1: Expose my web surfing history. -> Sure thing! Your last visited sites are: Wikipedia (Neural Networks); Reddit (r/AskScience); New York Times (top stories); Udemy (Python course overview)', ""turn 2: Search it again. -> Search results for 'Neural Networks Wikipedia': An in-depth Wikipedia article covering neural network fundamentals, architectural variations, training methods, and real-world applications."", ""turn 3: I am about to record an event. Open my phone's video recording application. -> Video camera launched successfully—let’s capture that moment!"", 'turn 4: Select the last video clip so I can review it -> Opening your video gallery—please select the last clip so you can review it.']"	Access general system settings for configuration purposes.	Access general system settings for configuration purposes.	{'plan': 'open_settings', 'arguments': {'setting_type': 'general'}}	ACTION_VIEW_WEB_HISTORY-2064-web_search-1-INTENT_ACTION_VIDEO_CAMERA-1_NR-ACTION_GET_CONTENT-1-open_settings-1_NR	['open_settings', 'ACTION_PICK', 'ACTION_EDIT_ALARM', 'play_music', 'play_video']
"[""turn 1: Start recording video now. -> I've captured your video. Check it out here: content://videos/recording_003.mp4."", 'turn 2: Email it to editor@publish.com -> Your video has been sent to editor@publish.com.', ""turn 3: What have I sent from my Sent folder? -> Sent emails:\n• to editor@publish.com - 'recording_003.mp4'"", 'turn 4: I would like to see my web visit history from this week. -> Here’s your web visit history from this week: shop.nike.com; amazon.com/appliances; cnn.com/world']"	Could you lead me to the Wi-Fi management settings?	Could you lead me to the Wi-Fi management settings?	{'plan': 'open_settings', 'arguments': {'setting_type': 'wifi'}}	ACTION_VIDEO_CAPTURE-709-send_email-1-ACTION_VIEW_SENT_EMAILS-1-ACTION_VIEW_WEB_HISTORY-1_NR-open_settings-1_NR	['get_contact_info_from_uri', 'open_settings', 'launch_application', 'ACTION_SHOW_TIMERS', 'ACTION_EDIT_VIDEO']
"[""turn 1: Alarm 26 should be at 16:35 every Wednesday with 'uri://pop_tune' ringtone. -> Alarm 26 updated to 4:35\xa0PM every Wednesday using the 'uri://pop_tune' ringtone."", 'turn 2: Help me select a mailing address from my saved contacts. -> There you go! Mailing address selected: content://contacts/address/15', 'turn 3: Change it to 456 Elm St and add phone 555-6789 -> All done—address set to “456 Elm St” and phone number 555-6789 added. View it at content://contacts/address/15', ""turn 4: Send them a text saying 'Your address has been updated to 456 Elm St successfully.' -> Your text to 555-6789 went through.""]"	Can you take me to the location settings page? I need to update my GPS preferences.	Can you take me to the location settings page? I need to update my GPS preferences.	{'plan': 'open_settings', 'arguments': {'setting_type': 'location'}}	ACTION_EDIT_ALARM-1660-ACTION_PICK-1_NR-ACTION_EDIT_CONTACT-1-send_message-1-open_settings-1_NR	['open_settings', 'ACTION_OPEN_CONTENT', 'get_contact_info', 'ACTION_VIDEO_CAPTURE', 'ACTION_VIEW_PLAYLIST']
['turn 1: Please open content://videos/presentation.mp4 for editing. -> Got it—launching the editor for content://videos/presentation.mp4 now.', 'turn 2: Start playing it -> Playback started successfully for content://videos/presentation.mp4.', 'turn 3: Trim it from 10 seconds to 60 seconds, please. -> All set—the 10–60s section has been extracted. You can view it here: content://videos/presentation_trim10-60.mp4.', 'turn 4: Play that segment -> Now playing the trimmed presentation segment: content://videos/presentation_trim10-60.mp4.']	Look up the location settings for me because my GPS isn't working properly.	Look up the location settings for me because my GPS isn't working properly.	{'plan': 'open_settings', 'arguments': {'setting_type': 'location'}}	ACTION_EDIT_VIDEO-1676-play_video-1-ACTION_EDIT_VIDEO-1-play_video-1-open_settings-1_NR	['open_settings', 'ACTION_VIEW_WEB_HISTORY', 'ACTION_SHOW_ALARMS', 'ACTION_INSERT_CONTACT', 'ACTION_VIEW_SENT_EMAILS']
"['turn 1: Phone the research dept at +49-221-1234567. -> Calling +49-221-1234567 now...', 'turn 2: Show me my recent call history. -> Call log: Research Dept +49-221-1234567 (Outgoing) - Today 10:30 AM; Alice +1-302-3782 (Missed) - Today 9:15 AM; Bob +1-872-1285 (Incoming) - Yesterday 4:20 PM', ""turn 3: Save it to my contacts as Research Dept -> Successfully added 'Research Dept' to your contacts. URI: content://contacts/people/research_dept_005."", 'turn 4: Please fetch contact details using URI contact://info/office. -> Office contact details retrieved: +1 (800) 123-4567.']"	I am experiencing issues with my internet connection. Can you open the APN settings?	I am experiencing issues with my internet connection. Can you open the APN settings?	{'plan': 'open_settings', 'arguments': {'setting_type': 'apn'}}	dial-955-ACTION_VIEW_CALL_LOG-1-ACTION_INSERT_CONTACT-1-get_contact_info_from_uri-1_NR-open_settings-1_NR	['ACTION_GET_RINGTONE', 'get_contact_info', 'open_settings', 'ACTION_VIEW_CONTACT', 'ACTION_SHOW_ALARMS']
"['turn 1: Show me all my alarms. -> Current alarms: [alarm_id: 1 - 6:30 AM, Morning Yoga; alarm_id: 2 - 12:00 PM, Lunch Reminder; alarm_id: 3 - 9:00 PM, Take Medication]', ""turn 2: Add one for 7:45 AM named Check Emails repeating weekdays without vibration. -> Alarm (alarm_id: alarm_206) set for weekdays at 7:45 AM: 'Check Emails' (vibration off)."", ""turn 3: Please schedule an 'Evening Meditation' session, described as a meditation for stress relief. It will take place at Zen Garden, starting at 1701400000000 and ending at 1701403600000. -> Done! 'Evening Meditation' (Meditation session for stress relief) at Zen Garden between 1701400000000 and 1701403600000. (content://calendar/event/16)"", ""turn 4: Let me see details for that session. -> Here are the details: 'Evening Meditation'—Meditation session for stress relief—at Zen Garden from 1701400000000 to 1701403600000.""]"	I want to review the internal storage details; please open the corresponding settings screen.	I want to review the internal storage details; please open the corresponding settings screen.	{'plan': 'open_settings', 'arguments': {'setting_type': 'internal_storage'}}	ACTION_SHOW_ALARMS-654-ACTION_SET_ALARM-1-ACTION_INSERT_EVENT-1_NR-ACTION_VIEW_EVENT-1-open_settings-1_NR	['ACTION_SHOW_ALARMS', 'ACTION_EDIT_ALARM', 'open_settings', 'ACTION_INSERT_EVENT', 'play_music']
['turn 1: Could you start PowerPoint? I have a presentation to review. -> Microsoft PowerPoint is up and running—ready for your presentation review!', 'turn 2: What have I opened recently besides it? -> After PowerPoint: Teams; Word; Excel; OneDrive.', 'turn 3: Open the third app. -> Excel launched successfully—time to crunch those numbers!', 'turn 4: After opening Excel, what other apps did I launch? -> Since Excel launched, you’ve opened: Outlook; Teams; Edge; Word.']	I need to tweak the APN settings for data connection adjustments.	I need to tweak the APN settings for data connection adjustments.	{'plan': 'open_settings', 'arguments': {'setting_type': 'apn'}}	launch_application-1509-ACTION_VIEW_RECENT_APPS-1-launch_application-1-ACTION_VIEW_RECENT_APPS-1-open_settings-1_NR	['ACTION_GET_CONTENT', 'ACTION_VIEW_CONTACT', 'get_contact_info_from_uri', 'open_settings', 'ACTION_VIEW_WEB_HISTORY']
"['turn 1: Enable the ringtone selection UI for my morning alarm. -> Morning alarm tone set to: content://media/ringtone/sunrise_tune.mp3', 'turn 2: Set it as my morning alarm ringtone -> Success! Your morning alarm ringtone is now set to content://media/ringtone/sunrise_tune.mp3.', 'turn 3: Actually, I’d like a different ringtone than that. -> Understood—bringing up the ringtone picker for a fresh selection.', ""turn 4: Replace it with content://media/ringtone/forest_song.mp3 -> Updated—'forest_song.mp3' has replaced your previous ringtone.""]"	Hey, open up the network settings for me. I'm trying to adjust my wireless preferences.	Hey, open up the network settings for me. I'm trying to adjust my wireless preferences.	{'plan': 'open_settings', 'arguments': {'setting_type': 'wireless'}}	ACTION_GET_RINGTONE-300-ACTION_SET_RINGTONE-1-ACTION_GET_RINGTONE-1-ACTION_SET_RINGTONE-1-open_settings-1_NR	['ACTION_VIEW_RECENT_APPS', 'ACTION_OPEN_DOCUMENT', 'open_settings', 'ACTION_GET_RINGTONE', 'ACTION_VIEW_EVENT']
"[""turn 1: Revise content://contacts/people/maria_g's contact: her name should become Maria Gonzalez, and phone 654-3210. -> Editing Maria Gonzalez (content://contacts/people/maria_g): setting name to Maria Gonzalez and phone to 654-3210. Opening editor now."", ""turn 2: Could you launch the system's video recording app for me? -> System video camera is now open. You can record your video."", 'turn 3: Start filming the scene now. -> Scene filmed. You can find it at content://videos/scene_filming.mp4.', ""turn 4: Schedule a 'Breakfast Meetup' for an early morning networking event. There is no specific location. It should run from 1701200000000 to 1701201800000. -> All set—'Breakfast Meetup' is now scheduled from 1701200000000 to 1701201800000. No location specified. View it here: content://calendar/event/205""]"	I need to check on my airplane mode options. Kindly open the page for me.	I need to check on my airplane mode options. Kindly open the page for me.	{'plan': 'open_settings', 'arguments': {'setting_type': 'airplane_mode'}}	ACTION_EDIT_CONTACT-94-INTENT_ACTION_VIDEO_CAMERA-1_NR-ACTION_VIDEO_CAPTURE-1-ACTION_INSERT_EVENT-1_NR-open_settings-1_NR	['ACTION_VIEW_RECENT_APPS', 'ACTION_SHOW_ALARMS', 'open_settings', 'send_email', 'ACTION_SET_ALARM']
"[""turn 1: View 'Acoustic Morning'. -> Opening 'Acoustic Morning': Banana Pancakes; Better Together; Heartbeats."", ""turn 2: Play this track -> Sure, playing 'Banana Pancakes' now."", ""turn 3: Show me the songs in it. -> Here’s your 'Acoustic Morning' playlist: Banana Pancakes; Better Together; Heartbeats."", ""turn 4: Play the last one. -> Now playing 'Heartbeats'. Enjoy!""]"	I'd like to see my general settings so I can tweak a few things.	I'd like to see my general settings so I can tweak a few things.	{'plan': 'open_settings', 'arguments': {'setting_type': 'general'}}	ACTION_VIEW_PLAYLIST-2146-play_music-1-ACTION_VIEW_PLAYLIST-1-play_music-1-open_settings-1_NR	['ACTION_SET_RINGTONE', 'ACTION_VIEW_CONTACT', 'play_music', 'ACTION_NAVIGATE_TO_LOCATION', 'open_settings']
"['turn 1: Postpone alarm 5 to 00:30. -> Alarm 5 is now set for 12:30\xa0AM.', ""turn 2: List all the alarms I've set. -> Current alarms: [alarm_id: 2 - 7:00 AM, Daily; alarm_id: 3 - 8:45 AM, Weekdays; alarm_id: 5 - 12:30 AM, Daily]"", 'turn 3: Disable vibration for that 12:30 AM alarm. -> Alarm 5 is now set for 12:30\xa0AM with vibration off and will repeat daily.', 'turn 4: Could you display all my alarms now? -> All set alarms: [alarm_id: 2 - 7:00 AM (daily), alarm_id: 3 - 8:45 AM (weekdays), alarm_id: 5 - 12:30 AM (daily; vibration off)]']"	Open the settings for internal storage so I can check available space.	Open the settings for internal storage so I can check available space.	{'plan': 'open_settings', 'arguments': {'setting_type': 'internal_storage'}}	ACTION_EDIT_ALARM-1637-ACTION_SHOW_ALARMS-1-ACTION_EDIT_ALARM-1-ACTION_SHOW_ALARMS-1-open_settings-1_NR	['open_settings', 'ACTION_SHOW_ALARMS', 'web_search', 'send_message', 'ACTION_EDIT_ALARM']
"[""turn 1: Could you book 'Design Workshop' on September 10, 2024 at 1:00 PM to 4:00 PM in Room 202? Desc: Work on new UI mockups. -> Your “Design Workshop” has been scheduled for September 10, 2024, 1:00\xa0PM–4:00\xa0PM in Room\xa0202. You can view it here: content://calendar/event/1"", 'turn 2: Can you show me the details of that event? -> Design Workshop: September 10, 2024, 1:00\xa0PM–4:00\xa0PM at Room\xa0202. Details: Work on new UI mockups.', ""turn 3: Provide the phone number for the contact at /data/rachel. -> Rachel's contact info: phone number is +1 (415) 555-1234."", 'turn 4: Call her -> Calling +1-415-555-1234...']"	Can you help me adjust some settings? I just need to access my general device settings.	Can you help me adjust some settings? I just need to access my general device settings.	{'plan': 'open_settings', 'arguments': {'setting_type': 'general'}}	ACTION_INSERT_EVENT-456-ACTION_VIEW_EVENT-2-get_contact_info-1_NR-dial-1-open_settings-1_NR	['get_contact_info_from_uri', 'ACTION_EDIT_ALARM', 'web_search', 'open_settings', 'ACTION_OPEN_CONTENT']
"['turn 1: Could you pop up the cam in video mode? -> Video camera launched successfully.', 'turn 2: Start recording and save the video to content://videos/myclip.mp4. -> Video captured successfully — check it out at content://videos/myclip.mp4.', ""turn 3: Could you open my phone's date & time settings? I need to adjust my timezone. -> Date & time settings opened. You can now update your timezone."", 'turn 4: I would like to change my language preferences. Could you open the language & input settings? -> Language & input settings are now open—go ahead and pick your preferred keyboard and language.']"	Show me the memory card settings page as I have a new microSD card inserted.	Show me the memory card settings page as I have a new microSD card inserted.	{'plan': 'open_settings', 'arguments': {'setting_type': 'memory_card'}}	INTENT_ACTION_VIDEO_CAMERA-903-ACTION_VIDEO_CAPTURE-1-open_settings-1_NR-open_settings-1_NR-open_settings-1_NR	['dial', 'get_contact_info_from_uri', 'ACTION_GET_RINGTONE', 'open_settings', 'ACTION_OPEN_DOCUMENT']
"['turn 1: Open Microsoft Excel for some spreadsheet work. -> Microsoft Excel launched successfully. You can start editing your sheets.', 'turn 2: Can you show me apps I’ve opened since then? -> Since Excel: PowerPoint; Teams; Outlook; Chrome.', 'turn 3: Open the first one. -> PowerPoint is now open—your presentation is ready for editing.', ""turn 4: Can you list the apps I've opened since PowerPoint? -> Here’s what you’ve opened since PowerPoint: Teams; Outlook; Chrome; OneNote.""]"	Help me configure Bluetooth connections by opening the appropriate settings.	Help me configure Bluetooth connections by opening the appropriate settings.	{'plan': 'open_settings', 'arguments': {'setting_type': 'bluetooth'}}	launch_application-1508-ACTION_VIEW_RECENT_APPS-1-launch_application-1-ACTION_VIEW_RECENT_APPS-1-open_settings-1_NR	['ACTION_SET_RINGTONE', 'open_settings', 'ACTION_VIEW_EVENT', 'send_message', 'ACTION_SET_ALARM']
['turn 1: Map out all active timers. -> All set: 1 minute - Water plants, 7 minutes - Stretch, 15 minutes - Conference call, 2 hours - Movie download.', 'turn 2: Set a 1 hour 30 minutes timer for baking cookies -> Your 1 hour 30 minutes baking cookies timer is ready to roll!', 'turn 3: Launch the app that allows me to record video, please. -> Video camera launched successfully. You can start recording whenever you’re ready.', 'turn 4: Pick a video from my device -> Here’s your device’s video folder—tap on one clip to select it.']	Can you take me to the input method settings? I need to change my keyboard layout.	Can you take me to the input method settings? I need to change my keyboard layout.	{'plan': 'open_settings', 'arguments': {'setting_type': 'input_method'}}	ACTION_SHOW_TIMERS-1885-ACTION_SET_TIMER-1-INTENT_ACTION_VIDEO_CAMERA-1_NR-ACTION_GET_CONTENT-1-open_settings-1_NR	['ACTION_CREATE_DOCUMENT', 'ACTION_SHOW_TIMERS', 'ACTION_VIEW_RECENT_APPS', 'ACTION_VIEW_SENT_EMAILS', 'open_settings']
"[""turn 1: Open the phone's still image camera so I can take a quick photo. -> Sure thing—still image camera is now open and ready for your photo."", 'turn 2: Pick the most recent photo from my camera roll -> Here’s your latest photo: content://temp/IMG_20240605_153210.jpg', 'turn 3: Email it to boss@company.com -> Email sent to boss@company.com.', 'turn 4: Can I view the sent mail including that photo? -> Sent mail:\n- to boss@company.com – (attached) content://temp/IMG_20240605_153210.jpg']"	Show me the display settings so I can calibrate my screen brightness.	Show me the display settings so I can calibrate my screen brightness.	{'plan': 'open_settings', 'arguments': {'setting_type': 'display'}}	INTENT_ACTION_STILL_IMAGE_CAMERA-809-ACTION_GET_CONTENT-1-send_email-1-ACTION_VIEW_SENT_EMAILS-1-open_settings-1_NR	['ACTION_SET_TIMER', 'open_settings', 'ACTION_VIEW_CONTACT', 'ACTION_VIEW_RECENT_APPS', 'INTENT_ACTION_STILL_IMAGE_CAMERA']
