conversation_history	query	rewrited_query	answer	unique_idx	candidates
"[""turn 1: Display 'Reggae Rhythms'. -> Here's the 'Reggae Rhythms' playlist: Three Little Birds; No Woman, No Cry; Is This Love"", 'turn 2: Play that last track -> Now playing ‘Is This Love’. Enjoy the vibes!', ""turn 3: Can I see all the songs in that playlist? -> Check out 'Reggae Rhythms': Three Little Birds; No Woman, No Cry; Is This Love."", ""turn 4: Play the second track. -> Playing 'No Woman, No Cry' now.""]"	Please look up the address of the contact found at /directory/annie.	Please look up the address of the contact found at /directory/annie.	{'plan': 'get_contact_info', 'arguments': {'contact_uri': '/directory/annie', 'info_type': 'address'}}	ACTION_VIEW_PLAYLIST-2155-play_music-1-ACTION_VIEW_PLAYLIST-1-play_music-1-get_contact_info-1_NR	['ACTION_SHOW_TIMERS', 'send_email', 'ACTION_VIEW_CONTACT', 'get_contact_info', 'send_message']
"['turn 1: View the details for event 450 in my calendar. -> Event 450: Budget Planning at 2:30\xa0PM on September 30, Location: Admin Office.', 'turn 2: Take me to that office -> I’ve opened maps to guide you to Admin Office.', ""turn 3: I want to add a new event called 'Strategy Session' to plan the next quarter's objectives in the Executive Boardroom. Schedule it from 1701900000000 to 1701907200000. -> Great! 'Strategy Session' will take place on December 8 in the Executive Boardroom. See details at content://calendar/event/10"", ""turn 4: What's the exact address for it? -> Admin Office is located at Main Admin Office, 200 Corporate Blvd, Springfield, IL 62707, USA.""]"	Give me the email information for the contact found at /mycontacts/julia_d.	Give me the email information for the contact found at /mycontacts/julia_d.	{'plan': 'get_contact_info', 'arguments': {'contact_uri': '/mycontacts/julia_d.', 'info_type': 'email'}}	ACTION_VIEW_EVENT-1791-ACTION_NAVIGATE_TO_LOCATION-1-ACTION_INSERT_EVENT-1_NR-search_location-1-get_contact_info-1_NR	['ACTION_NAVIGATE_TO_LOCATION', 'ACTION_PICK', 'get_contact_info', 'ACTION_VIEW_EVENT', 'launch_application']
"['turn 1: List the remaining countdowns. -> Remaining countdowns: 5 minutes - Sauce, 8 minutes - Break.', ""turn 2: Add a 45 seconds countdown for a quick stretch -> Quick stretch timer set for 45 seconds. Let's move!"", 'turn 3: What timers do I currently have? -> Timers on your list: 5 minutes\xa0– Sauce, 8 minutes\xa0– Break, and 45 seconds\xa0– Quick stretch.', 'turn 4: Set a 10-minute timer for presentation rehearsal -> Your 10-minute presentation rehearsal timer is on!']"	I'm looking for image files to attach to my report. Could you let me choose multiple images?	I'm looking for image files to attach to my report. Could you let me choose multiple images?	{'plan': 'ACTION_OPEN_DOCUMENT', 'arguments': {'mime_types': ['image/*'], 'allow_multiple': True}}	ACTION_SHOW_TIMERS-1886-ACTION_SET_TIMER-1-ACTION_SHOW_TIMERS-1-ACTION_SET_TIMER-1-ACTION_OPEN_DOCUMENT-1_NR	['ACTION_SHOW_TIMERS', 'ACTION_OPEN_DOCUMENT', 'get_contact_info', 'send_message', 'ACTION_PICK']
"[""turn 1: Template examples for collecting customer feedback. -> Launching search for 'customer feedback form template examples': Check out sample surveys, question suggestions, and form designs."", ""turn 2: Let me see what I’ve looked at recently. -> Sure, here are the pages you’ve visited lately: Google Search – 'customer feedback form template examples'; SurveyMonkey – Sample surveys; Typeform – Feedback form designs; Smartsheet – Survey templates."", ""turn 3: Search that Typeform feedback form designs again. -> Search results for 'Typeform feedback form designs': Collection of template examples, design best practices, and real-world implementation case studies."", ""turn 4: I want to see the pages I've visited lately. -> Absolutely! Here’s your recent web browsing history: Google Search – 'customer feedback form template examples'; SurveyMonkey – Sample surveys; Typeform – Feedback form designs; Smartsheet – Survey templates.""]"	Provide a file selection for multiple images; I need to choose several.	Provide a file selection for multiple images; I need to choose several.	{'plan': 'ACTION_OPEN_DOCUMENT', 'arguments': {'mime_types': ['image/*'], 'allow_multiple': True}}	web_search-1347-ACTION_VIEW_WEB_HISTORY-1-web_search-1-ACTION_VIEW_WEB_HISTORY-1-ACTION_OPEN_DOCUMENT-1_NR	['ACTION_PICK', 'ACTION_SHOW_TIMERS', 'ACTION_OPEN_DOCUMENT', 'ACTION_SET_ALARM', 'play_video']
"[""turn 1: I'd like to create a new PowerPoint slide deck titled DraftDeck.pptx. -> DraftDeck.pptx is ready! You can find it here: content://documents/DraftDeck.pptx."", 'turn 2: Add a title slide and a summary slide to it. -> Done! DraftDeck.pptx now includes a title slide and a summary slide. You can edit it at content://documents/DraftDeck.pptx.', 'turn 3: I want to choose more than one image at once. Please open a multi-select dialog for images. -> Here’s the multi-select image picker—feel free to pick all the photos you want.', 'turn 4: I want to take a photo. Launch my still camera. -> Still image camera opened. You can start taking photos now.']"	I would like to select several PDFs for my records. Open a multi-select for PDF files, please.	I would like to select several PDFs for my records. Open a multi-select for PDF files, please.	{'plan': 'ACTION_OPEN_DOCUMENT', 'arguments': {'mime_types': ['application/pdf'], 'allow_multiple': True}}	ACTION_CREATE_DOCUMENT-16-ACTION_EDIT_DOCUMENT-1-ACTION_OPEN_DOCUMENT-1_NR-INTENT_ACTION_STILL_IMAGE_CAMERA-1_NR-ACTION_OPEN_DOCUMENT-1_NR	['ACTION_IMAGE_CAPTURE', 'ACTION_SET_RINGTONE', 'INTENT_ACTION_VIDEO_CAMERA', 'ACTION_OPEN_DOCUMENT', 'web_search']
"['turn 1: Create a calendar file meeting.ics. -> Creating a new calendar file ""meeting.ics"". Please select where you’d like to save it.', 'turn 2: Launch the video mode of my camera so I can record a quick tutorial. -> Video recorder has started. You’re all set to shoot.', 'turn 3: Pick the video I just shot -> Sure thing! Opening your video library now—please tap the clip you just recorded to select it.', 'turn 4: Could you extract the telephone details for the contact at /contact/mark? -> Mark’s telephone number is +1 (310) 555-9834.']"	Show me a selection dialog where I can pick multiple plain text files.	Show me a selection dialog where I can pick multiple plain text files.	{'plan': 'ACTION_OPEN_DOCUMENT', 'arguments': {'mime_types': ['text/plain'], 'allow_multiple': True}}	ACTION_CREATE_DOCUMENT-51-INTENT_ACTION_VIDEO_CAMERA-1_NR-ACTION_GET_CONTENT-1-get_contact_info-1_NR-ACTION_OPEN_DOCUMENT-1_NR	['ACTION_VIEW_SENT_EMAILS', 'ACTION_EDIT_ALARM', 'ACTION_OPEN_DOCUMENT', 'ACTION_SHOW_ALARMS', 'send_message']
"[""turn 1: Start a countdown for 2 hours 15 minutes 30 seconds and don't show any confirmation. -> Done! Timer set for 2 hours 15 minutes and 30 seconds."", 'turn 2: Can you show the phone details referenced at contact://phone/home/555? -> Home phone found: +1-555-0155.', 'turn 3: Call it. -> Dialing +1-555-0155...', 'turn 4: Let me see my call log. -> Done. Your call history:\n• +1-555-0155 (Outgoing) – Today, 2:15\xa0PM\n• +1-999-888-7777 (Incoming) – Today, 10:45\xa0AM\n• +1-123-456-7890 (Missed) – Yesterday, 6:25\xa0PM']"	Please allow me to choose a single PDF file from my list; one is enough.	Please allow me to choose a single PDF file from my list; one is enough.	{'plan': 'ACTION_OPEN_DOCUMENT', 'arguments': {'mime_types': ['application/pdf']}}	ACTION_SET_TIMER-601-get_contact_info_from_uri-1_NR-dial-1-ACTION_VIEW_CALL_LOG-1-ACTION_OPEN_DOCUMENT-1_NR	['INTENT_ACTION_STILL_IMAGE_CAMERA', 'ACTION_OPEN_DOCUMENT', 'ACTION_VIEW_SENT_EMAILS', 'ACTION_NAVIGATE_TO_LOCATION', 'open_settings']
"['turn 1: Execute script install.sh from content://scripts/install.sh -> Opening script install.sh at content://scripts/install.sh.', 'turn 2: I need to dial someone soon; select their phone number from my phonebook. -> Dialer contact selector is up. You picked content://contacts/phone/55.', 'turn 3: Show me the details for it -> Opening the requested record: content://contacts/phone/55 — showing contact details now.', ""turn 4: Update it with company 'TechCorp' and set email to user55@techcorp.com -> Nice! I've set the company to TechCorp and email to user55@techcorp.com for content://contacts/phone/55.""]"	I'm looking to attach documents in both PDF and plain text formats; let me pick multiple files.	I'm looking to attach documents in both PDF and plain text formats; let me pick multiple files.	{'plan': 'ACTION_OPEN_DOCUMENT', 'arguments': {'mime_types': ['application/pdf', 'text/plain'], 'allow_multiple': True}}	ACTION_OPEN_CONTENT-251-ACTION_PICK-1_NR-ACTION_VIEW_CONTACT-1-ACTION_EDIT_CONTACT-1-ACTION_OPEN_DOCUMENT-1_NR	['search_location', 'ACTION_OPEN_DOCUMENT', 'ACTION_VIEW_PLAYLIST', 'get_contact_info_from_uri', 'ACTION_EDIT_ALARM']
"[""turn 1: List every alarm I've set. -> Your alarm schedule: [alarm_id: 1 - 7:20 AM, Morning Run; alarm_id: 2 - 2:00 PM, Grocery Shopping; alarm_id: 3 - 5:00 PM, Pick up Kids; alarm_id: 4 - 8:45 PM, Read Emails]"", 'turn 2: Modify it so it repeats every weekday at 2:00 PM -> Your Morning Run alarm (ID 1) is now set for 2:00 PM, repeating Monday through Friday.', 'turn 3: Could you display all of them? -> All set alarms: [alarm_id: 1 - 2:00 PM, Morning Run; alarm_id: 2 - 2:00 PM, Grocery Shopping; alarm_id: 3 - 5:00 PM, Pick up Kids; alarm_id: 4 - 8:45 PM, Read Emails]', 'turn 4: Please activate the video camera on my device to record a short film. -> Camera app in video mode is active. Let’s get filming!']"	I'm selecting multiple images. Help me pick several image files at once.	I'm selecting multiple images. Help me pick several image files at once.	{'plan': 'ACTION_OPEN_DOCUMENT', 'arguments': {'mime_types': ['image/*'], 'allow_multiple': True}}	ACTION_SHOW_ALARMS-661-ACTION_EDIT_ALARM-1-ACTION_SHOW_ALARMS-1-INTENT_ACTION_VIDEO_CAMERA-1_NR-ACTION_OPEN_DOCUMENT-1_NR	['ACTION_VIEW_PLAYLIST', 'ACTION_VIEW_WEB_HISTORY', 'ACTION_INSERT_CONTACT', 'ACTION_OPEN_DOCUMENT', 'ACTION_GET_RINGTONE']
"[""turn 1: Make sure Rebecca's contact at content://contacts/people/rebecca includes the address 5 Broadway St, her company Broadway Inc, and email rebecca@broadway.com. -> Rebecca’s contact has been enriched with all the details—Address: 5 Broadway St, Company: Broadway Inc, Email: rebecca@broadway.com. (URI: content://contacts/people/rebecca)"", 'turn 2: What timers are currently counting down on my device? -> Here are your active timers:\n• 7 minutes left on Laundry\n• 12 minutes left on Meditation\n• 3 minutes left on Tea steeping', 'turn 3: Could you trigger the video camera to record footage of my surroundings? -> Launching video camera… All set!', 'turn 4: Capture a short video and save it to content://videos/my_surroundings.mp4 -> Your video has been recorded successfully and saved to content://videos/my_surroundings.mp4.']"	Find me an external document that is a plain text file.	Find me an external document that is a plain text file.	{'plan': 'ACTION_OPEN_DOCUMENT', 'arguments': {'mime_types': ['text/plain']}}	ACTION_EDIT_CONTACT-109-ACTION_SHOW_TIMERS-1_NR-INTENT_ACTION_VIDEO_CAMERA-1_NR-ACTION_VIDEO_CAPTURE-1-ACTION_OPEN_DOCUMENT-1_NR	['ACTION_NAVIGATE_TO_LOCATION', 'ACTION_EDIT_DOCUMENT', 'web_search', 'get_contact_info', 'ACTION_OPEN_DOCUMENT']
"[""turn 1: Send to +1-808-555-0167: 'Surf's up! Catch you at the beach at 5?' -> Surf invite sent to +18085550167."", ""turn 2: Show the texts I just sent -> Here's your latest texts: +18085550167 – 'Surf's up! Catch you at the beach at 5?'."", ""turn 3: Schedule a 'Breakfast Meetup' for an early morning networking event. There is no specific location. It should run from 1701200000000 to 1701201800000. -> Your ‘Breakfast Meetup’ has been added on November 18. Take a look: content://calendar/event/14"", 'turn 4: Open that event in my calendar. -> Breakfast Meetup: November 18, 7:00\xa0AM–7:30\xa0AM. Early morning networking (no location specified).']"	Open the file chooser for image documents, and allow me to pick multiple files if necessary.	Open the file chooser for image documents, and allow me to pick multiple files if necessary.	{'plan': 'ACTION_OPEN_DOCUMENT', 'arguments': {'mime_types': ['image/*'], 'allow_multiple': True}}	send_message-1289-ACTION_VIEW_SENT_MESSAGES-1-ACTION_INSERT_EVENT-1_NR-ACTION_VIEW_EVENT-1-ACTION_OPEN_DOCUMENT-1_NR	['ACTION_OPEN_DOCUMENT', 'ACTION_CREATE_DOCUMENT', 'ACTION_VIDEO_CAPTURE', 'ACTION_SET_TIMER', 'send_email']
"['turn 1: Tell me about the alarms that are configured. -> All scheduled alarms: [alarm_id: 1 - 6:30 AM, Morning Jog, alarm_id: 2 - 7:00 AM, Breakfast, alarm_id: 3 - 8:00 AM, Team Meeting, alarm_id: 4 - 1:00 PM, Lunch Break]', 'turn 2: Reschedule the Lunch Break alarm at 1:00 PM to 12:30 PM and skip the confirmation UI -> Done! Your Lunch Break alarm (ID 4) is now set for 12:30 PM—no confirmation prompt will appear.', 'turn 3: Show them for me. -> Displaying all scheduled alarms: [alarm_id: 1 - 6:30 AM, Morning Jog; alarm_id: 2 - 7:00 AM, Breakfast; alarm_id: 3 - 8:00 AM, Team Meeting; alarm_id: 4 - 12:30 PM, Lunch Break]', ""turn 4: Add an alarm for 2:00 PM named 'Project review' with ringtone work_alert.mp3 and skip confirmation UI. -> Alarm set for alarm_id: alarm_210 - 2:00 PM: Project review (ringtone: work_alert.mp3, UI skipped).""]"	I want to open a file picker for my images; if possible, allow selecting multiple images.	I want to open a file picker for my images; if possible, allow selecting multiple images.	{'plan': 'ACTION_OPEN_DOCUMENT', 'arguments': {'mime_types': ['image/*'], 'allow_multiple': True}}	ACTION_SHOW_ALARMS-667-ACTION_EDIT_ALARM-1-ACTION_SHOW_ALARMS-1-ACTION_SET_ALARM-1-ACTION_OPEN_DOCUMENT-1_NR	['ACTION_OPEN_DOCUMENT', 'get_contact_info', 'ACTION_VIEW_SENT_EMAILS', 'ACTION_CREATE_DOCUMENT', 'ACTION_SET_TIMER']
"[""turn 1: Switch alarm 12 to 03:30 with ringtone 'uri://morning_call'. -> Got it! Alarm 12 is now set for 3:30\xa0AM using your 'uri://morning_call' ringtone."", ""turn 2: Show me my current alarms. -> Here's what's set: [alarm_id: 12 – 3:30\xa0AM (‘uri://morning_call’), alarm_id: 1 – 6:15\xa0AM, alarm_id: 33 – 4:44\xa0AM, alarm_id: 35 – 5:05\xa0AM ‘Sunrise’]."", 'turn 3: Change that Sunrise alarm to 6:00\xa0AM, repeat it on Saturday and Sunday, and use the default ringtone. -> Alarm 35 is updated to 6:00\xa0AM on Saturdays and Sundays using the default ringtone.', 'turn 4: Show me all current alarms. -> Currently set alarms: [alarm_id: 12 – 3:30 AM (‘uri://morning_call’), alarm_id: 1 – 6:15 AM, alarm_id: 33 – 4:44 AM, alarm_id: 35 – 6:00 AM (Sat & Sun)]']"	I'm trying to open one PDF file that I can work on later; please open the file picker.	I'm trying to open one PDF file that I can work on later; please open the file picker.	{'plan': 'ACTION_OPEN_DOCUMENT', 'arguments': {'mime_types': ['application/pdf']}}	ACTION_EDIT_ALARM-1651-ACTION_SHOW_ALARMS-2-ACTION_EDIT_ALARM-1-ACTION_SHOW_ALARMS-1-ACTION_OPEN_DOCUMENT-1_NR	['launch_application', 'ACTION_PICK', 'ACTION_OPEN_DOCUMENT', 'ACTION_GET_CONTENT', 'send_email']
"[""turn 1: Let's view my recent launch history. -> Here's your last used apps: Maps; Calendar; Clock; Weather"", ""turn 2: Input an event for 'Photography Walk' with the description 'An early morning stroll to capture city life'. No location is provided, and it should be scheduled from 1702000000000 to 1702003600000. -> Done! 'Photography Walk' scheduled on December 8, 2023. (content://calender/event/7)"", ""turn 3: Register an event 'Product Launch Meeting' with the description 'Final preparations for the launch event'. The meeting is at Main Office, and it should run from 1701300000000 to 1701305400000. -> Confirmed: 'Product Launch Meeting' (Final preparations for the launch event) in Main Office from 1701300000000 to 1701305400000. (content://calendar/event/17)"", 'turn 4: Take me there -> Maps is guiding you to Main Office.']"	Help me open a document that's in PDF format for long-term editing.	Help me open a document that's in PDF format for long-term editing.	{'plan': 'ACTION_OPEN_DOCUMENT', 'arguments': {'mime_types': ['application/pdf']}}	ACTION_VIEW_RECENT_APPS-2207-ACTION_INSERT_EVENT-1_NR-ACTION_INSERT_EVENT-1_NR-ACTION_NAVIGATE_TO_LOCATION-1-ACTION_OPEN_DOCUMENT-1_NR	['ACTION_EDIT_CONTACT', 'ACTION_OPEN_DOCUMENT', 'ACTION_VIEW_RECENT_APPS', 'ACTION_CREATE_DOCUMENT', 'ACTION_VIDEO_CAPTURE']
"['turn 1: Capture a quick video. -> Done! Your video has been recorded. Here’s the URI: content://videos/quickcap_001.mp4', 'turn 2: Play it back -> Playing your quick video now.', 'turn 3: Email it to colleague@example.com -> Email successfully sent to colleague@example.com with your video attached.', ""turn 4: Display the list of sent messages -> Here’s what you’ve sent:\n• to colleague@example.com - 'video attached'.""]"	I wish to pick multiple documents—one in PDF and one in plain text. Let me choose them together.	I wish to pick multiple documents—one in PDF and one in plain text. Let me choose them together.	{'plan': 'ACTION_OPEN_DOCUMENT', 'arguments': {'mime_types': ['application/pdf', 'text/plain'], 'allow_multiple': True}}	ACTION_VIDEO_CAPTURE-706-ACTION_OPEN_CONTENT-1-send_email-1-ACTION_VIEW_SENT_EMAILS-1-ACTION_OPEN_DOCUMENT-1_NR	['ACTION_OPEN_DOCUMENT', 'ACTION_SET_RINGTONE', 'send_message', 'ACTION_EDIT_CONTACT', 'ACTION_VIEW_RECENT_APPS']
['turn 1: Please begin playing my recodedFile.mp4. -> Now playing file:///storage/emulated/0/recodedFile.mp4. Sit back and enjoy!', 'turn 2: I want you to pick a phone contact detail from my phone book. -> Launching your phone contact picker—tap to select the number you need.', 'turn 3: Please look up the address of the contact found at /directory/annie. -> Annie’s address is 742 Evergreen Terrace, Springfield, IL.', 'turn 4: Get directions to it. -> Here’s your route—navigation is started in a maps application: 742 Evergreen Terrace, Springfield, IL']	I want to select one document that is in text format. Open my document picker.	I want to select one document that is in text format. Open my document picker.	{'plan': 'ACTION_OPEN_DOCUMENT', 'arguments': {'mime_types': ['text/plain']}}	play_video-1438-ACTION_PICK-1_NR-get_contact_info-1_NR-ACTION_NAVIGATE_TO_LOCATION-1-ACTION_OPEN_DOCUMENT-1_NR	['ACTION_INSERT_EVENT', 'ACTION_OPEN_DOCUMENT', 'ACTION_VIEW_EVENT', 'open_settings', 'ACTION_SET_ALARM']
['turn 1: Could you load content://home_videos/family_trip.mp4 so I can do some manual cuts? -> Sure—family_trip.mp4 is loaded and ready for your cuts.', 'turn 2: Play that for me -> Loaded! Now playing content://home_videos/family_trip.mp4.', 'turn 3: Mute it entirely. -> Your family trip video is now muted. Check it out at content://home_videos/family_trip_muted.mp4.', 'turn 4: Play the muted version -> Here goes your muted family trip video—playing content://home_videos/family_trip_muted.mp4 now.']	Give me access to a PDF document stored remotely so I can edit it later.	Give me access to a PDF document stored remotely so I can edit it later.	{'plan': 'ACTION_OPEN_DOCUMENT', 'arguments': {'mime_types': ['application/pdf']}}	ACTION_EDIT_VIDEO-1677-play_video-1-ACTION_EDIT_VIDEO-1-play_video-1-ACTION_OPEN_DOCUMENT-1_NR	['ACTION_EDIT_VIDEO', 'ACTION_VIEW_WEB_HISTORY', 'send_email', 'ACTION_VIEW_EVENT', 'ACTION_OPEN_DOCUMENT']
"[""turn 1: Set the device ringtone using the system alarm sound URI: content://com.android.alarms/alarm_sound -> Ringtone successfully changed to 'alarm_sound'."", 'turn 2: Open the ringtone picker -> All right, here’s your pick: content://com.android.alarms/ringtone_melodic.mp3', ""turn 3: Use it as my ringtone -> All set! Incoming calls will now ring with 'ringtone_melodic.mp3' (content://com.android.alarms/ringtone_melodic.mp3)."", ""turn 4: Actually, I'd like to choose a different one. -> Great pick! You chose 'ringtone_joyful.mp3' (content://com.android.alarms/ringtone_joyful.mp3).""]"	Can you allow me to open several files? I'm interested in both PDFs and text documents.	Can you allow me to open several files? I'm interested in both PDFs and text documents.	{'plan': 'ACTION_OPEN_DOCUMENT', 'arguments': {'mime_types': ['application/pdf', 'text/plain'], 'allow_multiple': True}}	ACTION_SET_RINGTONE-1579-ACTION_GET_RINGTONE-1-ACTION_SET_RINGTONE-1-ACTION_GET_RINGTONE-1-ACTION_OPEN_DOCUMENT-1_NR	['ACTION_NAVIGATE_TO_LOCATION', 'search_location', 'ACTION_VIEW_PLAYLIST', 'launch_application', 'ACTION_OPEN_DOCUMENT']
"[""turn 1: Show me what's listed in content://contacts/people/1024. -> Displaying record:\nName: Liam Martin\nPhone: (555) 789-0123\nEmail: liam.martin@example.io\nURI: content://contacts/people/1024"", 'turn 2: Need to acquire the email address for the contact at /contacts/lily-email. -> Lily’s email address at /contacts/lily-email is lily.adams@example.net.', 'turn 3: Open it -> Here’s the contact at content://contacts/people/1024:\nName: Liam Martin\nPhone: (555)\xa0789-0123\nEmail: liam.martin@example.io', ""turn 4: Select a contact's postal information, please. -> Here’s the postal address you asked for: content://contacts/address/42""]"	I need several images; allow me to open multiple image files for persistent access.	I need several images; allow me to open multiple image files for persistent access.	{'plan': 'ACTION_OPEN_DOCUMENT', 'arguments': {'mime_types': ['image/*'], 'allow_multiple': True}}	ACTION_VIEW_CONTACT-776-get_contact_info-1_NR-ACTION_VIEW_CONTACT-1-ACTION_PICK-1_NR-ACTION_OPEN_DOCUMENT-1_NR	['ACTION_INSERT_CONTACT', 'ACTION_SHOW_ALARMS', 'get_contact_info_from_uri', 'ACTION_OPEN_DOCUMENT', 'ACTION_CREATE_DOCUMENT']
"[""turn 1: Message my neighbor at +44 7312 345678: 'Could you feed my cat while I'm away?' -> Request sent to your neighbor at +447312345678."", ""turn 2: What messages have I sent? -> Sent messages: +447312345678 – 'Could you feed my cat while I'm away?'."", ""turn 3: I would like to set up an event titled 'Art Exhibition'. It's a public display of local art at Downtown Gallery from 1701100000000 to 1701103600000. -> Great news—‘Art Exhibition’ has been scheduled for November 17 at Downtown Gallery. View it here: content://calendar/event/15"", 'turn 4: Give me the information on it. -> Art Exhibition – Public display of local art at Downtown Gallery on November 17, 9:00\xa0AM–10:00\xa0AM.']"	Help me pick a single plain text document from my storage.	Help me pick a single plain text document from my storage.	{'plan': 'ACTION_OPEN_DOCUMENT', 'arguments': {'mime_types': ['text/plain']}}	send_message-1287-ACTION_VIEW_SENT_MESSAGES-1-ACTION_INSERT_EVENT-1_NR-ACTION_VIEW_EVENT-1-ACTION_OPEN_DOCUMENT-1_NR	['ACTION_SHOW_ALARMS', 'ACTION_OPEN_DOCUMENT', 'ACTION_PICK', 'launch_application', 'ACTION_GET_RINGTONE']
"['turn 1: Lay out my recent internet footsteps. -> Your web log shows: Google search for best noise-cancelling headphones; Wikipedia: Active Noise Control; YouTube: Sony WH-1000XM4 Review; Amazon: Bose QuietComfort 35 II; OpenAI Blog: GPT-4 Release Highlights; Reddit: r/headphones.', ""turn 2: Show me a selection dialog where I can pick multiple plain text files. -> Absolutely—here's your text file picker with multi-select enabled. Choose all the files you need."", ""turn 3: Then create one as a text file named TodoList.txt. -> Your text file 'TodoList.txt' with multi-select support is created at content://documents/TodoList.txt."", 'turn 4: Edit that document to add my grocery items: milk, eggs, and bread. -> Opening content://documents/TodoList.txt. I’ve added your grocery items—milk, eggs, and bread—to the list. Let me know if you need anything else.']"	Select a plain text file from my storage for editing.	Select a plain text file from my storage for editing.	{'plan': 'ACTION_OPEN_DOCUMENT', 'arguments': {'mime_types': ['text/plain']}}	ACTION_VIEW_WEB_HISTORY-2090-ACTION_OPEN_DOCUMENT-1_NR-ACTION_CREATE_DOCUMENT-1-ACTION_EDIT_DOCUMENT-1-ACTION_OPEN_DOCUMENT-1_NR	['ACTION_SET_ALARM', 'ACTION_VIEW_WEB_HISTORY', 'ACTION_IMAGE_CAPTURE', 'ACTION_VIEW_SENT_EMAILS', 'ACTION_OPEN_DOCUMENT']
"['turn 1: Open a single HTML file for editing. -> One HTML file ready for editing:\n- content://documents/webpage/index.html', 'turn 2: Open it for editing -> Opening HTML file for editing: content://documents/webpage/index.html', ""turn 3: Send it to webteam@company.com with subject 'Please review' -> Email successfully sent to webteam@company.com with the HTML file attached."", ""turn 4: Let me check that -> Sent emails:\n- webteam@company.com – 'Please review'""]"	I require selecting an image file. Let me pick one image from my gallery.	I require selecting an image file. Let me pick one image from my gallery.	{'plan': 'ACTION_OPEN_DOCUMENT', 'arguments': {'mime_types': ['image/*']}}	ACTION_OPEN_DOCUMENT-122-ACTION_OPEN_CONTENT-1-send_email-1-ACTION_VIEW_SENT_EMAILS-1-ACTION_OPEN_DOCUMENT-1_NR	['ACTION_VIEW_EVENT', 'ACTION_INSERT_EVENT', 'ACTION_EDIT_ALARM', 'ACTION_VIEW_RECENT_APPS', 'ACTION_OPEN_DOCUMENT']
