conversation_history	query	rewrited_query	answer	unique_idx	candidates
"[""turn 1: View 'Smooth Jazz Nights'. -> Playlist 'Smooth Jazz Nights': Breezin'; Winelight; Take Five."", ""turn 2: Play that second one. -> Playing 'Winelight' now—smooth jazz ahead!"", ""turn 3: What tracks are on this playlist? -> Loaded 'Smooth Jazz Nights': Breezin'; Winelight; Take Five."", ""turn 4: Play the last one -> Playing 'Take Five'—enjoy the groove!""]"	Could you look for reliable sources that discuss the causes of urban pollution?	Could you look for reliable sources that discuss the causes of urban pollution?	{'plan': 'web_search', 'arguments': {'query': 'causes of urban pollution sources'}}	ACTION_VIEW_PLAYLIST-2153-play_music-1-ACTION_VIEW_PLAYLIST-1-play_music-1-web_search-1_NR	['ACTION_INSERT_CONTACT', 'INTENT_ACTION_VIDEO_CAMERA', 'ACTION_EDIT_ALARM', 'ACTION_PICK', 'web_search']
"[""turn 1: Email alpha.testers@domain.org the onboarding guide (file:///onboarding.pdf) and the policy document (file:///policy.docx). Use subject 'Welcome Pack'. -> Welcome Pack sent to alpha.testers@domain.org with onboarding and policy attachments."", 'turn 2: I require the address details of the contact at /user/info/samuel. -> Samuel’s address is 1600 Amphitheatre Parkway, Mountain View, CA 94043.', 'turn 3: Update that contact to add email samuel@google.com and phone 650-253-0000. -> Updated /user/info/samuel with email samuel@google.com and phone 650-253-0000.', 'turn 4: Email him the updated contact details. -> Email successfully sent to samuel@google.com with the updated contact details.']"	Search for a list showing the highest-grossing video games.	Search for a list showing the highest-grossing video games.	{'plan': 'web_search', 'arguments': {'query': 'highest-grossing video games list'}}	send_email-1222-get_contact_info-1_NR-ACTION_EDIT_CONTACT-1-send_email-1-web_search-1_NR	['web_search', 'ACTION_SET_TIMER', 'send_email', 'ACTION_CREATE_DOCUMENT', 'launch_application']
"[""turn 1: Start a countdown for 2 hours 15 minutes 30 seconds and don't show any confirmation. -> Done! Timer set for 2 hours 15 minutes and 30 seconds."", 'turn 2: Could you list them? -> Timers in action: [2 hours 15 minutes 30 seconds].', 'turn 3: Add a 20-minute timer for a workout session -> All set! 20-minute workout session timer started.', ""turn 4: Could you launch my phone's camera in video mode? -> Camera launched in video mode. Start shooting whenever you’re ready.""]"	Search online for practical dieting tips for maintaining a healthy lifestyle.	Search online for practical dieting tips for maintaining a healthy lifestyle.	{'plan': 'web_search', 'arguments': {'query': 'practical dieting tips healthy lifestyle'}}	ACTION_SET_TIMER-601-ACTION_SHOW_TIMERS-1-ACTION_SET_TIMER-1-INTENT_ACTION_VIDEO_CAMERA-1_NR-web_search-1_NR	['ACTION_NAVIGATE_TO_LOCATION', 'web_search', 'open_settings', 'ACTION_SET_ALARM', 'ACTION_VIEW_WEB_HISTORY']
"[""turn 1: Add Rosalind Franklin: email rosie@chemistry.co.uk, note 'Scientist'. -> Rosalind Franklin’s contact entry is now in your list. (content://contacts/people/rosalind_franklin)"", 'turn 2: I need a list of all timers that are in progress right now. -> All timers currently in progress: [15 minutes – Report drafting; 6 minutes – Quick break; 25 minutes – Pasta cooking].', 'turn 3: I require the phone info from contact://phone/office/321. -> Got it — the office line is (555) 321‑0000.', ""turn 4: Retrieve the contact information from the resource at 'contact://linkedin/in-john'. -> Here’s John’s LinkedIn profile link: https://www.linkedin.com/in/john.""]"	Could you search for the latest trends in sustainable architecture?	Could you search for the latest trends in sustainable architecture?	{'plan': 'web_search', 'arguments': {'query': 'latest sustainable architecture trends'}}	ACTION_INSERT_CONTACT-430-ACTION_SHOW_TIMERS-1_NR-get_contact_info_from_uri-1_NR-get_contact_info_from_uri-1_NR-web_search-1_NR	['ACTION_VIEW_RECENT_APPS', 'ACTION_EDIT_VIDEO', 'web_search', 'ACTION_NAVIGATE_TO_LOCATION', 'ACTION_EDIT_ALARM']
"['turn 1: Could you apply the ringtone from this URI? content://com.android.externalstorage.documents/tree/primary%3ADownload%2Fring.mp3 -> Your ringtone has been set to ring.mp3.', ""turn 2: I'd like to pick another ringtone. -> Sure thing—opening the ringtone selector so you can choose a new tone."", ""turn 3: Use it to set an alarm for 7:30 AM every morning with label 'Morning Workout' and vibration on -> All set! Your daily workout alarm (ID: alarm_8) is configured for every morning at 7:30\xa0AM, label 'Morning Workout', ringtone ring.mp3, vibration on."", 'turn 4: Open a plain text file from my documents — just one file, please. -> Got it. Launching the text file picker—please select a single document from your storage.']"	Find recent studies on the advantages of meditation.	Find recent studies on the advantages of meditation.	{'plan': 'web_search', 'arguments': {'query': 'advantages of meditation recent studies'}}	ACTION_SET_RINGTONE-1593-ACTION_GET_RINGTONE-1-ACTION_SET_ALARM-1-ACTION_OPEN_DOCUMENT-1_NR-web_search-1_NR	['ACTION_VIEW_EVENT', 'ACTION_EDIT_VIDEO', 'web_search', 'launch_application', 'ACTION_VIEW_CALL_LOG']
"['turn 1: Insert Sarah Connor with phone 610-555-1212, email sarah.connor@resistance.net. -> Sarah Connor’s contact entry is live! content://contacts/people/sarah_connor', ""turn 2: Need a dialog to choose a PDF document; I'm only selecting one file. -> Understood—opening the PDF selector. Please pick the single document you want."", ""turn 3: Go ahead and create one as a PDF named Invoice.pdf. -> Your new PDF 'Invoice.pdf' is ready: content://documents/Invoice.pdf."", ""turn 4: Please get the info linked to this URI: 'contact://info/phone_number'. -> Here’s the phone number: (555)\xa0123‑4567.""]"	Please look up information regarding COVID-19 recovery timelines.	Please look up information regarding COVID-19 recovery timelines.	{'plan': 'web_search', 'arguments': {'query': 'COVID-19 recovery timelines'}}	ACTION_INSERT_CONTACT-426-ACTION_OPEN_DOCUMENT-1_NR-ACTION_CREATE_DOCUMENT-1-get_contact_info_from_uri-1_NR-web_search-1_NR	['ACTION_OPEN_CONTENT', 'web_search', 'ACTION_VIEW_WEB_HISTORY', 'ACTION_SET_TIMER', 'ACTION_PICK']
"[""turn 1: What pages have I visited in my browser in the last few days? -> The pages you visited over the past few days are: eBay (search 'vintage camera'); Pinterest (DIY decor); IMDb (movie ratings); Coursera (data science course)"", 'turn 2: Kindly display the websites I have visited in the past few minutes. -> Visited in the last few minutes: Google Docs (project draft); Trello (kanban board); Slack (team channel); Spotify Web Player', 'turn 3: I would like to record some video content; turn on video recording on my phone. -> Your video camera app is ready—go ahead and start filming!', ""turn 4: Let me pick multiple videos from my gallery -> You've selected the following clips: content://storage/videos/rec1.mp4 and content://storage/videos/rec2.mp4""]"	Could you fetch online details on major archaeological discoveries in the last decade?	Could you fetch online details on major archaeological discoveries in the last decade?	{'plan': 'web_search', 'arguments': {'query': 'major archaeological discoveries past decade'}}	ACTION_VIEW_WEB_HISTORY-2069-ACTION_VIEW_WEB_HISTORY-1_NR-INTENT_ACTION_VIDEO_CAMERA-1_NR-ACTION_GET_CONTENT-1-web_search-1_NR	['ACTION_VIEW_SENT_EMAILS', 'web_search', 'ACTION_EDIT_DOCUMENT', 'search_location', 'ACTION_VIEW_EVENT']
['turn 1: Get the still camera running. -> Still camera is up and running.', 'turn 2: Capture it and save it to content://android/data/myapp/cache/captured.jpg -> Image snapped and stored at content://android/data/myapp/cache/captured.jpg.', 'turn 3: Provide all timers that are active at the moment. -> Your active timers right now are: [5 minutes – Pasta, 12 minutes – Meditation, 30 minutes – Laundry].', 'turn 4: Add another one like the last one for stretching -> Timer set for 30 minutes: Laundry for stretching.']	Get Chrome up and running; I need to check something online.	Get Chrome up and running; I need to check something online.	{'plan': 'launch_application', 'arguments': {'application_name': 'Chrome'}}	INTENT_ACTION_STILL_IMAGE_CAMERA-843-ACTION_IMAGE_CAPTURE-1-ACTION_SHOW_TIMERS-1_NR-ACTION_SET_TIMER-1-launch_application-1_NR	['search_location', 'ACTION_VIEW_EVENT', 'launch_application', 'send_message', 'INTENT_ACTION_VIDEO_CAMERA']
"[""turn 1: Call grandma's cell at 555.123.4567. -> Calling grandma’s cell at 555.123.4567..."", 'turn 2: Pull an email from my stored contacts. -> Email picker is up. Email chosen: content://contacts/email/34.', 'turn 3: Set its name to Robert Johnson. -> Contact entry renamed to Robert Johnson. (URI: content://contacts/email/34)', ""turn 4: Send him a message saying 'Just set up your email contact successfully.' -> Sent! Message delivered to Robert Johnson.""]"	Please start the Alarm app so I can set my wake-up time.	Please start the Alarm app so I can set my wake-up time.	{'plan': 'launch_application', 'arguments': {'application_name': 'Alarm'}}	dial-938-ACTION_PICK-1_NR-ACTION_EDIT_CONTACT-1-send_message-1-launch_application-1_NR	['launch_application', 'ACTION_VIEW_WEB_HISTORY', 'ACTION_VIEW_SENT_MESSAGES', 'ACTION_EDIT_CONTACT', 'send_email']
"['turn 1: Get the street address for content://org.addressbook/entries/456. -> Street address for content://org.addressbook/entries/456: 456 Birch Lane, Gotham City, NJ 07097.', 'turn 2: Bring up that entry -> Now viewing content://org.addressbook/entries/456. Address: 456 Birch Lane, Gotham City, NJ 07097. Scroll for more details.', ""turn 3: Change the ringtone on my device to content://media/echo_chime. -> Sure, your incoming call ringtone is now 'echo_chime' (content://media/echo_chime)."", 'turn 4: Could I see the ringtone list again? -> Selected ringtone: content://media/zest_tone.']"	Please launch LinkedIn so I can update my professional profile.	Please launch LinkedIn so I can update my professional profile.	{'plan': 'launch_application', 'arguments': {'application_name': 'LinkedIn'}}	get_contact_info-1016-ACTION_VIEW_CONTACT-1-ACTION_SET_RINGTONE-1_NR-ACTION_GET_RINGTONE-1-launch_application-1_NR	['get_contact_info_from_uri', 'ACTION_VIEW_PLAYLIST', 'ACTION_EDIT_CONTACT', 'search_location', 'launch_application']
['turn 1: Show last 10 calls from my call log. -> Last 10 calls:\n1. Alice +1-302-3782 (Missed) - Today 2:45 PM\n2. Charlie +1-555-0199 (Incoming) - Today 9:30 AM\n3. Mom +1-800-123-4567 (Incoming) - Today 6:00 AM\n4. John +44-20-7946-0958 (Outgoing) - Today 11:45 AM\n5. Lisa +61-2-9374-4000 (Missed) - Today 10:15 AM\n6. Restaurant +1-212-555-0199 (Incoming) - Yesterday 8:30 PM\n7. Work +1-646-555-0000 (Outgoing) - Yesterday 4:00 PM\n8. Delivery +1-987-654-3210 (Missed) - Yesterday 5:20 PM\n9. Dad +1-800-765-4321 (Outgoing) - Yesterday 9:00 PM\n10. Gym +1-333-444-5555 (Missed) - Today 7:05 AM', 'turn 2: I want to choose a contact number from my phone directory. -> Phone picker launched. You picked content://contacts/phone/22.', 'turn 3: What details do you have for it? -> Showing contact details at content://contacts/phone/22.', 'turn 4: Can you take me to the input method settings? I need to change my keyboard layout. -> Input method settings launched—time to change your keyboard layout.']	Start Notepad for writing a quick memo.	Start Notepad for writing a quick memo.	{'plan': 'launch_application', 'arguments': {'application_name': 'Notepad'}}	ACTION_VIEW_CALL_LOG-1916-ACTION_PICK-1_NR-ACTION_VIEW_CONTACT-1-open_settings-1_NR-launch_application-1_NR	['ACTION_INSERT_EVENT', 'ACTION_VIEW_PLAYLIST', 'launch_application', 'ACTION_EDIT_CONTACT', 'ACTION_GET_CONTENT']
"[""turn 1: Can you get the video camera up and running? -> You're all set—the video camera is open."", 'turn 2: Go ahead and record it. -> All done! Video saved at content://example/new_video.mp4.', 'turn 3: Please retrieve a mobile phone number from my contacts for me. -> No problem—bringing up phone number selection. Once you pick one, I’ll grab it for you. Chosen phone URI: content://contacts/phone/21', 'turn 4: Change its phone number to +1-202-555-0175 -> Got it! The phone number for content://contacts/phone/21 is now set to +1-202-555-0175.']"	Run the Messaging app so I can reply to my friend.	Run the Messaging app so I can reply to my friend.	{'plan': 'launch_application', 'arguments': {'application_name': 'Messaging'}}	INTENT_ACTION_VIDEO_CAMERA-912-ACTION_VIDEO_CAPTURE-1-ACTION_PICK-1_NR-ACTION_EDIT_CONTACT-1-launch_application-1_NR	['ACTION_IMAGE_CAPTURE', 'launch_application', 'ACTION_SET_RINGTONE', 'ACTION_SET_TIMER', 'ACTION_EDIT_VIDEO']
"[""turn 1: I'd like to use this MP3 as my call tone: content://storage/emulated/0/Pictures/song_of_the_siren.mp3 -> Got it—'song_of_the_siren.mp3' is now your default ringtone."", ""turn 2: Show me the ringtone list -> Here you go—'echo_dream.mp3' is set (content://storage/emulated/0/Pictures/echo_dream.mp3)"", ""turn 3: Use that one as my ringtone -> Great choice! 'echo_dream.mp3' is now set as your ringtone."", ""turn 4: Show me some other tones. -> Here's your pick: 'echo_wave.mp3' (content://storage/emulated/0/Pictures/echo_wave.mp3).""]"	Initiate the Music Player so I can enjoy some tunes.	Initiate the Music Player so I can enjoy some tunes.	{'plan': 'launch_application', 'arguments': {'application_name': 'Music Player'}}	ACTION_SET_RINGTONE-1580-ACTION_GET_RINGTONE-1-ACTION_SET_RINGTONE-1-ACTION_GET_RINGTONE-1-launch_application-1_NR	['open_settings', 'launch_application', 'ACTION_SHOW_ALARMS', 'ACTION_VIEW_WEB_HISTORY', 'ACTION_EDIT_CONTACT']
"['turn 1: Access content://contacts/people/777 and return all details. -> All details for content://contacts/people/777:\nName: Sarah Lee\nPhone: (310) 555-7890\nEmail: sarah.lee@company.com\nAddress: 321 Elm Street, Beverly Hills, CA 90212.', 'turn 2: View it -> Showing all details for content://contacts/people/777:\nName: Sarah Lee\nPhone: (310) 555-7890\nEmail: sarah.lee@company.com\nAddress: 321 Elm Street, Beverly Hills, CA 90212', ""turn 3: Please schedule an event called 'Fitness Bootcamp'. It's described as an intense morning workout session at a local fitness center from 1701800000000 to 1701803600000. -> All set! ‘Fitness Bootcamp’ has been added to your calendar on November 24 at the Local fitness center. You can view it here: content://calendar/event/8"", ""turn 4: What's its exact address? -> Local Fitness Center is at 550 Workout Way, Springfield, IL 62701, USA.""]"	Could you start the Shopping application so I can browse for deals?	Could you start the Shopping application so I can browse for deals?	{'plan': 'launch_application', 'arguments': {'application_name': 'Shopping'}}	get_contact_info-1013-ACTION_VIEW_CONTACT-1-ACTION_INSERT_EVENT-1_NR-search_location-1-launch_application-1_NR	['ACTION_OPEN_CONTENT', 'ACTION_VIEW_RECENT_APPS', 'launch_application', 'ACTION_VIDEO_CAPTURE', 'search_location']
"[""turn 1: Forward the holiday greeting 'Merry Christmas and a Happy New Year!' to +81-90-1234-5678. -> Merry Christmas greeting sent to +81-90-1234-5678."", 'turn 2: Make a call to that number -> Calling +81-90-1234-5678...', ""turn 3: Could you bring up my call log? -> Sure thing—here's your call history: +81-90-1234-5678 (Outgoing) – Today 8:05 PM; Work Admin +1-310-555-9000 (Missed) – Today 4:20 PM; Alice +1-415-555-0199 (Incoming) – Yesterday 2:15 PM"", ""turn 4: Save that number as a new contact International Sales -> Success! 'International Sales' (+81-90-1234-5678) has been saved to your contacts. Entry URI: content://contacts/people/international_sales""]"	Open Messenger so I can chat with my colleague.	Open Messenger so I can chat with my colleague.	{'plan': 'launch_application', 'arguments': {'application_name': 'Messenger'}}	send_message-1244-dial-1-ACTION_VIEW_CALL_LOG-1-ACTION_INSERT_CONTACT-1-launch_application-1_NR	['ACTION_EDIT_DOCUMENT', 'ACTION_SET_RINGTONE', 'ACTION_EDIT_ALARM', 'ACTION_CREATE_DOCUMENT', 'launch_application']
"['turn 1: Launch the general settings menu. -> General settings opened—let me know what you’d like to configure.', 'turn 2: I want to access and update the document at content://letter/form. -> Opening your document for editing at content://letter/form. Let me know what changes you’d like to make.', ""turn 3: I'm looking for detailed reports on the impact of social media on society. -> Search results for 'impact of social media on society reports': Analysis of mental health effects, misinformation spread, and community engagement trends."", ""turn 4: What's the log of my recent web visits? -> Here are the pages you’ve visited: Search results for 'impact of social media on society reports'; report on mental health effects; analysis of misinformation spread; study on community engagement trends.""]"	Would you kindly open the Clock app? I need to set an alarm.	Would you kindly open the Clock app? I need to set an alarm.	{'plan': 'launch_application', 'arguments': {'application_name': 'Clock'}}	open_settings-1106-ACTION_EDIT_DOCUMENT-1_NR-web_search-1_NR-ACTION_VIEW_WEB_HISTORY-1-launch_application-1_NR	['ACTION_OPEN_DOCUMENT', 'ACTION_VIEW_RECENT_APPS', 'launch_application', 'search_location', 'dial']
['turn 1: Please video record our meeting. -> Starting video recording for your meeting now.', 'turn 2: Can you help me pick a contact from my saved directory? -> Sure—contact picker opened. You selected content://contacts/people/12.', 'turn 3: Update its phone number to 555-6789. -> Phone number for the contact has been changed to 555-6789. (content://contacts/people/12)', 'turn 4: Send them a quick text confirming the new number works. -> Quick text confirming the new number has been sent to content://contacts/people/12.']	Start the Fitness app; I want to track my workout statistics.	Start the Fitness app; I want to track my workout statistics.	{'plan': 'launch_application', 'arguments': {'application_name': 'Fitness'}}	ACTION_VIDEO_CAPTURE-750-ACTION_PICK-1_NR-ACTION_EDIT_CONTACT-1-send_message-1-launch_application-1_NR	['ACTION_EDIT_DOCUMENT', 'ACTION_INSERT_CONTACT', 'ACTION_INSERT_EVENT', 'ACTION_EDIT_ALARM', 'launch_application']
['turn 1: Access content://contacts/people/777 and return all details. -> All details for content://contacts/people/777:\nName: Sarah Lee\nPhone: (310) 555-7890\nEmail: sarah.lee@company.com\nAddress: 321 Elm Street, Beverly Hills, CA 90212.', 'turn 2: Could you trigger the video camera to record footage of my surroundings? -> The video camera has been opened. You can start filming.', 'turn 3: Record and save it to content://videos/my_surroundings.mp4. -> All set—your video has been recorded and saved to content://videos/my_surroundings.mp4.', 'turn 4: Mute its audio -> Audio muted on your surroundings video. Download it from content://videos/my_surroundings_muted.mp4.']	Can you start Snapchat? I want to see the latest stories.	Can you start Snapchat? I want to see the latest stories.	{'plan': 'launch_application', 'arguments': {'application_name': 'Snapchat'}}	get_contact_info-1013-INTENT_ACTION_VIDEO_CAMERA-1_NR-ACTION_VIDEO_CAPTURE-1-ACTION_EDIT_VIDEO-1-launch_application-1_NR	['ACTION_IMAGE_CAPTURE', 'get_contact_info', 'ACTION_SHOW_ALARMS', 'launch_application', 'ACTION_OPEN_CONTENT']
['turn 1: Get the phone entry from content://com.example.contacts/1001. -> Got it. The phone number for content://com.example.contacts/1001 is 555-123-4567.', 'turn 2: Please obtain the phone details from /contacts/zach. -> Sure—Zach’s phone number is 555-987-6543.', 'turn 3: Add an email address to it: zach@example.com. -> Email zach@example.com has been added to content://com.example.contacts/1001 successfully.', 'turn 4: Email him to check if he received the update -> Email sent to zach@example.com to check if he received the update.']	Fire up the Calendar so I can review my upcoming events.	Fire up the Calendar so I can review my upcoming events.	{'plan': 'launch_application', 'arguments': {'application_name': 'Calendar'}}	get_contact_info-1009-get_contact_info-1_NR-ACTION_EDIT_CONTACT-1-send_email-1-launch_application-1_NR	['ACTION_EDIT_DOCUMENT', 'ACTION_VIEW_RECENT_APPS', 'launch_application', 'play_video', 'INTENT_ACTION_STILL_IMAGE_CAMERA']
"[""turn 1: I'd like a route to 555 Washington Ave, Miami Beach, FL. -> All set! navigation is started in a maps application: 555 Washington Ave, Miami Beach, FL"", 'turn 2: For a quick recording, please turn on the video camera on my device. -> Video camera is up and running.', 'turn 3: Begin recording and save it to content://videos/myclip.mp4. -> Recording complete—your footage is now stored at content://videos/myclip.mp4.', 'turn 4: Trim it to the first 20 seconds -> Trimmed to the first 20 seconds—your clip is here: content://videos/myclip_first20s.mp4.']"	Please launch the Voice Assistant so I can use voice commands.	Please launch the Voice Assistant so I can use voice commands.	{'plan': 'launch_application', 'arguments': {'application_name': 'Voice Assistant'}}	ACTION_NAVIGATE_TO_LOCATION-1783-INTENT_ACTION_VIDEO_CAMERA-1_NR-ACTION_VIDEO_CAPTURE-1-ACTION_EDIT_VIDEO-1-launch_application-1_NR	['ACTION_GET_CONTENT', 'ACTION_EDIT_DOCUMENT', 'ACTION_INSERT_CONTACT', 'launch_application', 'open_settings']
['turn 1: Invoke device camera for recording. -> Video mode activated. Ready to capture your moments.', 'turn 2: Grab a contact entry from my phone contacts list. -> Done! You’ve selected content://contacts/people/8 from your contacts.', 'turn 3: Edit its email to team@openai.com. -> Email address updated to team@openai.com. (content://contacts/people/8)', 'turn 4: Send them a note letting them know I updated their email contact. -> Notification delivered to content://contacts/people/8 about the email update.']	Activate the ToDo List app to manage my daily tasks.	Activate the ToDo List app to manage my daily tasks.	{'plan': 'launch_application', 'arguments': {'application_name': 'ToDo List'}}	INTENT_ACTION_VIDEO_CAMERA-907-ACTION_PICK-1_NR-ACTION_EDIT_CONTACT-1-send_message-1-launch_application-1_NR	['launch_application', 'ACTION_SET_RINGTONE', 'ACTION_EDIT_VIDEO', 'ACTION_EDIT_DOCUMENT', 'INTENT_ACTION_STILL_IMAGE_CAMERA']
"['turn 1: I want to change my alarm ringtone—open the picker now. -> On it! Showing you the alarm ringtone picker.', ""turn 2: I want to record my surroundings. Open the video recording application, please. -> Launching video camera... It's up and running—ready to capture your surroundings."", 'turn 3: Capture my surroundings and save it to content://videos/surroundings_clip.mp4 -> Recording complete! Saved at content://videos/surroundings_clip.mp4.', ""turn 4: Trim it from 10 seconds to 30 seconds -> Extracted the 10–30 second window from your surroundings clip. It's saved at content://videos/surroundings_clip_10-30s.mp4.""]"	Can you open the Contacts application for me?	Can you open the Contacts application for me?	{'plan': 'launch_application', 'arguments': {'application_name': 'Contacts'}}	ACTION_GET_RINGTONE-308-INTENT_ACTION_VIDEO_CAMERA-1_NR-ACTION_VIDEO_CAPTURE-1-ACTION_EDIT_VIDEO-1-launch_application-1_NR	['launch_application', 'ACTION_EDIT_VIDEO', 'ACTION_VIEW_WEB_HISTORY', 'get_contact_info', 'ACTION_EDIT_DOCUMENT']
['turn 1: Start the Calculator app; I have some quick math to do. -> Calculator launched. Ready for your calculations.', 'turn 2: Show me the apps I opened in the last few uses. -> Just opened apps: Calculator; Notes; Weather; Clock.', 'turn 3: Please get the contact summary for /contacts/mia. -> Contact summary for Mia:\n• Phone: 646-555-6789\n• Email: mia_wong@services.com\n• Address: 321 Pine Street, Seattle, WA\xa098101.', 'turn 4: Call her -> Dialing 646-555-6789...']	Make the Photos app appear; I want to view my gallery.	Make the Photos app appear; I want to view my gallery.	{'plan': 'launch_application', 'arguments': {'application_name': 'Photos'}}	launch_application-1464-ACTION_VIEW_RECENT_APPS-1-get_contact_info-1_NR-dial-1-launch_application-1_NR	['ACTION_CREATE_DOCUMENT', 'ACTION_OPEN_DOCUMENT', 'ACTION_PICK', 'ACTION_GET_CONTENT', 'launch_application']
"['turn 1: Could you share the timers that are live? -> Live timers: 20 minutes - Plants watering, 15 minutes - Makeup, 5 minutes - Tea steep.', 'turn 2: Start a 10-minute timer for it -> Tea steep timer is on for 10 minutes. Brewing soon!', ""turn 3: Set an alarm at 15:45 for 'Afternoon Workout' that repeats every Monday, Wednesday, and Friday. -> Afternoon Workout alarm (alarm_707) scheduled at 3:45\xa0PM every Mon, Wed & Fri."", 'turn 4: Actually, change it to daily at 16:00. -> Afternoon Workout alarm (alarm_707) rescheduled to 4:00 PM every day.']"	Open the Voice Recorder so I can capture a quick memo.	Open the Voice Recorder so I can capture a quick memo.	{'plan': 'launch_application', 'arguments': {'application_name': 'Voice Recorder'}}	ACTION_SHOW_TIMERS-1867-ACTION_SET_TIMER-1-ACTION_SET_ALARM-1_NR-ACTION_EDIT_ALARM-1-launch_application-1_NR	['ACTION_GET_RINGTONE', 'launch_application', 'ACTION_NAVIGATE_TO_LOCATION', 'ACTION_EDIT_CONTACT', 'INTENT_ACTION_VIDEO_CAMERA']
