conversation_history	query	rewrited_query	answer	unique_idx	candidates
['turn 1: Provide me with the option to select a notification tone. -> Notification tone chosen: content://media/ringtone/modern_beats.mp3', 'turn 2: Use content://media/internal/audio/media/45 for my wake‑up tone -> Wake‑up ringtone updated (ID: 45).', 'turn 3: Show me more wake‑up tone choices. -> Got it! Here’s the wake‑up ringtone browser. Pick whatever you like.']	Make that my notification ringtone	Make content://media/ringtone/modern_beats.mp3 my notification ringtone	{'plan': 'ACTION_SET_RINGTONE', 'arguments': {'ringtone_uri': 'content://media/ringtone/modern_beats.mp3'}}	SWAP_T4_R1_S2_I000716-ACTION_SET_RINGTONE-1	['ACTION_GET_RINGTONE', 'ACTION_VIEW_CONTACT', 'ACTION_SHOW_ALARMS', 'ACTION_SET_RINGTONE', 'search_location']
"['turn 1: I need a fresh wake‑up tone, show me all my ringtone options. -> Selected wake-up ringtone: content://media/internal/audio/media/45', 'turn 2: Make content://media/ringtone/modern_beats.mp3 my notification ringtone -> Notification ringtone switched to ""modern_beats.mp3"".', 'turn 3: Can you show me some other notification ringtones? -> Absolutely—launching the notification tone selector now.']"	Use it for my wake‑up tone	Use content://media/internal/audio/media/45 for my wake‑up tone	{'plan': 'ACTION_SET_RINGTONE', 'arguments': {'ringtone_uri': 'content://media/internal/audio/media/45'}}	SWAP_T4_R1_S2_I000717-ACTION_SET_RINGTONE-1	['ACTION_VIEW_SENT_MESSAGES', 'ACTION_EDIT_ALARM', 'ACTION_VIDEO_CAPTURE', 'ACTION_SET_RINGTONE', 'ACTION_VIEW_WEB_HISTORY']
"['turn 1: Launch the ringtone selector now. -> Ringtone chosen: content://media/ringtone/morning_glory.mp3', 'turn 2: Apply content://media/ringtone/morning_glory.mp3 as my new ringtone -> Your new ringtone ""morning_glory.mp3"" has been applied.', ""turn 3: Let's pick another one. -> Okay, opening the ringtone selector again for you.""]"	Apply that as my new ringtone	Apply content://media/ringtone/morning_glory.mp3 as my new ringtone	{'plan': 'ACTION_SET_RINGTONE', 'arguments': {'ringtone_uri': 'content://media/ringtone/morning_glory.mp3'}}	SWAP_T4_R1_S2_I000718-ACTION_SET_RINGTONE-1	['ACTION_SET_RINGTONE', 'ACTION_CREATE_DOCUMENT', 'ACTION_EDIT_VIDEO', 'ACTION_OPEN_DOCUMENT', 'ACTION_OPEN_CONTENT']
"[""turn 1: I want to save Maya Lopez's birthday as May 10, 1995. -> All set! Maya Lopez’s contact (birthday: May\xa010,\xa01995) has been created. You can view it here: content://contacts/people/maya_lopez"", 'turn 2: Show my recent calls -> Recent calls: Evelyn +1-213-555-0599 (Missed) - Today 9:40 AM; James +1-202-555-0321 (Outgoing) - Yesterday 1:05 PM; Grace +1-312-555-0123 (Incoming) - 3 days ago 11:50 AM', 'turn 3: Save +1-312-555-0123 as Emily Stone -> All set! Emily Stone has been added to your contacts. (URI: content://contacts/people/emily_stone)']"	Add an email to it: maya.lopez@example.com	Add an email to content://contacts/people/maya_lopez: maya.lopez@example.com	{'plan': 'ACTION_EDIT_CONTACT', 'arguments': {'contact_uri': 'content://contacts/people/maya_lopez', 'contact_info': {'email': 'maya.lopez@example.com'}}}	SWAP_T4_R1_S2_I000719-ACTION_EDIT_CONTACT-1	['ACTION_VIEW_CONTACT', 'ACTION_VIEW_PLAYLIST', 'ACTION_OPEN_CONTENT', 'ACTION_VIEW_RECENT_APPS', 'ACTION_EDIT_CONTACT']
['turn 1: Save Carlos Mendoza; tel: 333-222-1111; address is 789 Vinegar Hill Rd. -> Carlos Mendoza has been saved to your contacts: content://contacts/people/carlos_mendoza', 'turn 2: Let me see the history of my outgoing and incoming calls -> Call history: Michael +1-646-555-0666 (Incoming) - Today 7:15 AM; Scarlett +1-312-555-0444 (Missed) - Yesterday 6:00 PM; Benjamin +1-415-555-0999 (Outgoing) - Last Monday 2:30 PM', 'turn 3: Save +1-646-555-0666 as Michael Johnson -> Great! Michael Johnson is now saved in your contacts. (content://contacts/people/michael_johnson)']	Add company info to it: Acme Corp.	Add company info to content://contacts/people/carlos_mendoza: Acme Corp.	{'plan': 'ACTION_EDIT_CONTACT', 'arguments': {'contact_uri': 'content://contacts/people/carlos_mendoza', 'contact_info': {'company': 'Acme Corp'}}}	SWAP_T4_R1_S2_I000720-ACTION_EDIT_CONTACT-1	['ACTION_INSERT_CONTACT', 'ACTION_EDIT_CONTACT', 'INTENT_ACTION_VIDEO_CAMERA', 'ACTION_VIEW_CONTACT', 'play_music']
"['turn 1: Add Sam Wilson with number 777-888-9999, and birthday June 30, 1985. -> Sam\xa0Wilson’s contact (phone & birthday) saved successfully! content://contacts/people/sam_wilson', 'turn 2: Call +18005550000 now -> Dialing +18005550000 now...', ""turn 3: Add +18005550000 to my contacts -> Got it. I've saved +18005550000 as a new contact. You can find it here: content://contacts/people/101""]"	Add email to that: 'sam.wilson@example.com'	Add email to content://contacts/people/sam_wilson: 'sam.wilson@example.com'	{'plan': 'ACTION_EDIT_CONTACT', 'arguments': {'contact_uri': 'content://contacts/people/sam_wilson', 'contact_info': {'email': 'sam.wilson@example.com'}}}	SWAP_T4_R1_S2_I000721-ACTION_EDIT_CONTACT-1	['send_email', 'ACTION_EDIT_CONTACT', 'ACTION_VIEW_RECENT_APPS', 'launch_application', 'ACTION_SET_ALARM']
"[""turn 1: I'd like to add Natasha Romanoff, with email natasha@shield.gov, company Shield, note 'Black Widow agent'. -> Contact for Natasha\xa0Romanoff created: content://contacts/people/natasha_romanoff"", ""turn 2: Return Leo +1-305-555-0199's call -> Dialing +1-305-555-0199..."", ""turn 3: Save +1-305-555-0199 -> I've created a contact for +1-305-555-0199. Reference: content://contacts/people/103""]"	Add phone number on that: 555-123-4567	Add phone number on content://contacts/people/natasha_romanoff: 555-123-4567	{'plan': 'ACTION_EDIT_CONTACT', 'arguments': {'contact_uri': 'content://contacts/people/natasha_romanoff', 'contact_info': {'phone': '555-123-4567'}}}	SWAP_T4_R1_S2_I000722-ACTION_EDIT_CONTACT-1	['ACTION_VIDEO_CAPTURE', 'ACTION_SET_TIMER', 'INTENT_ACTION_STILL_IMAGE_CAMERA', 'ACTION_SHOW_TIMERS', 'ACTION_EDIT_CONTACT']
"['turn 1: Fetch the details for the person whose contact is content://contacts/people/1033. -> Here you go: details for content://contacts/people/1033 are now open.', 'turn 2: Call Mom +82-3512-0000 now -> Connecting you now to Mom at +82-3512-0000...', ""turn 3: Save Mom +82-3512-0000's number to my contacts -> Mom has been added to your address book. URI: content://contacts/people/106""]"	Add work email work@example.com to it	Add work email work@example.com to content://contacts/people/1033	{'plan': 'ACTION_EDIT_CONTACT', 'arguments': {'contact_uri': 'content://contacts/people/1033', 'contact_info': {'email': 'work@example.com'}}}	SWAP_T4_R1_S2_I000723-ACTION_EDIT_CONTACT-1	['ACTION_SET_TIMER', 'play_music', 'ACTION_EDIT_CONTACT', 'ACTION_VIEW_RECENT_APPS', 'ACTION_OPEN_CONTENT']
['turn 1: Would you bring up the entry stored at content://contacts/people/1034? -> Bringing up the entry at content://contacts/people/1034.', 'turn 2: Can you start Snapchat? I want to see the latest stories. -> Snapchat is open—check out the newest stories.', 'turn 3: Select a personal contact entry from my list. -> Go ahead and choose a personal contact entry.']	Change its phone number to 555-1234	Change the phone number of the entry at content://contacts/people/1034 to 555-1234	{'plan': 'ACTION_EDIT_CONTACT', 'arguments': {'contact_uri': 'content://contacts/people/1034', 'contact_info': {'phone': '555-1234'}}}	SWAP_T4_R1_S2_I000724-ACTION_EDIT_CONTACT-1	['ACTION_INSERT_EVENT', 'ACTION_SET_RINGTONE', 'ACTION_EDIT_CONTACT', 'ACTION_VIEW_CALL_LOG', 'ACTION_NAVIGATE_TO_LOCATION']
"['turn 1: Could you schedule a one-hour brainstorming session for next Tuesday at 2 pm in Zoom Room A titled \'Project Alpha Brainstorm\' with description \'Initial idea generation for Project Alpha\'? -> Great! ""Project Alpha Brainstorm"" is on your calendar for April 16, 2024 at 2:00\xa0PM in Zoom Room A. Here\'s the event link: content://calendar/event/1', 'turn 2: Find the nearest gas station -> Sure thing. The nearest gas station is Shell, 842 Elm Street, Springfield.', ""turn 3: Create an event called Fill Up at Shell, 842 Elm Street, Springfield tomorrow at 3 PM and ending at 3:30 PM with description Fill the tank -> Sure—I've added 'Fill Up at Shell' to your calendar for tomorrow from 3:00 PM to 3:30 PM at 842 Elm Street, Springfield. You can view it here: content://calendar/event/1""]"	Can you show me that event on my calendar?	Can you show me content://calendar/event/1 on my calendar?	{'plan': 'ACTION_VIEW_EVENT', 'arguments': {'event_uri': 'content://calendar/event/1'}}	SWAP_T4_R1_S2_I000725-ACTION_VIEW_EVENT-1	['ACTION_VIEW_CALL_LOG', 'ACTION_OPEN_DOCUMENT', 'ACTION_VIEW_EVENT', 'INTENT_ACTION_VIDEO_CAMERA', 'ACTION_EDIT_CONTACT']
"['turn 1: I need a calendar entry on May 1, 2024 at 9:00 AM for an annual check-up with Dr. Smith at the Downtown Clinic. -> All set: ""Doctor Appointment"" is scheduled for May 1, 2024 at 9:00\xa0AM at Downtown Clinic. Check it here: content://calendar/event/2', 'turn 2: Find parking lots nearby -> Nearby parking: City Center Garage, 200 Park Lane, Springfield.', ""turn 3: Schedule parking reminder at 200 Park Lane tomorrow from 8 AM to 6 PM titled Park Car with description Leave the car at the garage -> Your 'Park Car' reminder's good to go. It's on your calendar for tomorrow, 8:00 AM–6:00 PM at 200 Park Lane. Details: content://calendar/event/3""]"	Can you show me the details for that appointment?	Can you show me the details for content://calendar/event/2?	{'plan': 'ACTION_VIEW_EVENT', 'arguments': {'event_uri': 'content://calendar/event/2'}}	SWAP_T4_R1_S2_I000726-ACTION_VIEW_EVENT-1	['get_contact_info', 'ACTION_SET_TIMER', 'play_video', 'get_contact_info_from_uri', 'ACTION_VIEW_EVENT']
"['turn 1: Set up a yoga class on June 10th, 2024 from 6 PM to 7 PM at Sunrise Yoga Studio. It\'s a Vinyasa flow session. -> Done – ""Yoga Class"" is locked in for June 10, 2024 at 6:00\xa0PM at Sunrise Yoga Studio. View it here: content://calendar/event/3', 'turn 2: Look up a bookstore in this area -> Here’s what I found: Pages & Co. Bookstore at 123 Market Road, Springfield.', ""turn 3: Add an event at 123 Market Road this Saturday from 2 PM to 3 PM called Book Browsing with description Browse new arrivals -> Done! 'Book Browsing' is now on your schedule for this Saturday, 2:00 PM–3:00 PM at 123 Market Road. See it here: content://calendar/event/4""]"	Let me view that yoga class.	Let me view content://calendar/event/3 yoga class.	{'plan': 'ACTION_VIEW_EVENT', 'arguments': {'event_uri': 'content://calendar/event/3'}}	SWAP_T4_R1_S2_I000727-ACTION_VIEW_EVENT-1	['ACTION_VIEW_WEB_HISTORY', 'ACTION_EDIT_CONTACT', 'ACTION_VIEW_EVENT', 'ACTION_SET_ALARM', 'ACTION_EDIT_ALARM']
"['turn 1: Add to my calendar: Lunch with Sarah at Cafe Roma on July 4, 2024, starting at noon for an hour and a half. We need to catch up over lunch. -> Your ""Lunch with Sarah"" is booked for July 4, 2024 at 12:00\xa0PM at Cafe Roma. Here\'s the event URI: content://calendar/event/4', 'turn 2: Find public Wi‑Fi hotspots near here. -> I see public Wi‑Fi at City Library, 300 Main Street, Springfield.', ""turn 3: Add a Library Review event at City Library, 300 Main Street, Springfield tomorrow from 10 AM to 11 AM to go over library resources -> I’ve slotted 'Library Review' for tomorrow from 10:00 AM to 11:00 AM at City Library, 300 Main Street, Springfield. View it: content://calendar/event/6""]"	Please open that lunch meeting.	Please open content://calendar/event/4 lunch meeting.	{'plan': 'ACTION_VIEW_EVENT', 'arguments': {'event_uri': 'content://calendar/event/4'}}	SWAP_T4_R1_S2_I000728-ACTION_VIEW_EVENT-1	['ACTION_VIEW_EVENT', 'ACTION_SET_ALARM', 'ACTION_VIEW_WEB_HISTORY', 'ACTION_VIEW_SENT_MESSAGES', 'get_contact_info']
"['turn 1: Please create an event titled \'AI Trends Webinar\' on August 15, 2024 from 8:00 to 9:00 AM online, with description \'Join online webinar on latest AI developments\'. -> Success! ""AI Trends Webinar"" is on your calendar for August 15, 2024 at 8:00\xa0AM (online). Access it here: content://calendar/event/5', 'turn 2: Search for the nearest airport. -> The closest airport is Springfield Regional, 1 Airport Drive, Springfield.', ""turn 3: Schedule a Flight Prep Meeting at Springfield Regional, 1 Airport Drive, Springfield next Wednesday from 1 PM to 2 PM to discuss travel plans -> Your 'Flight Prep Meeting' is on the books for next Wednesday, 1:00 PM–2:00 PM at Springfield Regional, 1 Airport Drive. Access it here: content://calendar/event/7""]"	I'd like to see that webinar event.	I'd like to see content://calendar/event/5 webinar event.	{'plan': 'ACTION_VIEW_EVENT', 'arguments': {'event_uri': 'content://calendar/event/5'}}	SWAP_T4_R1_S2_I000729-ACTION_VIEW_EVENT-1	['ACTION_EDIT_DOCUMENT', 'ACTION_EDIT_VIDEO', 'ACTION_CREATE_DOCUMENT', 'ACTION_OPEN_CONTENT', 'ACTION_VIEW_EVENT']
"['turn 1: Put a deadline for the project final report on September 1, 2024 at 5 PM lasting an hour, description \'Submit final report to management\'. -> Got it – ""Project Final Report Deadline"" is set for September 1, 2024 at 5:00\xa0PM. Here’s the link: content://calendar/event/6', 'turn 2: Locate Bluetooth headset stores around here. -> Found a store: TechGear Plus, 45 Electronics Plaza, Springfield.', ""turn 3: Add a Headset Shopping event to TechGear Plus, 45 Electronics Plaza, Springfield this Friday from 3 PM to 4 PM to browse Bluetooth headsets -> Added 'Headset Shopping' to your calendar for this Friday, 3:00 PM–4:00 PM at TechGear Plus, 45 Electronics Plaza, Springfield. Details: content://calendar/event/8""]"	Show me the details for it.	Show me the details for content://calendar/event/6.	{'plan': 'ACTION_VIEW_EVENT', 'arguments': {'event_uri': 'content://calendar/event/6'}}	SWAP_T4_R1_S2_I000730-ACTION_VIEW_EVENT-1	['ACTION_VIEW_CONTACT', 'ACTION_PICK', 'ACTION_VIEW_WEB_HISTORY', 'ACTION_VIEW_SENT_EMAILS', 'ACTION_VIEW_EVENT']
"['turn 1: Schedule \'Thanksgiving Dinner\' on November 22, 2024 from 11:00 AM to 1:00 PM at Mom\'s House for a family gathering. -> Your ""Thanksgiving Dinner"" is confirmed for November 22, 2024 at 11:00\xa0AM at Mom’s House. Tap here for details: content://calendar/event/8', 'turn 2: Find gas stations around here -> Nearby gas station: Valero at 115 Market Street, Springfield.', ""turn 3: Add a Car Refuel event at Valero at 115 Market Street, Springfield tomorrow from 5 PM to 5:30 PM to fill up tank -> All done! 'Car Refuel' scheduled for tomorrow from 5:00 PM to 5:30 PM at Valero, 115 Market Street, Springfield. See it: content://calendar/event/10""]"	View its details for me.	View content://calendar/event/8 details for me.	{'plan': 'ACTION_VIEW_EVENT', 'arguments': {'event_uri': 'content://calendar/event/8'}}	SWAP_T4_R1_S2_I000731-ACTION_VIEW_EVENT-1	['ACTION_VIEW_RECENT_APPS', 'ACTION_VIEW_EVENT', 'ACTION_GET_CONTENT', 'ACTION_SET_ALARM', 'ACTION_CREATE_DOCUMENT']
"['turn 1: I\'d like to plan a movie night at Grand Cinema on October 10, 2024 beginning at 8 PM until 11 PM to watch the new sci-fi film with friends. -> All right! ""Movie Night"" is scheduled for October 10, 2024 from 8:00\xa0PM to 11:00\xa0PM at Grand Cinema. See it here: content://calendar/event/7', 'turn 2: Trim tutorial.mp4 from 30000 ms to 300000 ms -> Your tutorial.mp4 has been trimmed from 30s to 300s. Find the new clip at content://media/edited_tutorial_009.mp4.', ""turn 3: Arrange an event 'Wine Tasting' described as an evening of sampling fine wines at Vineyard Estate, starting at 1702800000000 and ending at 1702805400000. -> Great news! 'Wine Tasting' has been added to your calendar on December 17 at Vineyard Estate. You can view it here: content://calendar/event/1""]"	Open that event so I can see the info.	Open content://calendar/event/7 so I can see the info.	{'plan': 'ACTION_VIEW_EVENT', 'arguments': {'event_uri': 'content://calendar/event/7'}}	SWAP_T4_R1_S2_I000732-ACTION_VIEW_EVENT-1	['ACTION_OPEN_CONTENT', 'launch_application', 'ACTION_VIEW_EVENT', 'ACTION_VIEW_WEB_HISTORY', 'ACTION_INSERT_EVENT']
"['turn 1: Create an event for a New Year\'s Party at Main Hall on December 31, 2024 starting at 10:00 PM and ending at 1:00 AM. -> Cheers! ""New Year\'s Party"" is on for December 31, 2024 at 10:00\xa0PM in Main Hall. Access it here: content://calendar/event/9', 'turn 2: Set a 30-minute timer for Nap. -> Nap timer activated for 30 minutes. Sweet dreams!', ""turn 3: Set a calendar event for 'Meditation Retreat', a full-day mindfulness practice session. No explicit location is mentioned and it is set from 1702700000000 to 1702707200000. -> All set! 'Meditation Retreat' is scheduled for December 16. You’ll find the event here: content://calendar/event/2""]"	Let me see that event.	Let me see content://calendar/event/9.	{'plan': 'ACTION_VIEW_EVENT', 'arguments': {'event_uri': 'content://calendar/event/9'}}	SWAP_T4_R1_S2_I000733-ACTION_VIEW_EVENT-1	['get_contact_info', 'web_search', 'ACTION_VIEW_EVENT', 'get_contact_info_from_uri', 'ACTION_SET_RINGTONE']
"['turn 1: Please add a \'Morning Run\' on December 15, 2024 from 7:00 to 8:00 AM with description \'5km run around the park\'. -> All set: ""Morning Run"" scheduled for December 15, 2024 from 7:00\xa0AM to 8:00\xa0AM. Here\'s the event link: content://calendar/event/10', 'turn 2: Record the video now and save it to content://example/uri. -> Recording now. The video will be saved to content://example/uri once you finish.', ""turn 3: Organize an event titled 'Coding Bootcamp' that is an intensive programming course covering Python and JavaScript. It should be held at Tech Center from 1702600000000 to 1702607200000. -> Success! 'Coding Bootcamp' is now on your calendar for December 15 at Tech Center. Details: content://calendar/event/3""]"	Could you display that event?	Could you display content://calendar/event/10?	{'plan': 'ACTION_VIEW_EVENT', 'arguments': {'event_uri': 'content://calendar/event/10'}}	SWAP_T4_R1_S2_I000734-ACTION_VIEW_EVENT-1	['INTENT_ACTION_STILL_IMAGE_CAMERA', 'dial', 'ACTION_VIEW_EVENT', 'play_music', 'ACTION_VIEW_PLAYLIST']
"[""turn 1: Could you book 'Design Workshop' on September 10, 2024 at 1:00 PM to 4:00 PM in Room 202? Desc: Work on new UI mockups. -> Your “Design Workshop” has been scheduled for September 10, 2024, 1:00\xa0PM–4:00\xa0PM in Room\xa0202. You can view it here: content://calendar/event/1"", 'turn 2: I am interested in seeing the timers that are currently on. -> Active timers list: [5 minutes – Stretch break, 25 minutes – Focus session, 3 minutes – Email check]', ""turn 3: I would like to add an event called 'Sculpture Workshop'. The description is 'Learn sculpting basics under expert guidance'. It will be hosted at the Art Institute from 1702500000000 to 1702505400000. -> Done – 'Sculpture Workshop' has been added on December 14 at Art Institute. Check it out: content://calendar/event/4""]"	Can you show me the details of that event?	Can you show me the details of content://calendar/event/1?	{'plan': 'ACTION_VIEW_EVENT', 'arguments': {'event_uri': 'content://calendar/event/1'}}	SWAP_T4_R1_S2_I000735-ACTION_VIEW_EVENT-1	['ACTION_VIEW_CALL_LOG', 'ACTION_GET_RINGTONE', 'open_settings', 'web_search', 'ACTION_VIEW_EVENT']
"[""turn 1: Please log a jog: 'Park Run' on May 20, 2024 from 6:00-7:00 AM with description '5K tempo run'. -> Got it—“Park Run” (5K tempo run) on May 20, 2024, from 6:00\xa0AM to 7:00\xa0AM is in your calendar now. See details: content://calendar/event/2"", ""turn 2: Set one for 10:15 PM labeled Wind Down and skip confirmation. -> All set! Alarm (alarm_id: alarm_208) scheduled for 10:15 PM: 'Wind Down' (no confirmation prompt)."", ""turn 3: Schedule a 'Kids Playdate' event described as an afternoon of fun at the park. The location is Local Playground and it should take place from 1702300000000 to 1702303600000. -> Your 'Kids Playdate' is all set for December 12 at Local Playground. Check it here: content://calendar/event/6""]"	Open it.	Open content://calendar/event/2.	{'plan': 'ACTION_VIEW_EVENT', 'arguments': {'event_uri': 'content://calendar/event/2'}}	SWAP_T4_R1_S2_I000736-ACTION_VIEW_EVENT-1	['ACTION_VIEW_PLAYLIST', 'ACTION_VIEW_RECENT_APPS', 'ACTION_VIEW_EVENT', 'ACTION_INSERT_EVENT', 'ACTION_SET_RINGTONE']
"[""turn 1: Create a calendar entry for 'Board Meeting' on November 8, 2024, 9:30 AM to 12:00 PM at Headquarters, details: 'Quarterly board review'. -> Done! ‘Board Meeting’ (Quarterly board review) is set for November 8, 2024, 9:30\xa0AM–12:00\xa0PM at Headquarters. View it here: content://calendar/event/3"", ""turn 2: Play The Message. -> Starting 'The Message' now. Enjoy the beat!"", ""turn 3: I need to log an event named 'Virtual Conference' with an online meeting featuring global speakers. Since it's virtual, no physical location is needed. It runs from 1702200000000 to 1702207200000. -> 'Virtual Conference' created for December 11 as an online event. Access it here: content://calendar/event/7""]"	What are the details of that meeting?	What are the details of content://calendar/event/3?	{'plan': 'ACTION_VIEW_EVENT', 'arguments': {'event_uri': 'content://calendar/event/3'}}	SWAP_T4_R1_S2_I000737-ACTION_VIEW_EVENT-1	['ACTION_SET_RINGTONE', 'ACTION_CREATE_DOCUMENT', 'ACTION_VIEW_EVENT', 'ACTION_INSERT_EVENT', 'ACTION_VIEW_SENT_EMAILS']
"[""turn 1: I need an event 'Dentist Check-Up' on August 1, 2024 at 11:00 AM at Smile Dental Clinic. Description: Routine cleaning. -> Your “Dentist Check-Up” on August 1, 2024 at 11:00\xa0AM at Smile Dental Clinic has been added. Check it out: content://calendar/event/4"", 'turn 2: Change my ringtone to content://media/device_default.mp3 -> Your ringtone has been changed to content://media/device_default.mp3.', ""turn 3: Can you record an event 'Language Class'? The session on Spanish will be held at Community Hall from 1702100000000 to 1702103600000. -> Nice! 'Language Class' has been scheduled on December 10 at Community Hall. You’ll find it here: content://calendar/event/8""]"	Show me that appointment.	Show me content://calendar/event/4.	{'plan': 'ACTION_VIEW_EVENT', 'arguments': {'event_uri': 'content://calendar/event/4'}}	SWAP_T4_R1_S2_I000738-ACTION_VIEW_EVENT-1	['ACTION_VIEW_EVENT', 'ACTION_SHOW_ALARMS', 'ACTION_SET_RINGTONE', 'ACTION_EDIT_CONTACT', 'ACTION_VIDEO_CAPTURE']
"[""turn 1: Schedule an all-hands meeting titled 'Company Update' on July 1, 2024 from 10 AM – 11 AM. -> All-hands meeting “Company Update” is booked for July 1, 2024, 10:00\xa0AM–11:00\xa0AM. Here’s the link: content://calendar/event/5"", 'turn 2: Actually, can I choose a different one than content://media/internal/audio/media/21? -> Done! Selected ringtone: content://media/internal/audio/media/22', ""turn 3: Input an event for 'Photography Walk' with the description 'An early morning stroll to capture city life'. No location is provided, and it should be scheduled from 1702000000000 to 1702003600000. -> 'Photography Walk' has been added on December 9. No venue needed—view details at content://calendar/event/9""]"	Show me this event.	Show me content://calendar/event/5.	{'plan': 'ACTION_VIEW_EVENT', 'arguments': {'event_uri': 'content://calendar/event/5'}}	SWAP_T4_R1_S2_I000739-ACTION_VIEW_EVENT-1	['ACTION_SET_RINGTONE', 'search_location', 'ACTION_OPEN_DOCUMENT', 'ACTION_VIEW_EVENT', 'ACTION_IMAGE_CAPTURE']
"[""turn 1: Please put down a lunch meetup 'Catch‑Up with Sarah' on June 30, 2024 at 12:00 PM to 1:00 PM at Central Café. -> Logged: “Catch‑Up with Sarah” (Lunch meetup) on June 30, 2024, 12:00\xa0PM–1:00\xa0PM at Central\xa0Café. Details: content://calendar/event/6"", 'turn 2: Take me to Admin Office -> I’ve opened maps to guide you to Admin Office.', ""turn 3: I want to add a new event called 'Strategy Session' to plan the next quarter's objectives in the Executive Boardroom. Schedule it from 1701900000000 to 1701907200000. -> Great! 'Strategy Session' will take place on December 8 in the Executive Boardroom. See details at content://calendar/event/10""]"	What are the details of the event I just created?	What are the details of content://calendar/event/6?	{'plan': 'ACTION_VIEW_EVENT', 'arguments': {'event_uri': 'content://calendar/event/6'}}	SWAP_T4_R1_S2_I000740-ACTION_VIEW_EVENT-1	['ACTION_VIEW_SENT_EMAILS', 'ACTION_INSERT_EVENT', 'ACTION_SHOW_TIMERS', 'ACTION_VIEW_EVENT', 'ACTION_OPEN_DOCUMENT']
"[""turn 1: Add 'Podcast Recording' event April 22, 2025 from 9:00 to 11:00 AM, description 'Episode 10 interview with guest'. -> Added “Podcast Recording” (Episode 10 interview with guest) on April 22, 2025, 9:00\xa0AM–11:00\xa0AM. View here: content://calendar/event/7"", ""turn 2: Locate alt.email@provider.com's domain on a map -> Sorry, I couldn’t find any HQ location for provider.com."", ""turn 3: I require an event 'Evening Swim' with the description 'Swimming session at the local pool'. There is no location provided. Please schedule it from 1703900000000 to 1703905400000. -> Done! 'Evening Swim' has been added to your calendar from 1703900000000 to 1703905400000. View it here: content://calendar/event/101.""]"	Show me its summary.	Show me the summary of content://calendar/event/7.	{'plan': 'ACTION_VIEW_EVENT', 'arguments': {'event_uri': 'content://calendar/event/7'}}	SWAP_T4_R1_S2_I000741-ACTION_VIEW_EVENT-1	['ACTION_VIEW_EVENT', 'ACTION_VIEW_CONTACT', 'ACTION_SHOW_TIMERS', 'ACTION_IMAGE_CAPTURE', 'ACTION_VIEW_SENT_EMAILS']
