conversation_history	query	rewrited_query	answer	unique_idx	candidates
['turn 1: Could you find the precise address of the White House? -> Here you go: The White House at 1600 Pennsylvania Avenue NW, Washington, DC 20500, USA.', 'turn 2: Get me the address details for the contact at /contacts/xavier. -> Xavier’s address: 456 Oak Road, Seattle, WA 98101.', 'turn 3: Open 456 Oak Road, Seattle, WA 98101 -> Launching Maps at 456 Oak Road, Seattle, WA 98101.']	Create 'Tour of White House' there on April 15 from 11 AM to 12 PM with description 'Guided tour'.	Create 'Tour of White House' at 1600 Pennsylvania Avenue NW, Washington, DC 20500, USA on April 15 from 11 AM to 12 PM with description 'Guided tour'.	{'plan': 'ACTION_INSERT_EVENT', 'arguments': {'TITLE': 'Tour of White House', 'DESCRIPTION': 'Guided tour', 'EVENT_LOCATION': '1600 Pennsylvania Avenue NW, Washington, DC 20500, USA', 'BEGIN_TIME': 1713178800000, 'END_TIME': 1713182400000}}	SWAP_T4_R1_S2_I000865-ACTION_INSERT_EVENT-1	['ACTION_INSERT_EVENT', 'launch_application', 'ACTION_VIEW_EVENT', 'ACTION_INSERT_CONTACT', 'web_search']
['turn 1: Where exactly is the Taj Mahal located? -> Taj Mahal: Dharmapuri, Forest Colony, Tajganj, Agra, Uttar Pradesh 282001, India.', 'turn 2: Please provide a summary of the contact details for /contacts/ursula. -> Here’s Ursula’s contact summary:\nName: Ursula Lee\nPhone: +1-303-555-0119\nEmail: ursula.lee@provider.com\nAddress: 321 Elm Street, Boulder, CO 80302', 'turn 3: Plot 321 Elm Street, Boulder, CO 80302 -> Plotting 321 Elm Street, Boulder, CO 80302 on your map.']	Add an event called 'Sunrise Visit' there next Friday at 6 AM for 1 hour with description 'Experience Taj Mahal at sunrise'.	Add an event called 'Sunrise Visit' at Dharmapuri, Forest Colony, Tajganj, Agra, Uttar Pradesh 282001, India next Friday at 6 AM for 1 hour with description 'Experience Taj Mahal at sunrise'.	{'plan': 'ACTION_INSERT_EVENT', 'arguments': {'TITLE': 'Sunrise Visit', 'DESCRIPTION': 'Experience Taj Mahal at sunrise', 'EVENT_LOCATION': 'Dharmapuri, Forest Colony, Tajganj, Agra, Uttar Pradesh 282001, India', 'BEGIN_TIME': 1712296800000, 'END_TIME': 1712300400000}}	SWAP_T4_R1_S2_I000866-ACTION_INSERT_EVENT-1	['ACTION_INSERT_CONTACT', 'ACTION_GET_CONTENT', 'search_location', 'ACTION_INSERT_EVENT', 'ACTION_EDIT_VIDEO']
"['turn 1: Locate the Brooklyn Bridge for me. -> Here’s the Brooklyn Bridge: Brooklyn Bridge, New York, NY 10038, USA.', ""turn 2: I would like to set up an event titled 'Art Exhibition'. It's a public display of local art at Downtown Gallery from 1701100000000 to 1701103600000. -> Art Exhibition at Downtown Gallery has been scheduled from 1701100000000 to 1701103600000. Event URI: content://calendar/event/5"", 'turn 3: Can you find the address of Downtown Gallery? -> Downtown Gallery is located at 789 Market St, Metropolis, NY 10001.']"	Schedule a discussion about suspension bridge history there next Monday at 2pm for one hour.	Schedule a discussion about suspension bridge history at Brooklyn Bridge, New York, NY 10038, USA next Monday at 2pm for one hour.	{'plan': 'ACTION_INSERT_EVENT', 'arguments': {'TITLE': 'Suspension Bridge History Discussion', 'DESCRIPTION': 'Discussion about suspension bridge history', 'EVENT_LOCATION': 'Brooklyn Bridge, New York, NY 10038, USA', 'BEGIN_TIME': 1683554400000, 'END_TIME': 1683558000000}}	SWAP_T4_R1_S2_I000867-ACTION_INSERT_EVENT-1	['ACTION_IMAGE_CAPTURE', 'play_video', 'ACTION_EDIT_VIDEO', 'ACTION_OPEN_DOCUMENT', 'ACTION_INSERT_EVENT']
"['turn 1: Send a quick email to mark@example.com reminding him about the quarterly report. -> Your reminder email has been sent to mark@example.com.', 'turn 2: Could you let me pick a single text file from my device? -> Sure—opening your text files. Pick one to proceed.', ""turn 3: Email content://docs/annual_report.pdf to bob@example.com with subject 'Need your input' and include 'I'll check it soon' in the body. -> Your email to bob@example.com has been sent.""]"	Show my sent emails including that reminder to mark.	Show my sent emails including the reminder to mark@example.com.	{'plan': 'ACTION_VIEW_SENT_EMAILS', 'arguments': {}}	SWAP_T4_R1_S2_I000868-ACTION_VIEW_SENT_EMAILS-1	['open_settings', 'ACTION_CREATE_DOCUMENT', 'ACTION_VIEW_SENT_EMAILS', 'ACTION_NAVIGATE_TO_LOCATION', 'ACTION_EDIT_ALARM']
"[""turn 1: I need to email Sarah at sarah.connor@skynet.com with subject 'Mission Update' and tell her the mission is a go. -> We've sent your 'Mission Update' email to sarah.connor@skynet.com."", 'turn 2: I need to retrieve a PDF document from my cloud storage. Let me pick one file, please. -> On it—opening the PDF selector. Please pick the file from your cloud storage.', ""turn 3: Email the PDF document from my cloud storage to helpdesk@example.com with subject 'Requested Document' and body 'Please find the PDF attached.' -> Email to helpdesk@example.com successfully sent.""]"	Can I review that mission update email in my sent folder?	Can I review the 'Mission Update' email to sarah.connor@skynet.com in my sent folder?	{'plan': 'ACTION_VIEW_SENT_EMAILS', 'arguments': {}}	SWAP_T4_R1_S2_I000869-ACTION_VIEW_SENT_EMAILS-1	['ACTION_IMAGE_CAPTURE', 'ACTION_INSERT_CONTACT', 'ACTION_VIEW_SENT_EMAILS', 'open_settings', 'ACTION_PICK']
"[""turn 1: Could you please send a message to team@project.com with the subject 'Standup Meeting' and attach the agenda document located at file:///agenda.docx and the minutes from last week file:///minutes.pdf, then write 'Let's all be prepared!' in the body? -> Standup Meeting email with attachments sent to team@project.com."", 'turn 2: Pick the most recent photo from my camera roll -> Here’s your latest photo: content://temp/IMG_20240605_153210.jpg', 'turn 3: Email content://temp/IMG_20240605_153210.jpg to boss@company.com -> Email sent to boss@company.com.']"	Let me see my sent emails to confirm that standup meeting message with the attachments.	Let me see my sent emails to confirm that Standup Meeting email with attachments sent to team@project.com.	{'plan': 'ACTION_VIEW_SENT_EMAILS', 'arguments': {}}	SWAP_T4_R1_S2_I000870-ACTION_VIEW_SENT_EMAILS-1	['open_settings', 'ACTION_CREATE_DOCUMENT', 'ACTION_VIEW_SENT_EMAILS', 'ACTION_INSERT_CONTACT', 'ACTION_SET_TIMER']
"[""turn 1: I would like to shoot an email to CEO <ceo@bigcorp.com> with a brief note: 'Congratulations on the company's growth this quarter! We appreciate your leadership.' Include subject as 'Kudos'. -> Your 'Kudos' email has been delivered to ceo@bigcorp.com."", 'turn 2: Select the last image I captured -> Got it—your last captured image is here: content://temp/IMG_20240605_160045.jpg', 'turn 3: Please send content://temp/IMG_20240605_160045.jpg to john.doe@gmail.com as an attachment -> Email successfully sent to john.doe@gmail.com.']"	Show the sent emails so I can verify that kudos message to the CEO.	Show the sent emails so I can verify that 'Kudos' message to the CEO.	{'plan': 'ACTION_VIEW_SENT_EMAILS', 'arguments': {}}	SWAP_T4_R1_S2_I000871-ACTION_VIEW_SENT_EMAILS-1	['get_contact_info', 'ACTION_VIEW_SENT_MESSAGES', 'ACTION_VIEW_SENT_EMAILS', 'ACTION_SHOW_TIMERS', 'ACTION_VIEW_EVENT']
['turn 1: Hey, can you pop an email to support@helpdesk.org regarding the login issue? -> Message about the login issue sent to support@helpdesk.org.', 'turn 2: Choose multiple videos from my camera roll -> Opening video gallery—pick the clips you need.', 'turn 3: Email multiple videos from my camera roll to team@videoedit.com with subject Raw footage -> Email successfully sent to team@videoedit.com.']	Let me review what I sent.	Let me review message about the login issue sent to support@helpdesk.org.	{'plan': 'ACTION_VIEW_SENT_EMAILS', 'arguments': {}}	SWAP_T4_R1_S2_I000872-ACTION_VIEW_SENT_EMAILS-1	['ACTION_SET_ALARM', 'play_music', 'ACTION_VIEW_SENT_EMAILS', 'ACTION_VIEW_SENT_MESSAGES', 'ACTION_INSERT_CONTACT']
['turn 1: Reach out to john.doe@gmail.com. -> Email sent to john.doe@gmail.com.', 'turn 2: Pick a video from my gallery -> Launching your video library—select one video to proceed.', 'turn 3: Email a video from my gallery to editor@media.com with subject Clip for editing -> Email successfully sent to editor@media.com with your video clip attached.']	Could you pull up that email?	Could you pull up john.doe@gmail.com email?	{'plan': 'ACTION_VIEW_SENT_EMAILS', 'arguments': {}}	SWAP_T4_R1_S2_I000873-ACTION_VIEW_SENT_EMAILS-1	['ACTION_NAVIGATE_TO_LOCATION', 'ACTION_SET_ALARM', 'ACTION_CREATE_DOCUMENT', 'ACTION_VIEW_SENT_EMAILS', 'ACTION_SET_RINGTONE']
"[""turn 1: Please mail my manager at manager@office.net a calendar invite file:///invite.ics with 'Here is the meeting invite' as body and subject 'Team Sync'. -> Meeting invite email has been sent to manager@office.net."", 'turn 2: Open content://documents/webpage/index.html for editing -> Opening HTML file for editing: content://documents/webpage/index.html', ""turn 3: Send content://documents/webpage/index.html to webteam@company.com with subject 'Please review' -> Email successfully sent to webteam@company.com with the HTML file attached.""]"	I'd like to see that invite in my sent folder.	I'd like to see the meeting invite in my sent folder.	{'plan': 'ACTION_VIEW_SENT_EMAILS', 'arguments': {}}	SWAP_T4_R1_S2_I000874-ACTION_VIEW_SENT_EMAILS-1	['play_music', 'dial', 'ACTION_EDIT_CONTACT', 'ACTION_PICK', 'ACTION_VIEW_SENT_EMAILS']
"[""turn 1: Could you forward the brochure (file:///brochure.pdf) to marketing@business.net and title it 'New Product Brochure'? -> Brochure successfully forwarded to marketing@business.net."", ""turn 2: Create an event at Acropolis, Athens 105 58, Greece on July 10 from 9 AM to 11 AM titled Project Review with description Discuss quarterly goals -> Your event 'Project Review' has been added to July 10, 2023, 9:00 AM–11:00 AM at Acropolis, Athens 105\xa058, Greece. content://calendar/event/201"", ""turn 3: Email the details of the event 'Project Review' at Acropolis, Athens 105 58, Greece on July 10 from 9 AM to 11 AM with description Discuss quarterly goals to john.doe@company.com -> Email successfully sent to john.doe@company.com with the event details.""]"	Can I check that forwarded brochure in my sent emails?	Can I check file:///brochure.pdf in my sent emails?	{'plan': 'ACTION_VIEW_SENT_EMAILS', 'arguments': {}}	SWAP_T4_R1_S2_I000875-ACTION_VIEW_SENT_EMAILS-1	['dial', 'launch_application', 'ACTION_VIEW_SENT_EMAILS', 'ACTION_IMAGE_CAPTURE', 'ACTION_SET_RINGTONE']
"[""turn 1: Send an SMS to +55 21 99999-8888: the new promotional video link 'https://youtu.be/abc123'. -> Message successfully sent to +5521999998888."", 'turn 2: Please open documents of type PDF and text. I would like the option to select more than one file. -> All set! I’ve got your selections:\n• content://docs/report.pdf\n• content://docs/notes.txt', ""turn 3: Send content://docs/report.pdf and content://docs/notes.txt to Sarah in a text message saying 'Here are the files you requested.' -> Files sent to Sarah successfully.""]"	Let me check what I've sent recently.	Let me check what I've sent to +5521999998888 recently.	{'plan': 'ACTION_VIEW_SENT_MESSAGES', 'arguments': {}}	SWAP_T4_R1_S2_I000876-ACTION_VIEW_SENT_MESSAGES-1	['ACTION_OPEN_DOCUMENT', 'ACTION_INSERT_EVENT', 'ACTION_VIEW_SENT_EMAILS', 'launch_application', 'ACTION_VIEW_SENT_MESSAGES']
"[""turn 1: Could you please forward 'Project deadline extended to next Friday.' to Mike's number +1-303-555-0123? -> Message successfully sent to +1-303-555-0123."", 'turn 2: I need to select an image from my device for an upcoming editing session. -> On it! Opening your photo gallery picker—select the image you want to edit.', ""turn 3: Send the selected image to Cleo with the message 'Looking forward to editing this together.' -> Message sent to Clem. She'll be looking forward to editing, too.""]"	Show me the messages I sent to him	Show me the messages I sent to +1-303-555-0123	{'plan': 'ACTION_VIEW_SENT_MESSAGES', 'arguments': {}}	SWAP_T4_R1_S2_I000877-ACTION_VIEW_SENT_MESSAGES-1	['ACTION_SET_TIMER', 'get_contact_info', 'ACTION_OPEN_DOCUMENT', 'open_settings', 'ACTION_VIEW_SENT_MESSAGES']
"[""turn 1: Fire up Spotify and play 'Uptown Funk - Mark Ronson ft. Bruno Mars'. -> Launching Spotify and playing 'Uptown Funk - Mark Ronson ft. Bruno Mars'."", ""turn 2: Display my 'Workout Hits' playlist -> Here’s 'Workout Hits': Stronger; On Top of the World; Pump It; Remember the Name."", 'turn 3: Play Pump It -> Sure thing! Playing “Pump It” right now.']"	What tracks are in this playlist?	What tracks are in 'Uptown Funk - Mark Ronson ft. Bruno Mars' playlist?	{'plan': 'ACTION_VIEW_PLAYLIST', 'arguments': {'playlist_name': 'Uptown Funk - Mark Ronson ft. Bruno Mars'}}	SWAP_T4_R1_S2_I000878-ACTION_VIEW_PLAYLIST-1	['ACTION_SET_RINGTONE', 'ACTION_VIEW_PLAYLIST', 'ACTION_INSERT_CONTACT', 'get_contact_info_from_uri', 'launch_application']
"[""turn 1: Cue up Billie Holiday's 'Strange Fruit'. -> All set! Now playing 'Strange Fruit' by Billie Holiday."", ""turn 2: Open my 'Chill Vibes' playlist -> Launching Chill Vibes... Playlist 'Chill Vibes': Dreaming; Hazy Daze; Midnight Sun; Smooth Sailing."", 'turn 3: Play Midnight Sun -> Alright, now playing “Midnight Sun.”']"	What songs are in it?	What songs are in Billie Holiday's 'Strange Fruit'?	{'plan': 'ACTION_VIEW_PLAYLIST', 'arguments': {'playlist_name': 'Strange Fruit'}}	SWAP_T4_R1_S2_I000879-ACTION_VIEW_PLAYLIST-1	['get_contact_info_from_uri', 'ACTION_IMAGE_CAPTURE', 'ACTION_OPEN_DOCUMENT', 'ACTION_VIEW_SENT_MESSAGES', 'ACTION_VIEW_PLAYLIST']
"[""turn 1: I would like to hear 'Ave Maria' by Schubert. -> Absolutely—now playing 'Ave Maria' by Schubert."", ""turn 2: Let me see my 'Morning Motivation' playlist -> Opening Morning Motivation... Playlist 'Morning Motivation': Good Morning; Happy; Wake Me Up; Beautiful Day."", 'turn 3: Play Beautiful Day -> You got it—starting “Beautiful Day.”']"	Show the songs in it.	Show the songs in 'Ave Maria' by Schubert.	{'plan': 'ACTION_VIEW_PLAYLIST', 'arguments': {'playlist_name': 'Ave Maria'}}	SWAP_T4_R1_S2_I000880-ACTION_VIEW_PLAYLIST-1	['ACTION_VIEW_PLAYLIST', 'ACTION_VIEW_WEB_HISTORY', 'ACTION_VIEW_SENT_EMAILS', 'get_contact_info_from_uri', 'play_video']
"['turn 1: Launch Deezer and play track deezer:track:987654321. -> Opening Deezer and playing track deezer:track:987654321.', ""turn 2: View my 'Top 50' playlist -> Your Top 50 playlist is ready: Blinding Lights; Save Your Tears; Peaches; Montero (Call Me By Your Name)."", 'turn 3: Play Blinding Lights; Save Your Tears; Peaches; Montero (Call Me By Your Name) on Spotify -> Queuing Blinding Lights, Save Your Tears, Peaches, and Montero (Call Me By The Name) on Spotify now.']"	List the tracks in that playlist.	List the tracks in deezer:track:987654321 playlist.	{'plan': 'ACTION_VIEW_PLAYLIST', 'arguments': {'playlist_name': 'deezer:track:987654321'}}	SWAP_T4_R1_S2_I000881-ACTION_VIEW_PLAYLIST-1	['ACTION_GET_CONTENT', 'dial', 'ACTION_VIEW_RECENT_APPS', 'ACTION_VIEW_PLAYLIST', 'ACTION_EDIT_CONTACT']
"[""turn 1: Initiate playback of 'Hotel California - Eagles'. -> Sure thing—playing 'Hotel California' by Eagles now."", 'turn 2: Display my Recently Played playlist. -> Here’s your Recently Played playlist: Blinding Lights; Levitating; Uptown Funk; Drivers License.', 'turn 3: Play Drivers License -> Now playing “Drivers License.” Enjoy!']"	Can you list the songs on it?	Can you list the songs on 'Hotel California - Eagles'?	{'plan': 'ACTION_VIEW_PLAYLIST', 'arguments': {'playlist_name': 'Hotel California - Eagles'}}	SWAP_T4_R1_S2_I000882-ACTION_VIEW_PLAYLIST-1	['ACTION_SHOW_ALARMS', 'dial', 'ACTION_VIEW_PLAYLIST', 'ACTION_NAVIGATE_TO_LOCATION', 'ACTION_SET_ALARM']
['turn 1: Launch Microsoft Word, please. -> Microsoft Word is now open and ready for you.', 'turn 2: Display my recently used apps. -> Recent apps: Instagram; Twitter; TikTok; Spotify.', 'turn 3: Launch Twitter. -> Twitter launched successfully—dive into your feed!']	What other apps have I used after it?	What other apps have I used after Microsoft Word?	{'plan': 'ACTION_VIEW_RECENT_APPS', 'arguments': {}}	SWAP_T4_R1_S2_I000883-ACTION_VIEW_RECENT_APPS-1	['play_music', 'send_email', 'ACTION_IMAGE_CAPTURE', 'ACTION_VIEW_RECENT_APPS', 'ACTION_CREATE_DOCUMENT']
['turn 1: Open Microsoft Excel for some spreadsheet work. -> Microsoft Excel launched successfully. You can start editing your sheets.', 'turn 2: Show me the apps I opened in the last few uses. -> Just opened apps: Calculator; Notes; Weather; Clock.', 'turn 3: Open Clock. -> Clock is up and running—what time would you like to check or set?']	Can you show me apps I’ve opened since then?	Can you show me apps I’ve opened since Microsoft Excel launched successfully?	{'plan': 'ACTION_VIEW_RECENT_APPS', 'arguments': {}}	SWAP_T4_R1_S2_I000884-ACTION_VIEW_RECENT_APPS-1	['get_contact_info_from_uri', 'ACTION_IMAGE_CAPTURE', 'ACTION_EDIT_VIDEO', 'ACTION_EDIT_DOCUMENT', 'ACTION_VIEW_RECENT_APPS']
"['turn 1: Could you start PowerPoint? I have a presentation to review. -> Microsoft PowerPoint is up and running—ready for your presentation review!', ""turn 2: What other apps have I used after Microsoft Word? -> You've used these apps after Word: Outlook; Teams; OneNote; Edge."", 'turn 3: Open Edge. -> Microsoft Edge opened—ready to browse the web.']"	What have I opened recently besides it?	What have I opened recently besides Microsoft PowerPoint?	{'plan': 'ACTION_VIEW_RECENT_APPS', 'arguments': {}}	SWAP_T4_R1_S2_I000885-ACTION_VIEW_RECENT_APPS-1	['get_contact_info_from_uri', 'dial', 'ACTION_VIEW_RECENT_APPS', 'ACTION_EDIT_CONTACT', 'ACTION_IMAGE_CAPTURE']
"['turn 1: Please change my incoming call ringtone to the audio file at content://media/external/audio/media/45. -> All set! Your incoming call ringtone has been changed to the audio file at content://media/external/audio/media/45.', 'turn 2: Give me other tones besides content://storage/emulated/0/Notifications/snap.wav. -> No problem—here’s the ringtone selection. Tap on any sound to set it.', 'turn 3: Make content://storage/emulated/0/Notifications/snap.wav my incoming call tone -> Nice pick! ""snap.wav"" (content://storage/emulated/0/Notifications/snap.wav) is now your incoming call tone.']"	Can you show me some other ringtones besides that?	Can you show me some other ringtones besides content://media/external/audio/media/45?	{'plan': 'ACTION_GET_RINGTONE', 'arguments': {}}	SWAP_T4_R1_S2_I000886-ACTION_GET_RINGTONE-1	['INTENT_ACTION_STILL_IMAGE_CAMERA', 'ACTION_PICK', 'ACTION_SHOW_ALARMS', 'ACTION_GET_RINGTONE', 'get_contact_info']
"['turn 1: Could you update my phone’s ringtone using this URI? content://media/internal/audio/media/5 -> Done! Incoming call ringtone updated to content://media/internal/audio/media/5.', 'turn 2: Let me pick a different one instead of content://storage/emulated/0/Ringtones/vintage_tone.m4a. -> Got it! Opening up your ringtone list—just pick any other tone you like.', ""turn 3: I'd like to set content://storage/emulated/0/Ringtones/modern_beats.m4a as my ringtone -> modern_beats.m4a is set as your new ringtone—give it a listen!""]"	Let me browse other ringtones instead of that.	Let me browse other ringtones instead of content://media/internal/audio/media/5.	{'plan': 'ACTION_GET_RINGTONE', 'arguments': {}}	SWAP_T4_R1_S2_I000887-ACTION_GET_RINGTONE-1	['ACTION_EDIT_VIDEO', 'ACTION_VIEW_WEB_HISTORY', 'ACTION_GET_RINGTONE', 'ACTION_VIEW_PLAYLIST', 'ACTION_INSERT_EVENT']
"[""turn 1: Switch the default ringtone to the 'Harmony' track located in my Music folder: content://storage/emulated/0/Music/Harmony.mp3 -> Great choice! Your default ringtone is now 'Harmony' (content://storage/emulated/0/Music/Harmony.mp3)."", ""turn 2: I'd like to choose something different from content://storage/emulated/0/Music/ambient_loop.ogg. -> On it—bringing up the ringtone picker so you can browse other options."", ""turn 3: Switch to content://storage/emulated/0/Music/ocean_waves.ogg as my ringtone -> Your ringtone has been switched to 'ocean_waves.ogg'.""]"	I’d like to choose a different one than that.	I’d like to choose a different one than content://storage/emulated/0/Music/Harmony.mp3.	{'plan': 'ACTION_GET_RINGTONE', 'arguments': {}}	SWAP_T4_R1_S2_I000888-ACTION_GET_RINGTONE-1	['ACTION_GET_RINGTONE', 'play_music', 'ACTION_VIDEO_CAPTURE', 'ACTION_SHOW_TIMERS', 'ACTION_SHOW_ALARMS']
"['turn 1: Make my device ring with the clip at content://com.android.providers.media.documents/document/audio%3A24 when I get calls. -> Your ringtone has been switched to the clip at content://com.android.providers.media.documents/document/audio%3A24.', ""turn 2: content://storage/emulated/0/Ringtones/soft_chime.wav isn't what I want, pick another -> Selected ringtone: content://media/external/audio/media/157"", 'turn 3: Make content://media/external/audio/media/157 my default ringtone -> Your ringtone is now set to the selected file (ID 157).']"	Pick a new ringtone for me instead of that clip.	Pick a new ringtone for me instead of the clip at content://com.android.providers.media.documents/document/audio%3A24.	{'plan': 'ACTION_GET_RINGTONE', 'arguments': {}}	SWAP_T4_R1_S2_I000889-ACTION_GET_RINGTONE-1	['ACTION_SET_TIMER', 'ACTION_GET_RINGTONE', 'ACTION_EDIT_VIDEO', 'ACTION_EDIT_CONTACT', 'play_video']
['turn 1: Set the ringtone to the raw audio file stored here: content://media/external/raw/media/10. -> Success! The raw audio file at content://media/external/raw/media/10 is now your ringtone.', 'turn 2: Can you show me other options besides content://media/external/audio/media/305? -> Ringtone set to: content://media/external/audio/media/312', 'turn 3: Go ahead and set content://media/external/audio/media/312 as my ringtone -> Ringtone set successfully to media item #312.']	I want to select a different ringtone rather than that file.	I want to select a different ringtone rather than content://media/external/raw/media/10.	{'plan': 'ACTION_GET_RINGTONE', 'arguments': {}}	SWAP_T4_R1_S2_I000890-ACTION_GET_RINGTONE-1	['ACTION_VIEW_PLAYLIST', 'ACTION_PICK', 'ACTION_GET_RINGTONE', 'ACTION_VIEW_CONTACT', 'web_search']
"['turn 1: Assign content://media/internal/audio/media/21 as the default ringtone -> Ringtone changed successfully.', ""turn 2: I'd like to pick another ringtone. -> Sure thing—opening the ringtone selector so you can choose a new tone."", ""turn 3: Set content://com.android.externalstorage.documents/tree/primary%3ADownload%2Fring2.mp3 as my ringtone -> All set! Your ringtone is now set to 'ring2.mp3'.""]"	Actually, can I choose a different one than that?	Actually, can I choose a different one than content://media/internal/audio/media/21?	{'plan': 'ACTION_GET_RINGTONE', 'arguments': {}}	SWAP_T4_R1_S2_I000891-ACTION_GET_RINGTONE-1	['ACTION_VIEW_CALL_LOG', 'get_contact_info_from_uri', 'ACTION_GET_RINGTONE', 'ACTION_SET_RINGTONE', 'ACTION_VIEW_PLAYLIST']
"['turn 1: Change ringtone to the audio document content://com.android.providers.media.documents/document/audio%3A25 -> Default ringtone updated!', 'turn 2: I want to change content://media/internal/audio/media/30 again. -> No problem! Let’s browse your ringtone list—please pick your next ringtone.', ""turn 3: Let's set content://media/internal/audio/media/30 as my ringtone -> Done! Ringtone updated to media file #30.""]"	Can I pick another one instead of that?	Can I pick another one instead of content://com.android.providers.media.documents/document/audio%3A25?	{'plan': 'ACTION_GET_RINGTONE', 'arguments': {}}	SWAP_T4_R1_S2_I000892-ACTION_GET_RINGTONE-1	['ACTION_GET_RINGTONE', 'ACTION_EDIT_VIDEO', 'play_video', 'ACTION_CREATE_DOCUMENT', 'search_location']
"[""turn 1: I'd like to hear the track at content://com.android.providers.media.documents/document/audio%3A26 for calls -> All done! Your phone will ring with that track."", 'turn 2: Let me browse other tones. -> Alright, feel free to explore—opening the ringtone menu now.', 'turn 3: Use content://storage/emulated/0/Notifications/alert.flac as my ringtone -> alert.flac is now set as your incoming call ringtone. Enjoy!']"	Can you show me options other than that?	Can you show me options other than content://com.android.providers.media.documents/document/audio%3A26?	{'plan': 'ACTION_GET_RINGTONE', 'arguments': {}}	SWAP_T4_R1_S2_I000893-ACTION_GET_RINGTONE-1	['ACTION_GET_RINGTONE', 'ACTION_OPEN_DOCUMENT', 'send_email', 'ACTION_VIDEO_CAPTURE', 'ACTION_NAVIGATE_TO_LOCATION']
"['turn 1: Make content://storage/emulated/0/Ringtones/vintage_tone.m4a my ringtone -> Vintage tone is now set as your default ringtone.', 'turn 2: Can I pick another one instead of content://com.android.providers.media.documents/document/audio%3A25? -> Sure thing! Let me open the ringtone picker so you can choose one.', ""turn 3: Use content://storage/emulated/0/Ringtones/uptown_funk.mp3 as my ringtone -> Your ringtone has been changed to 'uptown_funk.mp3'.""]"	Let me pick a different one instead of it.	Let me pick a different one instead of content://storage/emulated/0/Ringtones/vintage_tone.m4a.	{'plan': 'ACTION_GET_RINGTONE', 'arguments': {}}	SWAP_T4_R1_S2_I000894-ACTION_GET_RINGTONE-1	['ACTION_GET_RINGTONE', 'ACTION_VIEW_CALL_LOG', 'ACTION_NAVIGATE_TO_LOCATION', 'ACTION_SET_ALARM', 'ACTION_GET_CONTENT']
