conversation_history	query	rewrited_query	answer	unique_idx	candidates
"[""turn 1: Create an MP3 audio named podcast_episode.mp3. -> Podcast 'podcast_episode.mp3' is now available here: content://documents/podcast_episode.mp3"", ""turn 2: I'm looking to attach documents in both PDF and plain text formats; let me pick multiple files. -> Opening the file chooser for PDFs and text files. You can select multiple documents."", ""turn 3: Create a new PDF document named AttachedFile.pdf. -> New PDF 'AttachedFile.pdf' created at content://documents/AttachedFile.pdf. You can attach it whenever you’re ready.""]"	Play that podcast.	Play content://documents/podcast_episode.mp3 podcast.	{'plan': 'ACTION_OPEN_CONTENT', 'arguments': {'uri': 'content://documents/podcast_episode.mp3', 'mime_type': 'audio/mpeg'}}	SWAP_T4_R1_S2_I000482-ACTION_OPEN_CONTENT-1	['ACTION_VIEW_CALL_LOG', 'ACTION_INSERT_CONTACT', 'ACTION_VIEW_SENT_EMAILS', 'ACTION_OPEN_CONTENT', 'ACTION_SET_ALARM']
"[""turn 1: Create a ZIP archive with the filename archive.zip. -> Archive 'archive.zip' created successfully. Download it here: content://archives/archive.zip"", 'turn 2: Select a video to attach. -> Opening your video gallery—please tap a clip to attach.', ""turn 3: Create a video clip as a text file named ClipNotes.txt -> Your file 'ClipNotes.txt' has been created at content://documents/ClipNotes.txt.""]"	Open the archive.	Open content://archives/archive.zip.	{'plan': 'ACTION_OPEN_CONTENT', 'arguments': {'uri': 'content://archives/archive.zip', 'mime_type': 'application/zip'}}	SWAP_T4_R1_S2_I000483-ACTION_OPEN_CONTENT-1	['ACTION_SET_RINGTONE', 'ACTION_VIEW_RECENT_APPS', 'ACTION_IMAGE_CAPTURE', 'ACTION_OPEN_CONTENT', 'ACTION_VIEW_WEB_HISTORY']
"[""turn 1: Could you create an EPUB ebook named ebook.epub? -> Ebook 'ebook.epub' has been generated. You can get it at content://ebooks/ebook.epub"", 'turn 2: I want to use the document picker to select a PDF for some editing tasks. -> Opening the PDF document picker now. Please choose a file to edit.', ""turn 3: If no PDF is found, create one named NewDraft.pdf. -> All set! New PDF 'NewDraft.pdf' has been created at content://documents/NewDraft.pdf. Let me know when you'd like to edit it.""]"	Open that ebook.	Open content://ebooks/ebook.epub ebook.	{'plan': 'ACTION_OPEN_CONTENT', 'arguments': {'uri': 'content://ebooks/ebook.epub', 'mime_type': 'application/epub+zip'}}	SWAP_T4_R1_S2_I000484-ACTION_OPEN_CONTENT-1	['ACTION_GET_CONTENT', 'ACTION_SET_ALARM', 'dial', 'get_contact_info', 'ACTION_OPEN_CONTENT']
"[""turn 1: Please set up an MP4 video file called intro_video.mp4. -> Intro video 'intro_video.mp4' created successfully. Find it at content://videos/intro_video.mp4"", 'turn 2: Launch the file selector to choose an image file from my photos. -> Launching the image file selector—pick one image from your photos.', ""turn 3: If that image isn't in my photos, create a new one named Photo1.jpg. -> Couldn't find that image, so I made one for you: 'Photo1.jpg' at content://documents/Photo1.jpg. Feel free to view or edit it.""]"	Show me that video.	Show me content://videos/intro_video.mp4.	{'plan': 'ACTION_OPEN_CONTENT', 'arguments': {'uri': 'content://videos/intro_video.mp4', 'mime_type': 'video/mp4'}}	SWAP_T4_R1_S2_I000485-ACTION_OPEN_CONTENT-1	['ACTION_OPEN_CONTENT', 'ACTION_VIEW_SENT_EMAILS', 'ACTION_VIEW_RECENT_APPS', 'ACTION_GET_RINGTONE', 'ACTION_GET_CONTENT']
"[""turn 1: Kindly create an Excel spreadsheet titled Budget.xlsx. -> Your new spreadsheet 'Budget.xlsx' has been created. You can access it here: content://documents/Budget.xlsx"", 'turn 2: Pick the most recent photo from my camera roll -> Here’s your latest photo: content://temp/IMG_20240605_153210.jpg', ""turn 3: Save content://temp/IMG_20240605_153210.jpg as a PDF named RecentPhoto.pdf -> Done—your PDF 'RecentPhoto.pdf' is now available at content://documents/RecentPhoto.pdf.""]"	Show it to me	Show content://documents/Budget.xlsx to me	{'plan': 'ACTION_OPEN_CONTENT', 'arguments': {'uri': 'content://documents/Budget.xlsx', 'mime_type': 'application/vnd.openxmlformats-officedocument.spreadsheetml.sheet'}}	SWAP_T4_R1_S2_I000486-ACTION_OPEN_CONTENT-1	['ACTION_OPEN_CONTENT', 'ACTION_VIEW_SENT_EMAILS', 'ACTION_EDIT_VIDEO', 'play_music', 'ACTION_CREATE_DOCUMENT']
"[""turn 1: Generate a GIF animation file named animation.gif. -> All set! Your GIF 'animation.gif' is ready at content://documents/animation.gif"", 'turn 2: Provide a file selection for multiple images; I need to choose several. -> Okay, opening the image picker—select the pictures you need.', ""turn 3: If there aren’t any images, create one named GalleryPic1.jpg. -> No images were found—so I created 'GalleryPic1.jpg' at content://documents/GalleryPic1.jpg. You can view it right away.""]"	Play it now	Play content://documents/animation.gif now	{'plan': 'ACTION_OPEN_CONTENT', 'arguments': {'uri': 'content://documents/animation.gif', 'mime_type': 'image/gif'}}	SWAP_T4_R1_S2_I000487-ACTION_OPEN_CONTENT-1	['web_search', 'ACTION_OPEN_CONTENT', 'dial', 'send_email', 'ACTION_SHOW_ALARMS']
"[""turn 1: Can you create an SVG diagram file called diagram.svg? -> Done creating 'diagram.svg'. You can find it here: content://documents/diagram.svg"", 'turn 2: Open a plain text file from my documents — just one file, please. -> Opening the plain text document picker—please select one file.', ""turn 3: Okay, let's create a new plain text file and name it Draft.txt. -> Got it—your new text file 'Draft.txt' is ready at content://documents/Draft.txt. Start typing whenever you like.""]"	Please view it	Please view content://documents/diagram.svg	{'plan': 'ACTION_OPEN_CONTENT', 'arguments': {'uri': 'content://documents/diagram.svg', 'mime_type': 'image/svg+xml'}}	SWAP_T4_R1_S2_I000488-ACTION_OPEN_CONTENT-1	['ACTION_SET_RINGTONE', 'ACTION_INSERT_EVENT', 'ACTION_VIEW_SENT_MESSAGES', 'ACTION_EDIT_ALARM', 'ACTION_OPEN_CONTENT']
"[""turn 1: Please create a BMP image named canvas.bmp. -> Your BMP image 'canvas.bmp' has been saved. Access it via content://documents/canvas.bmp"", 'turn 2: I want to choose one PDF document for permanent access. Please open the file chooser. -> Opening the PDF-only picker. Choose a single PDF document for permanent access.', ""turn 3: Alright, let's make a new PDF document for permanent access and call it Report.pdf. -> Your permanent PDF 'Report.pdf' has been created at content://documents/Report.pdf. It’s saved and ready for long‑term access.""]"	Show me that image	Show me content://documents/canvas.bmp	{'plan': 'ACTION_OPEN_CONTENT', 'arguments': {'uri': 'content://documents/canvas.bmp', 'mime_type': 'image/bmp'}}	SWAP_T4_R1_S2_I000489-ACTION_OPEN_CONTENT-1	['ACTION_GET_CONTENT', 'ACTION_VIEW_SENT_MESSAGES', 'ACTION_OPEN_CONTENT', 'ACTION_PICK', 'ACTION_VIEW_CONTACT']
"[""turn 1: I want a WAV audio file titled audio_sample.wav. -> I've created your WAV file 'audio_sample.wav'. You can open it at content://documents/audio_sample.wav"", 'turn 2: Could I select one image only? I just need access to a single image document. -> Launching the image document picker—please select one image.', ""turn 3: Great, create a new one of launching the image document picker and name it Picture.jpg. -> New image file 'Picture.jpg' created at content://documents/Picture.jpg. Let me know if you’d like to open it.""]"	Play it	Play content://documents/audio_sample.wav	{'plan': 'ACTION_OPEN_CONTENT', 'arguments': {'uri': 'content://documents/audio_sample.wav', 'mime_type': 'audio/wav'}}	SWAP_T4_R1_S2_I000490-ACTION_OPEN_CONTENT-1	['ACTION_VIEW_EVENT', 'ACTION_SET_TIMER', 'ACTION_VIEW_SENT_EMAILS', 'ACTION_OPEN_CONTENT', 'play_video']
"['turn 1: Please pick multiple ZIP archives from local storage. -> Sure thing! Here are the ZIP archives you selected:\n- content://downloads/backups/backup_jan.zip\n- content://downloads/backups/backup_feb.zip', 'turn 2: Please allow me to choose a single PDF file from my list; one is enough. -> Opening the PDF file chooser—select a single PDF document.', ""turn 3: Sure, create a new PDF and call it Invoice.pdf. -> All done! Your PDF 'Invoice.pdf' is created at content://documents/Invoice.pdf. You can review it anytime.""]"	Open the second one	Open content://downloads/backups/backup_feb.zip	{'plan': 'ACTION_OPEN_CONTENT', 'arguments': {'uri': 'content://downloads/backups/backup_feb.zip', 'mime_type': 'application/zip'}}	SWAP_T4_R1_S2_I000491-ACTION_OPEN_CONTENT-1	['ACTION_OPEN_CONTENT', 'play_music', 'ACTION_VIEW_SENT_EMAILS', 'get_contact_info', 'INTENT_ACTION_VIDEO_CAMERA']
"['turn 1: Open a single HTML file for editing. -> One HTML file ready for editing:\n- content://documents/webpage/index.html', ""turn 2: I'm selecting multiple images. Help me pick several image files at once. -> Absolutely! Launching your gallery so you can multi-select the images you want."", ""turn 3: Could you make a new image file in the gallery named VacationCollage.jpg -> Voilà—your new gallery image 'VacationCollage.jpg' is ready at content://documents/VacationCollage.jpg. Enjoy!""]"	Open it for editing	Open content://documents/webpage/index.html for editing	{'plan': 'ACTION_OPEN_CONTENT', 'arguments': {'uri': 'content://documents/webpage/index.html', 'mime_type': 'text/html'}}	SWAP_T4_R1_S2_I000492-ACTION_OPEN_CONTENT-1	['ACTION_VIEW_RECENT_APPS', 'ACTION_CREATE_DOCUMENT', 'open_settings', 'ACTION_GET_RINGTONE', 'ACTION_OPEN_CONTENT']
"[""turn 1: Choose a PDF brochure and a TIFF image. -> Here's what you picked:\n- content://docs/brochure/spring_event.pdf\n- content://images/events/banner.tiff"", ""turn 2: Help me pick a single plain text document from my storage. -> Certainly. Here's the file browser for text documents—pick the one you’d like."", ""turn 3: If none of the text documents from my storage work, create one named MeetingNotes.txt. -> New document 'MeetingNotes.txt' is ready at content://documents/MeetingNotes.txt. You can now jot down your meeting notes.""]"	Open the second one	Open content://images/events/banner.tiff	{'plan': 'ACTION_OPEN_CONTENT', 'arguments': {'uri': 'content://images/events/banner.tiff', 'mime_type': 'image/tiff'}}	SWAP_T4_R1_S2_I000493-ACTION_OPEN_CONTENT-1	['ACTION_SET_TIMER', 'ACTION_EDIT_ALARM', 'ACTION_OPEN_CONTENT', 'ACTION_VIEW_WEB_HISTORY', 'ACTION_INSERT_EVENT']
"[""turn 1: I need to pick one image file from my gallery. -> All set! Here's the image you chose: content://temp/DCIM/Camera/IMG_20230815_123456.jpg"", 'turn 2: I need to select documents in both text and PDF formats. I plan to pick more than one file; please enable multiple selections. -> Multiple-document selector: files chosen are\n– content://storage/docs/meeting.txt\n– content://storage/docs/summary.pdf', 'turn 3: Create a new PDF from content://storage/docs/summary.pdf named CombinedSummary.pdf -> Created a fresh PDF named CombinedSummary.pdf at content://documents/CombinedSummary.pdf. Feel free to update or merge content.']"	Show me that image	Show me content://temp/DCIM/Camera/IMG_20230815_123456.jpg	{'plan': 'ACTION_OPEN_CONTENT', 'arguments': {'uri': 'content://temp/DCIM/Camera/IMG_20230815_123456.jpg', 'mime_type': 'image/jpeg'}}	SWAP_T4_R1_S2_I000494-ACTION_OPEN_CONTENT-1	['get_contact_info', 'ACTION_OPEN_CONTENT', 'dial', 'ACTION_VIEW_PLAYLIST', 'ACTION_INSERT_EVENT']
"['turn 1: Open the ringtone browser so I can pick one for notifications. -> Ringtone selected: content://media/ringtone/alarm_classic.mp3', ""turn 2: I'm looking for image files to attach to my report. Could you let me choose multiple images? -> All good! Two images ready for you:\n• content://images/img001.jpg\n• content://images/img002.png"", ""turn 3: Create a new text document to list content://images/img001.jpg and content://images/img002.png called ImageList.txt -> Here’s your new text file 'ImageList.txt': content://documents/ImageList.txt. You can now paste in the image URIs.""]"	Play it for me.	Play content://media/ringtone/alarm_classic.mp3 for me.	{'plan': 'ACTION_OPEN_CONTENT', 'arguments': {'uri': 'content://media/ringtone/alarm_classic.mp3'}}	SWAP_T4_R1_S2_I000495-ACTION_OPEN_CONTENT-1	['ACTION_NAVIGATE_TO_LOCATION', 'ACTION_OPEN_CONTENT', 'ACTION_EDIT_DOCUMENT', 'play_video', 'INTENT_ACTION_STILL_IMAGE_CAMERA']
"['turn 1: Provide me with the option to select a notification tone. -> Notification tone chosen: content://media/ringtone/modern_beats.mp3', ""turn 2: Can you open an image file for me? I'm looking for persistent access to it. -> Image loaded for long‑term access: content://pictures/favorites/photo123.png"", ""turn 3: Create a new image file for editing content://pictures/favorites/photo123.png called photo123_edited.png -> Your new PNG 'photo123_edited.png' is set up at content://images/photo123_edited.png. Go ahead and apply your edits.""]"	Preview it.	Preview content://media/ringtone/modern_beats.mp3.	{'plan': 'ACTION_OPEN_CONTENT', 'arguments': {'uri': 'content://media/ringtone/modern_beats.mp3'}}	SWAP_T4_R1_S2_I000496-ACTION_OPEN_CONTENT-1	['ACTION_INSERT_EVENT', 'ACTION_EDIT_DOCUMENT', 'open_settings', 'ACTION_SHOW_TIMERS', 'ACTION_OPEN_CONTENT']
"['turn 1: I want to capture an image and store it at content://app.images/captured/selfie.jpg -> Got it—camera is launching. Your selfie will be saved to content://app.images/captured/selfie.jpg.', 'turn 2: Let me access a TXT document for long-term management from my device. -> Alright, launching the document browser so you can select a text file (.txt) for long-term access.', ""turn 3: Just create a new one named LongTermNotes.txt. -> All set! New text document 'LongTermNotes.txt' created at content://documents/LongTermNotes.txt for your ongoing notes.""]"	Show me that selfie	Show me content://app.images/captured/selfie.jpg	{'plan': 'ACTION_OPEN_CONTENT', 'arguments': {'uri': 'content://app.images/captured/selfie.jpg'}}	SWAP_T4_R1_S2_I000497-ACTION_OPEN_CONTENT-1	['ACTION_OPEN_DOCUMENT', 'play_video', 'INTENT_ACTION_STILL_IMAGE_CAMERA', 'web_search', 'ACTION_OPEN_CONTENT']
"['turn 1: Capture a document scan and save to content://media/external/images/doc_scan.png -> Understood. Launching camera to scan the document and save it at content://media/external/images/doc_scan.png.', 'turn 2: I need to retrieve a PDF document from my cloud storage. Let me pick one file, please. -> On it—opening the PDF selector. Please pick the file from your cloud storage.', ""turn 3: Create a new file from the PDF selector called NewCloudReport.pdf. -> New PDF 'NewCloudReport.pdf' has been created at content://documents/NewCloudReport.pdf. You can now upload or edit it.""]"	Open that scan	Open content://media/external/images/doc_scan.png	{'plan': 'ACTION_OPEN_CONTENT', 'arguments': {'uri': 'content://media/external/images/doc_scan.png'}}	SWAP_T4_R1_S2_I000498-ACTION_OPEN_CONTENT-1	['ACTION_GET_RINGTONE', 'ACTION_VIEW_SENT_EMAILS', 'ACTION_SET_TIMER', 'ACTION_OPEN_CONTENT', 'ACTION_INSERT_CONTACT']
"['turn 1: Please photograph this scenery and save it at content://com.myapp/photos/trip_pic1.jpg -> Here we go—camera is open. I’ll store the shot at content://com.myapp/photos/trip_pic1.jpg.', 'turn 2: Could you let me pick a single text file from my device? -> Sure—opening your text files. Pick one to proceed.', ""turn 3: Alright, let's make a new text file called Notes.txt. -> Done—'Notes.txt' has been created at content://documents/Notes.txt. Ready when you are to start typing.""]"	Let me view that scenery shot.	Let me view content://com.myapp/photos/trip_pic1.jpg scenery shot.	{'plan': 'ACTION_OPEN_CONTENT', 'arguments': {'uri': 'content://com.myapp/photos/trip_pic1.jpg'}}	SWAP_T4_R1_S2_I000499-ACTION_OPEN_CONTENT-1	['ACTION_VIEW_SENT_MESSAGES', 'ACTION_VIEW_PLAYLIST', 'INTENT_ACTION_VIDEO_CAMERA', 'ACTION_OPEN_CONTENT', 'ACTION_INSERT_EVENT']
"['turn 1: Take a selfie and save into content://storage/emulated/0/Pictures/selfportrait.jpg -> Smile! Camera is opening. Your selfie will go to content://storage/emulated/0/Pictures/selfportrait.jpg.', 'turn 2: From my device, I want to open a single image file for persistent use. -> Alright, opening your images—please select one file for ongoing use.', ""turn 3: Since there's no suitable image, create a new one named Photo.png. -> No image matched your needs, so 'Photo.png' has been created: content://images/Photo.png. You can now add your own picture.""]"	I'd like to see that selfie.	I'd like to see content://storage/emulated/0/Pictures/selfportrait.jpg.	{'plan': 'ACTION_OPEN_CONTENT', 'arguments': {'uri': 'content://storage/emulated/0/Pictures/selfportrait.jpg'}}	SWAP_T4_R1_S2_I000500-ACTION_OPEN_CONTENT-1	['search_location', 'open_settings', 'ACTION_VIEW_EVENT', 'ACTION_OPEN_CONTENT', 'get_contact_info']
"['turn 1: Record a photo and store it at content://user.uploads/profiles/portrait.png -> Got it! Your portrait has been snapped and saved to content://user.uploads/profiles/portrait.png.', 'turn 2: I want to select one document that is in text format. Open my document picker. -> No problem—launching the text document picker. Go ahead and pick the file you’d like.', ""turn 3: If none are available, create a new text document named Diary.txt -> Got it. Created a new text document named 'Diary.txt': content://documents/Diary.txt""]"	Preview it	Preview content://user.uploads/profiles/portrait.png	{'plan': 'ACTION_OPEN_CONTENT', 'arguments': {'uri': 'content://user.uploads/profiles/portrait.png'}}	SWAP_T4_R1_S2_I000501-ACTION_OPEN_CONTENT-1	['ACTION_INSERT_EVENT', 'ACTION_VIEW_CONTACT', 'ACTION_GET_RINGTONE', 'get_contact_info', 'ACTION_OPEN_CONTENT']
"['turn 1: Can you please take a snapshot and save to content://files/mydocs/invoice.jpg? -> Snapshot captured successfully and stored at content://files/mydocs/invoice.jpg.', 'turn 2: Could you please provide a way to select my PDF file? -> Certainly—opening the PDF picker now. Please choose your file.', ""turn 3: If I don't see my PDF file, create a new PDF document named Report.pdf -> All set—your PDF 'Report.pdf' is now available at content://documents/Report.pdf.""]"	Open it for me	Open content://files/mydocs/invoice.jpg for me	{'plan': 'ACTION_OPEN_CONTENT', 'arguments': {'uri': 'content://files/mydocs/invoice.jpg'}}	SWAP_T4_R1_S2_I000502-ACTION_OPEN_CONTENT-1	['ACTION_SHOW_ALARMS', 'play_video', 'ACTION_OPEN_DOCUMENT', 'ACTION_OPEN_CONTENT', 'INTENT_ACTION_STILL_IMAGE_CAMERA']
"[""turn 1: Kindly create an Excel spreadsheet titled Budget.xlsx. -> Your new spreadsheet 'Budget.xlsx' has been created. You can access it here: content://documents/Budget.xlsx"", 'turn 2: Choose the image I just snapped -> Selected the photo you just took: content://temp/IMG_20240605_161230.jpg', ""turn 3: Create a new text document named ImageRecord.txt to note content://temp/IMG_20240605_161230.jpg -> Nice! I’ve created 'ImageRecord.txt'. You can find it at content://documents/ImageRecord.txt.""]"	Email it to finance@company.com with a quick note summarizing the budget.	Email content://documents/Budget.xlsx to finance@company.com with a quick note summarizing the budget.	{'plan': 'send_email', 'arguments': {'to': 'finance@company.com', 'body': 'Here is a quick summary of the budget.', 'attachments': ['content://documents/Budget.xlsx']}}	SWAP_T4_R1_S2_I000503-send_email-1	['ACTION_VIEW_CONTACT', 'ACTION_VIEW_EVENT', 'ACTION_VIEW_WEB_HISTORY', 'send_email', 'dial']
"[""turn 1: Generate a GIF animation file named animation.gif. -> All set! Your GIF 'animation.gif' is ready at content://documents/animation.gif"", 'turn 2: Choose multiple videos from my camera roll -> Opening video gallery—pick the clips you need.', ""turn 3: Put the clips from my camera roll into a new document named VideosArchive.zip. -> All set—your archive 'VideosArchive.zip' has been created at content://archives/VideosArchive.zip.""]"	Send that to design@company.com with the subject 'New animation feedback'.	Send content://documents/animation.gif to design@company.com with the subject 'New animation feedback'.	{'plan': 'send_email', 'arguments': {'to': 'design@company.com', 'subject': 'New animation feedback', 'attachments': ['content://documents/animation.gif']}}	SWAP_T4_R1_S2_I000504-send_email-1	['ACTION_GET_CONTENT', 'ACTION_NAVIGATE_TO_LOCATION', 'send_email', 'ACTION_EDIT_ALARM', 'ACTION_VIEW_SENT_EMAILS']
"[""turn 1: Can you help me edit the contact content://contacts/people/mary_bell? I want to add her work email mary@bellcorp.com. -> Got it, launching Mary's contact. You can add her work email mary@bellcorp.com right away."", 'turn 2: Help me bring up a file picker to choose multiple plain text documents for review. -> Opening the document picker—select one or more plain text files.', ""turn 3: Create a new plain text document named ReviewNotes.txt. -> Done! Text file 'ReviewNotes.txt' created at content://documents/ReviewNotes.txt. You can start adding your review notes now.""]"	Email her a welcome note about our upcoming call.	Email mary@bellcorp.com a welcome note about our upcoming call.	{'plan': 'send_email', 'arguments': {'to': 'mary@bellcorp.com', 'body': 'a welcome note about our upcoming call.'}}	SWAP_T4_R1_S2_I000505-send_email-1	['send_email', 'ACTION_GET_RINGTONE', 'ACTION_EDIT_ALARM', 'ACTION_VIEW_EVENT', 'send_message']
"['turn 1: I need to pick a single PDF file from my device for review. -> Please select a PDF document for review.', 'turn 2: I want to use the document picker to select a PDF for some editing tasks. -> Opening the PDF document picker now. Please choose a file to edit.', ""turn 3: If no PDF is found, create one named NewDraft.pdf. -> All set! New PDF 'NewDraft.pdf' has been created at content://documents/NewDraft.pdf. Let me know when you'd like to edit it.""]"	Email it to reviewer@example.com with subject 'Review PDF' and body 'Please take a look at this PDF and let me know your feedback.'	Email the PDF document for review to reviewer@example.com with subject 'Review PDF' and body 'Please take a look at this PDF and let me know your feedback.'	{'plan': 'send_email', 'arguments': {'to': 'reviewer@example.com', 'subject': 'Review PDF', 'body': 'Please take a look at this PDF and let me know your feedback.'}}	SWAP_T4_R1_S2_I000506-send_email-1	['open_settings', 'send_email', 'ACTION_SHOW_ALARMS', 'launch_application', 'ACTION_EDIT_CONTACT']
"['turn 1: Open a single PNG or JPEG image for editing in the app. -> Choose a PNG or JPEG image to edit.', ""turn 2: I'm looking to attach documents in both PDF and plain text formats; let me pick multiple files. -> Opening the file chooser for PDFs and text files. You can select multiple documents."", ""turn 3: Create a new PDF document named AttachedFile.pdf. -> New PDF 'AttachedFile.pdf' created at content://documents/AttachedFile.pdf. You can attach it whenever you’re ready.""]"	Email it to creative@example.com with subject 'Logo' and body 'Here's the image for editing.'	Email a PNG or JPEG image to creative@example.com with subject 'Logo' and body 'Here's the image for editing.'	"{'plan': 'send_email', 'arguments': {'to': 'creative@example.com', 'subject': 'Logo', 'body': ""Here's the image for editing.""}}"	SWAP_T4_R1_S2_I000507-send_email-1	['get_contact_info_from_uri', 'ACTION_SHOW_TIMERS', 'send_email', 'play_music', 'ACTION_OPEN_CONTENT']
"['turn 1: Let me pick an MP3 from my music library. -> Opening your music library—please select the MP3 file you’d like.', 'turn 2: Provide a file selection for multiple images; I need to choose several. -> Okay, opening the image picker—select the pictures you need.', ""turn 3: If there aren’t any images, create one named GalleryPic1.jpg. -> No images were found—so I created 'GalleryPic1.jpg' at content://documents/GalleryPic1.jpg. You can view it right away.""]"	Email it to jane@domain.com	Email the MP3 file from my music library to jane@domain.com	{'plan': 'send_email', 'arguments': {'to': 'jane@domain.com'}}	SWAP_T4_R1_S2_I000508-send_email-1	['ACTION_VIEW_WEB_HISTORY', 'ACTION_OPEN_CONTENT', 'ACTION_SHOW_TIMERS', 'send_email', 'ACTION_OPEN_DOCUMENT']
"['turn 1: Could you let me choose multiple text files for batch processing? -> Sure thing! Select all the text files you want to include.', 'turn 2: I want to choose one PDF document for permanent access. Please open the file chooser. -> Opening the PDF-only picker. Choose a single PDF document for permanent access.', ""turn 3: Alright, let's make a new PDF document for permanent access and call it Report.pdf. -> Your permanent PDF 'Report.pdf' has been created at content://documents/Report.pdf. It’s saved and ready for long‑term access.""]"	Email them to editor@company.com	Email all the text files you want to include to editor@company.com	{'plan': 'send_email', 'arguments': {'to': 'editor@company.com'}}	SWAP_T4_R1_S2_I000509-send_email-1	['ACTION_VIEW_RECENT_APPS', 'send_email', 'ACTION_NAVIGATE_TO_LOCATION', 'ACTION_VIEW_CALL_LOG', 'web_search']
"['turn 1: Please open the PDF located at content://documents/report2023.pdf -> Sure, opening your PDF now: content://documents/report2023.pdf.', 'turn 2: Open a plain text file from my documents — just one file, please. -> Opening the plain text document picker—please select one file.', ""turn 3: Okay, let's create a new plain text file and name it Draft.txt. -> Got it—your new text file 'Draft.txt' is ready at content://documents/Draft.txt. Start typing whenever you like.""]"	Email it to sarah@example.com with 'I reviewed the report' in the body	Email content://documents/report2023.pdf to sarah@example.com with 'I reviewed the report' in the body	{'plan': 'send_email', 'arguments': {'to': 'sarah@example.com', 'body': 'I reviewed the report', 'attachments': ['content://documents/report2023.pdf']}}	SWAP_T4_R1_S2_I000510-send_email-1	['play_music', 'ACTION_VIEW_RECENT_APPS', 'send_email', 'ACTION_VIEW_CALL_LOG', 'ACTION_SHOW_ALARMS']
