conversation_history	query	rewrited_query	answer	unique_idx	candidates
"[""turn 1: I need Jean-Luc Picard's contact saved: picard@starfleet.com. -> Jean‑Luc Picard’s contact has been created: content://contacts/people/jean_luc_picard"", 'turn 2: Call +18005550000 now -> Dialing +18005550000 now...', ""turn 3: Add +18005550000 to my contacts -> Got it. I've saved +18005550000 as a new contact. You can find it here: content://contacts/people/101""]"	Show me his full contact profile	Show me content://contacts/people/jean_luc_picard's full contact profile	{'plan': 'ACTION_VIEW_CONTACT', 'arguments': {'contact_uri': 'content://contacts/people/jean_luc_picard'}}	SWAP_T4_R1_S2_I000593-ACTION_VIEW_CONTACT-1	['ACTION_EDIT_DOCUMENT', 'ACTION_SET_TIMER', 'ACTION_VIEW_CONTACT', 'open_settings', 'ACTION_VIEW_WEB_HISTORY']
"[""turn 1: I'd like to save Bob Johnson's contact with email bob@example.com. -> content://contacts/people/bob_johnson"", ""turn 2: Return Leo +1-305-555-0199's call -> Dialing +1-305-555-0199..."", ""turn 3: Save +1-305-555-0199 -> I've created a contact for +1-305-555-0199. Reference: content://contacts/people/103""]"	View it	View content://contacts/people/bob_johnson	{'plan': 'ACTION_VIEW_CONTACT', 'arguments': {'contact_uri': 'content://contacts/people/bob_johnson'}}	SWAP_T4_R1_S2_I000594-ACTION_VIEW_CONTACT-1	['ACTION_VIEW_CONTACT', 'ACTION_SET_TIMER', 'ACTION_OPEN_DOCUMENT', 'play_music', 'ACTION_SHOW_TIMERS']
"['turn 1: Create contact for Charlie Brown with phone number 321-9876, email charlie.brown@example.com, and address 100 Peanuts Lane. -> content://contacts/people/charlie_brown', 'turn 2: Call Bob (+1-202-555-0147) now -> Starting call to +1-202-555-0147...', ""turn 3: Create a contact for Bob (+1-202-555-0147) -> Bob's contact has been created. Find it at content://contacts/people/107""]"	Display his contact information	Display content://contacts/people/charlie_brown contact information	{'plan': 'ACTION_VIEW_CONTACT', 'arguments': {'contact_uri': 'content://contacts/people/charlie_brown'}}	SWAP_T4_R1_S2_I000595-ACTION_VIEW_CONTACT-1	['ACTION_VIEW_SENT_MESSAGES', 'ACTION_EDIT_VIDEO', 'launch_application', 'search_location', 'ACTION_VIEW_CONTACT']
"['turn 1: Insert a contact with name Diana Prince, phone: (212) 555-0198, email: diana@amazon.com, address: 123 Themyscira Ln. -> content://contacts/people/diana_prince', ""turn 2: Store 888 777 6666 in my contacts. -> Great, I've added 888 777 6666 to your contacts. (content://contacts/people/8887776666)"", 'turn 3: Let me see an email from my contact list. -> Absolutely—opening the email picker. Go ahead and select the email you want… You picked: content://contacts/email/8']"	Open her contact profile	Open content://contacts/people/diana_prince contact profile	{'plan': 'ACTION_VIEW_CONTACT', 'arguments': {'contact_uri': 'content://contacts/people/diana_prince'}}	SWAP_T4_R1_S2_I000596-ACTION_VIEW_CONTACT-1	['ACTION_INSERT_CONTACT', 'ACTION_SHOW_ALARMS', 'ACTION_VIEW_CONTACT', 'search_location', 'INTENT_ACTION_STILL_IMAGE_CAMERA']
['turn 1: Add contact: name Edward Nygma, email enigramaster@riddles.com. -> content://contacts/people/edward_nygma', 'turn 2: Go ahead and record the video camera. -> All done! Video saved at content://example/new_video.mp4.', 'turn 3: Please retrieve a mobile phone number from my contacts for me. -> No problem—bringing up phone number selection. Once you pick one, I’ll grab it for you. Chosen phone URI: content://contacts/phone/21']	Show his contact details	Show contact details for content://contacts/people/edward_nygma	{'plan': 'ACTION_VIEW_CONTACT', 'arguments': {'contact_uri': 'content://contacts/people/edward_nygma'}}	SWAP_T4_R1_S2_I000597-ACTION_VIEW_CONTACT-1	['ACTION_EDIT_CONTACT', 'ACTION_VIEW_CONTACT', 'send_email', 'ACTION_INSERT_EVENT', 'ACTION_OPEN_CONTENT']
"['turn 1: Would you update Bob’s address to ""221B Baker Street, London""? His URI is content://contacts/people/bob. -> Okay, opening Bob\'s contact. Feel free to enter the new address—221B Baker Street, London.', 'turn 2: I require an address of one of my acquaintances; fetch me the postal info. -> All done! Address URI: content://contacts/address/42', 'turn 3: Change content://contacts/address/42 to 742 Evergreen Terrace, Springfield -> Done! The address has been updated to “742 Evergreen Terrace, Springfield.” You can view it here: content://contacts/address/42']"	Where is that on the map?	Where is 221B Baker Street, London on the map?	{'plan': 'search_location', 'arguments': {'query': '221B Baker Street, London'}}	SWAP_T4_R1_S2_I000598-search_location-1	['INTENT_ACTION_STILL_IMAGE_CAMERA', 'search_location', 'ACTION_OPEN_CONTENT', 'ACTION_INSERT_EVENT', 'open_settings']
"['turn 1: Hey, please update the address and email for Frank (URI: content://contacts/people/frank). Address: 55 Maple Ave, Boston. Email: frank@maple.com -> Alright, opening Frank’s contact. You can fill in the address 55 Maple Ave, Boston and email frank@maple.com.', ""turn 2: Please call up a contact's email address from my records. -> Alrighty! Email selected here: content://contacts/email/108"", ""turn 3: Change content://contacts/email/108's company to Acme Corp and add phone 555-1234 -> All set—Acme Corp and phone number 555-1234 have been added. Updated record: content://contacts/email/108""]"	Show me where it is.	Show me where 55 Maple Ave, Boston is.	{'plan': 'search_location', 'arguments': {'query': '55 Maple Ave, Boston'}}	SWAP_T4_R1_S2_I000599-search_location-1	['search_location', 'play_music', 'ACTION_SET_ALARM', 'INTENT_ACTION_STILL_IMAGE_CAMERA', 'ACTION_INSERT_EVENT']
['turn 1: Change Grace’s name in her contact content://contacts/people/grace to Grace Brown. -> Opening Grace’s contact—go ahead and update her name to Grace Brown.', 'turn 2: I want to choose a person by hand from my contacts. -> Contact URI: content://contacts/people/5', 'turn 3: Add address 123 Main St to content://contacts/people/5 and set company to Widgets Inc -> Got it—address “123 Main St” and company “Widgets Inc” have been added. Updated contact: content://contacts/people/5']	Could you locate her on a map?	Could you locate Grace Brown on a map?	{'plan': 'search_location', 'arguments': {'query': 'Grace Brown'}}	SWAP_T4_R1_S2_I000600-search_location-1	['launch_application', 'ACTION_VIEW_RECENT_APPS', 'search_location', 'ACTION_SET_ALARM', 'INTENT_ACTION_STILL_IMAGE_CAMERA']
['turn 1: Update the company of contact content://contacts/people/emily_jones to Innotech Solutions and change her phone to 123-456-7890. -> Launching Emily Jones’s contact. You can update her company to Innotech Solutions and change her phone to 123-456-7890.', 'turn 2: Help me select a mailing address from my saved contacts. -> There you go! Mailing address selected: content://contacts/address/15', 'turn 3: Change content://contacts/address/15 to 456 Elm St and add phone 555-6789 -> All done—address set to “456 Elm St” and phone number 555-6789 added. View it at content://contacts/address/15']	Can you show me that on a map?	Can you show me 123-456-7890 on a map?	{'plan': 'search_location', 'arguments': {'query': '123-456-7890'}}	SWAP_T4_R1_S2_I000601-search_location-1	['ACTION_SHOW_TIMERS', 'search_location', 'ACTION_INSERT_EVENT', 'get_contact_info_from_uri', 'send_email']
['turn 1: I need to update Isla’s company to Global Ventures in her contact URI content://contacts/people/isla_v. -> Sure, pulling up Isla’s contact. You can update her company to Global Ventures.', 'turn 2: Open content://contacts/people/kate_l contact’s info. -> All set—here’s Kate L.’s contact info (content://contacts/people/kate_l).', 'turn 3: Add 123 Elm Street, Springfield to Kate L.’s contact info (content://contacts/people/kate_l) -> Success! Added “123 Elm Street, Springfield” to Kate L.’s contact. Updated URI: content://contacts/people/kate_l']	Where is that company located?	Where is Global Ventures located?	{'plan': 'search_location', 'arguments': {'query': 'Global Ventures'}}	SWAP_T4_R1_S2_I000602-search_location-1	['search_location', 'INTENT_ACTION_VIDEO_CAMERA', 'ACTION_INSERT_EVENT', 'play_music', 'ACTION_VIEW_SENT_EMAILS']
"['turn 1: Reset the contact form for Henry: content://contacts/people/henry. I don’t need to pre-fill anything. -> Resetting Henry’s contact form now. No prefilled details, ready for your input.', 'turn 2: Save +1-555-0199 as a new contact named Alice -> Your new contact Alice (+1-555-0199) is set up. URI: content://contacts/people/alice', ""turn 3: Add company and address to content://contacts/people/alice: 'Acme Corp', '123 Main St, Springfield' -> Alice’s contact is now updated with company ‘Acme Corp’ and address ‘123 Main St, Springfield’. (content://contacts/people/alice)""]"	Where can I find him on a map?	Where can I find Henry on a map?	{'plan': 'search_location', 'arguments': {'query': 'Henry'}}	SWAP_T4_R1_S2_I000603-search_location-1	['get_contact_info_from_uri', 'web_search', 'ACTION_VIEW_CALL_LOG', 'search_location', 'ACTION_VIEW_WEB_HISTORY']
"['turn 1: Add Lucas Wright to my address book with phone: 321-654-0987 and home address: 456 Maple Street. -> Creating Lucas Wright’s contact: phone 321‑654‑0987 and address 456 Maple Street are filled in.', 'turn 2: Pull an email from my stored contacts. -> Email picker is up. Email chosen: content://contacts/email/34.', ""turn 3: Set content://contacts/email/34's name to Robert Johnson. -> Contact entry renamed to Robert Johnson. (URI: content://contacts/email/34)""]"	Show it in the map application	Show 456 Maple Street in the map application	{'plan': 'search_location', 'arguments': {'query': '456 Maple Street'}}	SWAP_T4_R1_S2_I000604-search_location-1	['ACTION_OPEN_DOCUMENT', 'ACTION_EDIT_DOCUMENT', 'search_location', 'ACTION_EDIT_ALARM', 'ACTION_GET_CONTENT']
"['turn 1: Insert new contact for Maria Gonzalez: name, email, and street address. Her email is maria.gonzalez@example.com and she lives at 789 Central Blvd. -> Sure—setting up Maria Gonzalez’s contact with email maria.gonzalez@example.com and address 789 Central Blvd.', 'turn 2: Can you help me pick a contact from my saved directory? -> Sure—contact picker opened. You selected content://contacts/people/12.', ""turn 3: Update content://contacts/people/12's phone number to 555-6789. -> Phone number for the contact has been changed to 555-6789. (content://contacts/people/12)""]"	Locate that address	Locate 789 Central Blvd.	{'plan': 'search_location', 'arguments': {'query': '789 Central Blvd'}}	SWAP_T4_R1_S2_I000605-search_location-1	['ACTION_NAVIGATE_TO_LOCATION', 'ACTION_SHOW_TIMERS', 'ACTION_VIEW_WEB_HISTORY', 'search_location', 'ACTION_SET_TIMER']
"['turn 1: Set up contact: Olivia King, phone 987-654-3210, email olivia.king@domain.com, address 321 Oak Ave, Apt 2. -> All set! Olivia King’s contact opens with phone 987‑654‑3210, email and address already in place.', 'turn 2: I require a contact from my people directory – please pull up one. -> Contact list opened. Your selection: content://contacts/people/30.', ""turn 3: Set content://contacts/people/30's company to OpenAI -> Company field updated to ‘OpenAI’. (content://contacts/people/30)""]"	Open her location in Maps	Open 321 Oak Ave, Apt 2 location in Maps	{'plan': 'search_location', 'arguments': {'query': '321 Oak Ave, Apt 2'}}	SWAP_T4_R1_S2_I000606-search_location-1	['ACTION_OPEN_CONTENT', 'send_message', 'ACTION_VIEW_PLAYLIST', 'search_location', 'ACTION_EDIT_VIDEO']
"[""turn 1: Could you store Peter Parker's details? He lives at 108 W 40th St and we should note 'Friendly neighborhood Spider-Man'. -> Preparing Peter Parker’s contact: address 108 W\xa040th St and notes (“Friendly neighborhood Spider-Man”) are set."", 'turn 2: I want to choose a contact number from my phone directory. -> Phone picker launched. You picked content://contacts/phone/22.', ""turn 3: Change content://contacts/phone/22's address to 1234 Elm Street, Springfield. -> Address updated to ‘1234 Elm Street, Springfield’. (content://contacts/phone/22)""]"	Show that address on a map	Show 108 W 40th St on a map	{'plan': 'search_location', 'arguments': {'query': '108 W 40th St'}}	SWAP_T4_R1_S2_I000607-search_location-1	['ACTION_VIEW_SENT_MESSAGES', 'ACTION_GET_CONTENT', 'search_location', 'open_settings', 'ACTION_NAVIGATE_TO_LOCATION']
['turn 1: Add contact Christine Wu with phone 212-555-9876, address 123 Elm Street, and website www.christinewu.com. -> Contact form launched for Christine Wu: phone, address, and website have been prefilled.', 'turn 2: Select a personal contact entry from my list. -> Personal contacts shown. You chose content://contacts/people/27.', 'turn 3: Add an address to content://contacts/people/27: 123 Maple Street, Springfield -> Address added: 123 Maple Street, Springfield. (content://contacts/people/27)']	Locate her address on a map	Locate 123 Elm Street on a map	{'plan': 'search_location', 'arguments': {'query': '123 Elm Street'}}	SWAP_T4_R1_S2_I000608-search_location-1	['launch_application', 'ACTION_VIEW_SENT_MESSAGES', 'ACTION_INSERT_CONTACT', 'search_location', 'ACTION_VIEW_WEB_HISTORY']
"['turn 1: I need a calendar entry on May 1, 2024 at 9:00 AM for an annual check-up with Dr. Smith at the Downtown Clinic. -> All set: ""Doctor Appointment"" is scheduled for May 1, 2024 at 9:00\xa0AM at Downtown Clinic. Check it here: content://calendar/event/2', 'turn 2: Please retrieve the address from the contact record at /user/info/hello_world. -> The address stored at /user/info/hello_world is 99 Infinite Loop, Imaginary City, ZX 12345.', 'turn 3: Add an email for /user/info/hello_world: hello@imaginary.com -> All set! I’ve added hello@imaginary.com to your contact. You can find the updated record here: /user/info/hello_world.']"	Where is it exactly?	Where is Downtown Clinic exactly?	{'plan': 'search_location', 'arguments': {'query': 'Downtown Clinic'}}	SWAP_T4_R1_S2_I000609-search_location-1	['play_video', 'send_email', 'ACTION_VIDEO_CAPTURE', 'search_location', 'get_contact_info']
"['turn 1: Set up a yoga class on June 10th, 2024 from 6 PM to 7 PM at Sunrise Yoga Studio. It\'s a Vinyasa flow session. -> Done – ""Yoga Class"" is locked in for June 10, 2024 at 6:00\xa0PM at Sunrise Yoga Studio. View it here: content://calendar/event/3', 'turn 2: I want to know the address for the contact listed at /user/profile/jack. -> Jack’s address is 456 Oak Avenue, Building 12, Floor 3, New York, NY 10001.', 'turn 3: Update the contact listed at /user/profile/jack with a new address 789 Birch Road, Floor 2, New York, NY 10001 -> Your update is complete! Jack’s contact now shows the new address at 789 Birch Road, Floor 2. Record saved at /user/profile/jack.']"	Can you find where that is?	Can you find where Sunrise Yoga Studio is?	{'plan': 'search_location', 'arguments': {'query': 'Sunrise Yoga Studio'}}	SWAP_T4_R1_S2_I000610-search_location-1	['INTENT_ACTION_VIDEO_CAMERA', 'search_location', 'play_video', 'ACTION_GET_CONTENT', 'ACTION_NAVIGATE_TO_LOCATION']
"['turn 1: Add to my calendar: Lunch with Sarah at Cafe Roma on July 4, 2024, starting at noon for an hour and a half. We need to catch up over lunch. -> Your ""Lunch with Sarah"" is booked for July 4, 2024 at 12:00\xa0PM at Cafe Roma. Here\'s the event URI: content://calendar/event/4', 'turn 2: Show content://contacts/people/2718 -> Alright—bringing up the contact at content://contacts/people/2718. You should see the full profile now.', 'turn 3: Edit content://contacts/people/2718 to update the phone number to 555-123-4567 -> Got it—555-123-4567 is now saved as the phone for content://contacts/people/2718.']"	Where is it situated?	Where is Cafe Roma situated?	{'plan': 'search_location', 'arguments': {'query': 'Cafe Roma'}}	SWAP_T4_R1_S2_I000611-search_location-1	['ACTION_EDIT_ALARM', 'ACTION_SET_ALARM', 'send_email', 'ACTION_VIEW_RECENT_APPS', 'search_location']
"['turn 1: Please create an event titled \'AI Trends Webinar\' on August 15, 2024 from 8:00 to 9:00 AM online, with description \'Join online webinar on latest AI developments\'. -> Success! ""AI Trends Webinar"" is on your calendar for August 15, 2024 at 8:00\xa0AM (online). Access it here: content://calendar/event/5', 'turn 2: I require the address details of the contact at /user/info/samuel. -> Samuel’s address is 1600 Amphitheatre Parkway, Mountain View, CA 94043.', 'turn 3: Update the contact at /user/info/samuel to add email samuel@google.com and phone 650-253-0000. -> Updated /user/info/samuel with email samuel@google.com and phone 650-253-0000.']"	Where is it hosted online?	Where is content://calendar/event/5 hosted online?	{'plan': 'search_location', 'arguments': {'query': 'content://calendar/event/5'}}	SWAP_T4_R1_S2_I000612-search_location-1	['ACTION_EDIT_VIDEO', 'ACTION_VIEW_CALL_LOG', 'ACTION_INSERT_EVENT', 'play_music', 'search_location']
"['turn 1: I\'d like to plan a movie night at Grand Cinema on October 10, 2024 beginning at 8 PM until 11 PM to watch the new sci-fi film with friends. -> All right! ""Movie Night"" is scheduled for October 10, 2024 from 8:00\xa0PM to 11:00\xa0PM at Grand Cinema. See it here: content://calendar/event/7', 'turn 2: Please get the address details for the contact with URI /contact/info/sara. -> Sara’s address on file is 128 Cherry Lane, Maple Town, CA 90210.', ""turn 3: Update /contact/info/sara's address to 500 Elm Street, Gotham City, NY 10001 -> Address for /contact/info/sara has been changed to 500 Elm Street, Gotham City, NY 10001.""]"	Where is it located?	Where is Grand Cinema located?	{'plan': 'search_location', 'arguments': {'query': 'Grand Cinema'}}	SWAP_T4_R1_S2_I000613-search_location-1	['ACTION_SET_TIMER', 'INTENT_ACTION_STILL_IMAGE_CAMERA', 'play_video', 'ACTION_SET_RINGTONE', 'search_location']
"['turn 1: Schedule \'Thanksgiving Dinner\' on November 22, 2024 from 11:00 AM to 1:00 PM at Mom\'s House for a family gathering. -> Your ""Thanksgiving Dinner"" is confirmed for November 22, 2024 at 11:00\xa0AM at Mom’s House. Tap here for details: content://calendar/event/8', 'turn 2: Retrieve the full contact summary from /contacts/john_doe. -> Full summary for /contacts/john_doe:\nName: John Doe\nPhone: (555) 123-4567\nEmail: john.doe@contact.com\nAddress: 789 Oak Avenue, Springfield, IL', ""turn 3: Change /contacts/john_doe's name to Jonathan Doe and email to jonathan.doe@newmail.com -> Your changes are in—/contacts/john_doe is now Jonathan Doe, email set to jonathan.doe@newmail.com.""]"	Where is it exactly?	Where is Mom’s House exactly?	{'plan': 'search_location', 'arguments': {'query': 'Mom’s House'}}	SWAP_T4_R1_S2_I000614-search_location-1	['ACTION_VIDEO_CAPTURE', 'ACTION_SET_RINGTONE', 'ACTION_PICK', 'search_location', 'INTENT_ACTION_STILL_IMAGE_CAMERA']
"['turn 1: Would you bring up the entry stored at content://contacts/people/1034? -> Bringing up the entry at content://contacts/people/1034.', 'turn 2: I need a complete summary of the contact details for /contacts/alexander. -> Complete details for /contacts/alexander:\nName: Alexander\nPhone: (404) 555-0168\nEmail: alexander@contacts.org\nAddress: 56 Pine Street, Atlanta, GA', ""turn 3: Edit /contacts/alexander's address to 123 Oak Avenue, New York, NY -> Done—the address for /contacts/alexander is now 123 Oak Avenue, New York, NY.""]"	Navigate to the contact's address	Navigate to the address of the contact stored at content://contacts/people/1034	{'plan': 'search_location', 'arguments': {'query': 'address of contact content://contacts/people/1034'}}	SWAP_T4_R1_S2_I000615-search_location-1	['send_email', 'ACTION_OPEN_CONTENT', 'open_settings', 'search_location', 'ACTION_EDIT_VIDEO']
['turn 1: Open contact ID 1036: content://contacts/people/1036. -> Loading contact ID 1036 (content://contacts/people/1036).', 'turn 2: Dial 321-654-0987 now -> Calling 321-654-0987 now...', 'turn 3: Add 321-654-0987 to my contacts -> Creating a new contact entry: telephone 321-654-0987 is pre-populated.']	Plot the contact's address	Plot the contact's address for contact ID 1036: content://contacts/people/1036	{'plan': 'search_location', 'arguments': {'query': 'address of contact content://contacts/people/1036'}}	SWAP_T4_R1_S2_I000616-search_location-1	['ACTION_SHOW_ALARMS', 'web_search', 'ACTION_CREATE_DOCUMENT', 'search_location', 'ACTION_VIEW_PLAYLIST']
['turn 1: Please launch the details view for content://contacts/people/1027. -> Displaying contact details for content://contacts/people/1027 now.', 'turn 2: Call 555-987-6543 -> Placing a call to 555-987-6543...', 'turn 3: Create new contact from the call to 555-987-6543 with address 321 Oak St, Centerville, OH 45459 -> Starting a new contact: phone 555-987-6543 and address 321 Oak St, Centerville, OH 45459 are pre-filled.']	Navigate to this contact's address.	Navigate to content://contacts/people/1027's address.	{'plan': 'search_location', 'arguments': {'query': 'address of contact content://contacts/people/1027'}}	SWAP_T4_R1_S2_I000617-search_location-1	['ACTION_VIEW_PLAYLIST', 'ACTION_EDIT_CONTACT', 'search_location', 'ACTION_VIEW_WEB_HISTORY', 'ACTION_PICK']
"[""turn 1: Can you retrieve the email address of the contact for this URI: content://contacts/people/23? -> Sure thing—I've pulled up the email for that contact. It’s jane.doe23@example.com."", 'turn 2: Dial +1-202-555-0198. -> Calling +1-202-555-0198 right away...', 'turn 3: Add +1-202-555-0198 to contacts -> Opening contact creation screen with main phone +1-202-555-0198 entered.']"	Search for it	Search for jane.doe23@example.com	{'plan': 'search_location', 'arguments': {'query': 'jane.doe23@example.com'}}	SWAP_T4_R1_S2_I000618-search_location-1	['launch_application', 'search_location', 'ACTION_VIEW_EVENT', 'ACTION_OPEN_DOCUMENT', 'ACTION_VIDEO_CAPTURE']
"['turn 1: Would you update Bob’s address to ""221B Baker Street, London""? His URI is content://contacts/people/bob. -> Okay, opening Bob\'s contact. Feel free to enter the new address—221B Baker Street, London.', 'turn 2: I require an address of one of my acquaintances; fetch me the postal info. -> All done! Address URI: content://contacts/address/42', 'turn 3: Change content://contacts/address/42 to 742 Evergreen Terrace, Springfield -> Done! The address has been updated to “742 Evergreen Terrace, Springfield.” You can view it here: content://contacts/address/42']"	Navigate there	Navigate to 221B Baker Street, London	{'plan': 'ACTION_NAVIGATE_TO_LOCATION', 'arguments': {'location': '221B Baker Street, London'}}	SWAP_T4_R1_S2_I000619-ACTION_NAVIGATE_TO_LOCATION-1	['ACTION_OPEN_DOCUMENT', 'ACTION_EDIT_ALARM', 'ACTION_SET_TIMER', 'ACTION_EDIT_DOCUMENT', 'ACTION_NAVIGATE_TO_LOCATION']
['turn 1: Update the company of contact content://contacts/people/emily_jones to Innotech Solutions and change her phone to 123-456-7890. -> Launching Emily Jones’s contact. You can update her company to Innotech Solutions and change her phone to 123-456-7890.', 'turn 2: Help me select a mailing address from my saved contacts. -> There you go! Mailing address selected: content://contacts/address/15', 'turn 3: Change content://contacts/address/15 to 456 Elm St and add phone 555-6789 -> All done—address set to “456 Elm St” and phone number 555-6789 added. View it at content://contacts/address/15']	Take me to their office	Take me to Innotech Solutions' office	"{'plan': 'ACTION_NAVIGATE_TO_LOCATION', 'arguments': {'location': ""Innotech Solutions' office""}}"	SWAP_T4_R1_S2_I000620-ACTION_NAVIGATE_TO_LOCATION-1	['launch_application', 'ACTION_EDIT_CONTACT', 'ACTION_INSERT_EVENT', 'ACTION_NAVIGATE_TO_LOCATION', 'send_message']
['turn 1: I need to update Isla’s company to Global Ventures in her contact URI content://contacts/people/isla_v. -> Sure, pulling up Isla’s contact. You can update her company to Global Ventures.', 'turn 2: Open content://contacts/people/kate_l contact’s info. -> All set—here’s Kate L.’s contact info (content://contacts/people/kate_l).', 'turn 3: Add 123 Elm Street, Springfield to Kate L.’s contact info (content://contacts/people/kate_l) -> Success! Added “123 Elm Street, Springfield” to Kate L.’s contact. Updated URI: content://contacts/people/kate_l']	Take me to her company's office	Take me to Global Ventures's office	"{'plan': 'ACTION_NAVIGATE_TO_LOCATION', 'arguments': {'location': ""Global Ventures's office""}}"	SWAP_T4_R1_S2_I000621-ACTION_NAVIGATE_TO_LOCATION-1	['ACTION_VIEW_WEB_HISTORY', 'open_settings', 'ACTION_NAVIGATE_TO_LOCATION', 'ACTION_GET_CONTENT', 'dial']
"['turn 1: Could you schedule a one-hour brainstorming session for next Tuesday at 2 pm in Zoom Room A titled \'Project Alpha Brainstorm\' with description \'Initial idea generation for Project Alpha\'? -> Great! ""Project Alpha Brainstorm"" is on your calendar for April 16, 2024 at 2:00\xa0PM in Zoom Room A. Here\'s the event link: content://calendar/event/1', 'turn 2: Save 777-8888 to my address book. -> Contact for 777-8888 saved. (URI: content://contacts/people/7778888)', ""turn 3: Name content://contacts/people/7778888 'Helpline Support'. -> Updated contact name to ‘Helpline Support’. (content://contacts/people/7778888)""]"	Get directions there	Get directions to Zoom Room A	{'plan': 'ACTION_NAVIGATE_TO_LOCATION', 'arguments': {'location': 'Zoom Room A'}}	SWAP_T4_R1_S2_I000622-ACTION_NAVIGATE_TO_LOCATION-1	['ACTION_VIEW_RECENT_APPS', 'ACTION_NAVIGATE_TO_LOCATION', 'ACTION_VIEW_CONTACT', 'ACTION_EDIT_ALARM', 'search_location']
