conversation_history	query	rewrited_query	answer	unique_idx	candidates
"[""turn 1: Open the phone's still image camera so I can take a quick photo. -> Sure thing—still image camera is now open and ready for your photo."", 'turn 2: Pick the most recent photo from my camera roll -> Here’s your latest photo: content://temp/IMG_20240605_153210.jpg', ""turn 3: Save content://temp/IMG_20240605_153210.jpg as a PDF named RecentPhoto.pdf -> Done—your PDF 'RecentPhoto.pdf' is now available at content://documents/RecentPhoto.pdf."", ""turn 4: Create a new PDF document named LatestShot.pdf and put content://temp/latest_shot.jpg there. -> Your PDF 'LatestShot.pdf' is now ready at content://documents/LatestShot.pdf.""]"	Edit that PDF to add a watermark 'CONFIDENTIAL'.	Edit content://documents/RecentPhoto.pdf to add a watermark 'CONFIDENTIAL'.	"{'plan': 'ACTION_EDIT_DOCUMENT', 'arguments': {'document_uri': 'content://documents/RecentPhoto.pdf', 'content': ""Add watermark 'CONFIDENTIAL'""}}"	SWAP_T5_R3_S4_I002292-ACTION_EDIT_DOCUMENT-1	['ACTION_OPEN_CONTENT', 'ACTION_VIEW_SENT_MESSAGES', 'ACTION_VIDEO_CAPTURE', 'ACTION_EDIT_DOCUMENT', 'ACTION_EDIT_VIDEO']
"['turn 1: I need to capture a photo—launch the camera for me, please. -> Got it! The camera app in photo mode has been launched.', 'turn 2: Choose the image I just snapped -> Selected the photo you just took: content://temp/IMG_20240605_161230.jpg', ""turn 3: Create a new text document named ImageRecord.txt to note content://temp/IMG_20240605_161230.jpg -> Nice! I’ve created 'ImageRecord.txt'. You can find it at content://documents/ImageRecord.txt."", ""turn 4: Create a new image/jpeg document for content://temp/photo131.jpg named PhotoCopy131.jpg -> All set! Your copy 'PhotoCopy131.jpg' has been created at content://documents/PhotoCopy131.jpg.""]"	Edit that document to insert the photo link and the caption 'Vacation start'.	Edit content://documents/ImageRecord.txt to insert the photo link and the caption 'Vacation start'.	"{'plan': 'ACTION_EDIT_DOCUMENT', 'arguments': {'document_uri': 'content://documents/ImageRecord.txt', 'content': ""Insert the photo link and the caption 'Vacation start'""}}"	SWAP_T5_R3_S4_I002293-ACTION_EDIT_DOCUMENT-1	['ACTION_SET_RINGTONE', 'ACTION_EDIT_ALARM', 'ACTION_EDIT_DOCUMENT', 'INTENT_ACTION_VIDEO_CAMERA', 'open_settings']
"['turn 1: Initiate video recording app. -> Video camera is open and ready to record.', 'turn 2: Choose multiple videos from my camera roll -> Opening video gallery—pick the clips you need.', ""turn 3: Put the clips from my camera roll into a new document named VideosArchive.zip. -> All set—your archive 'VideosArchive.zip' has been created at content://archives/VideosArchive.zip."", ""turn 4: Create a new image/jpeg document for content://temp/photo133.jpg named PhotoCopy133.jpg -> Here you go—'PhotoCopy133.jpg' has been created at content://documents/PhotoCopy133.jpg.""]"	Edit that archive to include a README.txt listing the video clip names.	Edit content://archives/VideosArchive.zip to include a README.txt listing the video clip names.	{'plan': 'ACTION_EDIT_DOCUMENT', 'arguments': {'document_uri': 'content://archives/VideosArchive.zip', 'content': 'Include a README.txt listing the video clip names'}}	SWAP_T5_R3_S4_I002294-ACTION_EDIT_DOCUMENT-1	['INTENT_ACTION_STILL_IMAGE_CAMERA', 'open_settings', 'dial', 'ACTION_OPEN_CONTENT', 'ACTION_EDIT_DOCUMENT']
"[""turn 1: Open the smartphone's video camera. -> Okay, video camera launched successfully."", 'turn 2: Pick a video from my gallery -> Launching your video library—select one video to proceed.', ""turn 3: Create a new document for the video clip from my gallery called MyClip.mp4. -> Your new video file 'MyClip.mp4' is ready: content://media/MyClip.mp4."", ""turn 4: Create a new image/jpeg document for content://temp/photo130.jpg named PhotoCopy130.jpg -> Done! 'PhotoCopy130.jpg' is saved here: content://documents/PhotoCopy130.jpg.""]"	Edit that video file to add the description 'Birthday party clip'.	Edit content://media/MyClip.mp4 to add the description 'Birthday party clip'.	"{'plan': 'ACTION_EDIT_DOCUMENT', 'arguments': {'document_uri': 'content://media/MyClip.mp4', 'content': ""Add the description 'Birthday party clip'""}}"	SWAP_T5_R3_S4_I002295-ACTION_EDIT_DOCUMENT-1	['dial', 'ACTION_VIEW_SENT_EMAILS', 'ACTION_VIEW_WEB_HISTORY', 'ACTION_EDIT_DOCUMENT', 'ACTION_EDIT_CONTACT']
"['turn 1: Can you pop up the video camera? -> The video camera has been opened—start recording anytime.', 'turn 2: Browse my video library to pick one -> Here’s your video collection—choose a clip to continue.', ""turn 3: Save a video clip from your video collection into a new document named Clip.mp4. -> Saved! 'Clip.mp4' is available at content://media/Clip.mp4."", ""turn 4: Create a new PDF named HolidayCollage.pdf and import content://gallery/holiday1.jpg, content://gallery/holiday2.jpg, content://gallery/holiday3.jpg, and content://gallery/holiday4.jpg all into it. -> All done! 'HolidayCollage.pdf' has been generated at content://documents/HolidayCollage.pdf.""]"	Edit that clip to add a subtitle file 'captions.srt'.	Edit content://media/Clip.mp4 to add a subtitle file 'captions.srt'.	"{'plan': 'ACTION_EDIT_DOCUMENT', 'arguments': {'document_uri': 'content://media/Clip.mp4', 'content': ""Add a subtitle file 'captions.srt'""}}"	SWAP_T5_R3_S4_I002296-ACTION_EDIT_DOCUMENT-1	['ACTION_INSERT_CONTACT', 'ACTION_OPEN_DOCUMENT', 'dial', 'ACTION_EDIT_DOCUMENT', 'ACTION_VIEW_CONTACT']
"[""turn 1: Create a reminder called 'Anniversary Dinner' on December 1, 2024 at 7:30 PM to 10:00 PM at The Olive Branch, desc: Celebrate with spouse. -> All set! 'Anniversary Dinner' is planned for December 1, 2024, 7:30\xa0PM–10:00\xa0PM at The Olive Branch. Here's the event: content://calendar/event/1010"", 'turn 2: Help me bring up a file picker to choose multiple plain text documents for review. -> Opening the document picker—select one or more plain text files.', ""turn 3: Create a new plain text document named ReviewNotes.txt. -> Done! Text file 'ReviewNotes.txt' created at content://documents/ReviewNotes.txt. You can start adding your review notes now."", 'turn 4: Create a new image file named Snapshot.jpg for content://temp/camera_last.jpg -> Snapshot.jpg has been created successfully at content://documents/Snapshot.jpg.']"	Edit that document to add an outline of the key review points	Edit content://documents/ReviewNotes.txt to add an outline of the key review points	{'plan': 'ACTION_EDIT_DOCUMENT', 'arguments': {'document_uri': 'content://documents/ReviewNotes.txt', 'content': 'Add an outline of the key review points'}}	SWAP_T5_R3_S4_I002297-ACTION_EDIT_DOCUMENT-1	['ACTION_VIEW_WEB_HISTORY', 'play_music', 'ACTION_EDIT_DOCUMENT', 'ACTION_EDIT_VIDEO', 'send_email']
"['turn 1: Put an alarm at midnight to mark the new day. -> All set! Alarm (ID: alarm_no2) is scheduled for 12:00 AM: Mark new day.', 'turn 2: I want to use the document picker to select a PDF for some editing tasks. -> Opening the PDF document picker now. Please choose a file to edit.', ""turn 3: If no PDF is found, create one named NewDraft.pdf. -> All set! New PDF 'NewDraft.pdf' has been created at content://documents/NewDraft.pdf. Let me know when you'd like to edit it."", ""turn 4: Create a new PDF named PhotoCapture.pdf with content://temp/last_capture.jpg image -> Created! Check out 'PhotoCapture.pdf' at content://documents/PhotoCapture.pdf.""]"	Edit it to insert the introduction section of the draft	Edit content://documents/NewDraft.pdf to insert the introduction section of the draft	{'plan': 'ACTION_EDIT_DOCUMENT', 'arguments': {'document_uri': 'content://documents/NewDraft.pdf', 'content': 'Insert the introduction section of the draft'}}	SWAP_T5_R3_S4_I002298-ACTION_EDIT_DOCUMENT-1	['get_contact_info_from_uri', 'ACTION_EDIT_DOCUMENT', 'ACTION_EDIT_ALARM', 'ACTION_VIEW_CALL_LOG', 'ACTION_EDIT_VIDEO']
"['turn 1: Start the Photos app so I can view recent shots. -> Photos app launched. View your recent shots now.', 'turn 2: Launch the file selector to choose an image file from my photos. -> Launching the image file selector—pick one image from your photos.', ""turn 3: If that image isn't in my photos, create a new one named Photo1.jpg. -> Couldn't find that image, so I made one for you: 'Photo1.jpg' at content://documents/Photo1.jpg. Feel free to view or edit it."", ""turn 4: Save content://temp/recent_image.jpg as a JPEG file named RecentImageBackup.jpg. -> Your backup 'RecentImageBackup.jpg' is ready at content://documents/RecentImageBackup.jpg.""]"	Edit it to add a caption below the image	Edit content://documents/Photo1.jpg to add a caption below the image	{'plan': 'ACTION_EDIT_DOCUMENT', 'arguments': {'document_uri': 'content://documents/Photo1.jpg', 'content': 'Add a caption below the image'}}	SWAP_T5_R3_S4_I002299-ACTION_EDIT_DOCUMENT-1	['ACTION_VIEW_PLAYLIST', 'launch_application', 'ACTION_EDIT_DOCUMENT', 'ACTION_SHOW_ALARMS', 'ACTION_SET_ALARM']
"['turn 1: Open content://files/lecture.mp4 without any edits. -> Opening lecture.mp4 in the video editor now. Let me know if you want to trim or mute anything once it’s loaded!', 'turn 2: Provide a file selection for multiple images; I need to choose several. -> Okay, opening the image picker—select the pictures you need.', ""turn 3: If there aren’t any images, create one named GalleryPic1.jpg. -> No images were found—so I created 'GalleryPic1.jpg' at content://documents/GalleryPic1.jpg. You can view it right away."", ""turn 4: Save content://temp/recent_image.jpg to a new PDF document named SavedImage.pdf -> Great news! Your new PDF 'SavedImage.pdf' is ready at content://documents/SavedImage.pdf.""]"	Edit it to add the caption 'Gallery launch'.	Edit content://documents/GalleryPic1.jpg to add the caption 'Gallery launch'.	{'plan': 'ACTION_EDIT_DOCUMENT', 'arguments': {'document_uri': 'content://documents/GalleryPic1.jpg', 'content': 'Gallery launch'}}	SWAP_T5_R3_S4_I002300-ACTION_EDIT_DOCUMENT-1	['open_settings', 'ACTION_EDIT_DOCUMENT', 'ACTION_EDIT_CONTACT', 'ACTION_VIEW_PLAYLIST', 'ACTION_PICK']
"[""turn 1: Adjust alarm 15 to 09:55, label 'Call Mom', vibrate off. -> Updated Alarm 15 to 9:55\xa0AM with label 'Call Mom' and vibration turned off."", 'turn 2: Open a plain text file from my documents — just one file, please. -> Opening the plain text document picker—please select one file.', ""turn 3: Okay, let's create a new plain text file and name it Draft.txt. -> Got it—your new text file 'Draft.txt' is ready at content://documents/Draft.txt. Start typing whenever you like."", ""turn 4: Save content://temp/last_photo.jpg as a PDF named MyLatestPhoto.pdf -> Done—I've created 'MyLatestPhoto.pdf' at content://documents/MyLatestPhoto.pdf.""]"	Edit it to include a bullet list of key points at the top.	Edit content://documents/Draft.txt to include a bullet list of key points at the top.	{'plan': 'ACTION_EDIT_DOCUMENT', 'arguments': {'document_uri': 'content://documents/Draft.txt', 'content': 'Bullet list of key points at the top'}}	SWAP_T5_R3_S4_I002301-ACTION_EDIT_DOCUMENT-1	['ACTION_SET_ALARM', 'web_search', 'ACTION_SHOW_ALARMS', 'ACTION_EDIT_DOCUMENT', 'ACTION_VIDEO_CAPTURE']
"[""turn 1: Common symptoms associated with type 2 diabetes. -> Searching for 'common symptoms of type 2 diabetes'... Preview: fatigue, frequent urination, increased thirst, blurred vision and slow-healing wounds are commonly listed."", 'turn 2: I want to choose one PDF document for permanent access. Please open the file chooser. -> Opening the PDF-only picker. Choose a single PDF document for permanent access.', ""turn 3: Alright, let's make a new PDF document for permanent access and call it Report.pdf. -> Your permanent PDF 'Report.pdf' has been created at content://documents/Report.pdf. It’s saved and ready for long‑term access."", ""turn 4: Create a new text document named PhotoNote.txt -> Your text file 'PhotoNote.txt' has been successfully created at content://documents/PhotoNote.txt.""]"	Edit it to insert an executive summary at the beginning saying 'This report provides...'.	Edit content://documents/Report.pdf to insert an executive summary at the beginning saying 'This report provides...'.	{'plan': 'ACTION_EDIT_DOCUMENT', 'arguments': {'document_uri': 'content://documents/Report.pdf', 'content': 'This report provides...'}}	SWAP_T5_R3_S4_I002302-ACTION_EDIT_DOCUMENT-1	['dial', 'ACTION_EDIT_DOCUMENT', 'ACTION_SET_TIMER', 'ACTION_SET_ALARM', 'INTENT_ACTION_STILL_IMAGE_CAMERA']
"['turn 1: Fetch only email from content://org.addressbook/entries/222. -> Here’s the email for content://org.addressbook/entries/222: jane.doe@example.com.', 'turn 2: Could I select one image only? I just need access to a single image document. -> Launching the image document picker—please select one image.', ""turn 3: Great, create a new one of launching the image document picker and name it Picture.jpg. -> New image file 'Picture.jpg' created at content://documents/Picture.jpg. Let me know if you’d like to open it."", 'turn 4: Save content://temp/img_0045.jpg into a new JPEG file named Snap.jpg -> Snap.jpg has been created and saved at content://pictures/Snap.jpg. Enjoy!']"	Edit it to add a watermark text 'Sample'.	Edit content://documents/Picture.jpg to add a watermark text 'Sample'.	{'plan': 'ACTION_EDIT_DOCUMENT', 'arguments': {'document_uri': 'content://documents/Picture.jpg', 'content': 'Sample'}}	SWAP_T5_R3_S4_I002303-ACTION_EDIT_DOCUMENT-1	['ACTION_EDIT_CONTACT', 'get_contact_info', 'ACTION_VIEW_SENT_EMAILS', 'ACTION_VIEW_CONTACT', 'ACTION_EDIT_DOCUMENT']
"['turn 1: Recording time, store as content://timelapse/tl_video.mp4. -> Got it—starting video capture now and saving to content://timelapse/tl_video.mp4.', 'turn 2: Please allow me to choose a single PDF file from my list; one is enough. -> Opening the PDF file chooser—select a single PDF document.', ""turn 3: Sure, create a new PDF and call it Invoice.pdf. -> All done! Your PDF 'Invoice.pdf' is created at content://documents/Invoice.pdf. You can review it anytime."", ""turn 4: Save content://temp/latest_capture.jpg as a JPEG named CaptureBackup.jpg -> Your JPEG 'CaptureBackup.jpg' is stored at content://pictures/CaptureBackup.jpg.""]"	Edit it to append 'Paid on May 1, 2024' at the end.	Edit content://documents/Invoice.pdf to append 'Paid on May 1, 2024' at the end.	{'plan': 'ACTION_EDIT_DOCUMENT', 'arguments': {'document_uri': 'content://documents/Invoice.pdf', 'content': 'Paid on May 1, 2024'}}	SWAP_T5_R3_S4_I002304-ACTION_EDIT_DOCUMENT-1	['ACTION_INSERT_CONTACT', 'INTENT_ACTION_STILL_IMAGE_CAMERA', 'ACTION_SET_ALARM', 'get_contact_info', 'ACTION_EDIT_DOCUMENT']
"['turn 1: Provide me with the active timer list. -> Your active timers: 10 minutes - Workout, 5 minutes - Tea, 20 minutes - Baking.', ""turn 2: Help me pick a single plain text document from my storage. -> Certainly. Here's the file browser for text documents—pick the one you’d like."", ""turn 3: If none of the text documents from my storage work, create one named MeetingNotes.txt. -> New document 'MeetingNotes.txt' is ready at content://documents/MeetingNotes.txt. You can now jot down your meeting notes."", 'turn 4: Save content://temp/newest_pic.jpg as NewestPicture.jpg -> NewestPicture.jpg has been saved to content://pictures/NewestPicture.jpg.']"	Edit it to add the meeting agenda: Introduction, Budget review, Action items.	Edit content://documents/MeetingNotes.txt to add the meeting agenda: Introduction, Budget review, Action items.	{'plan': 'ACTION_EDIT_DOCUMENT', 'arguments': {'document_uri': 'content://documents/MeetingNotes.txt', 'content': 'Meeting agenda: Introduction, Budget review, Action items.'}}	SWAP_T5_R3_S4_I002305-ACTION_EDIT_DOCUMENT-1	['ACTION_VIEW_EVENT', 'ACTION_NAVIGATE_TO_LOCATION', 'ACTION_SET_TIMER', 'ACTION_EDIT_DOCUMENT', 'ACTION_IMAGE_CAPTURE']
"['turn 1: Show me the way to 350 Fifth Avenue, New York, NY. -> 350 Fifth Avenue, New York, NY navigation initiated. Follow the turn-by-turn instructions.', 'turn 2: I need to select documents in both text and PDF formats. I plan to pick more than one file; please enable multiple selections. -> Multiple-document selector: files chosen are\n– content://storage/docs/meeting.txt\n– content://storage/docs/summary.pdf', 'turn 3: Create a new PDF from content://storage/docs/summary.pdf named CombinedSummary.pdf -> Created a fresh PDF named CombinedSummary.pdf at content://documents/CombinedSummary.pdf. Feel free to update or merge content.', ""turn 4: Combine content://temp/capture1.jpg, content://temp/capture2.jpg, content://temp/capture3.jpg into a PDF named LastThreeImages.pdf -> Here you go—'LastThreeImages.pdf' combining your photos is ready at content://documents/LastThreeImages.pdf.""]"	Edit it to append a conclusion paragraph summarizing the key findings.	Edit content://documents/CombinedSummary.pdf to append a conclusion paragraph summarizing the key findings.	{'plan': 'ACTION_EDIT_DOCUMENT', 'arguments': {'document_uri': 'content://documents/CombinedSummary.pdf', 'content': 'Conclusion paragraph summarizing the key findings'}}	SWAP_T5_R3_S4_I002306-ACTION_EDIT_DOCUMENT-1	['ACTION_EDIT_DOCUMENT', 'ACTION_CREATE_DOCUMENT', 'ACTION_SET_RINGTONE', 'get_contact_info_from_uri', 'send_email']
"[""turn 1: I want to dispatch an email to contact@vendor.org with subject 'RFQ Submission' and attach file:///rfq.docx and file:///pricing.xlsx. -> RFQ Submission email sent to contact@vendor.org with both RFQ and pricing files attached."", ""turn 2: Can you open an image file for me? I'm looking for persistent access to it. -> Image loaded for long‑term access: content://pictures/favorites/photo123.png"", ""turn 3: Create a new image file for editing content://pictures/favorites/photo123.png called photo123_edited.png -> Your new PNG 'photo123_edited.png' is set up at content://images/photo123_edited.png. Go ahead and apply your edits."", ""turn 4: Create a Word document named PhotoDescription.docx for content://temp/photo128.jpg -> Your Word doc 'PhotoDescription.docx' is now at content://documents/PhotoDescription.docx.""]"	Edit it to apply a sepia tone overlay.	Edit content://images/photo123_edited.png to apply a sepia tone overlay.	{'plan': 'ACTION_EDIT_DOCUMENT', 'arguments': {'document_uri': 'content://images/photo123_edited.png', 'content': 'Apply sepia tone overlay'}}	SWAP_T5_R3_S4_I002307-ACTION_EDIT_DOCUMENT-1	['ACTION_SHOW_TIMERS', 'dial', 'open_settings', 'play_music', 'ACTION_EDIT_DOCUMENT']
"['turn 1: Launch the still camera so I can take a shot. -> Still-image camera opened.', ""turn 2: I'm looking for image files to attach to my report. Could you let me choose multiple images? -> All good! Two images ready for you:\n• content://images/img001.jpg\n• content://images/img002.png"", ""turn 3: Create a new text document to list content://images/img001.jpg and content://images/img002.png called ImageList.txt -> Here’s your new text file 'ImageList.txt': content://documents/ImageList.txt. You can now paste in the image URIs."", 'turn 4: Save content://temp/photo123.jpg as a JPEG named Snapshot.jpg -> Snapshot.jpg created and saved at content://pictures/Snapshot.jpg.']"	Edit it to add the URIs content://images/img001.jpg and content://images/img002.png as a numbered list.	Edit content://documents/ImageList.txt to add the URIs content://images/img001.jpg and content://images/img002.png as a numbered list.	{'plan': 'ACTION_EDIT_DOCUMENT', 'arguments': {'document_uri': 'content://documents/ImageList.txt', 'content': '1. content://images/img001.jpg\n2. content://images/img002.png'}}	SWAP_T5_R3_S4_I002308-ACTION_EDIT_DOCUMENT-1	['ACTION_EDIT_DOCUMENT', 'ACTION_INSERT_CONTACT', 'ACTION_PICK', 'ACTION_NAVIGATE_TO_LOCATION', 'ACTION_VIEW_SENT_EMAILS']
"[""turn 1: I want to choose a single PDF report. -> Here's the report you selected: content://docs/annual_report.pdf"", 'turn 2: Could you let me pick a single text file from my device? -> Sure—opening your text files. Pick one to proceed.', ""turn 3: Alright, let's make a new text file called Notes.txt. -> Done—'Notes.txt' has been created at content://documents/Notes.txt. Ready when you are to start typing."", ""turn 4: Create a new image file for content://temp/recent_photo.jpg named LatestShot.jpg -> Got it! Created image file 'LatestShot.jpg' for you at content://documents/LatestShot.jpg""]"	Open it and start with 'Meeting Notes:' as a header	Open content://documents/Notes.txt and start with 'Meeting Notes:' as a header	{'plan': 'ACTION_EDIT_DOCUMENT', 'arguments': {'document_uri': 'content://documents/Notes.txt', 'content': 'Meeting Notes:'}}	SWAP_T5_R3_S4_I002309-ACTION_EDIT_DOCUMENT-1	['web_search', 'INTENT_ACTION_VIDEO_CAMERA', 'ACTION_EDIT_VIDEO', 'open_settings', 'ACTION_EDIT_DOCUMENT']
"['turn 1: Let me pick a melody from the ringtone list. -> Sure—opening the melody list so you can pick a ringtone.', 'turn 2: I need to retrieve a PDF document from my cloud storage. Let me pick one file, please. -> On it—opening the PDF selector. Please pick the file from your cloud storage.', ""turn 3: Create a new file from the PDF selector called NewCloudReport.pdf. -> New PDF 'NewCloudReport.pdf' has been created at content://documents/NewCloudReport.pdf. You can now upload or edit it."", ""turn 4: Make the document selected using the PDF picker a PDF named NewPDF.pdf -> Done! A new PDF called 'NewPDF.pdf' is ready at content://documents/NewPDF.pdf for you to populate.""]"	Edit it to insert a watermark 'Draft' on the first page	Edit content://documents/NewCloudReport.pdf to insert a watermark 'Draft' on the first page	"{'plan': 'ACTION_EDIT_DOCUMENT', 'arguments': {'document_uri': 'content://documents/NewCloudReport.pdf', 'content': ""Insert watermark 'Draft' on first page""}}"	SWAP_T5_R3_S4_I002310-ACTION_EDIT_DOCUMENT-1	['INTENT_ACTION_VIDEO_CAMERA', 'ACTION_INSERT_EVENT', 'ACTION_VIEW_CALL_LOG', 'ACTION_EDIT_DOCUMENT', 'ACTION_VIEW_PLAYLIST']
"['turn 1: Could you launch the MX Player to play this segment: rtsp://example.com/segment.sdp -> MX Player is streaming rtsp://example.com/segment.sdp now. Playback has started.', 'turn 2: From my device, I want to open a single image file for persistent use. -> Alright, opening your images—please select one file for ongoing use.', ""turn 3: Since there's no suitable image, create a new one named Photo.png. -> No image matched your needs, so 'Photo.png' has been created: content://images/Photo.png. You can now add your own picture."", ""turn 4: Make multiple images an image file named Collage.jpg -> Your new JPEG 'Collage.jpg' has been created at content://documents/Collage.jpg. You can now add your images to it.""]"	Edit it to add the caption 'Vacation snapshot from June'	Edit content://images/Photo.png to add the caption 'Vacation snapshot from June'	"{'plan': 'ACTION_EDIT_DOCUMENT', 'arguments': {'document_uri': 'content://images/Photo.png', 'content': ""Add caption 'Vacation snapshot from June'""}}"	SWAP_T5_R3_S4_I002311-ACTION_EDIT_DOCUMENT-1	['ACTION_SHOW_ALARMS', 'ACTION_EDIT_DOCUMENT', 'dial', 'ACTION_SET_RINGTONE', 'get_contact_info']
"['turn 1: Could you start up the camera in photo mode? -> Opening the still image camera now—ready when you are.', 'turn 2: Select the last image I captured -> Got it—your last captured image is here: content://temp/IMG_20240605_160045.jpg', ""turn 3: Create a new image file named Backup.jpg and save content://temp/IMG_20240605_160045.jpg -> Your new image 'Backup.jpg' is saved at content://images/Backup.jpg, copied from content://temp/IMG_20240605_160045.jpg."", ""turn 4: Make the document that is in text format a text file named Journal.txt -> Your text file 'Journal.txt' has been created at content://documents/Journal.txt. Feel free to start editing.""]"	Edit it to add alt text 'Device backup image'	Edit content://images/Backup.jpg to add alt text 'Device backup image'	"{'plan': 'ACTION_EDIT_DOCUMENT', 'arguments': {'document_uri': 'content://images/Backup.jpg', 'content': ""Add alt text 'Device backup image'""}}"	SWAP_T5_R3_S4_I002312-ACTION_EDIT_DOCUMENT-1	['ACTION_SET_TIMER', 'ACTION_EDIT_DOCUMENT', 'INTENT_ACTION_VIDEO_CAMERA', 'ACTION_VIEW_RECENT_APPS', 'ACTION_SHOW_TIMERS']
"['turn 1: Open default camera to shoot a video. -> The video camera is now open and ready to record.', ""turn 2: I'm looking to attach documents in both PDF and plain text formats; let me pick multiple files. -> Opening the file chooser for PDFs and text files. You can select multiple documents."", ""turn 3: Create a new PDF document named AttachedFile.pdf. -> New PDF 'AttachedFile.pdf' created at content://documents/AttachedFile.pdf. You can attach it whenever you’re ready."", ""turn 4: Create a new image/jpeg document for content://temp/photo131.jpg named PhotoCopy131.jpg -> All set! Your copy 'PhotoCopy131.jpg' has been created at content://documents/PhotoCopy131.jpg.""]"	Open it so I can attach it now	Open content://documents/AttachedFile.pdf so I can attach content://documents/AttachedFile.pdf now	{'plan': 'ACTION_OPEN_CONTENT', 'arguments': {'uri': 'content://documents/AttachedFile.pdf'}}	SWAP_T5_R3_S4_I002313-ACTION_OPEN_CONTENT-1	['ACTION_VIEW_SENT_EMAILS', 'ACTION_GET_CONTENT', 'get_contact_info', 'ACTION_OPEN_CONTENT', 'get_contact_info_from_uri']
