conversation_history	query	rewrited_query	answer	unique_idx	candidates
"['turn 1: Show me my recent call log. -> Call log: Alice +1-302-3782 (Missed) - Today 2:45 PM; Bob +1-872-1285 (Outgoing) - Yesterday 1:15 PM; Charlie +1-555-0199 (Incoming) - Today 9:00 AM', 'turn 2: Save +1-555-0199 as a new contact named Alice -> Your new contact Alice (+1-555-0199) is set up. URI: content://contacts/people/alice', ""turn 3: Add company and address to content://contacts/people/alice: 'Acme Corp', '123 Main St, Springfield' -> Alice’s contact is now updated with company ‘Acme Corp’ and address ‘123 Main St, Springfield’. (content://contacts/people/alice)"", 'turn 4: Change the address of content://contacts/people/23 to 742 Evergreen Terrace -> Perfect! Address for content://contacts/people/23 is now set to 742 Evergreen Terrace.']"	Can you show it on a map?	Can you show 123 Main St, Springfield on a map?	{'plan': 'search_location', 'arguments': {'query': '123 Main St, Springfield'}}	SWAP_T5_R3_S4_I002485-search_location-1	['ACTION_VIEW_EVENT', 'ACTION_VIEW_SENT_EMAILS', 'search_location', 'ACTION_EDIT_ALARM', 'ACTION_INSERT_EVENT']
"[""turn 1: Call grandma's cell at 555.123.4567. -> Calling grandma’s cell at 555.123.4567..."", 'turn 2: Pull an email from my stored contacts. -> Email picker is up. Email chosen: content://contacts/email/34.', ""turn 3: Set content://contacts/email/34's name to Robert Johnson. -> Contact entry renamed to Robert Johnson. (URI: content://contacts/email/34)"", 'turn 4: Change content://contacts/address/16 address to 221B Baker Street, London -> Your update is complete: content://contacts/address/16 now has 221B Baker Street, London as its address.']"	Where is his office located?	Where is Robert Johnson's office located?	"{'plan': 'search_location', 'arguments': {'query': ""Robert Johnson's office""}}"	SWAP_T5_R3_S4_I002486-search_location-1	['launch_application', 'ACTION_VIDEO_CAPTURE', 'search_location', 'send_message', 'play_video']
"['turn 1: Please video record our meeting. -> Starting video recording for your meeting now.', 'turn 2: Can you help me pick a contact from my saved directory? -> Sure—contact picker opened. You selected content://contacts/people/12.', ""turn 3: Update content://contacts/people/12's phone number to 555-6789. -> Phone number for the contact has been changed to 555-6789. (content://contacts/people/12)"", ""turn 4: Update content://contacts/people/7's company to OpenAI -> Company field updated to 'OpenAI'. Here's the contact: content://contacts/people/7""]"	Locate it on the map?	Locate content://contacts/people/12 on the map?	{'plan': 'search_location', 'arguments': {'query': 'content://contacts/people/12'}}	SWAP_T5_R3_S4_I002487-search_location-1	['get_contact_info', 'ACTION_CREATE_DOCUMENT', 'search_location', 'ACTION_SET_ALARM', 'ACTION_INSERT_CONTACT']
"['turn 1: Open the font file content://fonts/arial.ttf -> Loading font file arial.ttf from content://fonts/arial.ttf.', 'turn 2: I require a contact from my people directory – please pull up one. -> Contact list opened. Your selection: content://contacts/people/30.', ""turn 3: Set content://contacts/people/30's company to OpenAI -> Company field updated to ‘OpenAI’. (content://contacts/people/30)"", ""turn 4: Add content://contacts/people/7778888's address as 456 Maple Avenue -> Address changed to 456 Maple Avenue for content://contacts/people/7778888. You're all set!""]"	Where is that company located?	Where is OpenAI located?	{'plan': 'search_location', 'arguments': {'query': 'OpenAI'}}	SWAP_T5_R3_S4_I002488-search_location-1	['search_location', 'ACTION_EDIT_ALARM', 'ACTION_EDIT_VIDEO', 'INTENT_ACTION_VIDEO_CAMERA', 'ACTION_VIEW_WEB_HISTORY']
"['turn 1: Show last 10 calls from my call log. -> Last 10 calls:\n1. Alice +1-302-3782 (Missed) - Today 2:45 PM\n2. Charlie +1-555-0199 (Incoming) - Today 9:30 AM\n3. Mom +1-800-123-4567 (Incoming) - Today 6:00 AM\n4. John +44-20-7946-0958 (Outgoing) - Today 11:45 AM\n5. Lisa +61-2-9374-4000 (Missed) - Today 10:15 AM\n6. Restaurant +1-212-555-0199 (Incoming) - Yesterday 8:30 PM\n7. Work +1-646-555-0000 (Outgoing) - Yesterday 4:00 PM\n8. Delivery +1-987-654-3210 (Missed) - Yesterday 5:20 PM\n9. Dad +1-800-765-4321 (Outgoing) - Yesterday 9:00 PM\n10. Gym +1-333-444-5555 (Missed) - Today 7:05 AM', 'turn 2: I want to choose a contact number from my phone directory. -> Phone picker launched. You picked content://contacts/phone/22.', ""turn 3: Change content://contacts/phone/22's address to 1234 Elm Street, Springfield. -> Address updated to ‘1234 Elm Street, Springfield’. (content://contacts/phone/22)"", ""turn 4: Update content://contacts/people/23's email to jane.doe@newdomain.com -> All set! I've updated the email at content://contacts/people/23 to jane.doe@newdomain.com.""]"	Show me that location on a map.	Show me 1234 Elm Street, Springfield on a map.	{'plan': 'search_location', 'arguments': {'query': '1234 Elm Street, Springfield'}}	SWAP_T5_R3_S4_I002489-search_location-1	['ACTION_SET_ALARM', 'search_location', 'open_settings', 'ACTION_CREATE_DOCUMENT', 'launch_application']
['turn 1: Please take a photo and let the system decide where to save it. -> Got it. Photo taken and stored at content://media/internal/photos/IMG_20230615_100200.jpg.', 'turn 2: Select a personal contact entry from my list. -> Personal contacts shown. You chose content://contacts/people/27.', 'turn 3: Add an address to content://contacts/people/27: 123 Maple Street, Springfield -> Address added: 123 Maple Street, Springfield. (content://contacts/people/27)', 'turn 4: Edit content://contacts/address/15 and change the address to 789 Oak Street, Springfield. -> Your mailing address now reads 789 Oak Street, Springfield at content://contacts/address/15.']	Can you find that on a map?	Can you find 123 Maple Street, Springfield on a map?	{'plan': 'search_location', 'arguments': {'query': '123 Maple Street, Springfield'}}	SWAP_T5_R3_S4_I002490-search_location-1	['ACTION_NAVIGATE_TO_LOCATION', 'ACTION_OPEN_DOCUMENT', 'search_location', 'ACTION_VIEW_CONTACT', 'ACTION_SET_ALARM']
['turn 1: Access ringtone options for my evening alarm. -> Accessing ringtone options for your evening alarm now.', 'turn 2: Please retrieve the address from the contact record at /user/info/hello_world. -> The address stored at /user/info/hello_world is 99 Infinite Loop, Imaginary City, ZX 12345.', 'turn 3: Add an email for /user/info/hello_world: hello@imaginary.com -> All set! I’ve added hello@imaginary.com to your contact. You can find the updated record here: /user/info/hello_world.', 'turn 4: Edit content://contacts/address/89 to replace the address with 123 Elm Street, Springfield -> Sure thing! Address at content://contacts/address/89 is now 123 Elm Street, Springfield.']	Could you show that address on the map?	Could you show 99 Infinite Loop, Imaginary City, ZX 12345 on the map?	{'plan': 'search_location', 'arguments': {'query': '99 Infinite Loop, Imaginary City, ZX 12345'}}	SWAP_T5_R3_S4_I002491-search_location-1	['ACTION_SET_RINGTONE', 'ACTION_VIEW_WEB_HISTORY', 'search_location', 'ACTION_GET_CONTENT', 'send_email']
"['turn 1: Please load content://documents/doc/638. -> The file at content://documents/doc/638 has been loaded. You can start editing as soon as you like.', 'turn 2: I want to know the address for the contact listed at /user/profile/jack. -> Jack’s address is 456 Oak Avenue, Building 12, Floor 3, New York, NY 10001.', 'turn 3: Update the contact listed at /user/profile/jack with a new address 789 Birch Road, Floor 2, New York, NY 10001 -> Your update is complete! Jack’s contact now shows the new address at 789 Birch Road, Floor 2. Record saved at /user/profile/jack.', ""turn 4: Change content://contacts/addresses/27's address to 456 Elm St, Springfield, IL 62705. -> Address updated—all set! The selected contact's address is now 456 Elm St, Springfield, IL 62705 (content://contacts/addresses/27).""]"	Where is it located on the map?	Where is 789 Birch Road, Floor 2, New York, NY 10001 located on the map?	{'plan': 'search_location', 'arguments': {'query': '789 Birch Road, Floor 2, New York, NY 10001'}}	SWAP_T5_R3_S4_I002492-search_location-1	['search_location', 'ACTION_GET_CONTENT', 'send_message', 'ACTION_EDIT_VIDEO', 'ACTION_INSERT_CONTACT']
"['turn 1: Please extract the address for the person stored at content://contacts/people/2718. -> Here’s the address: 2718 Pine Lane, Rivertown, TX 75001.', 'turn 2: Show content://contacts/people/2718 -> Alright—bringing up the contact at content://contacts/people/2718. You should see the full profile now.', 'turn 3: Edit content://contacts/people/2718 to update the phone number to 555-123-4567 -> Got it—555-123-4567 is now saved as the phone for content://contacts/people/2718.', ""turn 4: Update content://contacts/address/42's address to 123 New Road, London -> Success! The address for content://contacts/address/42 is now 123 New Road, London.""]"	Where is it on the map?	Where is 2718 Pine Lane, Rivertown, TX 75001 on the map?	{'plan': 'search_location', 'arguments': {'query': '2718 Pine Lane, Rivertown, TX 75001'}}	SWAP_T5_R3_S4_I002493-search_location-1	['ACTION_VIEW_SENT_MESSAGES', 'ACTION_EDIT_VIDEO', 'search_location', 'ACTION_VIEW_CONTACT', 'ACTION_NAVIGATE_TO_LOCATION']
"[""turn 1: Email alpha.testers@domain.org the onboarding guide (file:///onboarding.pdf) and the policy document (file:///policy.docx). Use subject 'Welcome Pack'. -> Welcome Pack sent to alpha.testers@domain.org with onboarding and policy attachments."", 'turn 2: I require the address details of the contact at /user/info/samuel. -> Samuel’s address is 1600 Amphitheatre Parkway, Mountain View, CA 94043.', 'turn 3: Update the contact at /user/info/samuel to add email samuel@google.com and phone 650-253-0000. -> Updated /user/info/samuel with email samuel@google.com and phone 650-253-0000.', 'turn 4: Create a contact for (555) 123-4567 -> Your contact for (555) 123-4567 has been added successfully. Here’s the URI: content://contacts/people/1003.']"	Show that on a map.	Show 1600 Amphitheatre Parkway, Mountain View, CA 94043 on a map.	{'plan': 'search_location', 'arguments': {'query': '1600 Amphitheatre Parkway, Mountain View, CA 94043'}}	SWAP_T5_R3_S4_I002494-search_location-1	['ACTION_OPEN_DOCUMENT', 'play_music', 'ACTION_SHOW_ALARMS', 'search_location', 'ACTION_PICK']
"[""turn 1: Let me look at my sent email list. -> Your sent folder contains: to gina@example.com - 'Budget Report'; to harry@example.com - 'Weekly Sync'; to iris@example.com - 'Proposal Draft'."", 'turn 2: Please get the address details for the contact with URI /contact/info/sara. -> Sara’s address on file is 128 Cherry Lane, Maple Town, CA 90210.', ""turn 3: Update /contact/info/sara's address to 500 Elm Street, Gotham City, NY 10001 -> Address for /contact/info/sara has been changed to 500 Elm Street, Gotham City, NY 10001."", 'turn 4: Store +1-303-555-0119 in my contacts -> Done! +1-303-555-0119 is now saved. View it anytime at content://contacts/people/3035550119']"	Show me its location on the map.	Show me 500 Elm Street, Gotham City, NY 10001 location on the map.	{'plan': 'search_location', 'arguments': {'query': '500 Elm Street, Gotham City, NY 10001'}}	SWAP_T5_R3_S4_I002495-search_location-1	['open_settings', 'ACTION_OPEN_DOCUMENT', 'play_video', 'search_location', 'ACTION_INSERT_EVENT']
"['turn 1: Begin video shoot. -> Recording complete! The video is now available at content://device/videos/video123.mp4.', 'turn 2: Retrieve the full contact summary from /contacts/john_doe. -> Full summary for /contacts/john_doe:\nName: John Doe\nPhone: (555) 123-4567\nEmail: john.doe@contact.com\nAddress: 789 Oak Avenue, Springfield, IL', ""turn 3: Change /contacts/john_doe's name to Jonathan Doe and email to jonathan.doe@newmail.com -> Your changes are in—/contacts/john_doe is now Jonathan Doe, email set to jonathan.doe@newmail.com."", 'turn 4: Save +1-415-555-0199 under a new contact -> Great news—your new contact has been created. You can find it at content://contacts/people/4155550199']"	Can you pin that address on the map?	Can you pin 789 Oak Avenue, Springfield, IL on the map?	{'plan': 'search_location', 'arguments': {'query': '789 Oak Avenue, Springfield, IL'}}	SWAP_T5_R3_S4_I002496-search_location-1	['play_music', 'ACTION_SET_TIMER', 'search_location', 'ACTION_PICK', 'ACTION_OPEN_DOCUMENT']
"['turn 1: Could you let me choose a number to call from contacts? -> Certainly—displaying your contact phone numbers. Please select one to call.', 'turn 2: I need a complete summary of the contact details for /contacts/alexander. -> Complete details for /contacts/alexander:\nName: Alexander\nPhone: (404) 555-0168\nEmail: alexander@contacts.org\nAddress: 56 Pine Street, Atlanta, GA', ""turn 3: Edit /contacts/alexander's address to 123 Oak Avenue, New York, NY -> Done—the address for /contacts/alexander is now 123 Oak Avenue, New York, NY."", 'turn 4: Create a new contact named Quentin Blake with (212) 555‑0123 -> Contact Quentin Blake has been added! Check it out here: content://contacts/people/quentin_blake']"	Where is it located on the map?	Where is 123 Oak Avenue, New York, NY located on the map?	{'plan': 'search_location', 'arguments': {'query': '123 Oak Avenue, New York, NY'}}	SWAP_T5_R3_S4_I002497-search_location-1	['ACTION_PICK', 'ACTION_SHOW_ALARMS', 'ACTION_INSERT_EVENT', 'ACTION_INSERT_CONTACT', 'search_location']
"['turn 1: Add Lucas Wright to my address book with phone: 321-654-0987 and home address: 456 Maple Street. -> Creating Lucas Wright’s contact: phone 321‑654‑0987 and address 456 Maple Street are filled in.', 'turn 2: Dial 321-654-0987 now -> Calling 321-654-0987 now...', 'turn 3: Add 321-654-0987 to my contacts -> Creating a new contact entry: telephone 321-654-0987 is pre-populated.', ""turn 4: Store content://contacts/phone/67 under 'Friend' with a note 'Met at conference'. -> I created 'Friend' (from content://contacts/phone/67) with note 'Met at conference'. Access it here: content://contacts/people/friend_67""]"	Open that address on map	Open 456 Maple Street on map	{'plan': 'search_location', 'arguments': {'query': '456 Maple Street'}}	SWAP_T5_R3_S4_I002498-search_location-1	['INTENT_ACTION_STILL_IMAGE_CAMERA', 'launch_application', 'ACTION_VIEW_PLAYLIST', 'ACTION_SHOW_TIMERS', 'search_location']
"['turn 1: Give me a summary of the contact at content://contacts/people/42. -> Here’s what I found:\n• Name: Michael Lee\n• Phone: 555-987-6543\n• Email: michael.lee42@example.com\n• Address: 321 Oak St, Centerville, OH 45459', 'turn 2: Call 555-987-6543 -> Placing a call to 555-987-6543...', 'turn 3: Create new contact from the call to 555-987-6543 with address 321 Oak St, Centerville, OH 45459 -> Starting a new contact: phone 555-987-6543 and address 321 Oak St, Centerville, OH 45459 are pre-filled.', ""turn 4: Add 555-123-4567 as 'Boss' and include an address '123 Business Rd' -> Boss has been added to your contacts with phone 555-123-4567 and address 123 Business Rd. You can view it here: content://contacts/people/boss""]"	Show it on a map	Show 321 Oak St, Centerville, OH 45459 on a map	{'plan': 'search_location', 'arguments': {'query': '321 Oak St, Centerville, OH 45459'}}	SWAP_T5_R3_S4_I002499-search_location-1	['ACTION_SET_ALARM', 'INTENT_ACTION_STILL_IMAGE_CAMERA', 'ACTION_SHOW_TIMERS', 'INTENT_ACTION_VIDEO_CAMERA', 'search_location']
['turn 1: Please obtain the main phone using content://contacts/890/phone_main. -> Main phone number retrieved: +1-202-555-0198.', 'turn 2: Dial +1-202-555-0198. -> Calling +1-202-555-0198 right away...', 'turn 3: Add +1-202-555-0198 to contacts -> Opening contact creation screen with main phone +1-202-555-0198 entered.', 'turn 4: Store content://contacts/people/42 as a new contact -> Okay, created a new contact based on content://contacts/people/42. You can access it here: content://contacts/people/142']	Search for their address on the map	Search for address of +1-202-555-0198 on the map	{'plan': 'search_location', 'arguments': {'query': '+1-202-555-0198'}}	SWAP_T5_R3_S4_I002500-search_location-1	['INTENT_ACTION_VIDEO_CAMERA', 'get_contact_info', 'open_settings', 'ACTION_EDIT_ALARM', 'search_location']
"[""turn 1: Send a quick reminder to John at +15551234567 saying 'Don't forget the meeting at 3pm today.' -> Your reminder has been sent to +15551234567."", 'turn 2: Give +15551234567 a quick call -> Initiating call to +15551234567...', 'turn 3: Create a new contact with +15551234567 -> Initiating contact setup: +15551234567 is entered.', 'turn 4: Save +1-800-123-4567 as a new contact Sarah Parker -> Sarah Parker (+1-800-123-4567) has been added to your address book. Here’s the entry: content://contacts/people/sarah_parker']"	Find their address using the map app	Find +15551234567's address using the map app	{'plan': 'search_location', 'arguments': {'query': '+15551234567'}}	SWAP_T5_R3_S4_I002501-search_location-1	['ACTION_VIEW_PLAYLIST', 'search_location', 'ACTION_SET_ALARM', 'ACTION_GET_CONTENT', 'open_settings']
['turn 1: Make a call to 030-1234-5678 now! -> Placing a call to 030-1234-5678...', 'turn 2: What calls have I made and received recently? -> Recent calls: 030-1234-5678 (Outgoing) - Today 2:30 PM; 212-555-0182 (Missed) - Today 1:15 PM; Dad +1-415-555-0198 (Incoming) - Sep 12, 6:45 PM', 'turn 3: Save 212-555-0182 as a new contact named Dentist -> Done. Dentist (212-555-0182) has been added to your address book.', 'turn 4: Save +1-800-555-0000 as a new contact Emma Watson -> Emma Watson (+1-800-555-0000) was successfully added. View here: content://contacts/people/emma_watson']	Search for her on the map	Search for Dentist on the map	{'plan': 'search_location', 'arguments': {'query': 'Dentist'}}	SWAP_T5_R3_S4_I002502-search_location-1	['ACTION_SET_ALARM', 'ACTION_SET_TIMER', 'send_message', 'search_location', 'INTENT_ACTION_VIDEO_CAMERA']
"['turn 1: Ring up Dr. Mills at (212) 555-3344. -> Connecting you to (212) 555-3344...', ""turn 2: Show my recent call logs. -> Here's what I found: Dr. Mills +1-212-555-3344 (Missed) - Today 9:30 AM; Bob +1-872-1285 (Outgoing) - Yesterday 4:10 PM; Carol +44 20 7946 0958 (Incoming) - Sep 11, 11:00 AM"", 'turn 3: Save +44 20 7946 0958 as a new contact Carol -> Sure thing, Carol at +44 20 7946 0958 is now saved in your contacts.', 'turn 4: Save +1-212-555-0147 as a new contact Dr Stevens -> Great news! I’ve saved Dr Stevens (+1-212-555-0147). You can find it at content://contacts/people/dr_stevens']"	Show her location on the map	Show Carol's location on the map	{'plan': 'search_location', 'arguments': {'query': 'Carol'}}	SWAP_T5_R3_S4_I002503-search_location-1	['ACTION_VIEW_SENT_MESSAGES', 'search_location', 'play_video', 'get_contact_info_from_uri', 'ACTION_VIEW_CONTACT']
"['turn 1: I want to reach my voicemail; dial *86. -> Dialing *86 to access your voicemail...', 'turn 2: What calls have I made today? -> Latest calls: *86 (Outgoing) - Today 5:00 PM; 987-654-3210 (Incoming) - Yesterday 6:20 PM; 555-1234 (Missed) - Sep 12, 8:15 AM', 'turn 3: Save 987-654-3210 as a new contact Brian -> Brian (987-654-3210) has been added to your contacts.', ""turn 4: Save +1-305-555-0199 as Leo Smith -> Your contact 'Leo Smith' (+1-305-555-0199) was added successfully. URI: content://contacts/people/leo_smith""]"	Open his location	Open Brian's location	{'plan': 'search_location', 'arguments': {'query': 'Brian'}}	SWAP_T5_R3_S4_I002504-search_location-1	['open_settings', 'search_location', 'ACTION_CREATE_DOCUMENT', 'ACTION_VIEW_SENT_MESSAGES', 'ACTION_GET_CONTENT']
"['turn 1: Could you please connect me to +49 89 636-48018? -> Alright, dialing +49 89 636-48018...', ""turn 2: I'd like to see my call history. -> Recent call log: +49 89 636-48018 (Outgoing) - Today 1:45 PM; 555-0199 (Missed) - Today 12:00 PM; Emily +1-619-555-0175 (Incoming) - Sep 10, 4:30 PM"", 'turn 3: Save 555-0199 as a new contact Sam -> Got it. Sam (555-0199) has been stored as a new contact.', ""turn 4: Add a barbecue at 2718 Pine Lane, Rivertown, TX 75001 on Saturday from 3pm to 6pm with the note 'Bring your own grill'. -> Your 'Barbecue' is now on the calendar for Saturday, 3:00\xa0PM–6:00\xa0PM at 2718 Pine Lane, Rivertown, TX\xa075001. Event URI: content://calendar/event/11""]"	Find his location	Find Sam's location	{'plan': 'search_location', 'arguments': {'query': 'Sam'}}	SWAP_T5_R3_S4_I002505-search_location-1	['search_location', 'ACTION_OPEN_DOCUMENT', 'ACTION_IMAGE_CAPTURE', 'ACTION_VIEW_SENT_MESSAGES', 'ACTION_SET_ALARM']
"['turn 1: Call the front desk at +81-3-1234-5678. -> Calling +81-3-1234-5678 now...', ""turn 2: Give me the list of my recent calls. -> Here's your recent call log: +81-3-1234-5678 (Outgoing) - Today 3:50 PM; 020-7946-0958 (Incoming) - Today 10:10 AM; +1-800-123-4567 (Missed) - Yesterday 7:00 PM"", ""turn 3: Save +1-800-123-4567 as a new contact Support -> New contact 'Support' (+1-800-123-4567) saved successfully."", ""turn 4: Add a client call to 789 Pine Avenue, Apt. 5B, Metropolis, CA 90210 next Tuesday from 10 AM to 10:30 AM titled 'Client Follow-Up' with the description 'Review quarterly results' -> Client Follow‑Up call has been added next Tuesday from 10:00\xa0AM to 10:30\xa0AM at 789 Pine Avenue, Apt.\xa05B, Metropolis, CA\xa090210. Event URI: content://calendar/event/14""]"	Locate it on a map.	Locate +1-800-123-4567 on a map.	{'plan': 'search_location', 'arguments': {'query': '+1-800-123-4567'}}	SWAP_T5_R3_S4_I002506-search_location-1	['ACTION_VIEW_CONTACT', 'search_location', 'web_search', 'send_message', 'play_music']
"['turn 1: Place a call to the toll-free line 0800 123 456. -> Connecting to 0800 123 456...', 'turn 2: Display my call log. -> Call log: 0800 123 456 (Outgoing) - Today 9:00 AM; 4044044044 (Incoming) - Yesterday 11:45 AM; Mom +1-415-555-0123 (Missed) - Sep 11, 5:30 PM', 'turn 3: Save 4044044044 as a new contact John Smith -> John Smith (4044044044) is now in your contacts.', ""turn 4: Set a dentist appointment at 456 Cedar Lane, Chicago, IL 60607 on July 15 from 9 AM to 10 AM titled 'Dental Checkup' with the description 'Routine cleaning' -> Your 'Dental Checkup' is booked for July\xa015, 9:00\xa0AM–10:00\xa0AM at 456 Cedar Lane, Chicago, IL\xa060607 (Routine cleaning). Event URI: content://calendar/event/16""]"	Show its location on the map.	Show 4044044044's location on the map.	{'plan': 'search_location', 'arguments': {'query': '4044044044'}}	SWAP_T5_R3_S4_I002507-search_location-1	['ACTION_SET_RINGTONE', 'ACTION_OPEN_CONTENT', 'ACTION_EDIT_DOCUMENT', 'search_location', 'ACTION_EDIT_CONTACT']
"['turn 1: Open the memory card options, please. -> Memory card settings opened — you can now manage your external storage.', 'turn 2: Find the nearest gas station -> Sure thing. The nearest gas station is Shell, 842 Elm Street, Springfield.', ""turn 3: Create an event called Fill Up at Shell, 842 Elm Street, Springfield tomorrow at 3 PM and ending at 3:30 PM with description Fill the tank -> Sure—I've added 'Fill Up at Shell' to your calendar for tomorrow from 3:00 PM to 3:30 PM at 842 Elm Street, Springfield. You can view it here: content://calendar/event/1"", ""turn 4: Add a conference call at 321 Elm Street, Boulder, CO 80302 tomorrow from 8 AM to 9 AM titled 'Project Sync' with the description 'Update on deliverables' -> Project Sync conference call is on your calendar for tomorrow from 8:00\xa0AM to 9:00\xa0AM at 321 Elm Street, Boulder, CO\xa080302. Event URI: content://calendar/event/18""]"	Can you show me where that is on the map?	Can you show me where 842 Elm Street, Springfield is on the map?	{'plan': 'search_location', 'arguments': {'query': '842 Elm Street, Springfield'}}	SWAP_T5_R3_S4_I002508-search_location-1	['play_video', 'ACTION_GET_RINGTONE', 'ACTION_INSERT_EVENT', 'ACTION_SHOW_ALARMS', 'search_location']
"['turn 1: Launch internal storage settings so I can free up some space. -> Internal storage settings opened successfully. You can now free up space.', 'turn 2: Search for a coffee shop nearby -> Got it! There’s a coffee shop called Café Aroma at 58 Maple Avenue, Springfield.', ""turn 3: Set a meeting at 58 Maple Avenue, Springfield next Monday at 10 AM titled Coffee Break with description Catch up over coffee ending at 11 AM -> All set! Your 'Coffee Break' event is scheduled next Monday, 10:00 AM–11:00 AM at 58 Maple Avenue, Springfield. Check it out: content://calendar/event/2"", ""turn 4: Schedule a planting session at 256 Greenway Lane, Springfield, IL 62704 this Saturday from 9 AM to 11 AM titled 'Seed Starting' with description 'Begin seeds for community garden'. -> Seed Starting event is set for this Saturday from 9:00\xa0AM to 11:00\xa0AM at 256 Greenway Lane, Springfield, IL\xa062704 (Begin seeds for community garden). Event URI: content://calendar/event/20""]"	Could you map that meeting location?	Could you map 58 Maple Avenue, Springfield?	{'plan': 'search_location', 'arguments': {'query': '58 Maple Avenue, Springfield'}}	SWAP_T5_R3_S4_I002509-search_location-1	['play_video', 'web_search', 'search_location', 'ACTION_GET_CONTENT', 'ACTION_VIEW_SENT_MESSAGES']
