conversation_history	query	rewrited_query	answer	unique_idx	candidates
"['turn 1: I need to capture a photo—launch the camera for me, please. -> Got it! The camera app in photo mode has been launched.', 'turn 2: Choose the image I just snapped -> Selected the photo you just took: content://temp/IMG_20240605_161230.jpg', ""turn 3: Create a new text document named ImageRecord.txt to note content://temp/IMG_20240605_161230.jpg -> Nice! I’ve created 'ImageRecord.txt'. You can find it at content://documents/ImageRecord.txt."", ""turn 4: Create a new image/jpeg document for content://temp/photo130.jpg named PhotoCopy130.jpg -> Done! 'PhotoCopy130.jpg' is saved here: content://documents/PhotoCopy130.jpg.""]"	Email that text file to teamlead@example.com with a note that it's the record of the image	Email content://documents/ImageRecord.txt to teamlead@example.com with a note that it's the record of the image	"{'plan': 'send_email', 'arguments': {'to': 'teamlead@example.com', 'body': ""it's the record of the image"", 'attachments': ['content://documents/ImageRecord.txt']}}"	SWAP_T5_R3_S4_I002383-send_email-1	['send_email', 'get_contact_info', 'ACTION_SET_RINGTONE', 'ACTION_SHOW_TIMERS', 'ACTION_VIEW_WEB_HISTORY']
"['turn 1: Initiate video recording app. -> Video camera is open and ready to record.', 'turn 2: Choose multiple videos from my camera roll -> Opening video gallery—pick the clips you need.', ""turn 3: Put the clips from my camera roll into a new document named VideosArchive.zip. -> All set—your archive 'VideosArchive.zip' has been created at content://archives/VideosArchive.zip."", ""turn 4: Create a new image/jpeg document for content://temp/photo133.jpg named PhotoCopy133.jpg -> Here you go—'PhotoCopy133.jpg' has been created at content://documents/PhotoCopy133.jpg.""]"	Email that zip archive to archive@company.com and mention it's the video backup	Email content://archives/VideosArchive.zip to archive@company.com and mention it's the video backup	"{'plan': 'send_email', 'arguments': {'to': 'archive@company.com', 'body': ""it's the video backup"", 'attachments': ['content://archives/VideosArchive.zip']}}"	SWAP_T5_R3_S4_I002384-send_email-1	['ACTION_OPEN_DOCUMENT', 'send_email', 'ACTION_EDIT_VIDEO', 'open_settings', 'ACTION_VIEW_EVENT']
"[""turn 1: Create a reminder called 'Anniversary Dinner' on December 1, 2024 at 7:30 PM to 10:00 PM at The Olive Branch, desc: Celebrate with spouse. -> All set! 'Anniversary Dinner' is planned for December 1, 2024, 7:30\xa0PM–10:00\xa0PM at The Olive Branch. Here's the event: content://calendar/event/1010"", 'turn 2: Help me bring up a file picker to choose multiple plain text documents for review. -> Opening the document picker—select one or more plain text files.', ""turn 3: Create a new plain text document named ReviewNotes.txt. -> Done! Text file 'ReviewNotes.txt' created at content://documents/ReviewNotes.txt. You can start adding your review notes now."", ""turn 4: Create a new PDF document named LatestShot.pdf and put content://temp/latest_shot.jpg there. -> Your PDF 'LatestShot.pdf' is now ready at content://documents/LatestShot.pdf.""]"	Send it to reviewer@example.com with subject 'Review Notes'	Send content://documents/ReviewNotes.txt to reviewer@example.com with subject 'Review Notes'	{'plan': 'send_email', 'arguments': {'to': 'reviewer@example.com', 'subject': 'Review Notes', 'attachments': ['content://documents/ReviewNotes.txt']}}	SWAP_T5_R3_S4_I002385-send_email-1	['ACTION_SET_TIMER', 'send_email', 'ACTION_GET_CONTENT', 'ACTION_VIEW_SENT_MESSAGES', 'INTENT_ACTION_VIDEO_CAMERA']
"['turn 1: Put an alarm at midnight to mark the new day. -> All set! Alarm (ID: alarm_no2) is scheduled for 12:00 AM: Mark new day.', 'turn 2: I want to use the document picker to select a PDF for some editing tasks. -> Opening the PDF document picker now. Please choose a file to edit.', ""turn 3: If no PDF is found, create one named NewDraft.pdf. -> All set! New PDF 'NewDraft.pdf' has been created at content://documents/NewDraft.pdf. Let me know when you'd like to edit it."", ""turn 4: Create a new PDF named HolidayCollage.pdf and import content://gallery/holiday1.jpg, content://gallery/holiday2.jpg, content://gallery/holiday3.jpg, and content://gallery/holiday4.jpg all into it. -> All done! 'HolidayCollage.pdf' has been generated at content://documents/HolidayCollage.pdf.""]"	Email it to me at me@example.com with note 'Here is the draft'	Email content://documents/NewDraft.pdf to me@example.com with note 'Here is the draft'	{'plan': 'send_email', 'arguments': {'to': 'me@example.com', 'body': 'Here is the draft', 'attachments': ['content://documents/NewDraft.pdf']}}	SWAP_T5_R3_S4_I002386-send_email-1	['dial', 'ACTION_EDIT_DOCUMENT', 'ACTION_EDIT_ALARM', 'ACTION_GET_RINGTONE', 'send_email']
"['turn 1: Open default camera to shoot a video. -> The video camera is now open and ready to record.', ""turn 2: I'm looking to attach documents in both PDF and plain text formats; let me pick multiple files. -> Opening the file chooser for PDFs and text files. You can select multiple documents."", ""turn 3: Create a new PDF document named AttachedFile.pdf. -> New PDF 'AttachedFile.pdf' created at content://documents/AttachedFile.pdf. You can attach it whenever you’re ready."", ""turn 4: Create a new PDF named PhotoCapture.pdf with content://temp/last_capture.jpg image -> Created! Check out 'PhotoCapture.pdf' at content://documents/PhotoCapture.pdf.""]"	Send that PDF to partner@example.com	Send content://documents/AttachedFile.pdf to partner@example.com	{'plan': 'send_email', 'arguments': {'to': 'partner@example.com', 'attachments': ['content://documents/AttachedFile.pdf']}}	SWAP_T5_R3_S4_I002387-send_email-1	['get_contact_info_from_uri', 'ACTION_VIEW_PLAYLIST', 'ACTION_SHOW_TIMERS', 'ACTION_OPEN_CONTENT', 'send_email']
"['turn 1: Open content://files/lecture.mp4 without any edits. -> Opening lecture.mp4 in the video editor now. Let me know if you want to trim or mute anything once it’s loaded!', 'turn 2: Provide a file selection for multiple images; I need to choose several. -> Okay, opening the image picker—select the pictures you need.', ""turn 3: If there aren’t any images, create one named GalleryPic1.jpg. -> No images were found—so I created 'GalleryPic1.jpg' at content://documents/GalleryPic1.jpg. You can view it right away."", 'turn 4: Create a new image file named Snapshot.jpg for content://temp/camera_last.jpg -> Snapshot.jpg has been created successfully at content://documents/Snapshot.jpg.']"	Email it to sarah@company.com	Email content://documents/GalleryPic1.jpg to sarah@company.com	{'plan': 'send_email', 'arguments': {'to': 'sarah@company.com', 'attachments': ['content://documents/GalleryPic1.jpg']}}	SWAP_T5_R3_S4_I002388-send_email-1	['ACTION_GET_RINGTONE', 'INTENT_ACTION_VIDEO_CAMERA', 'ACTION_VIEW_CONTACT', 'ACTION_VIEW_SENT_MESSAGES', 'send_email']
"[""turn 1: Common symptoms associated with type 2 diabetes. -> Searching for 'common symptoms of type 2 diabetes'... Preview: fatigue, frequent urination, increased thirst, blurred vision and slow-healing wounds are commonly listed."", 'turn 2: I want to choose one PDF document for permanent access. Please open the file chooser. -> Opening the PDF-only picker. Choose a single PDF document for permanent access.', ""turn 3: Alright, let's make a new PDF document for permanent access and call it Report.pdf. -> Your permanent PDF 'Report.pdf' has been created at content://documents/Report.pdf. It’s saved and ready for long‑term access."", ""turn 4: Save content://temp/recent_image.jpg to a new PDF document named SavedImage.pdf -> Great news! Your new PDF 'SavedImage.pdf' is ready at content://documents/SavedImage.pdf.""]"	Email it to boss@company.com with the PDF attached	Email content://documents/Report.pdf to boss@company.com with the PDF attached	{'plan': 'send_email', 'arguments': {'to': 'boss@company.com', 'attachments': ['content://documents/Report.pdf']}}	SWAP_T5_R3_S4_I002389-send_email-1	['ACTION_NAVIGATE_TO_LOCATION', 'ACTION_VIEW_WEB_HISTORY', 'ACTION_EDIT_DOCUMENT', 'ACTION_VIDEO_CAPTURE', 'send_email']
"[""turn 1: Adjust alarm 15 to 09:55, label 'Call Mom', vibrate off. -> Updated Alarm 15 to 9:55\xa0AM with label 'Call Mom' and vibration turned off."", 'turn 2: Open a plain text file from my documents — just one file, please. -> Opening the plain text document picker—please select one file.', ""turn 3: Okay, let's create a new plain text file and name it Draft.txt. -> Got it—your new text file 'Draft.txt' is ready at content://documents/Draft.txt. Start typing whenever you like."", ""turn 4: Save content://temp/last_photo.jpg as a PDF named MyLatestPhoto.pdf -> Done—I've created 'MyLatestPhoto.pdf' at content://documents/MyLatestPhoto.pdf.""]"	Email it to editor@publisher.com with subject 'First Draft Attached'	Email content://documents/Draft.txt to editor@publisher.com with subject 'First Draft Attached'	{'plan': 'send_email', 'arguments': {'to': 'editor@publisher.com', 'subject': 'First Draft Attached', 'attachments': ['content://documents/Draft.txt']}}	SWAP_T5_R3_S4_I002390-send_email-1	['ACTION_OPEN_DOCUMENT', 'ACTION_NAVIGATE_TO_LOCATION', 'ACTION_EDIT_DOCUMENT', 'send_email', 'ACTION_EDIT_ALARM']
"['turn 1: Fetch only email from content://org.addressbook/entries/222. -> Here’s the email for content://org.addressbook/entries/222: jane.doe@example.com.', 'turn 2: Could I select one image only? I just need access to a single image document. -> Launching the image document picker—please select one image.', ""turn 3: Great, create a new one of launching the image document picker and name it Picture.jpg. -> New image file 'Picture.jpg' created at content://documents/Picture.jpg. Let me know if you’d like to open it."", ""turn 4: Save content://temp/20240615_101200.jpg to a new PDF called MeetingPhoto.pdf -> All set! 'MeetingPhoto.pdf' is now available at content://documents/MeetingPhoto.pdf.""]"	Email it to friend@example.com with subject 'Check it out' and body 'Let me know what you think.'	Email content://documents/Picture.jpg to friend@example.com with subject 'Check it out' and body 'Let me know what you think.'	{'plan': 'send_email', 'arguments': {'to': 'friend@example.com', 'subject': 'Check it out', 'body': 'Let me know what you think.', 'attachments': ['content://documents/Picture.jpg']}}	SWAP_T5_R3_S4_I002391-send_email-1	['search_location', 'ACTION_INSERT_EVENT', 'ACTION_OPEN_DOCUMENT', 'send_email', 'INTENT_ACTION_VIDEO_CAMERA']
"['turn 1: Recording time, store as content://timelapse/tl_video.mp4. -> Got it—starting video capture now and saving to content://timelapse/tl_video.mp4.', 'turn 2: Please allow me to choose a single PDF file from my list; one is enough. -> Opening the PDF file chooser—select a single PDF document.', ""turn 3: Sure, create a new PDF and call it Invoice.pdf. -> All done! Your PDF 'Invoice.pdf' is created at content://documents/Invoice.pdf. You can review it anytime."", ""turn 4: Create a new image file for content://temp/recent_photo.jpg named LatestShot.jpg -> Got it! Created image file 'LatestShot.jpg' for you at content://documents/LatestShot.jpg""]"	Email it to accounting@finance.com with subject 'Invoice', body 'Please process this invoice at your earliest convenience.' and attach it	Email content://documents/Invoice.pdf to accounting@finance.com with subject 'Invoice', body 'Please process this invoice at your earliest convenience.' and attach content://documents/Invoice.pdf	{'plan': 'send_email', 'arguments': {'to': 'accounting@finance.com', 'subject': 'Invoice', 'body': 'Please process this invoice at your earliest convenience.', 'attachments': ['content://documents/Invoice.pdf']}}	SWAP_T5_R3_S4_I002392-send_email-1	['ACTION_PICK', 'ACTION_INSERT_EVENT', 'send_email', 'get_contact_info_from_uri', 'ACTION_SHOW_TIMERS']
"['turn 1: Provide me with the active timer list. -> Your active timers: 10 minutes - Workout, 5 minutes - Tea, 20 minutes - Baking.', ""turn 2: Help me pick a single plain text document from my storage. -> Certainly. Here's the file browser for text documents—pick the one you’d like."", ""turn 3: If none of the text documents from my storage work, create one named MeetingNotes.txt. -> New document 'MeetingNotes.txt' is ready at content://documents/MeetingNotes.txt. You can now jot down your meeting notes."", ""turn 4: Make multiple images an image file named Collage.jpg -> Your new JPEG 'Collage.jpg' has been created at content://documents/Collage.jpg. You can now add your images to it.""]"	Email that document to the team with the subject Meeting Notes	Email content://documents/MeetingNotes.txt to the team with the subject Meeting Notes	{'plan': 'send_email', 'arguments': {'to': 'the team', 'subject': 'Meeting Notes', 'attachments': ['content://documents/MeetingNotes.txt']}}	SWAP_T5_R3_S4_I002393-send_email-1	['play_music', 'ACTION_VIEW_CONTACT', 'send_email', 'ACTION_EDIT_VIDEO', 'play_video']
"['turn 1: Show me the way to 350 Fifth Avenue, New York, NY. -> 350 Fifth Avenue, New York, NY navigation initiated. Follow the turn-by-turn instructions.', 'turn 2: I need to select documents in both text and PDF formats. I plan to pick more than one file; please enable multiple selections. -> Multiple-document selector: files chosen are\n– content://storage/docs/meeting.txt\n– content://storage/docs/summary.pdf', 'turn 3: Create a new PDF from content://storage/docs/summary.pdf named CombinedSummary.pdf -> Created a fresh PDF named CombinedSummary.pdf at content://documents/CombinedSummary.pdf. Feel free to update or merge content.', ""turn 4: Make the document selected using the PDF picker a PDF named NewPDF.pdf -> Done! A new PDF called 'NewPDF.pdf' is ready at content://documents/NewPDF.pdf for you to populate.""]"	Email it to the project lead with the body Please review the merged report	Email content://documents/CombinedSummary.pdf to the project lead with the body Please review the merged report	{'plan': 'send_email', 'arguments': {'to': 'the project lead', 'body': 'Please review the merged report', 'attachments': ['content://documents/CombinedSummary.pdf']}}	SWAP_T5_R3_S4_I002394-send_email-1	['ACTION_VIDEO_CAPTURE', 'ACTION_VIEW_CONTACT', 'send_email', 'ACTION_VIEW_RECENT_APPS', 'web_search']
"['turn 1: Could you set a 10-minute timer? -> All set! Your 10-minute timer is now running.', ""turn 2: I'm selecting multiple images. Help me pick several image files at once. -> Absolutely! Launching your gallery so you can multi-select the images you want."", ""turn 3: Could you make a new image file in the gallery named VacationCollage.jpg -> Voilà—your new gallery image 'VacationCollage.jpg' is ready at content://documents/VacationCollage.jpg. Enjoy!"", 'turn 4: Make one image from my gallery a JPEG named Portrait.jpg -> Portrait.jpg has just been created at content://documents/Portrait.jpg. Go ahead and drop your selected photo in there.']"	Email that image to mom	Email content://documents/VacationCollage.jpg to mom	{'plan': 'send_email', 'arguments': {'to': 'mom', 'attachments': ['content://documents/VacationCollage.jpg']}}	SWAP_T5_R3_S4_I002395-send_email-1	['ACTION_SHOW_TIMERS', 'search_location', 'play_video', 'send_email', 'send_message']
"['turn 1: Launch the still camera so I can take a shot. -> Still-image camera opened.', ""turn 2: I'm looking for image files to attach to my report. Could you let me choose multiple images? -> All good! Two images ready for you:\n• content://images/img001.jpg\n• content://images/img002.png"", ""turn 3: Create a new text document to list content://images/img001.jpg and content://images/img002.png called ImageList.txt -> Here’s your new text file 'ImageList.txt': content://documents/ImageList.txt. You can now paste in the image URIs."", ""turn 4: Make the document that is in text format a text file named Journal.txt -> Your text file 'Journal.txt' has been created at content://documents/Journal.txt. Feel free to start editing.""]"	Email that list to Sarah with subject Image List	Email content://documents/ImageList.txt to Sarah with subject Image List	{'plan': 'send_email', 'arguments': {'to': 'Sarah', 'subject': 'Image List', 'attachments': ['content://documents/ImageList.txt']}}	SWAP_T5_R3_S4_I002396-send_email-1	['send_message', 'ACTION_CREATE_DOCUMENT', 'INTENT_ACTION_VIDEO_CAMERA', 'send_email', 'dial']
"[""turn 1: I want to dispatch an email to contact@vendor.org with subject 'RFQ Submission' and attach file:///rfq.docx and file:///pricing.xlsx. -> RFQ Submission email sent to contact@vendor.org with both RFQ and pricing files attached."", ""turn 2: Can you open an image file for me? I'm looking for persistent access to it. -> Image loaded for long‑term access: content://pictures/favorites/photo123.png"", ""turn 3: Create a new image file for editing content://pictures/favorites/photo123.png called photo123_edited.png -> Your new PNG 'photo123_edited.png' is set up at content://images/photo123_edited.png. Go ahead and apply your edits."", ""turn 4: Create a new plain text document named Journal.txt. -> Sure—new text document 'Journal.txt' has been created at content://documents/Journal.txt. Ready when you are.""]"	Email it to the editor with the body The edits are complete	Email content://images/photo123_edited.png to the editor with the body The edits are complete	{'plan': 'send_email', 'arguments': {'to': 'the editor', 'body': 'The edits are complete', 'attachments': ['content://images/photo123_edited.png']}}	SWAP_T5_R3_S4_I002397-send_email-1	['dial', 'send_email', 'ACTION_VIEW_SENT_EMAILS', 'ACTION_IMAGE_CAPTURE', 'ACTION_VIEW_CALL_LOG']
"['turn 1: Can you display the Date & Time settings? I need to adjust the clock. -> Date & Time settings opened—feel free to adjust your clock.', 'turn 2: Let me access a TXT document for long-term management from my device. -> Alright, launching the document browser so you can select a text file (.txt) for long-term access.', ""turn 3: Just create a new one named LongTermNotes.txt. -> All set! New text document 'LongTermNotes.txt' created at content://documents/LongTermNotes.txt for your ongoing notes."", ""turn 4: Create a new PDF document named AnnualReport.pdf. -> Your new PDF 'AnnualReport.pdf' is ready at content://documents/AnnualReport.pdf. Let me know when you'd like to edit it.""]"	Email it to john.doe@example.com with subject Long Term Notes	Email content://documents/LongTermNotes.txt to john.doe@example.com with subject Long Term Notes	{'plan': 'send_email', 'arguments': {'to': 'john.doe@example.com', 'subject': 'Long Term Notes', 'attachments': ['content://documents/LongTermNotes.txt']}}	SWAP_T5_R3_S4_I002398-send_email-1	['get_contact_info', 'ACTION_SHOW_TIMERS', 'send_message', 'ACTION_VIEW_SENT_EMAILS', 'send_email']
"[""turn 1: I want to choose a single PDF report. -> Here's the report you selected: content://docs/annual_report.pdf"", 'turn 2: Could you let me pick a single text file from my device? -> Sure—opening your text files. Pick one to proceed.', ""turn 3: Alright, let's make a new text file called Notes.txt. -> Done—'Notes.txt' has been created at content://documents/Notes.txt. Ready when you are to start typing."", ""turn 4: Create a new plain text document named GroceryList.txt. -> All set—'GroceryList.txt' has been created at content://documents/GroceryList.txt. You can now jot down your items.""]"	Email it to team@example.com with subject Meeting Notes	Email content://documents/Notes.txt to team@example.com with subject Meeting Notes	{'plan': 'send_email', 'arguments': {'to': 'team@example.com', 'subject': 'Meeting Notes', 'attachments': ['content://documents/Notes.txt']}}	SWAP_T5_R3_S4_I002399-send_email-1	['send_email', 'ACTION_VIEW_WEB_HISTORY', 'ACTION_IMAGE_CAPTURE', 'ACTION_SET_RINGTONE', 'ACTION_VIEW_PLAYLIST']
"['turn 1: Let me pick a melody from the ringtone list. -> Sure—opening the melody list so you can pick a ringtone.', 'turn 2: I need to retrieve a PDF document from my cloud storage. Let me pick one file, please. -> On it—opening the PDF selector. Please pick the file from your cloud storage.', ""turn 3: Create a new file from the PDF selector called NewCloudReport.pdf. -> New PDF 'NewCloudReport.pdf' has been created at content://documents/NewCloudReport.pdf. You can now upload or edit it."", 'turn 4: Create a new JPEG image file named LandscapePhoto.jpg. -> LandscapePhoto.jpg has been created at content://documents/LandscapePhoto.jpg. Go ahead and add your image.']"	Send that PDF to manager@example.com with body Here is the new cloud report	Send content://documents/NewCloudReport.pdf to manager@example.com with body Here is the new cloud report	{'plan': 'send_email', 'arguments': {'to': 'manager@example.com', 'body': 'Here is the new cloud report', 'attachments': ['content://documents/NewCloudReport.pdf']}}	SWAP_T5_R3_S4_I002400-send_email-1	['ACTION_INSERT_EVENT', 'ACTION_VIDEO_CAPTURE', 'send_email', 'ACTION_SET_ALARM', 'ACTION_EDIT_CONTACT']
"['turn 1: Could you launch the MX Player to play this segment: rtsp://example.com/segment.sdp -> MX Player is streaming rtsp://example.com/segment.sdp now. Playback has started.', 'turn 2: From my device, I want to open a single image file for persistent use. -> Alright, opening your images—please select one file for ongoing use.', ""turn 3: Since there's no suitable image, create a new one named Photo.png. -> No image matched your needs, so 'Photo.png' has been created: content://images/Photo.png. You can now add your own picture."", 'turn 4: Create a new one called DraftReport.pdf -> DraftReport.pdf is now created at content://documents/DraftReport.pdf. You can start editing right away.']"	Email it to designer@example.com with body Please update this image	Email content://images/Photo.png to designer@example.com with body Please update this image	{'plan': 'send_email', 'arguments': {'to': 'designer@example.com', 'body': 'Please update this image', 'attachments': ['content://images/Photo.png']}}	SWAP_T5_R3_S4_I002401-send_email-1	['launch_application', 'web_search', 'ACTION_IMAGE_CAPTURE', 'send_email', 'ACTION_SET_TIMER']
"['turn 1: Do a quick retrieval of my call logs. -> Recent call logs: Victor +1-702-555-0111 (Incoming) - Today 1:00 PM; Wendy +1-213-555-0144 (Missed) - Today 6:30 AM; Xavier +1-512-555-0162 (Outgoing) - Yesterday 9:10 PM', 'turn 2: I want to select one document that is in text format. Open my document picker. -> No problem—launching the text document picker. Go ahead and pick the file you’d like.', ""turn 3: If none are available, create a new text document named Diary.txt -> Got it. Created a new text document named 'Diary.txt': content://documents/Diary.txt"", ""turn 4: Create a new PDF document called EditableVersion.pdf -> Your PDF 'EditableVersion.pdf' has been successfully created at content://documents/EditableVersion.pdf.""]"	Email it to me at alice@example.com so I can review it	Email content://documents/Diary.txt to me at alice@example.com so I can review content://documents/Diary.txt	{'plan': 'send_email', 'arguments': {'to': 'alice@example.com', 'body': 'so I can review content://documents/Diary.txt', 'attachments': ['content://documents/Diary.txt']}}	SWAP_T5_R3_S4_I002402-send_email-1	['ACTION_VIDEO_CAPTURE', 'ACTION_VIEW_CALL_LOG', 'send_email', 'ACTION_VIEW_PLAYLIST', 'ACTION_EDIT_VIDEO']
"[""turn 1: I'd like to listen to 'Hotel California' by The Eagles on Apple Music tonight. Could you play it? -> Tuning into Hotel California by The Eagles on Apple Music."", 'turn 2: Could you please provide a way to select my PDF file? -> Certainly—opening the PDF picker now. Please choose your file.', ""turn 3: If I don't see my PDF file, create a new PDF document named Report.pdf -> All set—your PDF 'Report.pdf' is now available at content://documents/Report.pdf."", ""turn 4: Create a new plain text document titled ReviewNotes.txt -> Success! Your new text file 'ReviewNotes.txt' is created at content://documents/ReviewNotes.txt.""]"	Email it to mark@company.com with a quick note about the report	Email content://documents/Report.pdf to mark@company.com with a quick note about the report	{'plan': 'send_email', 'arguments': {'to': 'mark@company.com', 'body': 'a quick note about the report', 'attachments': ['content://documents/Report.pdf']}}	SWAP_T5_R3_S4_I002403-send_email-1	['send_email', 'ACTION_SHOW_TIMERS', 'get_contact_info_from_uri', 'dial', 'ACTION_IMAGE_CAPTURE']
"['turn 1: Insert Sarah Connor with phone 610-555-1212, email sarah.connor@resistance.net. -> Sarah Connor’s contact entry is live! content://contacts/people/sarah_connor', ""turn 2: Need a dialog to choose a PDF document; I'm only selecting one file. -> Understood—opening the PDF selector. Please pick the single document you want."", ""turn 3: Go ahead and create one as a PDF named Invoice.pdf. -> Your new PDF 'Invoice.pdf' is ready: content://documents/Invoice.pdf."", ""turn 4: Create content://media/picker/0/com.android.providers.media.documents/document/image%3A1756 with the name NewPhoto.jpg -> Got it—your new JPEG 'NewPhoto.jpg' is available at content://media/picker/0/com.android.providers.media.documents/document/image%3A1756. You can open or modify it now.""]"	Email it to accounting@resistance.net with subject Invoice for review	Email content://documents/Invoice.pdf to accounting@resistance.net with subject Invoice for review	{'plan': 'send_email', 'arguments': {'to': 'accounting@resistance.net', 'subject': 'Invoice for review', 'attachments': ['content://documents/Invoice.pdf']}}	SWAP_T5_R3_S4_I002404-send_email-1	['launch_application', 'ACTION_INSERT_CONTACT', 'send_email', 'get_contact_info_from_uri', 'dial']
