conversation_history	query	rewrited_query	answer	unique_idx	candidates
"[""turn 1: I need an event 'Dentist Check-Up' on August 1, 2024 at 11:00 AM at Smile Dental Clinic. Description: Routine cleaning. -> Your “Dentist Check-Up” on August 1, 2024 at 11:00\xa0AM at Smile Dental Clinic has been added. Check it out: content://calendar/event/4"", 'turn 2: Give me directions to Smile Dental Clinic -> Hit the road! navigation is started in a maps application: Smile Dental Clinic.', 'turn 3: Could you pick a contact for me from my records? -> Done—contact selected: content://contacts/people/8', ""turn 4: Save (999)\xa0888‑7777 under the name Olivia Perez -> All set! I've added Olivia Perez at (999)\xa0888‑7777. You can view it here: content://contacts/people/olivia_perez""]"	Update their phone number to 555-1234	Update content://contacts/people/8's phone number to 555-1234	{'plan': 'ACTION_EDIT_CONTACT', 'arguments': {'contact_uri': 'content://contacts/people/8', 'contact_info': {'phone': '555-1234'}}}	SWAP_T5_R3_S4_I002603-ACTION_EDIT_CONTACT-1	['INTENT_ACTION_VIDEO_CAMERA', 'search_location', 'ACTION_VIEW_EVENT', 'ACTION_SET_RINGTONE', 'ACTION_EDIT_CONTACT']
"[""turn 1: Please play Eminem's 'Lose Yourself'. -> Now spinning Lose Yourself by Eminem."", ""turn 2: Could you look for reliable sources that discuss the causes of urban pollution? -> Looking up 'causes of urban pollution sources'... Found studies on traffic emissions, industrial pollutants, and urban planning impacts."", ""turn 3: Choose a person's address from my set of saved contacts. -> Address successfully picked: content://contacts/address/19"", ""turn 4: Add 911 as a contact with name Emergency Services -> Done\xa0– 'Emergency Services' (911) has been saved. Find it at content://contacts/people/emergency_services""]"	Change its street to 456 Oak Avenue	Change content://contacts/address/19's street to 456 Oak Avenue	{'plan': 'ACTION_EDIT_CONTACT', 'arguments': {'contact_uri': 'content://contacts/address/19', 'contact_info': {'address': '456 Oak Avenue'}}}	SWAP_T5_R3_S4_I002604-ACTION_EDIT_CONTACT-1	['dial', 'ACTION_EDIT_DOCUMENT', 'ACTION_EDIT_ALARM', 'ACTION_SET_ALARM', 'ACTION_EDIT_CONTACT']
"[""turn 1: Show the playlist called 'Summer Chillout'. -> Playlist 'Summer Chillout': Sunset Lover; Ocean Eyes; Island in the Sun."", ""turn 2: Play Playlist 'Summer Chillout': Sunset Lover; Ocean Eyes; Island in the Sun. on Apple Music. -> Here we go! Playing your 'Summer Chillout' playlist on Apple Music: Sunset Lover, Ocean Eyes, Island in the Sun."", ""turn 3: I'm looking for someone's email contact details. -> Here’s the email you requested: content://contacts/email/34"", 'turn 4: Add +1‑212‑555‑0142 to contacts as Robert Blake -> Great! Robert Blake (+1‑212‑555‑0142) is now in your contacts. URI: content://contacts/people/robert_blake']"	Edit their email to new_email@example.com	Edit content://contacts/email/34 to new_email@example.com	{'plan': 'ACTION_EDIT_CONTACT', 'arguments': {'contact_uri': 'content://contacts/email/34', 'contact_info': {'email': 'new_email@example.com'}}}	SWAP_T5_R3_S4_I002605-ACTION_EDIT_CONTACT-1	['ACTION_SET_RINGTONE', 'send_email', 'ACTION_EDIT_CONTACT', 'search_location', 'ACTION_VIEW_CONTACT']
"[""turn 1: Can you help me edit the contact content://contacts/people/mary_bell? I want to add her work email mary@bellcorp.com. -> Got it, launching Mary's contact. You can add her work email mary@bellcorp.com right away."", ""turn 2: Send content://contacts/people/mary_bell a reminder message asking if she saw my email. -> Reminder sent to Mary Bell (content://contacts/people/mary_bell): 'Did you see my email?'."", 'turn 3: Get me a phone contact from my list, please. -> Phone record retrieved: content://contacts/phone/6', ""turn 4: Add +1-202-555-1122 to my address book -> Your new contact for +1-202-555-1122 is all set. Here's the URI: content://contacts/people/12025551122""]"	Replace it with 987-654-3210	Replace content://contacts/phone/6 with 987-654-3210	{'plan': 'ACTION_EDIT_CONTACT', 'arguments': {'contact_uri': 'content://contacts/phone/6', 'contact_info': {'phone': '987-654-3210'}}}	SWAP_T5_R3_S4_I002606-ACTION_EDIT_CONTACT-1	['ACTION_OPEN_CONTENT', 'get_contact_info', 'ACTION_PICK', 'ACTION_EDIT_CONTACT', 'ACTION_VIEW_CONTACT']
"['turn 1: Please deliver the PDF report (https://reports.example.com/q1.pdf) to CFO at +49 151 76543210. -> Successfully sent the PDF report to +4915176543210.', ""turn 2: Can you list https://reports.example.com/q1.pdf I sent to the CFO and my recent sent messages? -> Here's a rundown of your recent messages: CFO +4915176543210 – 'PDF report delivered: https://reports.example.com/q1.pdf'."", 'turn 3: Can you help me pick a contact from my saved directory? -> Contact selection complete: content://contacts/people/21', 'turn 4: Create a new contact for +1-987-654-3210 -> New contact added for +1-987-654-3210. You can view it at content://contacts/people/19876543210']"	Add their company as Acme Corp and address as 789 Pine Road	Add content://contacts/people/21's company as Acme Corp and address as 789 Pine Road	{'plan': 'ACTION_EDIT_CONTACT', 'arguments': {'contact_uri': 'content://contacts/people/21', 'contact_info': {'company': 'Acme Corp', 'address': '789 Pine Road'}}}	SWAP_T5_R3_S4_I002607-ACTION_EDIT_CONTACT-1	['ACTION_NAVIGATE_TO_LOCATION', 'open_settings', 'ACTION_EDIT_DOCUMENT', 'ACTION_INSERT_EVENT', 'ACTION_EDIT_CONTACT']
"['turn 1: Please open up the camera app so I can capture an image. -> Photo-taking camera is open and ready.', 'turn 2: Shoot an image. -> Your photo has been captured. You can find it at content://media/external/images/media/4751.', ""turn 3: Can you get me someone's phone number from my contact directory? -> Got it! Phone number ready at content://contacts/phone/21"", 'turn 4: Please store +1-555-0155 -> Done! +1-555-0155 has been saved to your address book: content://contacts/people/15550155']"	Add an email to it: alice@example.com	Add an email to content://contacts/phone/21: alice@example.com	{'plan': 'ACTION_EDIT_CONTACT', 'arguments': {'contact_uri': 'content://contacts/phone/21', 'contact_info': {'email': 'alice@example.com'}}}	SWAP_T5_R3_S4_I002608-ACTION_EDIT_CONTACT-1	['ACTION_EDIT_ALARM', 'ACTION_EDIT_VIDEO', 'ACTION_EDIT_CONTACT', 'search_location', 'ACTION_SET_ALARM']
"['turn 1: Please adjust alarm 40 to 10:10, schedule it daily. -> Alarm 40 has been adjusted to 10:10 and is now scheduled to go off every day.', ""turn 2: Check the internet for discoveries of exoplanets reported in the last year. -> Searching 'exoplanets discovery last year'... Highlights include TESS findings and NASA reports on dozens of new exoplanets."", 'turn 3: I want to pick one of the contacts from my phone; please show me a contact entry. -> Alright, here’s the contact entry you picked: content://contacts/people/7', ""turn 4: Store content://contacts/phone/67 under 'Friend' with a note 'Met at conference'. -> I created 'Friend' (from content://contacts/phone/67) with note 'Met at conference'. Access it here: content://contacts/people/friend_67""]"	Update its company to OpenAI	Update content://contacts/people/7's company to OpenAI	{'plan': 'ACTION_EDIT_CONTACT', 'arguments': {'contact_uri': 'content://contacts/people/7', 'contact_info': {'company': 'OpenAI'}}}	SWAP_T5_R3_S4_I002609-ACTION_EDIT_CONTACT-1	['ACTION_EDIT_CONTACT', 'ACTION_SET_RINGTONE', 'ACTION_VIEW_RECENT_APPS', 'ACTION_OPEN_CONTENT', 'ACTION_EDIT_ALARM']
"['turn 1: I want information on timers still running. -> Running timers: 30 seconds - Exercise, 12 minutes - Rice, 50 minutes - Study session.', 'turn 2: Start a 2-hour timer -> All set! 2-hour timer is ticking away.', 'turn 3: Help me extract a phone number from my contact list. -> Phone detail extracted: content://contacts/phone/33', ""turn 4: Create a new contact using content://contacts/phone/210 with the name 'Alice' and email 'alice@example.com'. -> Contact 'Alice' (Email: alice@example.com) created from content://contacts/phone/210. Check it out: content://contacts/people/alice_210""]"	Fill its address with 123 Main St	Fill content://contacts/phone/33's address with 123 Main St	{'plan': 'ACTION_EDIT_CONTACT', 'arguments': {'contact_uri': 'content://contacts/phone/33', 'contact_info': {'address': '123 Main St'}}}	SWAP_T5_R3_S4_I002610-ACTION_EDIT_CONTACT-1	['ACTION_EDIT_CONTACT', 'ACTION_SHOW_ALARMS', 'dial', 'ACTION_VIDEO_CAPTURE', 'ACTION_IMAGE_CAPTURE']
"['turn 1: I need to email professor@university.edu asking about the extension for the assignment. -> Your query has been sent to professor@university.edu.', ""turn 2: Show me the one I sent to professor@university.edu. -> Sent emails: to professor@university.edu - '(no subject)'"", ""turn 3: Select a contact's postal information, please. -> Postal address selected: content://contacts/address/8"", 'turn 4: Add 555-123-4567 to my contacts -> All set—new contact with number 555-123-4567 has been created: content://contacts/people/5551234567.']"	Update its address to 99 Elm Street, Metropolis	Update content://contacts/address/8's address to 99 Elm Street, Metropolis	{'plan': 'ACTION_EDIT_CONTACT', 'arguments': {'contact_uri': 'content://contacts/address/8', 'contact_info': {'address': '99 Elm Street, Metropolis'}}}	SWAP_T5_R3_S4_I002611-ACTION_EDIT_CONTACT-1	['get_contact_info_from_uri', 'ACTION_SET_TIMER', 'ACTION_EDIT_DOCUMENT', 'ACTION_EDIT_CONTACT', 'ACTION_IMAGE_CAPTURE']
"['turn 1: Launch the Android Gallery player to play content://videos/9876 -> Launching Android Gallery to play content://videos/9876.', 'turn 2: Mute content://videos/9876. -> Audio muted—your new file is ready at content://videos/9876_muted.mp4.', 'turn 3: Could you extract the address detail of a contact for me? -> Address info retrieved: content://contacts/address/14', ""turn 4: Save 555-123-4567 as a new contact -> Done! I've created a new entry for 555-123-4567. You can find it at content://contacts/people/5551234567.""]"	Add the email user123@gmail.com to it	Add the email user123@gmail.com to content://contacts/address/14	{'plan': 'ACTION_EDIT_CONTACT', 'arguments': {'contact_uri': 'content://contacts/address/14', 'contact_info': {'email': 'user123@gmail.com'}}}	SWAP_T5_R3_S4_I002612-ACTION_EDIT_CONTACT-1	['get_contact_info', 'ACTION_CREATE_DOCUMENT', 'ACTION_EDIT_CONTACT', 'ACTION_VIDEO_CAPTURE', 'ACTION_VIEW_WEB_HISTORY']
"['turn 1: Hey, start a 1 hour timer named hourly check. -> All set: your “hourly check” timer is ticking for 1 hour.', 'turn 2: I want to browse files and pick a PDF document. -> Sure thing! Opening the file picker for PDFs—go ahead and choose the document you want.', ""turn 3: I need a quick selection of a contact's detail. -> Done! Selected contact URI: content://contacts/people/27"", 'turn 4: Create a new contact for 777-8888 -> Contact saved for 777-8888. View it here: content://contacts/people/7778888.']"	Rename it to Jane Smith and add phone number 010-5555-6666	Rename content://contacts/people/27 to Jane Smith and add phone number 010-5555-6666	{'plan': 'ACTION_EDIT_CONTACT', 'arguments': {'contact_uri': 'content://contacts/people/27', 'contact_info': {'name': 'Jane Smith', 'phone': '010-5555-6666'}}}	SWAP_T5_R3_S4_I002613-ACTION_EDIT_CONTACT-1	['ACTION_NAVIGATE_TO_LOCATION', 'play_video', 'web_search', 'launch_application', 'ACTION_EDIT_CONTACT']
['turn 1: Switch default ringtone to classic tune located here: content://com.android.externalstorage.documents/tree/primary%3AMusic%2Fclassic_tune.mp3 -> Classic tune is now set as your ringtone. Enjoy!', 'turn 2: I want to choose a person by hand from my contacts. -> Contact URI: content://contacts/people/5', 'turn 3: Pick out an email on my contact list. -> Okay, here’s the email you picked: content://contacts/email/5', 'turn 4: Store +1-718-555-0145 in my address book -> All done! Your new contact with +1-718-555-0145 is now stored at content://contacts/people/17185550145.']	Change its email address to newemail@example.com	Change content://contacts/email/5's email address to newemail@example.com	{'plan': 'ACTION_EDIT_CONTACT', 'arguments': {'contact_uri': 'content://contacts/email/5', 'contact_info': {'email': 'newemail@example.com'}}}	SWAP_T5_R3_S4_I002614-ACTION_EDIT_CONTACT-1	['send_email', 'ACTION_EDIT_CONTACT', 'ACTION_VIEW_SENT_EMAILS', 'search_location', 'ACTION_SET_RINGTONE']
"['turn 1: Please start playing on the default player. -> Alright, launching your default music player now.', ""turn 2: Show me the songs in my default playlist -> Playlist 'Default Playlist': Smells Like Teen Spirit; Sweet Child O' Mine; Back in Black"", 'turn 3: I want you to pick a phone contact detail from my phone book. -> Your chosen phone contact: content://contacts/phone/29', ""turn 4: Save 212-999-0000 to my contacts -> Great! I've added 212-999-0000 to your contacts. Here’s the link: content://contacts/people/2129990000.""]"	Set its company to Initech	Set content://contacts/phone/29's company to Initech	{'plan': 'ACTION_EDIT_CONTACT', 'arguments': {'contact_uri': 'content://contacts/phone/29', 'contact_info': {'company': 'Initech'}}}	SWAP_T5_R3_S4_I002615-ACTION_EDIT_CONTACT-1	['ACTION_GET_RINGTONE', 'get_contact_info', 'ACTION_EDIT_CONTACT', 'ACTION_OPEN_CONTENT', 'INTENT_ACTION_VIDEO_CAMERA']
"['turn 1: Open the memory card options, please. -> Memory card settings opened — you can now manage your external storage.', 'turn 2: Find the nearest gas station -> Sure thing. The nearest gas station is Shell, 842 Elm Street, Springfield.', ""turn 3: Create an event called Fill Up at Shell, 842 Elm Street, Springfield tomorrow at 3 PM and ending at 3:30 PM with description Fill the tank -> Sure—I've added 'Fill Up at Shell' to your calendar for tomorrow from 3:00 PM to 3:30 PM at 842 Elm Street, Springfield. You can view it here: content://calendar/event/1"", ""turn 4: Set up a meeting at 456 Oak Avenue, Metropolis, NY 10001 next Monday at 10 AM titled Project Kickoff, description Initial planning session, lasting one hour. -> Done: 'Project Kickoff' is locked in for next Monday at 10:00\xa0AM–11:00\xa0AM at 456 Oak Avenue, Metropolis, NY 10001. Take a look: content://calendar/event/112.""]"	Open it so I can see its details.	Open content://calendar/event/1 so I can see its details.	{'plan': 'ACTION_VIEW_EVENT', 'arguments': {'event_uri': 'content://calendar/event/1'}}	SWAP_T5_R3_S4_I002616-ACTION_VIEW_EVENT-1	['ACTION_SET_ALARM', 'play_music', 'ACTION_VIEW_CALL_LOG', 'ACTION_EDIT_DOCUMENT', 'ACTION_VIEW_EVENT']
"['turn 1: Show me the general settings page. -> General settings page opened successfully.', 'turn 2: Find parking lots nearby -> Nearby parking: City Center Garage, 200 Park Lane, Springfield.', ""turn 3: Schedule parking reminder at 200 Park Lane tomorrow from 8 AM to 6 PM titled Park Car with description Leave the car at the garage -> Your 'Park Car' reminder's good to go. It's on your calendar for tomorrow, 8:00 AM–6:00 PM at 200 Park Lane. Details: content://calendar/event/3"", ""turn 4: I require an event 'Evening Swim' with the description 'Swimming session at the local pool'. There is no location provided. Please schedule it from 1703900000000 to 1703905400000. -> Done! 'Evening Swim' (Swimming session at the local pool) has been added from 1703900000000 to 1703905400000 with no location specified. View it here: content://calendar/event/115.""]"	Open it in my calendar.	Open content://calendar/event/3 in my calendar.	{'plan': 'ACTION_VIEW_EVENT', 'arguments': {'event_uri': 'content://calendar/event/3'}}	SWAP_T5_R3_S4_I002617-ACTION_VIEW_EVENT-1	['ACTION_VIEW_EVENT', 'launch_application', 'ACTION_GET_CONTENT', 'open_settings', 'play_video']
"['turn 1: I want to pick a new keyboard—show me Input Method settings. -> Input Method settings are now open. Choose your preferred keyboard layout.', 'turn 2: Look up a bookstore in this area -> Here’s what I found: Pages & Co. Bookstore at 123 Market Road, Springfield.', ""turn 3: Add an event at 123 Market Road this Saturday from 2 PM to 3 PM called Book Browsing with description Browse new arrivals -> Done! 'Book Browsing' is now on your schedule for this Saturday, 2:00 PM–3:00 PM at 123 Market Road. See it here: content://calendar/event/4"", ""turn 4: Organize an event titled 'Coding Bootcamp' that is an intensive programming course covering Python and JavaScript. It should be held at Tech Center from 1702600000000 to 1702607200000. -> Awesome! 'Coding Bootcamp' is on your calendar at Tech Center, covering Python and JavaScript from 1702600000000 to 1702607200000. Event link: content://calendar/event/101""]"	Give me a summary of that event.	Give me a summary of content://calendar/event/4 event.	{'plan': 'ACTION_VIEW_EVENT', 'arguments': {'event_uri': 'content://calendar/event/4'}}	SWAP_T5_R3_S4_I002618-ACTION_VIEW_EVENT-1	['ACTION_VIEW_EVENT', 'ACTION_SET_TIMER', 'ACTION_VIEW_SENT_EMAILS', 'ACTION_NAVIGATE_TO_LOCATION', 'ACTION_EDIT_DOCUMENT']
"['turn 1: Can you open the Wi‑Fi settings on my phone? -> Sure thing! Opening Wi‑Fi settings now.', 'turn 2: Find public Wi‑Fi hotspots near here. -> I see public Wi‑Fi at City Library, 300 Main Street, Springfield.', ""turn 3: Add a Library Review event at City Library, 300 Main Street, Springfield tomorrow from 10 AM to 11 AM to go over library resources -> I’ve slotted 'Library Review' for tomorrow from 10:00 AM to 11:00 AM at City Library, 300 Main Street, Springfield. View it: content://calendar/event/6"", ""turn 4: I want to add a new event called 'Strategy Session' to plan the next quarter's objectives in the Executive Boardroom. Schedule it from 1701900000000 to 1701907200000. -> Got it! 'Strategy Session' is scheduled in the Executive Boardroom (Planning the next quarter's objectives) from 1701900000000 to 1701907200000. You can open it here: content://calendar/event/108""]"	Could you show me its details?	Could you show me content://calendar/event/6's details?	{'plan': 'ACTION_VIEW_EVENT', 'arguments': {'event_uri': 'content://calendar/event/6'}}	SWAP_T5_R3_S4_I002619-ACTION_VIEW_EVENT-1	['INTENT_ACTION_VIDEO_CAMERA', 'ACTION_VIEW_EVENT', 'ACTION_VIEW_PLAYLIST', 'send_message', 'ACTION_INSERT_EVENT']
"['turn 1: Please call the toll‑free line 888 777 6666. -> Dialing 888 777 6666 now...', ""turn 2: Store 888 777 6666 in my contacts. -> Great, I've added 888 777 6666 to your contacts. (content://contacts/people/8887776666)"", 'turn 3: Let me see an email from my contact list. -> Absolutely—opening the email picker. Go ahead and select the email you want… You picked: content://contacts/email/8', 'turn 4: I want to retrieve a full contact record from my directory. -> Sure thing! Contact record retrieved: content://contacts/people/5']"	Show me that email	Show me content://contacts/email/8 email	{'plan': 'get_contact_info_from_uri', 'arguments': {'data_uri': 'content://contacts/email/8'}}	SWAP_T5_R3_S4_I002620-get_contact_info_from_uri-1	['web_search', 'ACTION_VIEW_PLAYLIST', 'ACTION_NAVIGATE_TO_LOCATION', 'get_contact_info_from_uri', 'ACTION_VIEW_SENT_EMAILS']
"['turn 1: Please load content://games/trailer.mp4 and silence it. -> Your game trailer (content://games/trailer.mp4) is loaded and muted—ready for any further edits.', 'turn 2: Play content://games/trailer.mp4 trailer -> Firing up the game trailer now. Enjoy!', ""turn 3: Please pick someone's address for mailing purposes from my contacts. -> Sure thing—launching your address picker now. Please choose the contact’s address you’d like to use… Selected address URI: content://contacts/addresses/12"", 'turn 4: Find a valid email for any of my contacts. -> Here’s the email you chose: content://contacts/email/12']"	Get that address	Get content://contacts/addresses/12 address	{'plan': 'get_contact_info_from_uri', 'arguments': {'data_uri': 'content://contacts/addresses/12'}}	SWAP_T5_R3_S4_I002621-get_contact_info_from_uri-1	['ACTION_INSERT_CONTACT', 'get_contact_info_from_uri', 'ACTION_EDIT_ALARM', 'ACTION_IMAGE_CAPTURE', 'play_music']
"[""turn 1: Can you get the video camera up and running? -> You're all set—the video camera is open."", 'turn 2: Go ahead and record the video camera. -> All done! Video saved at content://example/new_video.mp4.', 'turn 3: Please retrieve a mobile phone number from my contacts for me. -> No problem—bringing up phone number selection. Once you pick one, I’ll grab it for you. Chosen phone URI: content://contacts/phone/21', ""turn 4: Recommend a phone record from my phone book. -> All right, I've picked this phone number for you: content://contacts/phone/7""]"	Fetch that phone number	Fetch content://contacts/phone/21 phone number	{'plan': 'get_contact_info_from_uri', 'arguments': {'data_uri': 'content://contacts/phone/21'}}	SWAP_T5_R3_S4_I002622-get_contact_info_from_uri-1	['ACTION_EDIT_VIDEO', 'ACTION_CREATE_DOCUMENT', 'ACTION_EDIT_CONTACT', 'ACTION_VIEW_RECENT_APPS', 'get_contact_info_from_uri']
"['turn 1: Please change my incoming call ringtone to the audio file at content://media/external/audio/media/45. -> All set! Your incoming call ringtone has been changed to the audio file at content://media/external/audio/media/45.', 'turn 2: Can you show me some other ringtones besides content://media/external/audio/media/45? -> Great! Here’s the new ringtone: content://media/external/audio/media/52', 'turn 3: Find me a single contact from my directory database, please. -> On it—opening your contacts list. Please tap the person you want… Here’s the contact URI: content://contacts/people/3', ""turn 4: Could you pick a contact for me from my records? -> I've selected a contact for you: content://contacts/people/15""]"	Get that contact’s info	Get content://contacts/people/3's info	{'plan': 'get_contact_info_from_uri', 'arguments': {'data_uri': 'content://contacts/people/3'}}	SWAP_T5_R3_S4_I002623-get_contact_info_from_uri-1	['get_contact_info_from_uri', 'ACTION_OPEN_DOCUMENT', 'ACTION_SHOW_TIMERS', 'INTENT_ACTION_STILL_IMAGE_CAMERA', 'ACTION_VIEW_CALL_LOG']
"['turn 1: Show me the input method settings. -> Input method settings opened successfully—choose your preferred input method.', 'turn 2: Access general system settings for configuration purposes. -> General settings have been opened. Feel free to adjust your configuration.', ""turn 3: Please call up a contact's email address from my records. -> Sure—launching email address picker now. Pick the contact email you need… Selected: content://contacts/email/15"", ""turn 4: Choose a person's address from my set of saved contacts. -> Address picked: content://contacts/address/4""]"	Get that email address	Get content://contacts/email/15 email address	{'plan': 'get_contact_info_from_uri', 'arguments': {'data_uri': 'content://contacts/email/15'}}	SWAP_T5_R3_S4_I002624-get_contact_info_from_uri-1	['ACTION_SET_RINGTONE', 'ACTION_NAVIGATE_TO_LOCATION', 'ACTION_VIEW_PLAYLIST', 'ACTION_VIEW_WEB_HISTORY', 'get_contact_info_from_uri']
"['turn 1: Give me the address of content://contacts/people/9988. -> The address is 123 Main St, Springfield, IL 62704.', 'turn 2: Open content://contacts/people/9988 -> Loading contact content://contacts/people/9988. Address on file: 123 Main St, Springfield, IL 62704. Additional details are displayed now.', 'turn 3: Could you switch to picking a phone number from my contact list? -> Got it—switching to phone number picker. Please select the number you’d like… Phone URI returned: content://contacts/phone/42', ""turn 4: I need a quick selection of a contact's detail. -> Okay, here’s the contact you chose: content://contacts/people/8""]"	What is that phone number?	What is content://contacts/phone/42 phone number?	{'plan': 'get_contact_info_from_uri', 'arguments': {'data_uri': 'content://contacts/phone/42'}}	SWAP_T5_R3_S4_I002625-get_contact_info_from_uri-1	['send_email', 'ACTION_GET_CONTENT', 'get_contact_info_from_uri', 'ACTION_EDIT_CONTACT', 'dial']
"[""turn 1: Can I see the 'Movie Soundtracks' tracks? -> Movie Soundtracks includes: Time; My Heart Will Go On; Now We Are Free."", ""turn 2: Fetch web results regarding the current best practices in cybersecurity. -> Looking up 'current best cybersecurity practices'... Listing resources on zero trust, encryption standards, and threat mitigation."", 'turn 3: I want to choose a person by hand from my contacts. -> Sure thing—opening your contacts so you can pick the person you want. Once done, here’s the URI: content://contacts/people/9', ""turn 4: I want you to pick a phone contact detail from my phone book. -> Done! Here's the phone detail selected: content://contacts/phone/6""]"	Get the info for that contact.	Get the info for content://contacts/people/9 contact.	{'plan': 'get_contact_info_from_uri', 'arguments': {'data_uri': 'content://contacts/people/9'}}	SWAP_T5_R3_S4_I002626-get_contact_info_from_uri-1	['ACTION_GET_CONTENT', 'ACTION_VIEW_WEB_HISTORY', 'get_contact_info_from_uri', 'ACTION_PICK', 'ACTION_INSERT_EVENT']
