conversation_history	query	rewrited_query	answer	unique_idx	candidates
['turn 1: Play ms-wmv://media.server.net/file.wmv -> Playing media from ms-wmv://media.server.net/file.wmv with your default player. Enjoy!', 'turn 2: Trim ms-wmv://media.server.net/file.wmv from 10 seconds to 1 minute and mute the audio. -> Your video has been trimmed (10s–60s) and muted. Check out the edited file here: content://media/edited_file_004.wmv.', 'turn 3: I require a full summary of the contact details from /contacts/adam. -> Complete summary for /contacts/adam:\nName: Adam Brown\nPhone: (212) 555-0101\nEmail: adam.brown@domain.com\nAddress: 200 Elm Street, New York, NY 10001', 'turn 4: Dial (212) 555-0101 -> Initiating call to (212) 555-0101...']	Save it in my address book.	Save (212) 555-0101 in my address book.	{'plan': 'ACTION_INSERT_CONTACT', 'arguments': {'contact_info': {'phone': '(212) 555-0101'}}}	play_video-1436-ACTION_EDIT_VIDEO-1-get_contact_info-1_NR-dial-1-ACTION_INSERT_CONTACT-1	['ACTION_INSERT_CONTACT', 'ACTION_PICK', 'ACTION_IMAGE_CAPTURE', 'get_contact_info', 'ACTION_VIDEO_CAPTURE']
['turn 1: Press camera shutter and save the image to content://photos/app_saved/new_photo.jpeg -> Done! Your photo is now stored at content://photos/app_saved/new_photo.jpeg.', 'turn 2: Let me see content://photos/app_saved/new_photo.jpeg -> Got it—here’s your new photo.', 'turn 3: Could you fetch the phone information from /contacts/amy_2023? -> Amy’s phone number (from /contacts/amy_2023) is 314-159-2653.', 'turn 4: Make a call to 314-159-2653 -> Calling 314-159-2653...']	Store it as a contact.	Store 314-159-2653 as a contact.	{'plan': 'ACTION_INSERT_CONTACT', 'arguments': {'contact_info': {'phone': '314-159-2653'}}}	ACTION_IMAGE_CAPTURE-340-ACTION_OPEN_CONTENT-1-get_contact_info-1_NR-dial-1-ACTION_INSERT_CONTACT-1	['ACTION_VIEW_SENT_MESSAGES', 'dial', 'INTENT_ACTION_VIDEO_CAMERA', 'ACTION_INSERT_CONTACT', 'ACTION_IMAGE_CAPTURE']
['turn 1: Start the Calculator app; I have some quick math to do. -> Calculator launched. Ready for your calculations.', 'turn 2: Show me the apps I opened in the last few uses. -> Just opened apps: Calculator; Notes; Weather; Clock.', 'turn 3: Please get the contact summary for /contacts/mia. -> Contact summary for Mia:\n• Phone: 646-555-6789\n• Email: mia_wong@services.com\n• Address: 321 Pine Street, Seattle, WA\xa098101.', 'turn 4: Call 646-555-6789 -> Dialing 646-555-6789...']	Add it to my address book	Add 646-555-6789 to my address book	{'plan': 'ACTION_INSERT_CONTACT', 'arguments': {'contact_info': {'phone': '646-555-6789'}}}	launch_application-1464-ACTION_VIEW_RECENT_APPS-1-get_contact_info-1_NR-dial-1-ACTION_INSERT_CONTACT-1	['ACTION_INSERT_CONTACT', 'ACTION_VIEW_WEB_HISTORY', 'send_message', 'ACTION_NAVIGATE_TO_LOCATION', 'ACTION_EDIT_VIDEO']
"['turn 1: I want to see the list of SMS I’ve sent out. Show them to me. -> Here\'s what you\'ve sent recently: John – ""+1 (555) 123-4567"" – ""Don\'t forget our lunch tomorrow.""; Sarah – ""+1 (555) 765-4321"" – ""Happy Mother\'s Day!""; Office – ""+1 800-234-5678"" – ""Meeting moved to 3\xa0PM.""', 'turn 2: Make the Photos app appear; I want to view my gallery. -> Photos is up and running—enjoy browsing your gallery.', 'turn 3: Please obtain the phone details from /contacts/zach. -> Zach’s phone number: +1 (202) 555‑0198.', 'turn 4: Place a call to +1 (202) 555‑0198 -> Connecting to +1 (202) 555‑0198...']"	Store it as a new contact	Store +1 (202) 555‑0198 as a new contact	{'plan': 'ACTION_INSERT_CONTACT', 'arguments': {'contact_info': {'phone': '+1 (202) 555-0198'}}}	ACTION_VIEW_SENT_MESSAGES-1999-launch_application-1_NR-get_contact_info-1_NR-dial-1-ACTION_INSERT_CONTACT-1	['ACTION_GET_RINGTONE', 'ACTION_CREATE_DOCUMENT', 'INTENT_ACTION_VIDEO_CAMERA', 'ACTION_SHOW_ALARMS', 'ACTION_INSERT_CONTACT']
['turn 1: Lead me to Times Square in New York City. -> Ready to head to Times Square, New York City. Navigation is live.', 'turn 2: Fetch the email information for the contact at /directory/evelyn.email. -> Evelyn’s email address is evelyn.smith@corporate.com.', 'turn 3: What is the complete summary for the contact at /contacts/yolanda? -> Yolanda’s contact summary:\nPhone: 202-555-0146\nEmail: yolanda.perez@domain.com\nAddress: 456 Oak Lane, Seattle, WA 98101', 'turn 4: Ring 202-555-0146 -> Dialing 202-555-0146...']	Please save this number to my contacts	Please save 202-555-0146 to my contacts	{'plan': 'ACTION_INSERT_CONTACT', 'arguments': {'contact_info': {'phone': '202-555-0146'}}}	ACTION_NAVIGATE_TO_LOCATION-1758-get_contact_info-1_NR-get_contact_info-1_NR-dial-1-ACTION_INSERT_CONTACT-1	['web_search', 'ACTION_VIEW_EVENT', 'ACTION_PICK', 'dial', 'ACTION_INSERT_CONTACT']
"['turn 1: I’d like to review files in Drive—please launch Google Drive. -> Google Drive app opened—browse your files now.', 'turn 2: What is the phone number associated with /contacts/rita? -> Here’s Rita’s phone number: (213) 555‑0123.', ""turn 3: Update /contacts/rita's phone to (310) 555-6789. -> All set—Rita’s number at /contacts/rita is updated to (310) 555-6789."", 'turn 4: Give (310) 555-6789 a ring -> Placing call to (310) 555-6789...']"	Open the call log to see that call	Open the call log to see the call to (310) 555-6789	{'plan': 'ACTION_VIEW_CALL_LOG', 'arguments': {}}	launch_application-1493-get_contact_info-1_NR-ACTION_EDIT_CONTACT-1-dial-1-ACTION_VIEW_CALL_LOG-1	['ACTION_VIEW_WEB_HISTORY', 'ACTION_EDIT_CONTACT', 'ACTION_VIEW_SENT_EMAILS', 'ACTION_GET_CONTENT', 'ACTION_VIEW_CALL_LOG']
"['turn 1: View the details for event 450 in my calendar. -> Event 450: Budget Planning at 2:30\xa0PM on September 30, Location: Admin Office.', 'turn 2: Take me to Admin Office -> I’ve opened maps to guide you to Admin Office.', ""turn 3: I want to add a new event called 'Strategy Session' to plan the next quarter's objectives in the Executive Boardroom. Schedule it from 1701900000000 to 1701907200000. -> Great! 'Strategy Session' will take place on December 8 in the Executive Boardroom. See details at content://calendar/event/10"", ""turn 4: What's the exact address for Admin Office? -> Admin Office is located at Main Admin Office, 200 Corporate Blvd, Springfield, IL 62707, USA.""]"	Schedule a 'Budget Review' there on October 5 from 1 PM to 2 PM to go over last quarter.	Schedule a 'Budget Review' at Main Admin Office, 200 Corporate Blvd, Springfield, IL 62707, USA on October 5 from 1 PM to 2 PM to go over last quarter.	{'plan': 'ACTION_INSERT_EVENT', 'arguments': {'TITLE': 'Budget Review', 'DESCRIPTION': 'Go over last quarter', 'EVENT_LOCATION': 'Main Admin Office, 200 Corporate Blvd, Springfield, IL 62707, USA', 'BEGIN_TIME': 1728133200000, 'END_TIME': 1728136800000}}	ACTION_VIEW_EVENT-1791-ACTION_NAVIGATE_TO_LOCATION-1-ACTION_INSERT_EVENT-1_NR-search_location-1-ACTION_INSERT_EVENT-1	['get_contact_info_from_uri', 'ACTION_INSERT_EVENT', 'launch_application', 'ACTION_VIEW_CALL_LOG', 'ACTION_PICK']
"[""turn 1: Please transmit 'Password for the vault is 8392' to the security manager at +1-310-555-0111. -> Vault password notification sent securely to +13105550111."", 'turn 2: Show me the active timers list. -> Looks like you don’t have any daily timers active right now.', ""turn 3: I need to book an event called 'Customer Feedback Session' to collect feedback on our new product. It will take place at Client's Office, starting at 1703400000000 and ending at 1703405400000. -> 'Customer Feedback Session' at Client's Office is now on your calendar for 1703400000000–1703405400000. Details: content://calendar/event/105."", ""turn 4: What's the address for Client's Office? -> Client's Office is at 400 Client Plaza, Springfield, IL 62701, USA.""]"	Set up a 'Product Demo' event at that location this Friday from 2 PM to 3 PM for investors.	Set up a 'Product Demo' event at 400 Client Plaza, Springfield, IL 62701, USA this Friday from 2 PM to 3 PM for investors.	{'plan': 'ACTION_INSERT_EVENT', 'arguments': {'TITLE': 'Product Demo', 'DESCRIPTION': 'For investors', 'EVENT_LOCATION': '400 Client Plaza, Springfield, IL 62701, USA', 'BEGIN_TIME': 1704463200000, 'END_TIME': 1704466800000}}	send_message-1295-ACTION_SHOW_TIMERS-1_NR-ACTION_INSERT_EVENT-1_NR-search_location-1-ACTION_INSERT_EVENT-1	['ACTION_PICK', 'ACTION_SHOW_ALARMS', 'play_video', 'ACTION_INSERT_EVENT', 'INTENT_ACTION_STILL_IMAGE_CAMERA']
"['turn 1: I want to check recent calls I’ve made and received. -> Recent call entries: Mia +1-213-555-0156 (Missed) - Today 5:35 PM; Noah +1-415-555-0001 (Outgoing) - Yesterday 2:10 PM; Olivia +44-20-7946-0999 (Incoming) - Today 8:00 AM', ""turn 2: Save +44-20-7946-0999 as a new contact for Mia -> Mia's new contact (+44-20-7946-0999) is now saved. Check it: content://contacts/people/mia"", ""turn 3: Schedule an event 'Workshop on AI' that dives deep into AI trends and technologies. It should be held at Innovation Hub, from 1703800000000 to 1703807200000. -> Your 'Workshop on AI' at Innovation Hub is on the calendar for 1703800000000–1703807200000. Access it here: content://calendar/event/102."", 'turn 4: Can you show me where Innovation Hub is on a map? -> Mapping Innovation Hub: 500 Innovation Way, Palo Alto, CA 94301, USA.']"	Add a 'Tech Brainstorm' event there tomorrow from 10 AM to 12 PM to discuss new prototypes.	Add a 'Tech Brainstorm' event at 500 Innovation Way, Palo Alto, CA 94301, USA tomorrow from 10 AM to 12 PM to discuss new prototypes.	{'plan': 'ACTION_INSERT_EVENT', 'arguments': {'TITLE': 'Tech Brainstorm', 'DESCRIPTION': 'Discuss new prototypes', 'EVENT_LOCATION': '500 Innovation Way, Palo Alto, CA 94301, USA', 'BEGIN_TIME': 1704189600000, 'END_TIME': 1704196800000}}	ACTION_VIEW_CALL_LOG-1895-ACTION_INSERT_CONTACT-1-ACTION_INSERT_EVENT-1_NR-search_location-1-ACTION_INSERT_EVENT-1	['ACTION_VIDEO_CAPTURE', 'ACTION_VIEW_EVENT', 'ACTION_INSERT_EVENT', 'INTENT_ACTION_VIDEO_CAMERA', 'ACTION_INSERT_CONTACT']
"['turn 1: Access content://contacts/people/777 and return all details. -> All details for content://contacts/people/777:\nName: Sarah Lee\nPhone: (310) 555-7890\nEmail: sarah.lee@company.com\nAddress: 321 Elm Street, Beverly Hills, CA 90212.', 'turn 2: View content://contacts/people/777 -> Showing all details for content://contacts/people/777:\nName: Sarah Lee\nPhone: (310) 555-7890\nEmail: sarah.lee@company.com\nAddress: 321 Elm Street, Beverly Hills, CA 90212', ""turn 3: Please schedule an event called 'Fitness Bootcamp'. It's described as an intense morning workout session at a local fitness center from 1701800000000 to 1701803600000. -> All set! ‘Fitness Bootcamp’ has been added to your calendar on November 24 at the Local fitness center. You can view it here: content://calendar/event/8"", ""turn 4: What's the exact address of the Local fitness center? -> Local Fitness Center is at 550 Workout Way, Springfield, IL 62701, USA.""]"	Add a 'Morning Yoga' session there next Saturday from 8 AM to 9 AM as a routine workout.	Add a 'Morning Yoga' session at 550 Workout Way, Springfield, IL 62701, USA next Saturday from 8 AM to 9 AM as a routine workout.	{'plan': 'ACTION_INSERT_EVENT', 'arguments': {'TITLE': 'Morning Yoga', 'DESCRIPTION': 'As a routine workout', 'EVENT_LOCATION': '550 Workout Way, Springfield, IL 62701, USA', 'BEGIN_TIME': 1704528000000, 'END_TIME': 1704531600000}}	get_contact_info-1013-ACTION_VIEW_CONTACT-1-ACTION_INSERT_EVENT-1_NR-search_location-1-ACTION_INSERT_EVENT-1	['get_contact_info_from_uri', 'ACTION_VIDEO_CAPTURE', 'get_contact_info', 'play_video', 'ACTION_INSERT_EVENT']
"[""turn 1: Message my neighbor at +44 7312 345678: 'Could you feed my cat while I'm away?' -> Request sent to your neighbor at +447312345678."", ""turn 2: What messages have I sent? -> Sent messages: +447312345678 – 'Could you feed my cat while I'm away?'."", ""turn 3: I would like to set up an event titled 'Art Exhibition'. It's a public display of local art at Downtown Gallery from 1701100000000 to 1701103600000. -> Great news—‘Art Exhibition’ has been scheduled for November 17 at Downtown Gallery. View it here: content://calendar/event/15"", 'turn 4: Can you show me where Downtown Gallery is located? -> Downtown Gallery is at 45 Art Ave, Springfield, IL 62703.']"	Plan a gallery opening reception there next Wednesday from 5 PM to 7 PM	Plan a gallery opening reception at 45 Art Ave, Springfield, IL 62703 next Wednesday from 5 PM to 7 PM	{'plan': 'ACTION_INSERT_EVENT', 'arguments': {'TITLE': 'Gallery Opening Reception', 'DESCRIPTION': 'Gallery opening reception', 'EVENT_LOCATION': '45 Art Ave, Springfield, IL 62703', 'BEGIN_TIME': 1701968400000, 'END_TIME': 1701975600000}}	send_message-1287-ACTION_VIEW_SENT_MESSAGES-1-ACTION_INSERT_EVENT-1_NR-search_location-1-ACTION_INSERT_EVENT-1	['play_video', 'dial', 'ACTION_VIEW_RECENT_APPS', 'ACTION_GET_CONTENT', 'ACTION_INSERT_EVENT']
"[""turn 1: Fetch my 'Meditation & Relaxation' playlist. -> Playlist 'Meditation & Relaxation': Enya\xa0–\xa0Orinoco\xa0Flow; Brian\xa0Eno\xa0–\xa0An\xa0Ending\xa0(Ascent); Deuter\xa0–\xa0Reiki\xa0Hands\xa0of\xa0Light; Liquid\xa0Mind\xa0–\xa0Serenity"", ""turn 2: Play Liquid\xa0Mind\xa0–\xa0Serenity -> Now playing 'Serenity' by Liquid Mind."", ""turn 3: What songs are on the 'Meditation & Relaxation' playlist? -> Playlist 'Meditation & Relaxation': Enya\xa0–\xa0Orinoco\xa0Flow; Brian\xa0Eno\xa0–\xa0An\xa0Ending\xa0(Ascent); Deuter\xa0–\xa0Reiki\xa0Hands\xa0of\xa0Light; Liquid\xa0Mind\xa0–\xa0Serenity."", ""turn 4: Play Brian Eno – An Ending (Ascent) on Spotify -> Playing 'Brian Eno – An Ending (Ascent)' on Spotify. Let the serenity begin.""]"	What's on that playlist?	What's on the 'Meditation & Relaxation' playlist?	{'plan': 'ACTION_VIEW_PLAYLIST', 'arguments': {'playlist_name': 'Meditation & Relaxation'}}	ACTION_VIEW_PLAYLIST-2131-play_music-1-ACTION_VIEW_PLAYLIST-1-play_music-1-ACTION_VIEW_PLAYLIST-1	['get_contact_info_from_uri', 'ACTION_VIEW_PLAYLIST', 'dial', 'INTENT_ACTION_VIDEO_CAMERA', 'ACTION_SET_RINGTONE']
"[""turn 1: Let me see the recent apps I've used. -> You recently opened: Messages; Chrome; YouTube; Maps; Gmail"", 'turn 2: Launch Chrome. -> Chrome has been opened successfully.', 'turn 3: Which apps have I opened since Chrome has been opened successfully? -> Since opening Chrome, you’ve launched: Calendar; Camera; WhatsApp; Settings; Music.', 'turn 4: Launch WhatsApp. -> WhatsApp is up and running—ready to chat!']"	Which apps have I opened since launching it?	Which apps have I opened since launching WhatsApp?	{'plan': 'ACTION_VIEW_RECENT_APPS', 'arguments': {}}	ACTION_VIEW_RECENT_APPS-2199-launch_application-1-ACTION_VIEW_RECENT_APPS-1-launch_application-1-ACTION_VIEW_RECENT_APPS-1	['ACTION_VIEW_EVENT', 'web_search', 'ACTION_VIEW_RECENT_APPS', 'ACTION_EDIT_CONTACT', 'send_message']
['turn 1: List out my last few apps. -> Listing your last few apps: Calculator; Notes; Files; Settings.', 'turn 2: Launch Notes. -> Notes is now open. Ready when you are!', 'turn 3: Could you list Calculator; Notes; Files; Settings.? -> Recent apps: Calculator; Notes; Files; Settings.', 'turn 4: Launch Calculator. -> Calculator is open—go ahead and crunch those numbers!']	I'd like to see the apps I've used after launching it.	I'd like to see the apps I've used after launching Calculator.	{'plan': 'ACTION_VIEW_RECENT_APPS', 'arguments': {}}	ACTION_VIEW_RECENT_APPS-2189-launch_application-1-ACTION_VIEW_RECENT_APPS-1-launch_application-1-ACTION_VIEW_RECENT_APPS-1	['dial', 'ACTION_SET_TIMER', 'INTENT_ACTION_VIDEO_CAMERA', 'ACTION_VIEW_RECENT_APPS', 'send_message']
['turn 1: I want to pull the recent app list. -> Your recent apps list: Camera; Chrome; WhatsApp; Settings.', 'turn 2: Launch Camera. -> Camera is up and running.', 'turn 3: Can you show me Camera; Chrome; WhatsApp; Settings I accessed before? -> Here’s the list of apps you accessed previously: Camera; Chrome; WhatsApp; Settings.', 'turn 4: Launch Chrome. -> Chrome has been opened—happy browsing!']	List the apps I’ve run since launching it.	List the apps I’ve run since launching Chrome.	{'plan': 'ACTION_VIEW_RECENT_APPS', 'arguments': {}}	ACTION_VIEW_RECENT_APPS-2212-launch_application-1-ACTION_VIEW_RECENT_APPS-1-launch_application-1-ACTION_VIEW_RECENT_APPS-1	['ACTION_VIEW_RECENT_APPS', 'play_video', 'ACTION_SET_RINGTONE', 'open_settings', 'ACTION_EDIT_CONTACT']
"[""turn 1: Expose my device's recent app history. -> Your recent applications: Calendar; Gmail; Spotify; Photos."", 'turn 2: I need to open both text and PDF files, and I want to be able to select multiple documents. -> Okay, launching the file picker for both text and PDF documents. Feel free to select as many as you like.', ""turn 3: Also, create one as a PDF named CombinedReport.pdf. -> Done! Here's your freshly created PDF 'CombinedReport.pdf': content://documents/CombinedReport.pdf."", 'turn 4: Activate the File Manager to browse through my documents. -> File Manager launched successfully. You can now browse your documents.']"	What apps have I used recently, including the one I just opened?	What apps have I used recently, including the File Manager?	{'plan': 'ACTION_VIEW_RECENT_APPS', 'arguments': {}}	ACTION_VIEW_RECENT_APPS-2214-ACTION_OPEN_DOCUMENT-1_NR-ACTION_CREATE_DOCUMENT-1-launch_application-1_NR-ACTION_VIEW_RECENT_APPS-1	['ACTION_EDIT_DOCUMENT', 'dial', 'ACTION_VIEW_SENT_EMAILS', 'ACTION_SHOW_ALARMS', 'ACTION_VIEW_RECENT_APPS']
"[""turn 1: Alarm for 15:00 called 'Coffee break' next Wednesday. -> Done! Alarm (alarm_no10) set for 3:00 PM on Wednesday: Coffee break."", ""turn 2: I prefer the ringtone content://media/gentle_breeze; please change my phone sound. -> Your ringtone has been changed to 'gentle_breeze'. Enjoy!"", 'turn 3: Show me alternative ringtones. -> On it—revealing alternative ringtone options for you to choose from.', ""turn 4: Make content://media/ringtone/ocean_waves.mp3 my default ringtone -> Done! 'ocean_waves.mp3' is now your default ringtone.""]"	Not quite, show me a different one.	Not quite, show me a different ringtone.	{'plan': 'ACTION_GET_RINGTONE', 'arguments': {}}	ACTION_SET_ALARM-563-ACTION_SET_RINGTONE-1_NR-ACTION_GET_RINGTONE-1-ACTION_SET_RINGTONE-1-ACTION_GET_RINGTONE-1	['INTENT_ACTION_STILL_IMAGE_CAMERA', 'ACTION_OPEN_DOCUMENT', 'ACTION_EDIT_DOCUMENT', 'ACTION_GET_RINGTONE', 'ACTION_SHOW_ALARMS']
"['turn 1: Load content://archive/film.mp4 so I can manually adjust it. -> Opening content://archive/film.mp4 in edit mode—feel free to make any adjustments.', ""turn 2: Assign my ringtone as content://media/ethereal_sound. -> The ringtone has been updated to 'ethereal_sound'."", 'turn 3: Let me choose another ringtone. -> Okay—reopening the ringtone picker to choose a new sound.', ""turn 4: Set content://media/ringtone/cosmic_echo.mp3 as my ringtone -> All done—'cosmic_echo.mp3' is now your ringtone.""]"	I'd like to see that picker again.	I'd like to see the ringtone picker again.	{'plan': 'ACTION_GET_RINGTONE', 'arguments': {}}	ACTION_EDIT_VIDEO-1725-ACTION_SET_RINGTONE-1_NR-ACTION_GET_RINGTONE-1-ACTION_SET_RINGTONE-1-ACTION_GET_RINGTONE-1	['ACTION_VIEW_CONTACT', 'ACTION_VIEW_PLAYLIST', 'search_location', 'ACTION_GET_RINGTONE', 'ACTION_VIEW_EVENT']
"[""turn 1: I'd like to pull together several text files for analysis. -> Opening text file selector—feel free to choose multiple documents."", 'turn 2: Activate the video camera function on my mobile, please. -> Video camera activated. Ready whenever you are.', 'turn 3: Record video camera for me. -> Video has been captured and saved here: content://media/external/video/media/1004.', 'turn 4: Trim content://media/external/video/media/1004 between 5 and 20 seconds. -> Here’s the segment you requested (5–20s): content://media/external/video/media/1004_5-20s.mp4']"	Play it	Play content://media/external/video/media/1004_5-20s.mp4	{'plan': 'play_video', 'arguments': {'video_uri': 'content://media/external/video/media/1004_5-20s.mp4'}}	ACTION_GET_CONTENT-202-INTENT_ACTION_VIDEO_CAMERA-1_NR-ACTION_VIDEO_CAPTURE-1-ACTION_EDIT_VIDEO-1-play_video-1	['ACTION_OPEN_DOCUMENT', 'ACTION_VIDEO_CAPTURE', 'open_settings', 'play_video', 'INTENT_ACTION_VIDEO_CAMERA']
['turn 1: Open Microsoft Excel for some spreadsheet work. -> Microsoft Excel launched successfully. You can start editing your sheets.', 'turn 2: Please enable the video camera on my phone for a recording session. -> Opening video camera... now in video recording mode.', 'turn 3: Go ahead and capture the video. -> Video saved to content://videos/session_20240606.mp4', 'turn 4: Trim content://videos/session_20240606.mp4 to include only from 10 seconds to 1 minute -> I’ve sliced your video from 10s to 60s. Grab the edited file here: content://videos/session_20240606_10-60s.mp4']	Start playback of it	Start playback of content://videos/session_20240606_10-60s.mp4	{'plan': 'play_video', 'arguments': {'video_uri': 'content://videos/session_20240606_10-60s.mp4'}}	launch_application-1508-INTENT_ACTION_VIDEO_CAMERA-1_NR-ACTION_VIDEO_CAPTURE-1-ACTION_EDIT_VIDEO-1-play_video-1	['ACTION_EDIT_ALARM', 'ACTION_EDIT_DOCUMENT', 'ACTION_IMAGE_CAPTURE', 'send_message', 'play_video']
"['turn 1: Please launch a 90-second timer. -> Your 90-second timer is now active.', ""turn 2: Open my device's camera in video mode so I can start shooting a scene. -> Your device’s video camera is activated. Go ahead and film!"", 'turn 3: Record the scene that was just activated with my device’s video camera. -> Video capture complete—file available at content://videos/scene_capture.mp4', 'turn 4: Trim content://videos/scene_capture.mp4 to start at 3 seconds and mute its audio -> Trimmed from 3 seconds onward and muted. Your file is at content://videos/scene_capture_3s_muted.mp4']"	I'd like to watch it	I'd like to watch content://videos/scene_capture_3s_muted.mp4	{'plan': 'play_video', 'arguments': {'video_uri': 'content://videos/scene_capture_3s_muted.mp4'}}	ACTION_SET_TIMER-603-INTENT_ACTION_VIDEO_CAMERA-1_NR-ACTION_VIDEO_CAPTURE-1-ACTION_EDIT_VIDEO-1-play_video-1	['play_video', 'web_search', 'launch_application', 'ACTION_SET_ALARM', 'ACTION_INSERT_EVENT']
"[""turn 1: Could you display the content of my sent folder? -> Displaying sent items: to victor@example.com - 'System Update'; to wanda@example.com - 'Team Lunch'; to xander@example.com - 'Client Meeting Notes'."", 'turn 2: Please open the app that lets me record videos on my phone. -> Sure thing—your video camera is now open. Go ahead and record.', 'turn 3: Start recording the video. -> Your video has been recorded and saved to content://media/external/video/media/1001.', 'turn 4: Trim content://media/external/video/media/1001 to the first 15 seconds. -> Your video is now a 15-second clip. You can play it here: content://media/external/video/media/1001_trim15s.mp4']"	Play the clip	Play content://media/external/video/media/1001_trim15s.mp4	{'plan': 'play_video', 'arguments': {'video_uri': 'content://media/external/video/media/1001_trim15s.mp4'}}	ACTION_VIEW_SENT_EMAILS-1972-INTENT_ACTION_VIDEO_CAMERA-1_NR-ACTION_VIDEO_CAPTURE-1-ACTION_EDIT_VIDEO-1-play_video-1	['launch_application', 'play_video', 'ACTION_INSERT_CONTACT', 'ACTION_GET_RINGTONE', 'search_location']
"[""turn 1: I'd like to glance at my most recent web history. -> Here's a quick glance at your most recent web visits: CNN (world news); Facebook (timeline); Instagram (feed); Quora (tech questions)"", 'turn 2: I need to record a vlog, can you launch the video recording camera? -> Video recording app started. Go ahead and capture your footage.', 'turn 3: Start capturing footage for my vlog. -> Camera is rolling now. When you finish, your vlog clip will be saved at content://videos/vlog_capture_001.mp4.', 'turn 4: Trim content://videos/vlog_capture_001.mp4 from 10 seconds to 45 seconds -> Your vlog’s trimmed between 10s and 45s—ready for you at content://videos/vlog_capture_001_10-45s.mp4.']"	Play the trimmed vlog clip	Play content://videos/vlog_capture_001_10-45s.mp4	{'plan': 'play_video', 'arguments': {'video_uri': 'content://videos/vlog_capture_001_10-45s.mp4'}}	ACTION_VIEW_WEB_HISTORY-2066-INTENT_ACTION_VIDEO_CAMERA-1_NR-ACTION_VIDEO_CAPTURE-1-ACTION_EDIT_VIDEO-1-play_video-1	['ACTION_EDIT_ALARM', 'ACTION_VIEW_WEB_HISTORY', 'ACTION_VIEW_SENT_EMAILS', 'get_contact_info_from_uri', 'play_video']
"['turn 1: Please generate a JPEG image and call it ProfilePic.jpg. -> Your JPEG image “ProfilePic.jpg” is all set at content://documents/ProfilePic.jpg.', ""turn 2: I would like to film something. Could you open my phone's video camera? -> Your phone’s video camera is active—start recording anytime."", 'turn 3: Record and save to content://mygallery/video1.mp4. -> Great! Your video has been captured and saved at content://mygallery/video1.mp4.', 'turn 4: Extract the segment from 5 seconds to 25 seconds and mute content://mygallery/video1.mp4 -> Here’s the segment you requested from 5s to 25s, with audio muted: content://mygallery/video1_clip.mp4.']"	Play the edited clip	Play content://mygallery/video1_clip.mp4	{'plan': 'play_video', 'arguments': {'video_uri': 'content://mygallery/video1_clip.mp4'}}	ACTION_CREATE_DOCUMENT-20-INTENT_ACTION_VIDEO_CAMERA-1_NR-ACTION_VIDEO_CAPTURE-1-ACTION_EDIT_VIDEO-1-play_video-1	['ACTION_VIDEO_CAPTURE', 'play_video', 'ACTION_VIEW_WEB_HISTORY', 'play_music', 'ACTION_INSERT_CONTACT']
