conversation_history	query	rewrited_query	answer	unique_idx	candidates
"['turn 1: Might you seize an image of the current scene? -> All set—image captured and saved to content://camera_app/photos/98765.', 'turn 2: Display content://camera_app/photos/98765 -> Displaying the captured image for you.', 'turn 3: I want to use the document picker to select a PDF for some editing tasks. -> Here’s the file chooser—go ahead and pick the PDF you’d like to edit.', ""turn 4: Create a new PDF document called EditableVersion.pdf -> Your PDF 'EditableVersion.pdf' has been successfully created at content://documents/EditableVersion.pdf.""]"	Edit it by adding an executive summary at the start.	Edit content://documents/EditableVersion.pdf by adding an executive summary at the start.	{'plan': 'ACTION_EDIT_DOCUMENT', 'arguments': {'document_uri': 'content://documents/EditableVersion.pdf', 'content': 'Add an executive summary at the start.'}}	ACTION_IMAGE_CAPTURE-339-ACTION_OPEN_CONTENT-1-ACTION_OPEN_DOCUMENT-1_NR-ACTION_CREATE_DOCUMENT-1-ACTION_EDIT_DOCUMENT-1	['ACTION_VIEW_WEB_HISTORY', 'ACTION_SET_ALARM', 'ACTION_EDIT_DOCUMENT', 'ACTION_SET_TIMER', 'web_search']
"['turn 1: Select various file types to include in the package. -> Opening file selector—please pick multiple files of any type.', 'turn 2: If there aren’t any files, create a new PDF document named PackageContents.pdf. -> No files detected. Let’s generate a PDF—pick a folder for “PackageContents.pdf.”', 'turn 3: Help me bring up a file picker to choose multiple plain text documents for review. -> Opening the document picker—please select all the plain text files you’d like to review.', ""turn 4: Create a new plain text document titled ReviewNotes.txt -> Success! Your new text file 'ReviewNotes.txt' is created at content://documents/ReviewNotes.txt.""]"	Edit that file to pre-fill it with headings: Introduction, Main Points, Conclusion.	Edit content://documents/ReviewNotes.txt to pre-fill it with headings: Introduction, Main Points, Conclusion.	{'plan': 'ACTION_EDIT_DOCUMENT', 'arguments': {'document_uri': 'content://documents/ReviewNotes.txt', 'content': 'headings: Introduction, Main Points, Conclusion'}}	ACTION_GET_CONTENT-200-ACTION_CREATE_DOCUMENT-1-ACTION_OPEN_DOCUMENT-1_NR-ACTION_CREATE_DOCUMENT-1-ACTION_EDIT_DOCUMENT-1	['INTENT_ACTION_STILL_IMAGE_CAMERA', 'send_email', 'ACTION_VIEW_SENT_EMAILS', 'ACTION_EDIT_DOCUMENT', 'web_search']
"['turn 1: Select a ringtone for the reminder alert. -> Reminder alert tone set to: content://media/ringtone/reminder_ping.mp3', 'turn 2: Set content://media/ringtone/reminder_ping.mp3 as the reminder ringtone. -> Reminder ringtone updated to content://media/ringtone/reminder_ping.mp3.', 'turn 3: Could I select one image only? I just need access to a single image document. -> Opening the image selector—go ahead and pick one image.', ""turn 4: Why not make a fresh image called VacationPhoto.jpg? -> Your new image 'VacationPhoto.jpg' is saved at content://images/VacationPhoto.jpg.""]"	Edit that image document to add the caption 'Summer trip highlights'.	Edit content://images/VacationPhoto.jpg to add the caption 'Summer trip highlights'.	"{'plan': 'ACTION_EDIT_DOCUMENT', 'arguments': {'document_uri': 'content://images/VacationPhoto.jpg', 'content': ""Add the caption 'Summer trip highlights'.""}}"	ACTION_GET_RINGTONE-304-ACTION_SET_RINGTONE-1-ACTION_OPEN_DOCUMENT-1_NR-ACTION_CREATE_DOCUMENT-1-ACTION_EDIT_DOCUMENT-1	['ACTION_VIEW_SENT_EMAILS', 'ACTION_SET_TIMER', 'ACTION_EDIT_DOCUMENT', 'get_contact_info', 'ACTION_IMAGE_CAPTURE']
"['turn 1: Could you connect me to the number 4044044044? -> Starting a call to 4044044044...', ""turn 2: Add 4044044044 to my contact list. -> I've added 4044044044 to your contact list. (URI: content://contacts/people/4044044044)"", 'turn 3: I want to choose one PDF document for permanent access. Please open the file chooser. -> Sure, opening the PDF picker—please select the document you’d like to grant long‑term access to.', 'turn 4: Go ahead and create one named BudgetReport.pdf. -> BudgetReport.pdf has been created at content://documents/BudgetReport.pdf.']"	Edit that document to insert a 'Total Expenses' section at the end.	Edit content://documents/BudgetReport.pdf to insert a 'Total Expenses' section at the end.	"{'plan': 'ACTION_EDIT_DOCUMENT', 'arguments': {'document_uri': 'content://documents/BudgetReport.pdf', 'content': ""Insert a 'Total Expenses' section at the end.""}}"	dial-927-ACTION_INSERT_CONTACT-1-ACTION_OPEN_DOCUMENT-1_NR-ACTION_CREATE_DOCUMENT-1-ACTION_EDIT_DOCUMENT-1	['ACTION_EDIT_CONTACT', 'ACTION_VIEW_PLAYLIST', 'ACTION_EDIT_DOCUMENT', 'INTENT_ACTION_VIDEO_CAMERA', 'ACTION_OPEN_CONTENT']
"[""turn 1: Open Apple Music and play 'Shape of You'. -> Starting 'Shape of You' on Apple Music for you."", 'turn 2: Show the songs in my Chill Vibes playlist. -> Here’s what’s in your Chill Vibes playlist: Lo‑fi Chill; Sunday Morning; Ocean Drive; Night Owl.', ""turn 3: I'm searching for a text document to open; nothing fancy, just one file will do. -> All right, launching the file chooser—please select the text document you need."", 'turn 4: Let’s create a new text document for me called JournalEntry.txt. -> JournalEntry.txt is all set at content://documents/JournalEntry.txt.']"	Edit that document to add my journal entry: 'Dear Diary, today was...'.	Edit content://documents/JournalEntry.txt to add my journal entry: 'Dear Diary, today was...'.	"{'plan': 'ACTION_EDIT_DOCUMENT', 'arguments': {'document_uri': 'content://documents/JournalEntry.txt', 'content': ""Add my journal entry: 'Dear Diary, today was...'.""}}"	play_music-1369-ACTION_VIEW_PLAYLIST-1-ACTION_OPEN_DOCUMENT-1_NR-ACTION_CREATE_DOCUMENT-1-ACTION_EDIT_DOCUMENT-1	['ACTION_VIDEO_CAPTURE', 'launch_application', 'ACTION_EDIT_DOCUMENT', 'ACTION_VIEW_SENT_EMAILS', 'send_email']
"['turn 1: Display the 3D model at content://models/ship.obj -> Opening 3D model from content://models/ship.obj. Dive into that ship design now!', ""turn 2: I'm having trouble with my SD card. Open the memory card settings for me. -> Memory card settings opened. You can troubleshoot your SD card here."", 'turn 3: I want to browse files and pick a PDF document. -> Opening the PDF picker now—please select the document you’d like to open for long‑term access.', ""turn 4: Create content://models/ship.obj as a PDF and name it SummaryReport.pdf. -> Done—'SummaryReport.pdf' is available at content://documents/SummaryReport.pdf.""]"	Edit that document to add the key findings paragraph after the introduction.	Edit content://documents/SummaryReport.pdf to add the key findings paragraph after the introduction.	{'plan': 'ACTION_EDIT_DOCUMENT', 'arguments': {'document_uri': 'content://documents/SummaryReport.pdf', 'content': 'Add the key findings paragraph after the introduction.'}}	ACTION_OPEN_CONTENT-275-open_settings-1_NR-ACTION_OPEN_DOCUMENT-1_NR-ACTION_CREATE_DOCUMENT-1-ACTION_EDIT_DOCUMENT-1	['dial', 'ACTION_SET_TIMER', 'ACTION_INSERT_CONTACT', 'ACTION_SHOW_ALARMS', 'ACTION_EDIT_DOCUMENT']
"[""turn 1: Hey, get this to jane_smith@website.com — the screenshot is at file:///screenshot.png, message body: 'See the issue highlighted in the attached image'. -> Sent to jane_smith@website.com with your screenshot and note about the issue."", ""turn 2: Can I see the message I sent jane_smith@website.com? -> Found in Sent: to jane_smith@website.com – 'See the issue highlighted in the attached image'."", ""turn 3: Add a calendar event called 'Lunch with Sarah'. It's a casual lunch meeting with Sarah, scheduled from 1700100000000 to 1700103600000. No location is specified. -> Added 'Lunch with Sarah'—Casual lunch meeting with Sarah—from 1700100000000 to 1700103600000. (content://calendar/event/13)"", 'turn 4: Show me a selection dialog where I can pick multiple plain text files. -> Here’s the multi-pick text-file dialog—select as many .txt files as you need. You picked: content://storage/documents/journal1.txt; content://storage/documents/reminder.txt; content://storage/documents/ideas.txt.']"	Open the second one	Open content://storage/documents/reminder.txt	{'plan': 'ACTION_OPEN_CONTENT', 'arguments': {'uri': 'content://storage/documents/reminder.txt', 'mime_type': 'text/plain'}}	send_email-1223-ACTION_VIEW_SENT_EMAILS-1-ACTION_INSERT_EVENT-1_NR-ACTION_OPEN_DOCUMENT-1_NR-ACTION_OPEN_CONTENT-1	['get_contact_info', 'ACTION_VIEW_RECENT_APPS', 'ACTION_OPEN_CONTENT', 'send_email', 'ACTION_INSERT_EVENT']
['turn 1: Bring up the log showing both incoming and outgoing calls. -> Here’s your incoming and outgoing calls:\n- Charlie +1-555-0199 (Incoming) - Today 9:30 AM\n- Mom +1-800-123-4567 (Incoming) - Today 6:00 AM\n- John +44-20-7946-0958 (Outgoing) - Today 11:45 AM\n- Bob +1-872-1285 (Outgoing) - Yesterday 1:15 PM', 'turn 2: Open the video recording feature on my smartphone so I can record a clip. -> Video camera app started successfully. Let’s record.', 'turn 3: Activate the standard photo camera feature on my device. -> Still image camera launched. Ready to shoot whenever you are.', 'turn 4: Open the standard photo camera image. -> Image loaded from your camera: content://camera/image/011.jpeg']	View that image	View content://camera/image/011.jpeg	{'plan': 'ACTION_OPEN_CONTENT', 'arguments': {'uri': 'content://camera/image/011.jpeg', 'mime_type': 'image/jpeg'}}	ACTION_VIEW_CALL_LOG-1918-INTENT_ACTION_VIDEO_CAMERA-1_NR-INTENT_ACTION_STILL_IMAGE_CAMERA-1_NR-ACTION_GET_CONTENT-1-ACTION_OPEN_CONTENT-1	['play_video', 'launch_application', 'ACTION_VIEW_EVENT', 'web_search', 'ACTION_OPEN_CONTENT']
['turn 1: Pop up all timers now active. -> Timers active now: 3 minutes - Desk tidy, 20 minutes - Gaming session, 45 minutes - Podcast.', 'turn 2: Start a 2-hour timer for writing and skip any confirmation dialogs. -> Launching your 2-hour writing timer now—no confirmation needed.', 'turn 3: Trigger the camera in still mode to capture a moment. -> Still camera mode is now active; you can capture your moment.', 'turn 4: Pick the picture from Still camera mode. -> Selected your still-mode shot: content://camera/image/014.jpeg']	Display it	Display content://camera/image/014.jpeg	{'plan': 'ACTION_OPEN_CONTENT', 'arguments': {'uri': 'content://camera/image/014.jpeg', 'mime_type': 'image/jpeg'}}	ACTION_SHOW_TIMERS-1888-ACTION_SET_TIMER-1-INTENT_ACTION_STILL_IMAGE_CAMERA-1_NR-ACTION_GET_CONTENT-1-ACTION_OPEN_CONTENT-1	['ACTION_EDIT_DOCUMENT', 'ACTION_PICK', 'ACTION_VIEW_CALL_LOG', 'ACTION_OPEN_CONTENT', 'get_contact_info_from_uri']
['turn 1: Let me pick multiple PowerPoint slides to merge. -> Let’s merge some slides! Pick all the PowerPoint files you need.', 'turn 2: Actually, create a new PowerPoint deck named MergedSlides.pptx -> Creating a blank presentation “MergedSlides.pptx.” Choose where you’d like to store it.', 'turn 3: I need to capture an image. Open the camera in still mode. -> Still image camera is up and running—take your picture when ready.', 'turn 4: Grab the recent pictures from the camera in still mode -> Here are the photos you just snapped: content://camera/image/017.jpeg, content://camera/image/018.jpeg']	Open the last photo	Open content://camera/image/018.jpeg	{'plan': 'ACTION_OPEN_CONTENT', 'arguments': {'uri': 'content://camera/image/018.jpeg', 'mime_type': 'image/jpeg'}}	ACTION_GET_CONTENT-204-ACTION_CREATE_DOCUMENT-1-INTENT_ACTION_STILL_IMAGE_CAMERA-1_NR-ACTION_GET_CONTENT-1-ACTION_OPEN_CONTENT-1	['ACTION_OPEN_CONTENT', 'ACTION_GET_RINGTONE', 'ACTION_EDIT_CONTACT', 'launch_application', 'ACTION_VIEW_WEB_HISTORY']
"['turn 1: Trim and mute content://performances/theater.mp4 between 10s and 120s. -> Perfect! I’ve extracted the 10s–2m segment from theater.mp4 and muted the audio. Your edited file is here: content://media/edited_video_004.mp4.', ""turn 2: I want to choose a document that's in PDF format from my files. -> Here we go: opening your PDF files—choose the document you'd like."", ""turn 3: I wish to record a still snapshot; please fire up the camera. -> Still image camera launched. You're all set to take a shot."", 'turn 4: Select that snapshot -> Snapshot loaded: content://temp/snapshot_20240601.jpg']"	Display that snapshot	Display content://temp/snapshot_20240601.jpg	{'plan': 'ACTION_OPEN_CONTENT', 'arguments': {'uri': 'content://temp/snapshot_20240601.jpg', 'mime_type': 'image/jpeg'}}	ACTION_EDIT_VIDEO-1729-ACTION_OPEN_DOCUMENT-1_NR-INTENT_ACTION_STILL_IMAGE_CAMERA-1_NR-ACTION_GET_CONTENT-1-ACTION_OPEN_CONTENT-1	['ACTION_CREATE_DOCUMENT', 'INTENT_ACTION_STILL_IMAGE_CAMERA', 'send_message', 'ACTION_EDIT_VIDEO', 'ACTION_OPEN_CONTENT']
['turn 1: Can you display the Date & Time settings? I need to adjust the clock. -> Date & Time settings opened—feel free to adjust your clock.', 'turn 2: Let me access a TXT document for long-term management from my device. -> Alright, launching the document browser so you can select a text file (.txt) for long-term access.', 'turn 3: I need to capture a live moment, kindly open the video recording application. -> Camera in video mode—ready to capture that live moment.', 'turn 4: Select multiple videos from the videos just recorded -> All done! Here are your selected recordings: content://camera/new_recording1.mp4, content://camera/new_recording2.mp4, content://camera/new_recording3.mp4']	Play those recordings as video/mp4	Play content://camera/new_recording1.mp4, content://camera/new_recording2.mp4, content://camera/new_recording3.mp4 as video/mp4	{'plan': 'ACTION_OPEN_CONTENT', 'arguments': {'uri': 'content://camera/new_recording1.mp4, content://camera/new_recording2.mp4, content://camera/new_recording3.mp4', 'mime_type': 'video/mp4'}}	open_settings-1098-ACTION_OPEN_DOCUMENT-1_NR-INTENT_ACTION_VIDEO_CAMERA-1_NR-ACTION_GET_CONTENT-1-ACTION_OPEN_CONTENT-1	['ACTION_VIEW_CONTACT', 'ACTION_SHOW_ALARMS', 'play_music', 'ACTION_OPEN_CONTENT', 'ACTION_EDIT_DOCUMENT']
"['turn 1: Make content://storage/emulated/0/Ringtones/vintage_tone.m4a my ringtone -> Vintage tone is now set as your default ringtone.', 'turn 2: Let me pick a different one instead of content://storage/emulated/0/Ringtones/vintage_tone.m4a. -> Got it! Opening up your ringtone list—just pick any other tone you like.', ""turn 3: I'd like to set content://storage/emulated/0/Ringtones/modern_beats.m4a as my ringtone -> modern_beats.m4a is set as your new ringtone—give it a listen!"", 'turn 4: Maybe I’ll pick another tone instead of content://storage/emulated/0/Ringtones/modern_beats.m4a -> Sure—opening your ringtone picker so you can pick a new tone.']"	Play it again	Play content://storage/emulated/0/Ringtones/modern_beats.m4a again	{'plan': 'ACTION_OPEN_CONTENT', 'arguments': {'uri': 'content://storage/emulated/0/Ringtones/modern_beats.m4a'}}	ACTION_SET_RINGTONE-1589-ACTION_GET_RINGTONE-1-ACTION_SET_RINGTONE-1-ACTION_GET_RINGTONE-1-ACTION_OPEN_CONTENT-1	['web_search', 'ACTION_IMAGE_CAPTURE', 'ACTION_GET_CONTENT', 'ACTION_OPEN_CONTENT', 'ACTION_CREATE_DOCUMENT']
"['turn 1: Display the 3D model at content://models/ship.obj -> Opening 3D model from content://models/ship.obj. Dive into that ship design now!', ""turn 2: I'm having trouble with my SD card. Open the memory card settings for me. -> Memory card settings opened. You can troubleshoot your SD card here."", 'turn 3: I want to browse files and pick a PDF document. -> Opening the PDF picker now—please select the document you’d like to open for long‑term access.', ""turn 4: Create content://models/ship.obj as a PDF and name it SummaryReport.pdf. -> Done—'SummaryReport.pdf' is available at content://documents/SummaryReport.pdf.""]"	Send it to the team group with the text 'Here's the summary report.'	Send content://documents/SummaryReport.pdf to the team group with the text 'Here's the summary report.'	"{'plan': 'send_message', 'arguments': {'to': 'the team group', 'message': ""Here's the summary report."", 'attachments': ['content://documents/SummaryReport.pdf']}}"	ACTION_OPEN_CONTENT-275-open_settings-1_NR-ACTION_OPEN_DOCUMENT-1_NR-ACTION_CREATE_DOCUMENT-1-send_message-1	['ACTION_INSERT_EVENT', 'send_message', 'ACTION_VIEW_RECENT_APPS', 'get_contact_info_from_uri', 'INTENT_ACTION_STILL_IMAGE_CAMERA']
"[""turn 1: Open Apple Music and play 'Shape of You'. -> Starting 'Shape of You' on Apple Music for you."", 'turn 2: Show the songs in my Chill Vibes playlist. -> Here’s what’s in your Chill Vibes playlist: Lo‑fi Chill; Sunday Morning; Ocean Drive; Night Owl.', ""turn 3: I'm searching for a text document to open; nothing fancy, just one file will do. -> All right, launching the file chooser—please select the text document you need."", 'turn 4: Let’s create a new text document for me called JournalEntry.txt. -> JournalEntry.txt is all set at content://documents/JournalEntry.txt.']"	Send it to Alice with the note 'Check out today's journal entry.'	Send content://documents/JournalEntry.txt to Alice with the note 'Check out today's journal entry.'	"{'plan': 'send_message', 'arguments': {'to': 'Alice', 'message': ""Check out today's journal entry."", 'attachments': ['content://documents/JournalEntry.txt']}}"	play_music-1369-ACTION_VIEW_PLAYLIST-1-ACTION_OPEN_DOCUMENT-1_NR-ACTION_CREATE_DOCUMENT-1-send_message-1	['send_message', 'ACTION_EDIT_ALARM', 'ACTION_GET_RINGTONE', 'ACTION_IMAGE_CAPTURE', 'ACTION_VIEW_SENT_MESSAGES']
"['turn 1: I want information on timers still running. -> Running timers: 30 seconds - Exercise, 12 minutes - Rice, 50 minutes - Study session.', 'turn 2: Start a 2-hour timer -> All set! 2-hour timer is ticking away.', 'turn 3: Help me extract a phone number from my contact list. -> Phone detail extracted: content://contacts/phone/33', ""turn 4: Fill content://contacts/phone/33's address with 123 Main St -> Done! Contact at content://contacts/phone/33 has been updated with the new address: 123 Main St.""]"	Send it a message saying 'Hi, I just added your address at 123 Main St. Let me know if it's correct.'	Send content://contacts/phone/33 a message saying 'Hi, I just added your address at 123 Main St. Let me know if it's correct.'	"{'plan': 'send_message', 'arguments': {'to': 'content://contacts/phone/33', 'message': ""Hi, I just added your address at 123 Main St. Let me know if it's correct.""}}"	ACTION_SHOW_TIMERS-1884-ACTION_SET_TIMER-1-ACTION_PICK-1_NR-ACTION_EDIT_CONTACT-1-send_message-1	['ACTION_SHOW_TIMERS', 'ACTION_OPEN_CONTENT', 'send_message', 'INTENT_ACTION_VIDEO_CAMERA', 'ACTION_SET_TIMER']
['turn 1: Launch the Android Gallery player to play content://videos/9876 -> Launching Android Gallery to play content://videos/9876.', 'turn 2: Mute content://videos/9876. -> Audio muted—your new file is ready at content://videos/9876_muted.mp4.', 'turn 3: Could you extract the address detail of a contact for me? -> Address info retrieved: content://contacts/address/14', 'turn 4: Add the email user123@gmail.com to content://contacts/address/14 -> Success! Added email user123@gmail.com to the contact at content://contacts/address/14.']	Send it a message saying 'Your email user123@gmail.com has been added to your contact info.'	Send content://contacts/address/14 a message saying 'Your email user123@gmail.com has been added to your contact info.'	{'plan': 'send_message', 'arguments': {'to': 'content://contacts/address/14', 'message': 'Your email user123@gmail.com has been added to your contact info.'}}	play_video-1420-ACTION_EDIT_VIDEO-1-ACTION_PICK-1_NR-ACTION_EDIT_CONTACT-1-send_message-1	['INTENT_ACTION_VIDEO_CAMERA', 'send_message', 'ACTION_NAVIGATE_TO_LOCATION', 'get_contact_info', 'open_settings']
"[""turn 1: Schedule 'Football Match' on July 14, 2024, from 4 PM to 6 PM at City Stadium. Description: Friendly game. -> Added 'Football Match' (Friendly game) for July\xa014,\xa02024, 4:00\xa0PM–6:00\xa0PM at City Stadium. You can check it here: content://calendar/event/4"", 'turn 2: Display the details of content://calendar/event/4. -> Your Football Match is set for July\xa014,\xa02024, 4:00\xa0PM–6:00\xa0PM at City Stadium. Good luck!', 'turn 3: Select from my saved contacts. -> Contact selected from your list: content://contacts/people/30', 'turn 4: Update content://contacts/people/30 company to Acme Corp -> Done! The company for contact content://contacts/people/30 has been updated to Acme Corp.']"	Send them a welcome message saying 'Your company has been changed to Acme Corp. Congrats!'	Send content://contacts/people/30 a welcome message saying 'Your company has been changed to Acme Corp. Congrats!'	{'plan': 'send_message', 'arguments': {'to': 'content://contacts/people/30', 'message': 'Your company has been changed to Acme Corp. Congrats!'}}	ACTION_INSERT_EVENT-479-ACTION_VIEW_EVENT-1-ACTION_PICK-1_NR-ACTION_EDIT_CONTACT-1-send_message-1	['INTENT_ACTION_VIDEO_CAMERA', 'web_search', 'send_message', 'ACTION_OPEN_CONTENT', 'play_music']
"[""turn 1: I need an event 'Dentist Check-Up' on August 1, 2024 at 11:00 AM at Smile Dental Clinic. Description: Routine cleaning. -> Your “Dentist Check-Up” on August 1, 2024 at 11:00\xa0AM at Smile Dental Clinic has been added. Check it out: content://calendar/event/4"", 'turn 2: Give me directions to Smile Dental Clinic -> Hit the road! navigation is started in a maps application: Smile Dental Clinic.', 'turn 3: Could you pick a contact for me from my records? -> Done—contact selected: content://contacts/people/8', ""turn 4: Update content://contacts/people/8's phone number to 555-1234 -> Your contact has been updated with the new number 555-1234. Here’s the updated entry: content://contacts/people/8""]"	Text them 'Your updated phone number 555-1234 has been saved.'	Text content://contacts/people/8 'Your updated phone number 555-1234 has been saved.'	{'plan': 'send_message', 'arguments': {'to': 'content://contacts/people/8', 'message': 'Your updated phone number 555-1234 has been saved.'}}	ACTION_INSERT_EVENT-459-ACTION_NAVIGATE_TO_LOCATION-1-ACTION_PICK-1_NR-ACTION_EDIT_CONTACT-1-send_message-1	['ACTION_SET_ALARM', 'ACTION_VIEW_SENT_EMAILS', 'ACTION_SHOW_ALARMS', 'send_message', 'ACTION_VIEW_PLAYLIST']
"[""turn 1: Please play Eminem's 'Lose Yourself'. -> Now spinning Lose Yourself by Eminem."", ""turn 2: Could you look for reliable sources that discuss the causes of urban pollution? -> Looking up 'causes of urban pollution sources'... Found studies on traffic emissions, industrial pollutants, and urban planning impacts."", ""turn 3: Choose a person's address from my set of saved contacts. -> Address successfully picked: content://contacts/address/19"", ""turn 4: Change content://contacts/address/19's street to 456 Oak Avenue -> Street address changed to 456 Oak Avenue. Updated address record: content://contacts/address/19""]"	Send them a message saying 'Your address has been updated to 456 Oak Avenue.'	Send content://contacts/address/19 a message saying 'Your address has been updated to 456 Oak Avenue.'	{'plan': 'send_message', 'arguments': {'to': 'content://contacts/address/19', 'message': 'Your address has been updated to 456 Oak Avenue.'}}	play_music-1358-web_search-1_NR-ACTION_PICK-1_NR-ACTION_EDIT_CONTACT-1-send_message-1	['ACTION_SET_TIMER', 'play_video', 'search_location', 'send_message', 'ACTION_VIEW_EVENT']
"['turn 1: Execute script install.sh from content://scripts/install.sh -> Opening script install.sh at content://scripts/install.sh.', 'turn 2: I need to dial someone soon; select their phone number from my phonebook. -> Dialer contact selector is up. You picked content://contacts/phone/55.', 'turn 3: Show me the details for content://contacts/phone/55 -> Opening the requested record: content://contacts/phone/55 — showing contact details now.', ""turn 4: Update content://contacts/phone/55 with company 'TechCorp' and set email to user55@techcorp.com -> Nice! I've set the company to TechCorp and email to user55@techcorp.com for content://contacts/phone/55.""]"	Email them welcoming them to TechCorp.	Email user55@techcorp.com welcoming them to TechCorp.	{'plan': 'send_email', 'arguments': {'to': 'user55@techcorp.com', 'body': 'welcoming them to TechCorp.'}}	ACTION_OPEN_CONTENT-251-ACTION_PICK-1_NR-ACTION_VIEW_CONTACT-1-ACTION_EDIT_CONTACT-1-send_email-1	['send_email', 'ACTION_OPEN_DOCUMENT', 'ACTION_EDIT_VIDEO', 'ACTION_SET_ALARM', 'ACTION_NAVIGATE_TO_LOCATION']
"['turn 1: Could you change the company of contact content://contacts/people/steph to GameWorks and update the address to 50 Arcade Dr? -> Opening the editor for Steph (content://contacts/people/steph) with company GameWorks and address 50 Arcade Dr.', 'turn 2: I want to launch a file picker to select a PDF document from my cloud storage. -> Picker ready. You selected: content://drive/Proposal.pdf', ""turn 3: Forward content://drive/Proposal.pdf to +1 (555) 333-0000 saying 'Here's the proposal for your review.' -> Proposal sent to +1 (555) 333-0000."", 'turn 4: Could you please provide a way to select my PDF file? -> PDF picker is up—just pick the document you need. You selected: content://drive/MyReports/AnnualReport.pdf.']"	Email it to manager@example.com with subject 'Annual Report' and body 'Attached is the annual report for your review. Thanks.'	Email content://drive/MyReports/AnnualReport.pdf to manager@example.com with subject 'Annual Report' and body 'Attached is the annual report for your review. Thanks.'	{'plan': 'send_email', 'arguments': {'to': 'manager@example.com', 'subject': 'Annual Report', 'body': 'Attached is the annual report for your review. Thanks.', 'attachments': ['content://drive/MyReports/AnnualReport.pdf']}}	ACTION_EDIT_CONTACT-91-ACTION_OPEN_DOCUMENT-1_NR-send_message-1-ACTION_OPEN_DOCUMENT-1_NR-send_email-1	['INTENT_ACTION_STILL_IMAGE_CAMERA', 'send_email', 'ACTION_INSERT_EVENT', 'ACTION_VIEW_EVENT', 'ACTION_SHOW_ALARMS']
