conversation_history	query	rewrited_query	answer	unique_idx	refered_turn	candidates
['turn 1: Show me a list of contact cards so I can pick one. -> Sure—here’s your contact list. Tap the card you’d like to select.', 'turn 2: Can you retrieve complete contact info for /directory/carmen? -> Sure thing! Here’s Carmen’s full contact card:\nName: Carmen Rodriguez\nPhone: +1-415-555-0199\nEmail: carmen.rodriguez@workmail.com\nAddress: 234 Elm Street, San Francisco, CA 94102', 'turn 3: Can you give +1-415-555-0199 a call? -> Dialing +1-415-555-0199...', 'turn 4: Save +1-415-555-0199 under a new contact -> Great news—your new contact has been created. You can find it at content://contacts/people/4155550199']	Store this number in my address book	Store +1-415-555-0199 in my address book	{'plan': 'ACTION_INSERT_CONTACT', 'arguments': {'contact_info': {'phone': '+1-415-555-0199'}}}	ACTION_PICK-531-get_contact_info-1_NR-dial-1-ACTION_INSERT_CONTACT-1-ACTION_INSERT_CONTACT-1	3	['ACTION_INSERT_CONTACT', 'ACTION_VIEW_RECENT_APPS', 'ACTION_SET_TIMER', 'dial', 'ACTION_PICK']
['turn 1: Get ready for me to take a picture—start the camera. -> The camera is ready to take a picture.', 'turn 2: Looking up the phone information from contact /contacts/alan_smith. Can you help? -> Sure thing! Alan Smith’s phone number is (617) 555-0123.', 'turn 3: Call (617) 555-0123 -> Calling (617) 555-0123...', 'turn 4: Add (617) 555-0123 to my address book -> Perfect—(617) 555-0123 is now saved to your address book. Check it here: content://contacts/people/1002.']	Save this number to my address book	Save (617) 555-0123 to my address book	{'plan': 'ACTION_INSERT_CONTACT', 'arguments': {'contact_info': {'phone': '(617) 555-0123'}}}	INTENT_ACTION_STILL_IMAGE_CAMERA-853-get_contact_info-1_NR-dial-1-ACTION_INSERT_CONTACT-1-ACTION_INSERT_CONTACT-1	3	['web_search', 'search_location', 'ACTION_CREATE_DOCUMENT', 'ACTION_VIEW_WEB_HISTORY', 'ACTION_INSERT_CONTACT']
['turn 1: Give me a summary of the contact at content://contacts/people/42. -> Here’s what I found:\n• Name: Michael Lee\n• Phone: 555-987-6543\n• Email: michael.lee42@example.com\n• Address: 321 Oak St, Centerville, OH 45459', 'turn 2: Open content://contacts/people/42 to show me the full profile of Michael Lee. -> Opening Michael Lee’s full profile now (content://contacts/people/42). You’ll see all his contact details.', 'turn 3: Call 555-987-6543. -> On it—dialing 555-987-6543 now...', 'turn 4: Store content://contacts/people/42 as a new contact -> Okay, created a new contact based on content://contacts/people/42. You can access it here: content://contacts/people/142']	Create a new contact with this number.	Create a new contact with 555-987-6543.	{'plan': 'ACTION_INSERT_CONTACT', 'arguments': {'contact_info': {'phone': '555-987-6543'}}}	get_contact_info-970-ACTION_VIEW_CONTACT-1-dial-1-ACTION_INSERT_CONTACT-1-ACTION_INSERT_CONTACT-1	3	['ACTION_PICK', 'ACTION_IMAGE_CAPTURE', 'ACTION_EDIT_VIDEO', 'ACTION_INSERT_EVENT', 'ACTION_INSERT_CONTACT']
['turn 1: Display all the alarms present. -> All alarms on file: [alarm_id: 1 - 6:20 AM, Morning Pages; alarm_id: 2 - 6:50 AM, Check News; alarm_id: 3 - 7:30 AM, Dog Walk; alarm_id: 4 - 9:00 AM, Project Discussion]', 'turn 2: Find a valid email for any of my contacts. -> Got it—let’s grab an email. Opening your contacts; please pick the person whose email you need.', 'turn 3: Dial 718-555-1212 -> Placing call to 718-555-1212...', 'turn 4: Add a contact with name Carol Lee and 718-555-1212 -> Successfully created Carol Lee in your address book: content://contacts/people/carol_lee.']	Create a new contact for this number	Create a new contact for 718-555-1212	{'plan': 'ACTION_INSERT_CONTACT', 'arguments': {'contact_info': {'phone': '718-555-1212'}}}	ACTION_SHOW_ALARMS-700-ACTION_PICK-1_NR-dial-1-ACTION_INSERT_CONTACT-1-ACTION_INSERT_CONTACT-1	3	['ACTION_INSERT_CONTACT', 'ACTION_VIEW_CALL_LOG', 'ACTION_CREATE_DOCUMENT', 'ACTION_INSERT_EVENT', 'open_settings']
"[""turn 1: Start a countdown for 2 hours 15 minutes 30 seconds and don't show any confirmation. -> Done! Timer set for 2 hours 15 minutes and 30 seconds."", 'turn 2: Can you show the phone details referenced at contact://phone/home/555? -> Home phone found: +1-555-0155.', 'turn 3: Call +1-555-0155. -> Dialing +1-555-0155...', 'turn 4: Please store +1-555-0155 -> Done! +1-555-0155 has been saved to your address book: content://contacts/people/15550155']"	Create a contact using this number and assign email charlie@example.com.	Create a contact using +1-555-0155 and assign email charlie@example.com.	{'plan': 'ACTION_INSERT_CONTACT', 'arguments': {'contact_info': {'phone': '+1-555-0155', 'email': 'charlie@example.com'}}}	ACTION_SET_TIMER-601-get_contact_info_from_uri-1_NR-dial-1-ACTION_INSERT_CONTACT-1-ACTION_INSERT_CONTACT-1	3	['send_message', 'ACTION_INSERT_CONTACT', 'ACTION_PICK', 'send_email', 'search_location']
"['turn 1: Expose my web surfing history. -> Sure thing! Your last visited sites are: Wikipedia (Neural Networks); Reddit (r/AskScience); New York Times (top stories); Udemy (Python course overview)', 'turn 2: Select one person from my contacts database. -> Okay, here are your contacts. Please choose one person to continue.', 'turn 3: Dial 323-123-9876 -> Dialing 323-123-9876...', ""turn 4: Create a new contact called Pizza Delivery using 323-123-9876 -> Your new 'Pizza Delivery' contact (323-123-9876) has been created—check it here: content://contacts/people/pizza_delivery.""]"	Let me see the log of that call	Let me see the log of 323-123-9876 call	{'plan': 'ACTION_VIEW_CALL_LOG', 'arguments': {}}	ACTION_VIEW_WEB_HISTORY-2064-ACTION_PICK-1_NR-dial-1-ACTION_INSERT_CONTACT-1-ACTION_VIEW_CALL_LOG-1	3	['ACTION_GET_CONTENT', 'open_settings', 'ACTION_VIEW_PLAYLIST', 'send_email', 'ACTION_VIEW_CALL_LOG']
"['turn 1: Could you tweak contact content://contacts/people/matthew by changing the phone number to (123) 456-7890? -> Sure thing—Matthew’s phone number is now (123)\xa0456‑7890. You’ll find his updated contact at content://contacts/people/matthew', ""turn 2: Schedule an event 'Workshop on AI' that dives deep into AI trends and technologies. It should be held at Innovation Hub, from 1703800000000 to 1703807200000. -> Your 'Workshop on AI' is set at Innovation Hub from 1703800000000 to 1703807200000. Event ID: content://calendar/event/9"", 'turn 3: Where is Innovation Hub located exactly? -> Here’s Innovation Hub: 321 Tech Way, Silicon Valley, CA 94043.', ""turn 4: Schedule a deep dive session at 321 Tech Way, Silicon Valley, CA 94043 on March 5 from 2 PM to 5 PM called 'AI Trends Analysis' with description 'Review the latest AI research and applications' -> Your 'AI Trends Analysis' deep dive is booked for March\xa05, 2024, 2:00\xa0PM–5:00\xa0PM at 321 Tech Way, Silicon Valley, CA 94043. See details here: content://calendar/event/110.""]"	Add a workshop event at that location on July 15th from 9am to 12pm with the team	Add a workshop event at 321 Tech Way, Silicon Valley, CA 94043 on July 15th from 9am to 12pm with the team	{'plan': 'ACTION_INSERT_EVENT', 'arguments': {'TITLE': 'Workshop Event', 'DESCRIPTION': 'With the team', 'EVENT_LOCATION': '321 Tech Way, Silicon Valley, CA 94043', 'BEGIN_TIME': 1721120400000, 'END_TIME': 1721131200000}}	ACTION_EDIT_CONTACT-108-ACTION_INSERT_EVENT-1_NR-search_location-1-ACTION_INSERT_EVENT-1-ACTION_INSERT_EVENT-1	3	['ACTION_INSERT_EVENT', 'ACTION_VIDEO_CAPTURE', 'ACTION_VIEW_EVENT', 'get_contact_info', 'ACTION_EDIT_ALARM']
"[""turn 1: Set up 'Gardening Meetup' June 8, 2024 at 10 AM to 12 PM at Community Garden, details: Planting season prep. -> Gardening Meetup (Planting season prep) scheduled for June\xa08,\xa02024 from 10:00\xa0AM to 12:00\xa0PM at Community Garden. Event URI: content://calendar/event/10"", ""turn 2: Please arrange a 'Coding Workshop' focused on Python at Tech Hub. The event is scheduled to run from 1700900000000 to 1700907200000. -> Your 'Coding Workshop' (Learning session focused on Python) is confirmed at Tech Hub from 1700900000000 to 1700907200000. Event URI: content://calendar/event/7"", 'turn 3: What’s the address for Community Garden? -> I’ve got Community Garden here: 256 Greenway Lane, Springfield, IL 62704.', ""turn 4: Schedule a planting session at 256 Greenway Lane, Springfield, IL 62704 this Saturday from 9 AM to 11 AM titled 'Seed Starting' with description 'Begin seeds for community garden'. -> Seed Starting event is set for this Saturday from 9:00\xa0AM to 11:00\xa0AM at 256 Greenway Lane, Springfield, IL\xa062704 (Begin seeds for community garden). Event URI: content://calendar/event/20""]"	Add a volunteer session there this Saturday from 8am to 11am	Add a volunteer session at 256 Greenway Lane, Springfield, IL 62704 this Saturday from 8am to 11am	{'plan': 'ACTION_INSERT_EVENT', 'arguments': {'TITLE': 'Volunteer Session', 'DESCRIPTION': 'Volunteer session', 'EVENT_LOCATION': '256 Greenway Lane, Springfield, IL 62704', 'BEGIN_TIME': 1714896000000, 'END_TIME': 1714905600000}}	ACTION_INSERT_EVENT-485-ACTION_INSERT_EVENT-1_NR-search_location-1-ACTION_INSERT_EVENT-1-ACTION_INSERT_EVENT-1	3	['dial', 'ACTION_INSERT_EVENT', 'ACTION_OPEN_DOCUMENT', 'play_video', 'ACTION_IMAGE_CAPTURE']
"['turn 1: Please extract the address for the person stored at content://contacts/people/2718. -> Here’s the address: 2718 Pine Lane, Rivertown, TX 75001.', 'turn 2: Show content://contacts/people/2718 -> Alright—bringing up the contact at content://contacts/people/2718. You should see the full profile now.', 'turn 3: Find 2718 Pine Lane, Rivertown, TX 75001 on the map -> Mapping 2718 Pine Lane, Rivertown, TX 75001—here you go.', ""turn 4: Add a barbecue at 2718 Pine Lane, Rivertown, TX 75001 on Saturday from 3pm to 6pm with the note 'Bring your own grill'. -> Your 'Barbecue' is now on the calendar for Saturday, 3:00\xa0PM–6:00\xa0PM at 2718 Pine Lane, Rivertown, TX\xa075001. Event URI: content://calendar/event/11""]"	Book a home inspection there next Wednesday at 10 AM for two hours titled Home Inspection with description Comprehensive property inspection	Book a home inspection at 2718 Pine Lane, Rivertown, TX 75001 next Wednesday at 10 AM for two hours titled Home Inspection with description Comprehensive property inspection	{'plan': 'ACTION_INSERT_EVENT', 'arguments': {'TITLE': 'Home Inspection', 'DESCRIPTION': 'Comprehensive property inspection', 'EVENT_LOCATION': '2718 Pine Lane, Rivertown, TX 75001', 'BEGIN_TIME': 1701200000000, 'END_TIME': 1701207200000}}	get_contact_info-975-ACTION_VIEW_CONTACT-1-search_location-1-ACTION_INSERT_EVENT-1-ACTION_INSERT_EVENT-1	3	['ACTION_PICK', 'ACTION_VIEW_CALL_LOG', 'open_settings', 'ACTION_NAVIGATE_TO_LOCATION', 'ACTION_INSERT_EVENT']
"['turn 1: Provide me the address details of contact content://contacts/people/333. -> Sure thing! The address for content://contacts/people/333 is 123 Maple Street, Springfield, IL 62704.', 'turn 2: What is the complete summary for the contact at /contacts/yolanda? -> Here’s a summary for Yolanda:\nName: Yolanda Martinez\nPhone: +1-312-555-0123\nEmail: yolanda.martinez@domain.com\nAddress: 456 Cedar Lane, Chicago, IL 60607', 'turn 3: Show 456 Cedar Lane, Chicago, IL 60607 on a map -> Opening map to 456 Cedar Lane, Chicago, IL 60607 for you.', ""turn 4: Set a dentist appointment at 456 Cedar Lane, Chicago, IL 60607 on July 15 from 9 AM to 10 AM titled 'Dental Checkup' with the description 'Routine cleaning' -> Your 'Dental Checkup' is booked for July\xa015, 9:00\xa0AM–10:00\xa0AM at 456 Cedar Lane, Chicago, IL\xa060607 (Routine cleaning). Event URI: content://calendar/event/16""]"	Set up an appointment titled 'Property Viewing' with description 'Inspect 456 Cedar Lane property' at that location on August 10 from 1 PM to 2 PM	Set up an appointment titled 'Property Viewing' with description 'Inspect 456 Cedar Lane property' at 456 Cedar Lane, Chicago, IL 60607 on August 10 from 1 PM to 2 PM	{'plan': 'ACTION_INSERT_EVENT', 'arguments': {'TITLE': 'Property Viewing', 'DESCRIPTION': 'Inspect 456 Cedar Lane property', 'EVENT_LOCATION': '456 Cedar Lane, Chicago, IL 60607', 'BEGIN_TIME': 1701800000000, 'END_TIME': 1701803600000}}	get_contact_info-1008-get_contact_info-1_NR-search_location-1-ACTION_INSERT_EVENT-1-ACTION_INSERT_EVENT-1	3	['ACTION_INSERT_EVENT', 'INTENT_ACTION_STILL_IMAGE_CAMERA', 'ACTION_GET_RINGTONE', 'ACTION_VIEW_CONTACT', 'INTENT_ACTION_VIDEO_CAMERA']
"['turn 1: Capture a quick video. -> Done! Your video has been recorded. Here’s the URI: content://videos/quickcap_001.mp4', 'turn 2: Play content://videos/quickcap_001.mp4 back -> Playing your quick video now.', 'turn 3: Email content://videos/quickcap_001.mp4 to colleague@example.com -> Email successfully sent to colleague@example.com with your video attached.', ""turn 4: Display the list of sent messages -> Here’s what you’ve sent:\n• to colleague@example.com - 'video attached'.""]"	Show the email where I attached that video	Show the email where I attached content://videos/quickcap_001.mp4	{'plan': 'ACTION_VIEW_SENT_EMAILS', 'arguments': {}}	ACTION_VIDEO_CAPTURE-706-ACTION_OPEN_CONTENT-1-send_email-1-ACTION_VIEW_SENT_EMAILS-1-ACTION_VIEW_SENT_EMAILS-1	3	['ACTION_VIEW_SENT_EMAILS', 'ACTION_EDIT_CONTACT', 'get_contact_info_from_uri', 'ACTION_SHOW_ALARMS', 'ACTION_VIEW_WEB_HISTORY']
"['turn 1: Could you search for the location of the Acropolis in Athens, Greece? -> Sure thing! The Acropolis is located at ""Acropolis, Athens 105 58, Greece.""', ""turn 2: Create an event at Acropolis, Athens 105 58, Greece on July 10 from 9 AM to 11 AM titled Project Review with description Discuss quarterly goals -> Your event 'Project Review' has been added to July 10, 2023, 9:00 AM–11:00 AM at Acropolis, Athens 105\xa058, Greece. content://calendar/event/201"", ""turn 3: Email the details of the event 'Project Review' at Acropolis, Athens 105 58, Greece on July 10 from 9 AM to 11 AM with description Discuss quarterly goals to john.doe@company.com -> Email successfully sent to john.doe@company.com with the event details."", ""turn 4: Show the details of the event 'Project Review' at Acropolis, Athens 105 58, Greece on July 10 from 9 AM to 11 AM with description Discuss quarterly goals in my sent emails. -> Sent emails: to john.doe@company.com - 'Project Review event details'.""]"	Show the email I sent about the Project Review event	Show the email I sent about the 'Project Review' event at Acropolis, Athens 105 58, Greece on July 10 from 9 AM to 11 AM with description Discuss quarterly goals	{'plan': 'ACTION_VIEW_SENT_EMAILS', 'arguments': {}}	search_location-1131-ACTION_INSERT_EVENT-1-send_email-1-ACTION_VIEW_SENT_EMAILS-1-ACTION_VIEW_SENT_EMAILS-1	3	['send_message', 'launch_application', 'web_search', 'ACTION_VIEW_SENT_EMAILS', 'ACTION_SET_ALARM']
"['turn 1: Please remind me at noon to take my lunch break every weekday. -> Got it! Alarm (alarm_no8) scheduled for 12:00 PM Monday through Friday: Take my lunch break.', ""turn 2: Schedule a 'Breakfast Meetup' for an early morning networking event. There is no specific location. It should run from 1701200000000 to 1701201800000. -> ‘Breakfast Meetup’ (Early morning networking event) has been added from 1701200000000 to 1701201800000. Event URI: content://calendar/event/4"", 'turn 3: Shoot me a message with content://calendar/event/4 schedule -> Your schedule info for event 4 has been sent to you.', ""turn 4: I want to add a new event called 'Strategy Session' to plan the next quarter's objectives in the Executive Boardroom. Schedule it from 1701900000000 to 1701907200000. -> Got it! 'Strategy Session' is scheduled in the Executive Boardroom (Planning the next quarter's objectives) from 1701900000000 to 1701907200000. You can open it here: content://calendar/event/108""]"	Show that schedule message you sent me.	Show the schedule message with content://calendar/event/4 schedule you sent me.	{'plan': 'ACTION_VIEW_SENT_MESSAGES', 'arguments': {}}	ACTION_SET_ALARM-561-ACTION_INSERT_EVENT-1_NR-send_message-1-ACTION_INSERT_EVENT-1_NR-ACTION_VIEW_SENT_MESSAGES-1	3	['ACTION_EDIT_VIDEO', 'get_contact_info_from_uri', 'ACTION_VIEW_WEB_HISTORY', 'send_message', 'ACTION_VIEW_SENT_MESSAGES']
"['turn 1: Could you change the company of contact content://contacts/people/steph to GameWorks and update the address to 50 Arcade Dr? -> Opening the editor for Steph (content://contacts/people/steph) with company GameWorks and address 50 Arcade Dr.', 'turn 2: I want to launch a file picker to select a PDF document from my cloud storage. -> Picker ready. You selected: content://drive/Proposal.pdf', ""turn 3: Forward content://drive/Proposal.pdf to +1 (555) 333-0000 saying 'Here's the proposal for your review.' -> Proposal sent to +1 (555) 333-0000."", 'turn 4: Could you please provide a way to select my PDF file? -> PDF picker is up—just pick the document you need. You selected: content://drive/MyReports/AnnualReport.pdf.']"	Show that proposal message.	Show the 'Here's the proposal for your review.' message.	{'plan': 'ACTION_VIEW_SENT_MESSAGES', 'arguments': {}}	ACTION_EDIT_CONTACT-91-ACTION_OPEN_DOCUMENT-1_NR-send_message-1-ACTION_OPEN_DOCUMENT-1_NR-ACTION_VIEW_SENT_MESSAGES-1	3	['ACTION_VIEW_SENT_MESSAGES', 'ACTION_EDIT_VIDEO', 'send_email', 'INTENT_ACTION_VIDEO_CAMERA', 'ACTION_SET_ALARM']
"['turn 1: Launch Bluetooth settings so I can connect to my headset. -> Bluetooth settings are open and ready for you to connect your headset.', 'turn 2: Open the file chooser for image documents, and allow me to pick multiple files if necessary. -> Image chooser launched—your picks:\n1) content://images/vacation1.jpg\n2) content://images/vacation2.png', ""turn 3: Text content://images/vacation1.jpg and content://images/vacation2.png to Emma with the message 'Thought you'd like these photos.' -> Photos delivered to Emma. She should get them shortly."", 'turn 4: Show me the messages I just sent -> Sent messages: Emma – ""Thought you\'d like these photos.""']"	Show me that photo message I just sent to Emma	Show me the photo message I just sent to Emma.	{'plan': 'ACTION_VIEW_SENT_MESSAGES', 'arguments': {}}	open_settings-1097-ACTION_OPEN_DOCUMENT-1_NR-send_message-1-ACTION_VIEW_SENT_MESSAGES-1-ACTION_VIEW_SENT_MESSAGES-1	3	['ACTION_VIEW_CALL_LOG', 'ACTION_EDIT_DOCUMENT', 'play_video', 'get_contact_info', 'ACTION_VIEW_SENT_MESSAGES']
"['turn 1: I need to speak with tech support: 1800-123-000. -> Dialing tech support at 1800-123-000 now...', 'turn 2: I need to select an image from my device for an upcoming editing session. -> On it! Opening your photo gallery picker—select the image you want to edit.', ""turn 3: Send the selected image to Cleo with the message 'Looking forward to editing this together.' -> Message sent to Clem. She'll be looking forward to editing, too."", 'turn 4: Show me the message I sent to Clem. -> Outgoing message to Clem: Clem – ""Looking forward to editing this together.""']"	Show the messages I sent to her.	Show the messages I sent to Clem.	{'plan': 'ACTION_VIEW_SENT_MESSAGES', 'arguments': {}}	dial-934-ACTION_OPEN_DOCUMENT-1_NR-send_message-1-ACTION_VIEW_SENT_MESSAGES-1-ACTION_VIEW_SENT_MESSAGES-1	3	['ACTION_VIEW_SENT_MESSAGES', 'ACTION_GET_RINGTONE', 'ACTION_GET_CONTENT', 'ACTION_SET_TIMER', 'ACTION_PICK']
"['turn 1: Provide me with my recent browsing sessions. -> Here are your recent browsing sessions: Zoom (meeting link); Trello (project board); Google Docs (grocery list); PayPal (transaction history)', 'turn 2: Review my latest internet activity, please. I need to know which websites I just looked at. -> Here are your most recent visits: Zoom (meeting link); Trello (project roadmap); Google Docs (grocery list); PayPal (transaction history)', ""turn 3: Search Google Docs (grocery list). -> Search results for 'grocery list': Shopping list templates, meal-planning guides, and Google Docs examples."", 'turn 4: Open the photographic mode on my smartphone, please. -> Photography mode is up and running—still image camera ready.']"	What's in my browsing history?	What's in your browsing history?	{'plan': 'ACTION_VIEW_WEB_HISTORY', 'arguments': {}}	ACTION_VIEW_WEB_HISTORY-2068-ACTION_VIEW_WEB_HISTORY-1_NR-web_search-1-INTENT_ACTION_STILL_IMAGE_CAMERA-1_NR-ACTION_VIEW_WEB_HISTORY-1	3	['ACTION_VIEW_WEB_HISTORY', 'INTENT_ACTION_STILL_IMAGE_CAMERA', 'ACTION_VIEW_SENT_MESSAGES', 'get_contact_info', 'open_settings']
"['turn 1: Launch the general settings menu. -> General settings opened—let me know what you’d like to configure.', 'turn 2: I want to access and update the document at content://letter/form. -> Opening your document for editing at content://letter/form. Let me know what changes you’d like to make.', ""turn 3: I'm looking for detailed reports on the impact of social media on society. -> Search results for 'impact of social media on society reports': Analysis of mental health effects, misinformation spread, and community engagement trends."", ""turn 4: What's the log of my recent web visits? -> Here are the pages you’ve visited: Search results for 'impact of social media on society reports'; report on mental health effects; analysis of misinformation spread; study on community engagement trends.""]"	Could you pull up my browser history?	Could you pull up the log of my recent web visits?	{'plan': 'ACTION_VIEW_WEB_HISTORY', 'arguments': {}}	open_settings-1106-ACTION_EDIT_DOCUMENT-1_NR-web_search-1_NR-ACTION_VIEW_WEB_HISTORY-1-ACTION_VIEW_WEB_HISTORY-1	3	['play_music', 'ACTION_VIEW_SENT_EMAILS', 'ACTION_VIEW_WEB_HISTORY', 'ACTION_VIEW_CALL_LOG', 'dial']
"[""turn 1: Please switch the ringtone to this OGG clip: content://storage/emulated/0/Movies/ringtone.ogg -> All set! Incoming calls will now ring with 'ringtone.ogg'."", ""turn 2: Browse available ringtones -> Sure thing—'ringtone2.ogg' is now your tone (content://storage/emulated/0/Movies/ringtone2.ogg)"", ""turn 3: I'm curious about recent advances in quantum computing; can you look it up? -> Search results for 'recent advances in quantum computing': Latest research papers, hardware developments, and expert articles."", ""turn 4: I fancy the sound at content://media/chic_harmony as my ringtone. Could you update it? -> Set 'chic_harmony' as your ringtone. Enjoy the sophisticated melody!""]"	Could you display my history from that search?	Could you display my history from the search about recent advances in quantum computing?	{'plan': 'ACTION_VIEW_WEB_HISTORY', 'arguments': {}}	ACTION_SET_RINGTONE-1577-ACTION_GET_RINGTONE-1-web_search-1_NR-ACTION_SET_RINGTONE-1_NR-ACTION_VIEW_WEB_HISTORY-1	3	['launch_application', 'ACTION_NAVIGATE_TO_LOCATION', 'ACTION_IMAGE_CAPTURE', 'ACTION_VIEW_WEB_HISTORY', 'ACTION_SHOW_TIMERS']
"['turn 1: Kickstart the still image camera. -> Camera app is now open and ready for still photos.', ""turn 2: Tell me which sites I accessed in the last few hours by showing my web history. -> Sure, you visited: CNN – Latest headlines; The Verge – Tech news roundup; Weather.com – Today's forecast; BBC News – World update; NYTimes – Market analysis."", ""turn 3: Search BBC News – World update again. -> Search results for 'BBC News – World update': Headline stories, global analysis, and live news reports."", ""turn 4: I need details on the timers that haven't finished yet. -> Timers still pending completion: [8 minutes - Video export, 3 minutes - File backup, 18 minutes - Download]""]"	Show my browsing history	Show CNN – Latest headlines; The Verge – Tech news roundup; Weather.com – Today's forecast; BBC News – World update; NYTimes – Market analysis	{'plan': 'ACTION_VIEW_WEB_HISTORY', 'arguments': {}}	INTENT_ACTION_STILL_IMAGE_CAMERA-860-ACTION_VIEW_WEB_HISTORY-1_NR-web_search-1-ACTION_SHOW_TIMERS-1_NR-ACTION_VIEW_WEB_HISTORY-1	3	['ACTION_VIEW_WEB_HISTORY', 'ACTION_CREATE_DOCUMENT', 'ACTION_VIEW_SENT_EMAILS', 'ACTION_EDIT_CONTACT', 'ACTION_VIEW_RECENT_APPS']
['turn 1: I’d like to check active timers. -> Two timers in progress: 35 minutes - Baking bread, 18 minutes - Gym circuit.', 'turn 2: Start another 18-minute timer for Gym circuit -> 18-minute Gym circuit timer is set. Go smash it!', 'turn 3: Fire up the Game Center so I can check out my installed games. -> Launching Game Center for you—browse your installed games now.', 'turn 4: Show me the apps I used after I opened Game Center. -> Here’s your post–Game Center app list: Settings; Messages; App Store; Music.']	Now that I fired up that gaming hub, show me my recent apps.	Now that I fired up Game Center, show me my recent apps.	{'plan': 'ACTION_VIEW_RECENT_APPS', 'arguments': {}}	ACTION_SHOW_TIMERS-1864-ACTION_SET_TIMER-1-launch_application-1_NR-ACTION_VIEW_RECENT_APPS-1-ACTION_VIEW_RECENT_APPS-1	3	['ACTION_VIEW_CONTACT', 'ACTION_OPEN_DOCUMENT', 'ACTION_VIEW_RECENT_APPS', 'launch_application', 'ACTION_SET_TIMER']
