conversation_history	query	rewrited_query	answer	unique_idx	refered_turn	candidates
"[""turn 1: Adjust alarm 15 to 09:55, label 'Call Mom', vibrate off. -> Updated Alarm 15 to 9:55\xa0AM with label 'Call Mom' and vibration turned off."", 'turn 2: Open a plain text file from my documents — just one file, please. -> Opening the plain text document picker—please select one file.', ""turn 3: Okay, let's create a new plain text file and name it Draft.txt. -> Got it—your new text file 'Draft.txt' is ready at content://documents/Draft.txt. Start typing whenever you like."", ""turn 4: Send content://documents/Draft.txt to Bob saying 'Here’s the draft document for you to start editing.' -> Done—your draft has been sent over to Bob.""]"	Email that file to editor@example.com with subject Draft Feedback and body Please provide your feedback on this draft.	Email content://documents/Draft.txt to editor@example.com with subject Draft Feedback and body Please provide your feedback on this draft.	{'plan': 'send_email', 'arguments': {'to': 'editor@example.com', 'subject': 'Draft Feedback', 'body': 'Please provide your feedback on this draft.', 'attachments': ['content://documents/Draft.txt']}}	ACTION_EDIT_ALARM-1656-ACTION_OPEN_DOCUMENT-1_NR-ACTION_CREATE_DOCUMENT-1-send_message-1-send_email-1	3	['ACTION_VIEW_CALL_LOG', 'ACTION_GET_CONTENT', 'ACTION_VIEW_PLAYLIST', 'send_email', 'ACTION_NAVIGATE_TO_LOCATION']
"['turn 1: Insert Sarah Connor with phone 610-555-1212, email sarah.connor@resistance.net. -> Sarah Connor’s contact entry is live! content://contacts/people/sarah_connor', ""turn 2: Need a dialog to choose a PDF document; I'm only selecting one file. -> Understood—opening the PDF selector. Please pick the single document you want."", ""turn 3: Go ahead and create one as a PDF named Invoice.pdf. -> Your new PDF 'Invoice.pdf' is ready: content://documents/Invoice.pdf."", ""turn 4: Edit content://documents/Invoice.pdf to add today's date and the total amount -> Editing content://documents/Invoice.pdf now. I’ve inserted today’s date and the total amount—feel free to review or adjust.""]"	Send that invoice PDF to accounting@example.com with body 'Please process this invoice at your earliest convenience.'	Send content://documents/Invoice.pdf to accounting@example.com with body 'Please process this invoice at your earliest convenience.'	{'plan': 'send_email', 'arguments': {'to': 'accounting@example.com', 'body': 'Please process this invoice at your earliest convenience.', 'attachments': ['content://documents/Invoice.pdf']}}	ACTION_INSERT_CONTACT-426-ACTION_OPEN_DOCUMENT-1_NR-ACTION_CREATE_DOCUMENT-1-ACTION_EDIT_DOCUMENT-1-send_email-1	3	['ACTION_VIEW_EVENT', 'ACTION_SET_TIMER', 'ACTION_EDIT_VIDEO', 'ACTION_VIDEO_CAPTURE', 'send_email']
"['turn 1: Open camera to capture scene. -> Done! Scene captured—check it out at content://external_media/100/photos/scene_01.jpg.', ""turn 2: I'm trying to open one PDF file that I can work on later; please open the file picker. -> Okay, pulling up the PDF file selection interface. Go ahead and pick the one you’d like."", ""turn 3: Create a new PDF document named WorkDocument.pdf -> PDF 'WorkDocument.pdf' is ready at content://documents/WorkDocument.pdf."", ""turn 4: Create an event titled 'Music Rehearsal' for a band practice session. It will take place at Studio 7 starting at 1701500000000 and ending at 1701503600000. -> Great! 'Music Rehearsal' has been scheduled at Studio\xa07 from 1701500000000 to 1701503600000. Check it out: content://calendar/event/202""]"	Email that document to client@example.com with subject 'Work Document Review' and body 'Here is the work document you requested.'	Email content://documents/WorkDocument.pdf to client@example.com with subject 'Work Document Review' and body 'Here is the work document you requested.'	{'plan': 'send_email', 'arguments': {'to': 'client@example.com', 'attachments': ['content://documents/WorkDocument.pdf'], 'subject': 'Work Document Review', 'body': 'Here is the work document you requested.'}}	ACTION_IMAGE_CAPTURE-368-ACTION_OPEN_DOCUMENT-1_NR-ACTION_CREATE_DOCUMENT-1-ACTION_INSERT_EVENT-1_NR-send_email-1	3	['get_contact_info_from_uri', 'play_music', 'send_message', 'send_email', 'ACTION_EDIT_VIDEO']
"[""turn 1: I want to choose a single PDF report. -> Here's the report you selected: content://docs/annual_report.pdf"", 'turn 2: Could you let me pick a single text file from my device? -> Sure—opening your text files. Pick one to proceed.', ""turn 3: Alright, let's make a new text file called Notes.txt. -> Done—'Notes.txt' has been created at content://documents/Notes.txt. Ready when you are to start typing."", ""turn 4: Send content://documents/Notes.txt to my assistant with the note 'Start filling this with daily updates' and attach content://documents/Notes.txt. -> Notes.txt has been sent to your assistant.""]"	Email that file to jane@example.com with the subject 'Meeting Notes'.	Email content://documents/Notes.txt to jane@example.com with the subject 'Meeting Notes'.	{'plan': 'send_email', 'arguments': {'to': 'jane@example.com', 'attachments': ['content://documents/Notes.txt'], 'subject': 'Meeting Notes'}}	ACTION_GET_CONTENT-174-ACTION_OPEN_DOCUMENT-1_NR-ACTION_CREATE_DOCUMENT-1-send_message-1-send_email-1	3	['ACTION_VIEW_SENT_EMAILS', 'ACTION_VIEW_RECENT_APPS', 'ACTION_VIEW_PLAYLIST', 'send_email', 'get_contact_info_from_uri']
"['turn 1: Locate the Sagrada Familia church in Barcelona for me. -> Dropping a pin at Sagrada Família, Carrer de Mallorca, 401, 08013 Barcelona, Spain. Check it out!', ""turn 2: Please call up a contact's email address from my records. -> Alrighty! Email selected here: content://contacts/email/108"", ""turn 3: Change content://contacts/email/108's company to Acme Corp and add phone 555-1234 -> All set—Acme Corp and phone number 555-1234 have been added. Updated record: content://contacts/email/108"", ""turn 4: Send content://contacts/email/108 a welcome message: 'Hello, welcome to Acme Corp! I'll call you soon at your new number.' -> Done! Message sent to content://contacts/email/108.""]"	Email that contact about the company and phone update	Email content://contacts/email/108 about the company and phone update	{'plan': 'send_email', 'arguments': {'to': 'content://contacts/email/108', 'body': 'about the company and phone update'}}	search_location-1168-ACTION_PICK-1_NR-ACTION_EDIT_CONTACT-1-send_message-1-send_email-1	3	['get_contact_info_from_uri', 'send_email', 'ACTION_SHOW_TIMERS', 'ACTION_SET_ALARM', 'ACTION_SET_TIMER']
['turn 1: Please extract the address for the person stored at content://contacts/people/2718. -> Here’s the address: 2718 Pine Lane, Rivertown, TX 75001.', 'turn 2: Show content://contacts/people/2718 -> Alright—bringing up the contact at content://contacts/people/2718. You should see the full profile now.', 'turn 3: Edit content://contacts/people/2718 to update the phone number to 555-123-4567 -> Got it—555-123-4567 is now saved as the phone for content://contacts/people/2718.', 'turn 4: Can you initiate my camera in video mode? I wish to record a message. -> Video app launched successfully. Recording mode is live.']	Email her about the updated phone number.	Email the person at content://contacts/people/2718 about the updated phone number.	{'plan': 'send_email', 'arguments': {'to': 'content://contacts/people/2718', 'body': 'the updated phone number'}}	get_contact_info-975-ACTION_VIEW_CONTACT-1-ACTION_EDIT_CONTACT-1-INTENT_ACTION_VIDEO_CAMERA-1_NR-send_email-1	3	['send_email', 'launch_application', 'ACTION_VIEW_SENT_MESSAGES', 'ACTION_OPEN_CONTENT', 'ACTION_CREATE_DOCUMENT']
"['turn 1: Show the apps in my recent activity log. -> Recent apps: Chrome; YouTube; Maps; Messages.', 'turn 2: Can you retrieve the email info for the record at /contacts/laura? -> Laura’s email address is laura.smith@domain.com.', ""turn 3: Update contacts/laura's company to Domain Inc. -> Domain Inc. is now listed as the company for contacts/laura."", 'turn 4: Send laura.smith@domain.com an email about the company update. -> Email to laura.smith@domain.com about the company update has been sent.']"	Email that contact a welcome message from Domain Inc.	Email laura.smith@domain.com a welcome message from Domain Inc.	{'plan': 'send_email', 'arguments': {'to': 'laura.smith@domain.com', 'body': 'A welcome message from Domain Inc.'}}	ACTION_VIEW_RECENT_APPS-2210-get_contact_info-1_NR-ACTION_EDIT_CONTACT-1-send_email-1-send_email-1	3	['ACTION_GET_CONTENT', 'ACTION_PICK', 'send_email', 'open_settings', 'ACTION_GET_RINGTONE']
"['turn 1: Retrieve an overview of contact content://profiles/contacts/2022. -> Contact details:\nName: Alex Johnson\nPhone: 315-555-0198\nEmail: alex.johnson@domain.com\nAddress: 456 Elm St, Metropolis, CA 90001.', 'turn 2: I want to take a portrait. Open up the good old still camera. -> Still image camera is now open for a portrait.', ""turn 3: Get the latest image file I just captured. -> Here's your latest capture: content://temp/latest_capture.jpg"", 'turn 4: Mute content://temp/latest_capture.jpg -> Your capture has been muted successfully. You can access it at content://media/edited_latest_capture_005.mp4.']"	Send that image to alice@example.com with subject 'Check this out'	Send content://media/edited_latest_capture_005.mp4 to alice@example.com with subject 'Check this out'	{'plan': 'send_email', 'arguments': {'to': 'alice@example.com', 'subject': 'Check this out', 'attachments': ['content://media/edited_latest_capture_005.mp4']}}	get_contact_info-1021-INTENT_ACTION_STILL_IMAGE_CAMERA-1_NR-ACTION_GET_CONTENT-1-ACTION_EDIT_VIDEO-1-send_email-1	3	['play_music', 'send_message', 'ACTION_INSERT_CONTACT', 'send_email', 'ACTION_CREATE_DOCUMENT']
"['turn 1: Lead me to Times Square in New York City. -> Ready to head to Times Square, New York City. Navigation is live.', 'turn 2: Fetch the email information for the contact at /directory/evelyn.email. -> Evelyn’s email address is evelyn.smith@corporate.com.', 'turn 3: Modify the contact at /directory/evelyn.email to use the new email evelyn.jones@corporate.com and set her company to Corporate Inc. -> Done! Evelyn’s contact has been updated with her new email and company. You can view it at /directory/evelyn.email.', ""turn 4: Please power up my phone's video camera so I can document an event. -> Camera launched. You’re all set to document your event.""]"	Where is that company located?	Where is Corporate Inc. located?	{'plan': 'search_location', 'arguments': {'query': 'Corporate Inc.'}}	ACTION_NAVIGATE_TO_LOCATION-1758-get_contact_info-1_NR-ACTION_EDIT_CONTACT-1-INTENT_ACTION_VIDEO_CAMERA-1_NR-search_location-1	3	['ACTION_PICK', 'send_message', 'get_contact_info', 'ACTION_INSERT_EVENT', 'search_location']
['turn 1: Give me a summary of the contact at content://contacts/people/42. -> Here’s what I found:\n• Name: Michael Lee\n• Phone: 555-987-6543\n• Email: michael.lee42@example.com\n• Address: 321 Oak St, Centerville, OH 45459', 'turn 2: Call 555-987-6543 -> Placing a call to 555-987-6543...', 'turn 3: Create new contact from the call to 555-987-6543 with address 321 Oak St, Centerville, OH 45459 -> Starting a new contact: phone 555-987-6543 and address 321 Oak St, Centerville, OH 45459 are pre-filled.', 'turn 4: Show 321 Oak St, Centerville, OH 45459 on a map -> Displaying 321 Oak St, Centerville, OH 45459 on the map now.']	Open that address on map	Open 321 Oak St, Centerville, OH 45459 on map	{'plan': 'search_location', 'arguments': {'query': '321 Oak St, Centerville, OH 45459'}}	get_contact_info-970-dial-1-ACTION_INSERT_CONTACT-1-search_location-1-search_location-1	3	['ACTION_VIEW_CALL_LOG', 'ACTION_VIEW_SENT_EMAILS', 'search_location', 'ACTION_NAVIGATE_TO_LOCATION', 'ACTION_EDIT_DOCUMENT']
"[""turn 1: Could you pull my spouse's email from content://contacts/657/data/email_spouse? -> Sure, here's your spouse's email: spouse@example.net."", ""turn 2: Show spouse@example.net's domain headquarters -> No headquarters info found for the domain example.net—it’s reserved."", ""turn 3: Please add a 'Team Building' event to my calendar. It involves fun activities and brainstorming at the Office Playground, scheduled from 1700500000000 to 1700505400000. -> Success! 'Team Building'—Fun activities and brainstorming—added at Office Playground from 1700500000000 to 1700505400000. (content://calendar/event/10)"", ""turn 4: Display content://calendar/event/10's details. -> Team Building – Fun activities & brainstorming at the Office Playground on November 12, 2:00\xa0PM–3:30\xa0PM.""]"	Where is that Office Playground located?	Where is the Office Playground located?	{'plan': 'search_location', 'arguments': {'query': 'Office Playground'}}	get_contact_info_from_uri-1051-search_location-1-ACTION_INSERT_EVENT-1_NR-ACTION_VIEW_EVENT-1-search_location-1	3	['ACTION_CREATE_DOCUMENT', 'search_location', 'ACTION_VIEW_RECENT_APPS', 'ACTION_SHOW_TIMERS', 'get_contact_info_from_uri']
"[""turn 1: Launch Tidal and play 'Bad Guy' by Billie Eilish. -> Streaming Bad Guy by Billie Eilish on Tidal."", ""turn 2: View my 'Top 50' playlist -> Your Top 50 playlist is ready: Blinding Lights; Save Your Tears; Peaches; Montero (Call Me By Your Name)."", ""turn 3: Plan an event 'Restaurant Reservation' for a dinner with friends at Bella Italia to celebrate a special occasion. It should run from 1701700000000 to 1701705400000. -> Your ‘Restaurant Reservation’ is confirmed for November 23 at Bella Italia. Check it out here: content://calendar/event/9"", 'turn 4: Can you show me where content://calendar/event/9 is? -> Map location: Bella Italia, 123 Park Ave, Springfield, IL 62704.']"	Where is that Bella Italia located?	Where is Bella Italia located?	{'plan': 'search_location', 'arguments': {'query': 'Bella Italia'}}	play_music-1359-ACTION_VIEW_PLAYLIST-1-ACTION_INSERT_EVENT-1_NR-search_location-1-search_location-2	3	['ACTION_VIEW_CALL_LOG', 'play_music', 'launch_application', 'search_location', 'ACTION_GET_CONTENT']
"['turn 1: Could you bring forward my recently opened apps? -> Your recent apps are: Chrome; YouTube; Docs; Sheets', 'turn 2: I am interested in seeing the timers that are currently on. -> Active timers list: [5 minutes – Stretch break, 25 minutes – Focus session, 3 minutes – Email check]', ""turn 3: I would like to add an event called 'Sculpture Workshop'. The description is 'Learn sculpting basics under expert guidance'. It will be hosted at the Art Institute from 1702500000000 to 1702505400000. -> Done – 'Sculpture Workshop' has been added on December 14 at Art Institute. Check it out: content://calendar/event/4"", ""turn 4: Can you locate content://calendar/event/4 for me? -> Sure—'Sculpture Workshop' is at Art Institute of Chicago, 111 S Michigan Ave, Chicago, IL 60603, USA.""]"	Where is that institute located?	Where is Art Institute of Chicago located?	{'plan': 'search_location', 'arguments': {'query': 'Art Institute of Chicago'}}	ACTION_VIEW_RECENT_APPS-2209-ACTION_SHOW_TIMERS-1_NR-ACTION_INSERT_EVENT-1_NR-search_location-1-search_location-1	3	['INTENT_ACTION_STILL_IMAGE_CAMERA', 'ACTION_OPEN_CONTENT', 'search_location', 'ACTION_EDIT_CONTACT', 'ACTION_EDIT_VIDEO']
"['turn 1: What have I been clicking around recently? -> Recent sites visited: Google search (best noise cancelling headphones); Wikipedia | Active Noise Control; YouTube video on Sony WH-1000XM4; Amazon Bose QuietComfort 35 II page; OpenAI Blog GPT-4 Release; Reddit r/headphones.', ""turn 2: Search Amazon Bose QuietComfort 35 II page again. -> Search results for 'Bose QuietComfort 35 II Amazon': Amazon product listing featuring Bose QC35 II headphones, detailed specs, current pricing, and verified customer reviews."", ""turn 3: Create an event titled 'Music Rehearsal' for a band practice session. It will take place at Studio 7 starting at 1701500000000 and ending at 1701503600000. -> Done! ‘Music Rehearsal’ is on November 21 at Studio 7. You can open it here: content://calendar/event/11"", 'turn 4: Show me where Studio 7 is on the map. -> This is where Studio\xa07 is located: 556 Music Blvd, Springfield, IL 62701.']"	Show me where that location is.	Show me where 556 Music Blvd, Springfield, IL 62701 is.	{'plan': 'search_location', 'arguments': {'query': '556 Music Blvd, Springfield, IL 62701'}}	ACTION_VIEW_WEB_HISTORY-2087-web_search-1-ACTION_INSERT_EVENT-1_NR-search_location-1-search_location-1	3	['search_location', 'send_message', 'ACTION_EDIT_CONTACT', 'launch_application', 'ACTION_IMAGE_CAPTURE']
"[""turn 1: Send to +1-808-555-0167: 'Surf's up! Catch you at the beach at 5?' -> Surf invite sent to +18085550167."", ""turn 2: Show the texts I just sent -> Here's your latest texts: +18085550167 – 'Surf's up! Catch you at the beach at 5?'."", ""turn 3: Schedule a 'Breakfast Meetup' for an early morning networking event. There is no specific location. It should run from 1701200000000 to 1701201800000. -> Your ‘Breakfast Meetup’ has been added on November 18. Take a look: content://calendar/event/14"", 'turn 4: Open content://calendar/event/14 in my calendar. -> Breakfast Meetup: November 18, 7:00\xa0AM–7:30\xa0AM. Early morning networking (no location specified).']"	Search for a suitable venue for it.	Search for a suitable venue for content://calendar/event/14.	{'plan': 'search_location', 'arguments': {'query': 'a suitable venue for content://calendar/event/14'}}	send_message-1289-ACTION_VIEW_SENT_MESSAGES-1-ACTION_INSERT_EVENT-1_NR-ACTION_VIEW_EVENT-1-search_location-1	3	['ACTION_OPEN_DOCUMENT', 'ACTION_EDIT_ALARM', 'search_location', 'web_search', 'ACTION_NAVIGATE_TO_LOCATION']
"['turn 1: Locate the Sagrada Familia church in Barcelona for me. -> Dropping a pin at Sagrada Família, Carrer de Mallorca, 401, 08013 Barcelona, Spain. Check it out!', ""turn 2: Please call up a contact's email address from my records. -> Alrighty! Email selected here: content://contacts/email/108"", ""turn 3: Change content://contacts/email/108's company to Acme Corp and add phone 555-1234 -> All set—Acme Corp and phone number 555-1234 have been added. Updated record: content://contacts/email/108"", ""turn 4: Send content://contacts/email/108 a welcome message: 'Hello, welcome to Acme Corp! I'll call you soon at your new number.' -> Done! Message sent to content://contacts/email/108.""]"	Call that number	Call 555-1234	{'plan': 'dial', 'arguments': {'phone_number': '555-1234'}}	search_location-1168-ACTION_PICK-1_NR-ACTION_EDIT_CONTACT-1-send_message-1-dial-3	3	['ACTION_EDIT_CONTACT', 'ACTION_VIEW_PLAYLIST', 'ACTION_GET_RINGTONE', 'ACTION_VIDEO_CAPTURE', 'dial']
"[""turn 1: Alarm 26 should be at 16:35 every Wednesday with 'uri://pop_tune' ringtone. -> Alarm 26 updated to 4:35\xa0PM every Wednesday using the 'uri://pop_tune' ringtone."", 'turn 2: Help me select a mailing address from my saved contacts. -> There you go! Mailing address selected: content://contacts/address/15', 'turn 3: Change content://contacts/address/15 to 456 Elm St and add phone 555-6789 -> All done—address set to “456 Elm St” and phone number 555-6789 added. View it at content://contacts/address/15', 'turn 4: Where is content://contacts/address/15 on the map? -> Location set: 456 Elm St on the map. Let me know if you need anything else.']"	Call that new number	Call 555-6789	{'plan': 'dial', 'arguments': {'phone_number': '555-6789'}}	ACTION_EDIT_ALARM-1660-ACTION_PICK-1_NR-ACTION_EDIT_CONTACT-1-search_location-1-dial-2	3	['ACTION_EDIT_VIDEO', 'ACTION_GET_RINGTONE', 'ACTION_PICK', 'dial', 'ACTION_VIEW_PLAYLIST']
"['turn 1: Locate the Sagrada Familia church in Barcelona for me. -> Dropping a pin at Sagrada Família, Carrer de Mallorca, 401, 08013 Barcelona, Spain. Check it out!', ""turn 2: Please call up a contact's email address from my records. -> Alrighty! Email selected here: content://contacts/email/108"", ""turn 3: Change content://contacts/email/108's company to Acme Corp and add phone 555-1234 -> All set—Acme Corp and phone number 555-1234 have been added. Updated record: content://contacts/email/108"", 'turn 4: Open content://contacts/email/108 to view details -> Here’s the contact entry you asked for: content://contacts/email/108']"	Call that number	Call 555-1234	{'plan': 'dial', 'arguments': {'phone_number': '555-1234'}}	search_location-1168-ACTION_PICK-1_NR-ACTION_EDIT_CONTACT-1-ACTION_VIEW_CONTACT-1-dial-2	3	['ACTION_VIEW_EVENT', 'dial', 'launch_application', 'ACTION_VIEW_SENT_MESSAGES', 'ACTION_PICK']
"[""turn 1: Alarm 26 should be at 16:35 every Wednesday with 'uri://pop_tune' ringtone. -> Alarm 26 updated to 4:35\xa0PM every Wednesday using the 'uri://pop_tune' ringtone."", 'turn 2: Help me select a mailing address from my saved contacts. -> There you go! Mailing address selected: content://contacts/address/15', 'turn 3: Change content://contacts/address/15 to 456 Elm St and add phone 555-6789 -> All done—address set to “456 Elm St” and phone number 555-6789 added. View it at content://contacts/address/15', 'turn 4: Show me contact details for content://contacts/address/15 -> Opening contact details for you: content://contacts/address/15']"	Place a call to that number.	Place a call to 555-6789.	{'plan': 'dial', 'arguments': {'phone_number': '555-6789'}}	ACTION_EDIT_ALARM-1660-ACTION_PICK-1_NR-ACTION_EDIT_CONTACT-1-ACTION_VIEW_CONTACT-1-dial-1	3	['ACTION_EDIT_DOCUMENT', 'ACTION_INSERT_EVENT', 'open_settings', 'dial', 'ACTION_SET_TIMER']
"[""turn 1: I need an event 'Dentist Check-Up' on August 1, 2024 at 11:00 AM at Smile Dental Clinic. Description: Routine cleaning. -> Your “Dentist Check-Up” on August 1, 2024 at 11:00\xa0AM at Smile Dental Clinic has been added. Check it out: content://calendar/event/4"", 'turn 2: Give me directions to Smile Dental Clinic -> Hit the road! navigation is started in a maps application: Smile Dental Clinic.', 'turn 3: Could you pick a contact for me from my records? -> Done—contact selected: content://contacts/people/8', ""turn 4: Update content://contacts/people/8's phone number to 555-1234 -> Your contact has been updated with the new number 555-1234. Here’s the updated entry: content://contacts/people/8""]"	Place a call to this contact	Place a call to 555-1234	{'plan': 'dial', 'arguments': {'phone_number': '555-1234'}}	ACTION_INSERT_EVENT-459-ACTION_NAVIGATE_TO_LOCATION-1-ACTION_PICK-1_NR-ACTION_EDIT_CONTACT-1-dial-1	3	['get_contact_info_from_uri', 'INTENT_ACTION_STILL_IMAGE_CAMERA', 'dial', 'ACTION_INSERT_CONTACT', 'ACTION_SET_ALARM']
"[""turn 1: Hey, get this to jane_smith@website.com — the screenshot is at file:///screenshot.png, message body: 'See the issue highlighted in the attached image'. -> Sent to jane_smith@website.com with your screenshot and note about the issue."", 'turn 2: Give me the phone information from the contact record located at /contacts/oliver. -> Oliver’s phone number is +44 20 7946 0958.', 'turn 3: View the contact record located at /contacts/oliver. -> Contact /contacts/oliver opened—here are Oliver’s details:\nName: Oliver\nPhone: +44 20 7946 0958', 'turn 4: Call +44 20 7946 0958 -> Dialing +44 20 7946 0958...']"	Call that number	Call +44 20 7946 0958	{'plan': 'dial', 'arguments': {'phone_number': '+44 20 7946 0958'}}	send_email-1223-get_contact_info-1_NR-ACTION_VIEW_CONTACT-1-dial-1-dial-1	3	['ACTION_VIEW_PLAYLIST', 'send_email', 'open_settings', 'dial', 'ACTION_GET_CONTENT']
"['turn 1: Give me the postal address of content://profiles/contacts/89. -> The postal address at content://profiles/contacts/89 is 789 Pine Road, Smalltown, CA 90210.', 'turn 2: Retrieve a mailing address from the contacts stored on my phone. -> Opening address picker. Selected: content://contacts/address/89.', ""turn 3: Edit content://contacts/address/89's name to John Doe -> Name field updated to John Doe. (content://contacts/address/89)"", ""turn 4: Send content://contacts/address/89 a message saying 'Your contact name is now John Doe.' -> Your name update confirmation has been sent to content://contacts/address/89.""]"	Show me that contact entry	Show me content://contacts/address/89.	{'plan': 'ACTION_VIEW_CONTACT', 'arguments': {'contact_uri': 'content://contacts/address/89'}}	get_contact_info-1012-ACTION_PICK-1_NR-ACTION_EDIT_CONTACT-1-send_message-1-ACTION_VIEW_CONTACT-1	3	['ACTION_VIEW_CONTACT', 'send_email', 'play_video', 'ACTION_INSERT_EVENT', 'get_contact_info']
"[""turn 1: I want a WAV audio file titled audio_sample.wav. -> I've created your WAV file 'audio_sample.wav'. You can open it at content://documents/audio_sample.wav"", ""turn 2: Play content://documents/audio_sample.wav -> Now playing 'audio_sample.wav' from content://documents/audio_sample.wav."", 'turn 3: Could you pull up an email address from my directory? -> I’ve got an email address for you: content://contacts/email/8', 'turn 4: Update the name of content://contacts/email/8 to Elizabeth Taylor -> All done! The name for content://contacts/email/8 is now Elizabeth Taylor.']"	View the contact info linked to that email.	View the contact info linked to content://contacts/email/8.	{'plan': 'ACTION_VIEW_CONTACT', 'arguments': {'contact_uri': 'content://contacts/email/8'}}	ACTION_CREATE_DOCUMENT-35-ACTION_OPEN_CONTENT-1-ACTION_PICK-1_NR-ACTION_EDIT_CONTACT-1-ACTION_VIEW_CONTACT-1	3	['ACTION_VIEW_CONTACT', 'ACTION_SET_ALARM', 'ACTION_SHOW_ALARMS', 'INTENT_ACTION_STILL_IMAGE_CAMERA', 'ACTION_EDIT_ALARM']
