conversation_history	query	rewrited_query	answer	unique_idx	candidates
['turn 1: Play track on SoundCloud: https://soundcloud.com/artist/song-name. -> Playing the SoundCloud track now: https://soundcloud.com/artist/song-name.', 'turn 2: Open my Road Trip playlist. -> Road Trip playlist loaded: Highway to Hell; Sweet Child O’ Mine; Back in Black; Born to Run.', 'turn 3: Play https://soundcloud.com/artist/song-name on Spotify -> Playing the SoundCloud link on Spotify: https://soundcloud.com/artist/song-name.', 'turn 4: I want to select one document that is in text format. Open my document picker. -> Opening the text document picker—choose your file. You picked: content://storage/documents/notes.txt.']	Email it to me@example.com with subject 'Meeting Notes' and a brief message 'Please find the notes attached.'	Email content://storage/documents/notes.txt to me@example.com with subject 'Meeting Notes' and a brief message 'Please find the notes attached.'	{'plan': 'send_email', 'arguments': {'to': 'me@example.com', 'subject': 'Meeting Notes', 'body': 'Please find the notes attached.', 'attachments': ['content://storage/documents/notes.txt']}}	play_music-1370-ACTION_VIEW_PLAYLIST-1-play_music-1-ACTION_OPEN_DOCUMENT-1_NR-send_email-1	['ACTION_PICK', 'ACTION_SET_ALARM', 'send_email', 'ACTION_IMAGE_CAPTURE', 'ACTION_VIEW_SENT_EMAILS']
['turn 1: Select a ringtone for the reminder alert. -> Reminder alert tone set to: content://media/ringtone/reminder_ping.mp3', 'turn 2: Set content://media/ringtone/reminder_ping.mp3 as the reminder ringtone. -> Reminder ringtone updated to content://media/ringtone/reminder_ping.mp3.', 'turn 3: I want a different alert sound instead of content://media/ringtone/reminder_ping.mp3. -> No problem—pulling up the ringtone picker so you can select a different alert tone.', 'turn 4: I require selecting an image file. Let me pick one image from my gallery. -> Gallery picker ready for a single image. You’ve selected: content://media/external/images/media/2048.']	Send that image to bob@example.com with subject 'Check this out' and message 'What do you think of this photo?'	Send content://media/external/images/media/2048 to bob@example.com with subject 'Check this out' and message 'What do you think of this photo?'	{'plan': 'send_email', 'arguments': {'to': 'bob@example.com', 'subject': 'Check this out', 'body': 'What do you think of this photo?', 'attachments': ['content://media/external/images/media/2048']}}	ACTION_GET_RINGTONE-304-ACTION_SET_RINGTONE-1-ACTION_GET_RINGTONE-1-ACTION_OPEN_DOCUMENT-1_NR-send_email-1	['ACTION_VIEW_PLAYLIST', 'ACTION_INSERT_CONTACT', 'send_email', 'ACTION_VIEW_SENT_MESSAGES', 'web_search']
"['turn 1: Write to support@cloudservice.com to ask why my VM instance keeps rebooting. -> Support request sent to support@cloudservice.com.', ""turn 2: View the emails I’ve just sent. -> Sent emails: to support@cloudservice.com - '(no subject)'"", 'turn 3: Open my camera app in still-image mode, please. -> Camera opened in still-image mode. Say cheese!', ""turn 4: Need a dialog to choose a PDF document; I'm only selecting one file. -> Launching PDF selector—pick one document. You chose: content://drive/research/paper.pdf.""]"	Send it to prof.brown@university.edu with subject 'Paper Submission' and body 'Please find my research paper attached.'	Send content://drive/research/paper.pdf to prof.brown@university.edu with subject 'Paper Submission' and body 'Please find my research paper attached.'	{'plan': 'send_email', 'arguments': {'to': 'prof.brown@university.edu', 'subject': 'Paper Submission', 'body': 'Please find my research paper attached.', 'attachments': ['content://drive/research/paper.pdf']}}	send_email-1215-ACTION_VIEW_SENT_EMAILS-1-INTENT_ACTION_STILL_IMAGE_CAMERA-1_NR-ACTION_OPEN_DOCUMENT-1_NR-send_email-1	['ACTION_VIDEO_CAPTURE', 'ACTION_INSERT_EVENT', 'search_location', 'launch_application', 'send_email']
"['turn 1: I need to record a video, open camera. -> You’re all set. Video camera is open and waiting.', 'turn 2: Capture this -> Commencing recording. Your video will be saved once you stop.', ""turn 3: Switch to the camera's still image mode so I can take a picture. -> Switched to still image mode—snap away!"", 'turn 4: Grab the picture. -> Got it—your picture is here: content://camera/image/008.jpeg']"	Email it to teamlead@example.com with subject 'Profile Picture'.	Email content://camera/image/008.jpeg to teamlead@example.com with subject 'Profile Picture'.	{'plan': 'send_email', 'arguments': {'to': 'teamlead@example.com', 'subject': 'Profile Picture', 'attachments': ['content://camera/image/008.jpeg']}}	INTENT_ACTION_VIDEO_CAMERA-900-ACTION_VIDEO_CAPTURE-1-INTENT_ACTION_STILL_IMAGE_CAMERA-1_NR-ACTION_GET_CONTENT-1-send_email-1	['open_settings', 'send_email', 'ACTION_EDIT_VIDEO', 'ACTION_EDIT_CONTACT', 'ACTION_VIEW_WEB_HISTORY']
"[""turn 1: Please put 'System Maintenance' on April 30, 2024 from 11 PM to May 1, 2 AM. Desc: Server upgrades. -> System Maintenance (Server upgrades) scheduled from April\xa030,\xa02024 11:00\xa0PM to May\xa01,\xa02024 2:00\xa0AM. Saved to calendar: content://calendar/event/5"", 'turn 2: Launch the Notes app as I need to jot down some ideas right away. -> Notes is open—feel free to jot down all your ideas.', 'turn 3: Please initiate the still image capture mode for photography. -> Still image camera is now open—go ahead and snap your photo.', 'turn 4: Select the still image photo. -> Still image ready for you: content://camera/image/009.jpeg']"	Email it to design@example.com with the message 'See attached image for review'.	Email content://camera/image/009.jpeg to design@example.com with the message 'See attached image for review'.	{'plan': 'send_email', 'arguments': {'to': 'design@example.com', 'body': 'See attached image for review', 'attachments': ['content://camera/image/009.jpeg']}}	ACTION_INSERT_EVENT-480-launch_application-1_NR-INTENT_ACTION_STILL_IMAGE_CAMERA-1_NR-ACTION_GET_CONTENT-1-send_email-1	['ACTION_SHOW_TIMERS', 'ACTION_INSERT_EVENT', 'ACTION_VIEW_EVENT', 'send_email', 'ACTION_EDIT_CONTACT']
['turn 1: Give me a summary of the contact at content://contacts/people/42. -> Here’s what I found:\n• Name: Michael Lee\n• Phone: 555-987-6543\n• Email: michael.lee42@example.com\n• Address: 321 Oak St, Centerville, OH 45459', 'turn 2: Open content://contacts/people/42 to show me the full profile of Michael Lee. -> Opening Michael Lee’s full profile now (content://contacts/people/42). You’ll see all his contact details.', 'turn 3: Call 555-987-6543. -> On it—dialing 555-987-6543 now...', 'turn 4: Store content://contacts/people/42 as a new contact -> Okay, created a new contact based on content://contacts/people/42. You can access it here: content://contacts/people/142']	Display it	Display content://contacts/people/142	{'plan': 'ACTION_VIEW_CONTACT', 'arguments': {'contact_uri': 'content://contacts/people/142'}}	get_contact_info-970-ACTION_VIEW_CONTACT-1-dial-1-ACTION_INSERT_CONTACT-1-ACTION_VIEW_CONTACT-1	['ACTION_SET_ALARM', 'ACTION_NAVIGATE_TO_LOCATION', 'ACTION_VIEW_CONTACT', 'play_music', 'ACTION_VIEW_EVENT']
"['turn 1: Pull up all existing alarms. -> Here are the alarms you’ve set: [alarm_id: 1 - 6:50 AM, Gym Session; alarm_id: 2 - 1:00 PM, Lunch Alert; alarm_id: 3 - 8:30 PM, Family Call]', 'turn 2: Change alarm_id: 3 - 8:30 PM, Family Call to 8:30 PM with the jazz ringtone and skip confirmation -> Alarm 3 is now scheduled for 8:30\xa0PM with the jazz ringtone. UI confirmation skipped.', 'turn 3: Bring up the full list. -> Active alarms on your device: [alarm_id: 1 - 6:50 AM, Gym Session; alarm_id: 2 - 1:00 PM, Lunch Alert; alarm_id: 3 - 8:30 PM, Family Call]', ""turn 4: Recommend a phone record from my phone book. -> All right, I've picked this phone number for you: content://contacts/phone/7""]"	Open it	Open content://contacts/phone/7	{'plan': 'ACTION_VIEW_CONTACT', 'arguments': {'contact_uri': 'content://contacts/phone/7'}}	ACTION_SHOW_ALARMS-663-ACTION_EDIT_ALARM-1-ACTION_SHOW_ALARMS-1-ACTION_PICK-1_NR-ACTION_VIEW_CONTACT-1	['play_video', 'ACTION_IMAGE_CAPTURE', 'send_message', 'ACTION_VIEW_CONTACT', 'ACTION_VIEW_PLAYLIST']
"[""turn 1: View songs in 'Piano Moods'. -> Playlist 'Piano Moods' loaded. Tracks: Clair de Lune; Nocturne Op.9 No.2; Moonlight Sonata."", ""turn 2: Play Nocturne Op.9 No.2. -> Okay, 'Nocturne Op.9 No.2' is on now."", ""turn 3: Show me the rest of Playlist 'Piano Moods'. -> Here’s 'Piano Moods' with its tracks: Clair de Lune; Nocturne Op.9 No.2; Moonlight Sonata."", 'turn 4: Could you extract the address detail of a contact for me? -> Done! The contact’s postal address is at: content://contacts/address/88']"	I'd like to see the full contact info for it.	I'd like to see the full contact info for content://contacts/address/88.	{'plan': 'ACTION_VIEW_CONTACT', 'arguments': {'contact_uri': 'content://contacts/address/88'}}	ACTION_VIEW_PLAYLIST-2136-play_music-1-ACTION_VIEW_PLAYLIST-1-ACTION_PICK-1_NR-ACTION_VIEW_CONTACT-1	['play_music', 'ACTION_VIEW_EVENT', 'ACTION_VIEW_CONTACT', 'ACTION_GET_CONTENT', 'ACTION_VIEW_WEB_HISTORY']
"['turn 1: Please pull up my sent MMS and SMS history. -> Sent MMS/SMS: VacationGroup – ""+1-310-555-0199"" – [Photo of beach]; Brian – ""+61 416 555 019"" – ""Thanks for dinner!""; Mom – ""+82-3512-0000"" – ""Love you lots!""', 'turn 2: Please start the Alarm app so I can set my wake-up time. -> Alarm app opened successfully. You can set your wake-up time now.', 'turn 3: Which apps did I use before launching the Alarm app? -> Recent apps: Messages; Alarm; Gallery; Settings.', 'turn 4: I’d like you to choose a phone number from my contacts. -> Sure thing! Here’s the phone number: content://contacts/phone/50']"	Could you show me the contact details for that number?	Could you show me the contact details for content://contacts/phone/50?	{'plan': 'ACTION_VIEW_CONTACT', 'arguments': {'contact_uri': 'content://contacts/phone/50'}}	ACTION_VIEW_SENT_MESSAGES-2001-launch_application-1_NR-ACTION_VIEW_RECENT_APPS-1-ACTION_PICK-1_NR-ACTION_VIEW_CONTACT-1	['web_search', 'INTENT_ACTION_VIDEO_CAMERA', 'ACTION_VIEW_CONTACT', 'ACTION_VIEW_PLAYLIST', 'ACTION_GET_RINGTONE']
['turn 1: Gather all Office documents (.doc, .docx, .xls, .xlsx, .ppt) in one go. -> Alright, you can select multiple Office documents—Word (.doc/.docx), Excel (.xls/.xlsx), and PowerPoint (.ppt). Please choose the files.', 'turn 2: Access one of my stored addresses from the contacts database. -> Address picker is ready. Address selected: content://contacts/address/15.', 'turn 3: Can I view the details of content://contacts/address/15? -> Here you go—loading the address details from content://contacts/address/15.', 'turn 4: Show me a complete summary for /data/alex. -> Sure thing—here’s Alex’s full contact summary: Name: Alex Martinez; Phone: +1-408-555-0199; Email: alex.martinez@example.com; Address: 742 Evergreen Terrace, Springfield, OR.']	Open it to display the full contact info	Open /data/alex to display the full contact info	{'plan': 'ACTION_VIEW_CONTACT', 'arguments': {'contact_uri': '/data/alex'}}	ACTION_OPEN_DOCUMENT-154-ACTION_PICK-1_NR-ACTION_VIEW_CONTACT-1-get_contact_info-1_NR-ACTION_VIEW_CONTACT-1	['ACTION_VIEW_CONTACT', 'dial', 'ACTION_SET_ALARM', 'ACTION_SHOW_TIMERS', 'open_settings']
['turn 1: Fetch any media files for preview. -> Opening file picker—select any files you’d like to preview. You can pick multiple items.', 'turn 2: Alright, create a new text document named PreviewList.txt. -> Here’s your new text file listing your selections: content://documents/PreviewList.txt', 'turn 3: Edit content://documents/PreviewList.txt to append numbering to each item -> Numbering appended to each entry in PreviewList.txt. You can check the updated list here: content://documents/PreviewList.txt', 'turn 4: I require a full summary of the contact details from /contacts/adam. -> Here’s the complete info for Adam:\n• Name: Adam Smith\n• Phone: +1-310-555-0145\n• Email: adam.smith@example.com\n• Address: 10 Downing Street, London, SW1A\xa02AA.']	Open it to view more details.	Open /contacts/adam to view more details.	{'plan': 'ACTION_VIEW_CONTACT', 'arguments': {'contact_uri': '/contacts/adam'}}	ACTION_GET_CONTENT-196-ACTION_CREATE_DOCUMENT-1-ACTION_EDIT_DOCUMENT-1-get_contact_info-1_NR-ACTION_VIEW_CONTACT-1	['open_settings', 'ACTION_INSERT_EVENT', 'ACTION_VIEW_CONTACT', 'ACTION_OPEN_DOCUMENT', 'play_music']
"['turn 1: Play the playlist file at content://music/playlist.m3u with MIME audio/x-mpegurl. -> Loading your playlist (content://music/playlist.m3u) now. Enjoy the tunes!', 'turn 2: I wish to record a still snapshot; please fire up the camera. -> Photo capture interface is now open.', 'turn 3: Take a photo and save it to content://photos/new_pic.jpg -> Your picture has been taken and saved to content://photos/new_pic.jpg', ""turn 4: I want you to pick a phone contact detail from my phone book. -> Done! Here's the phone detail selected: content://contacts/phone/6""]"	Call this number	Call content://contacts/phone/6	{'plan': 'dial', 'arguments': {'phone_number': 'content://contacts/phone/6'}}	ACTION_OPEN_CONTENT-272-INTENT_ACTION_STILL_IMAGE_CAMERA-1_NR-ACTION_IMAGE_CAPTURE-1-ACTION_PICK-1_NR-dial-1	['play_music', 'ACTION_SHOW_ALARMS', 'ACTION_PICK', 'dial', 'ACTION_EDIT_VIDEO']
"['turn 1: Open OneDrive so I can access my cloud files. -> OneDrive is now open. Your cloud storage is at your fingertips.', 'turn 2: List the apps I accessed after OneDrive. -> Following OneDrive: Excel; Word; Teams; Outlook.', ""turn 3: Add to my calendar an event named 'Interview Session'. The description is 'Discussing candidate roles'. No location is specified. Please set it from 1701500000000 to 1701505400000. -> You're all set! 'Interview Session'—Discussing candidate roles—from 1701500000000 to 1701505400000 has been added. (content://calendar/event/15)"", 'turn 4: Fetch a telephone number from one of my contacts. -> All right, here’s the phone entry you selected: content://contacts/phone/34']"	Call that number	Call content://contacts/phone/34	{'plan': 'dial', 'arguments': {'phone_number': 'content://contacts/phone/34'}}	launch_application-1510-ACTION_VIEW_RECENT_APPS-1-ACTION_INSERT_EVENT-1_NR-ACTION_PICK-1_NR-dial-1	['ACTION_SHOW_ALARMS', 'dial', 'ACTION_INSERT_EVENT', 'ACTION_GET_CONTENT', 'web_search']
"['turn 1: Open the YouTube app. -> YouTube opened successfully.', ""turn 2: What have I opened lately? -> Here's what you've opened recently: YouTube; Photos; Gmail; Calendar."", 'turn 3: I need to open both text and PDF files, and I want to be able to select multiple documents. -> Launching the picker for text and PDF files—you can select multiple items.', ""turn 4: Can you get me someone's phone number from my contact directory? -> Sure, here’s the phone number you picked: content://contacts/phone/78""]"	Place a call to it	Place a call to content://contacts/phone/78	{'plan': 'dial', 'arguments': {'phone_number': 'content://contacts/phone/78'}}	launch_application-1457-ACTION_VIEW_RECENT_APPS-1-ACTION_OPEN_DOCUMENT-1_NR-ACTION_PICK-1_NR-dial-1	['dial', 'ACTION_OPEN_DOCUMENT', 'ACTION_SET_RINGTONE', 'ACTION_EDIT_ALARM', 'ACTION_VIEW_SENT_EMAILS']
"[""turn 1: Add Ellen Ripley: email ellen@weylandyutani.com and note 'Warrant officer'. -> Ellen Ripley’s contact has been created (Warrant officer). Lookup ID: content://contacts/people/ellen_ripley"", 'turn 2: What is the contact summary for the URI /directory/contact_456? -> Here’s the contact summary for content://directory/contact_456:\nName: Emily Clark\nPhone: (302) 555-0147\nEmail: emily.clark@directory.com', ""turn 3: Update content://directory/contact_456's phone number to (302) 999-0000 and company to Acme Corp -> Contact content://directory/contact_456 updated: phone is now (302) 999-0000 and company set to Acme Corp."", 'turn 4: Show me the full profile of content://directory/contact_456. -> Displaying content://directory/contact_456. Emily Clark; Phone: (302) 999-0000; Email: emily.clark@directory.com; Company: Acme Corp.']"	Give her a call	Give (302) 999-0000 a call	{'plan': 'dial', 'arguments': {'phone_number': '(302) 999-0000'}}	ACTION_INSERT_CONTACT-424-get_contact_info-1_NR-ACTION_EDIT_CONTACT-1-ACTION_VIEW_CONTACT-1-dial-1	['ACTION_VIEW_WEB_HISTORY', 'ACTION_GET_RINGTONE', 'ACTION_SET_TIMER', 'ACTION_GET_CONTENT', 'dial']
"[""turn 1: Can I see the 'Movie Soundtracks' tracks? -> Movie Soundtracks includes: Time; My Heart Will Go On; Now We Are Free."", ""turn 2: Fetch web results regarding the current best practices in cybersecurity. -> Looking up 'current best cybersecurity practices'... Listing resources on zero trust, encryption standards, and threat mitigation."", 'turn 3: I want to choose a person by hand from my contacts. -> Sure thing—opening your contacts so you can pick the person you want. Once done, here’s the URI: content://contacts/people/9', 'turn 4: Show me the details of content://contacts/people/9. -> Opening contact details for Alice Johnson: +1-303-555-0142; alice.johnson@domain.com (content://contacts/people/9)']"	Call her	Call +1-303-555-0142	{'plan': 'dial', 'arguments': {'phone_number': '+1-303-555-0142'}}	ACTION_VIEW_PLAYLIST-2141-web_search-1_NR-ACTION_PICK-1_NR-ACTION_VIEW_CONTACT-1-dial-1	['dial', 'ACTION_EDIT_ALARM', 'ACTION_VIEW_EVENT', 'send_email', 'ACTION_SET_TIMER']
['turn 1: Invoke the video camera software. -> Video camera software is up and running.', 'turn 2: Select a single video for review -> Sure thing—opening your video library now. Please pick a single video for review.', 'turn 3: Recommend a phone record from my phone book. -> Recommended phone entry selected: content://contacts/phone/14', 'turn 4: Display the contact details of content://contacts/phone/14 -> Displaying number for David Lee: +1-212-555-0188 (URI: content://contacts/phone/14)']	Place a call to him	Place a call to +1-212-555-0188	{'plan': 'dial', 'arguments': {'phone_number': '+1-212-555-0188'}}	INTENT_ACTION_VIDEO_CAMERA-902-ACTION_GET_CONTENT-1-ACTION_PICK-1_NR-ACTION_VIEW_CONTACT-1-dial-1	['ACTION_INSERT_CONTACT', 'ACTION_GET_RINGTONE', 'ACTION_VIEW_EVENT', 'ACTION_SET_ALARM', 'dial']
"['turn 1: I need to select both images and videos. -> Understood. Please select the images and videos you need—you can pick more than one.', ""turn 2: I'm looking for reviews of the top fitness trackers right now; can you search that for me? -> Searching for 'reviews of top fitness trackers'... Comparing options like Fitbit, Apple\xa0Watch, Garmin, and their key features."", 'turn 3: Select one person from my contacts database. -> Contact picked: content://contacts/people/3', 'turn 4: Show me the details of content://contacts/people/3 -> Contact info for Frank White: +1-718-555-0102; frank.white@service.com (content://contacts/people/3)']"	Dial him	Dial +1-718-555-0102	{'plan': 'dial', 'arguments': {'phone_number': '+1-718-555-0102'}}	ACTION_OPEN_DOCUMENT-157-web_search-1_NR-ACTION_PICK-1_NR-ACTION_VIEW_CONTACT-1-dial-1	['ACTION_VIEW_SENT_MESSAGES', 'play_music', 'ACTION_VIEW_CONTACT', 'ACTION_IMAGE_CAPTURE', 'dial']
"['turn 1: Can I pick a contact’s email via the picker for registration? -> Opening the email selector—please choose the email for registration.', ""turn 2: Set a calendar event for 'Meditation Retreat', a full-day mindfulness practice session. No explicit location is mentioned and it is set from 1702700000000 to 1702707200000. -> 'Meditation Retreat' is now set on December 17, 2023, 9:00\xa0AM–11:00\xa0AM (no location). Access it via content://calendar/event/9."", ""turn 3: Where is 'Meditation Retreat' held? -> I’m not finding a set location for 'Meditation Retreat'. Would you like to add one?"", ""turn 4: Yes—set 'Meditation Retreat' at Serenity Center, 45 Peace Way, Harmony City, CA on December 17, 2023 from 9:00 AM to 11:00 AM with description 'Full-day mindfulness practice session'. -> ‘Meditation Retreat’ is now on your calendar at Serenity Center, 45 Peace Way, Harmony City, CA, on December\xa017,\xa02023, from 9:00\xa0AM to 11:00\xa0AM. Access it via: content://calendar/event/111.""]"	Can you show me where that is?	Can you show me where Serenity Center, 45 Peace Way, Harmony City, CA is?	{'plan': 'search_location', 'arguments': {'query': 'Serenity Center, 45 Peace Way, Harmony City, CA'}}	ACTION_PICK-539-ACTION_INSERT_EVENT-1_NR-search_location-1-ACTION_INSERT_EVENT-1-search_location-1	['get_contact_info_from_uri', 'dial', 'search_location', 'get_contact_info', 'ACTION_VIEW_WEB_HISTORY']
"[""turn 1: I'd like to see the phone number and email for content://contacts/people/1035. -> Here’s the phone and email for content://contacts/people/1035, opening now."", ""turn 2: Update content://contacts/people/1035's company to Initech -> Company updated to Initech for contact content://contacts/people/1035. You can review it now."", 'turn 3: Can you find Initech on a map? -> Here’s Initech on the map: 4120\xa0Friedrich\xa0Lane, Austin, TX\xa078744, USA.', ""turn 4: Schedule an Onboarding Meeting at 4120\xa0Friedrich\xa0Lane, Austin, TX\xa078744, USA next Monday from 3 PM to 5 PM with description 'Welcome new hires' -> Your 'Onboarding Meeting' has been scheduled for April\xa08,\xa02024, 3:00\xa0PM–5:00\xa0PM at 4120\xa0Friedrich\xa0Lane, Austin,\xa0TX\xa078744, USA. Description: Welcome new hires. Check it here: content://calendar/event/302""]"	Where exactly is that venue located?	Where exactly is 4120 Friedrich Lane, Austin, TX 78744, USA located?	{'plan': 'search_location', 'arguments': {'query': '4120\xa0Friedrich\xa0Lane, Austin, TX\xa078744, USA'}}	ACTION_VIEW_CONTACT-786-ACTION_EDIT_CONTACT-1-search_location-1-ACTION_INSERT_EVENT-1-search_location-1	['send_email', 'search_location', 'ACTION_GET_RINGTONE', 'play_video', 'ACTION_EDIT_VIDEO']
"['turn 1: I need the precise address for the Louvre Museum. -> The Louvre Museum sits at Rue de Rivoli, 75001 Paris, France.', ""turn 2: Add a museum visit at Rue de Rivoli, 75001 Paris, France on May 5 from 09:00 to 11:00 titled 'Louvre Morning Visit' with description 'Admire art collections'. -> Your calendar now includes 'Louvre Morning Visit' on May\xa05,\xa02023, from 9:00\xa0AM to 11:00\xa0AM at Rue de Rivoli, 75001 Paris, France. content://calendar/event/204"", 'turn 3: Show me where Rue de Rivoli, 75001 Paris, France is. -> Located: Rue de Rivoli, 75001 Paris, France. It’s pinned for you.', ""turn 4: Add an Afternoon Stroll at Rue de Rivoli, 75001 Paris, France this Sunday from 3 PM to 5 PM with description Walk along the riverbank -> Your 'Afternoon Stroll' has been set for this Sunday, 3:00\xa0PM–5:00\xa0PM at Rue de Rivoli, 75001 Paris, France. Walk along the riverbank. Here’s the link: content://calendar/event/307""]"	Could you locate it for me?	Could you locate Rue de Rivoli, 75001 Paris, France for me?	{'plan': 'search_location', 'arguments': {'query': 'Rue de Rivoli, 75001 Paris, France'}}	search_location-1145-ACTION_INSERT_EVENT-1-search_location-1-ACTION_INSERT_EVENT-1-search_location-1	['ACTION_SHOW_TIMERS', 'get_contact_info_from_uri', 'search_location', 'send_email', 'ACTION_INSERT_CONTACT']
"[""turn 1: Reveal the apps I've recently tapped into. -> Recent apps: TikTok; Snapchat; Messages; Music"", ""turn 2: Create an event titled 'Music Rehearsal' for a band practice session. It will take place at Studio 7 starting at 1701500000000 and ending at 1701503600000. -> Event 'Music Rehearsal' (Band practice for upcoming concert) has been added at Studio 7 from 1701500000000 to 1701503600000. Event URI: content://calendar/event/1"", 'turn 3: Where is Studio 7 located exactly? -> I found Studio\xa07 at 376 Avenue of the Americas, New\xa0York, NY\xa010014. Take a look.', ""turn 4: Set up a Drum Rehearsal at 376 Avenue of the Americas, New\xa0York, NY\xa010014 tomorrow from 2 PM to 4 PM with description Focus on rhythm drills -> Got it! 'Drum Rehearsal' is set for tomorrow, 2:00\xa0PM–4:00\xa0PM at 376 Avenue of the Americas, New\xa0York, NY\xa010014. Focus on rhythm drills. Here’s the event: content://calendar/event/309""]"	Drop a map pin there.	Drop a map pin at 376 Avenue of the Americas, New York, NY 10014.	{'plan': 'search_location', 'arguments': {'query': '376 Avenue of the Americas, New York, NY 10014'}}	ACTION_VIEW_RECENT_APPS-2206-ACTION_INSERT_EVENT-1_NR-search_location-1-ACTION_INSERT_EVENT-1-search_location-1	['search_location', 'ACTION_SET_ALARM', 'ACTION_GET_CONTENT', 'open_settings', 'get_contact_info']
"['turn 1: I want to cut segment from 0 to 7 seconds in content://kids/cartoon.mp4 -> Your cartoon clip is set to play from 0 to 7 seconds—video loaded with that segment.', 'turn 2: Would it be possible to see which timers are still active? -> Sure thing! Your active timers are: [5 minutes – Chamomile steep; 9 minutes – Homework; 16 minutes – Yoga session; 13 minutes – Parking meter].', 'turn 3: Start another timer for 20 minutes for dinner prep. -> 20-minute dinner prep timer activated. Enjoy your cooking!', ""turn 4: Please add an event called 'Gardening Workshop' that encourages community gardening. It will be held at City Park from 1701300000000 to 1701305400000. -> Garden time! 'Gardening Workshop' at City Park booked from 1701300000000 to 1701305400000. Event link: content://calendar/event/204""]"	Can you show me where it is?	Can you show me where City Park is?	{'plan': 'search_location', 'arguments': {'query': 'City Park'}}	ACTION_EDIT_VIDEO-1724-ACTION_SHOW_TIMERS-1_NR-ACTION_SET_TIMER-1-ACTION_INSERT_EVENT-1_NR-search_location-1	['ACTION_VIEW_EVENT', 'search_location', 'ACTION_VIEW_CALL_LOG', 'ACTION_SHOW_ALARMS', 'get_contact_info_from_uri']
