conversation_history	query	rewrited_query	answer	unique_idx	refered_turn	candidates
"[""turn 1: Can I see the 'Movie Soundtracks' tracks? -> Movie Soundtracks includes: Time; My Heart Will Go On; Now We Are Free."", ""turn 2: Fetch web results regarding the current best practices in cybersecurity. -> Looking up 'current best cybersecurity practices'... Listing resources on zero trust, encryption standards, and threat mitigation."", 'turn 3: I want to choose a person by hand from my contacts. -> Sure thing—opening your contacts so you can pick the person you want. Once done, here’s the URI: content://contacts/people/9', 'turn 4: Show me the details of content://contacts/people/9. -> Opening contact details for Alice Johnson: +1-303-555-0142; alice.johnson@domain.com (content://contacts/people/9)']"	Open that contact to display their details.	Open content://contacts/people/9 to display Alice Johnson's details.	{'plan': 'ACTION_VIEW_CONTACT', 'arguments': {'contact_uri': 'content://contacts/people/9'}}	ACTION_VIEW_PLAYLIST-2141-web_search-1_NR-ACTION_PICK-1_NR-ACTION_VIEW_CONTACT-1-ACTION_VIEW_CONTACT-1	3	['ACTION_VIEW_WEB_HISTORY', 'search_location', 'ACTION_VIEW_RECENT_APPS', 'ACTION_VIEW_CONTACT', 'ACTION_SHOW_TIMERS']
"['turn 1: Start streaming at rtmp://live.twitch.tv/app/stream_keyabc -> Connecting to rtmp://live.twitch.tv/app/stream_keyabc now. Your live stream is on!', 'turn 2: Can you start Snapchat? I want to see the latest stories. -> Snapchat is open—check out the newest stories.', 'turn 3: Select a personal contact entry from my list. -> Go ahead and choose a personal contact entry.', ""turn 4: Edit the contact at content://contacts/people/daniel and set daniel's email to daniel@initech.com -> All right! Daniel’s contact now includes daniel@initech.com. (content://contacts/people/daniel)""]"	Display that contact's full information.	Display content://contacts/people/daniel's full information.	{'plan': 'ACTION_VIEW_CONTACT', 'arguments': {'contact_uri': 'content://contacts/people/daniel'}}	play_video-1440-launch_application-1_NR-ACTION_PICK-1_NR-ACTION_EDIT_CONTACT-1-ACTION_VIEW_CONTACT-1	3	['ACTION_IMAGE_CAPTURE', 'ACTION_VIEW_CONTACT', 'play_video', 'ACTION_CREATE_DOCUMENT', 'ACTION_OPEN_DOCUMENT']
"[""turn 1: Can you help me edit the contact content://contacts/people/mary_bell? I want to add her work email mary@bellcorp.com. -> Got it, launching Mary's contact. You can add her work email mary@bellcorp.com right away."", ""turn 2: Send content://contacts/people/mary_bell a reminder message asking if she saw my email. -> Reminder sent to Mary Bell (content://contacts/people/mary_bell): 'Did you see my email?'."", 'turn 3: Get me a phone contact from my list, please. -> Phone record retrieved: content://contacts/phone/6', 'turn 4: Replace content://contacts/phone/6 with 987-654-3210 -> Phone number successfully replaced with 987-654-3210. Updated record: content://contacts/phone/6']"	Display that person’s details	Display content://contacts/phone/6’s details	{'plan': 'ACTION_VIEW_CONTACT', 'arguments': {'contact_uri': 'content://contacts/phone/6'}}	ACTION_EDIT_CONTACT-57-send_message-1-ACTION_PICK-1_NR-ACTION_EDIT_CONTACT-1-ACTION_VIEW_CONTACT-1	3	['ACTION_OPEN_CONTENT', 'ACTION_VIEW_CONTACT', 'ACTION_EDIT_VIDEO', 'ACTION_EDIT_DOCUMENT', 'ACTION_VIEW_EVENT']
"[""turn 1: Can you get the video camera up and running? -> You're all set—the video camera is open."", 'turn 2: Go ahead and record the video camera. -> All done! Video saved at content://example/new_video.mp4.', 'turn 3: Please retrieve a mobile phone number from my contacts for me. -> No problem—bringing up phone number selection. Once you pick one, I’ll grab it for you. Chosen phone URI: content://contacts/phone/21', ""turn 4: Change content://contacts/phone/21's phone number to +1-202-555-0175 -> Got it! The phone number for content://contacts/phone/21 is now set to +1-202-555-0175.""]"	Show me the details of that contact.	Show me the details of content://contacts/phone/21.	{'plan': 'ACTION_VIEW_CONTACT', 'arguments': {'contact_uri': 'content://contacts/phone/21'}}	INTENT_ACTION_VIDEO_CAMERA-912-ACTION_VIDEO_CAPTURE-1-ACTION_PICK-1_NR-ACTION_EDIT_CONTACT-1-ACTION_VIEW_CONTACT-1	3	['open_settings', 'ACTION_SET_ALARM', 'send_message', 'ACTION_VIEW_CONTACT', 'ACTION_PICK']
"['turn 1: Please start playing on the default player. -> Alright, launching your default music player now.', ""turn 2: Show me the songs in my default playlist -> Playlist 'Default Playlist': Smells Like Teen Spirit; Sweet Child O' Mine; Back in Black"", 'turn 3: I want you to pick a phone contact detail from my phone book. -> Your chosen phone contact: content://contacts/phone/29', ""turn 4: Set content://contacts/phone/29's company to Initech -> Got it! Company updated to Initech for contact at content://contacts/phone/29.""]"	I'd like to view its info.	I'd like to view content://contacts/phone/29's info.	{'plan': 'ACTION_VIEW_CONTACT', 'arguments': {'contact_uri': 'content://contacts/phone/29'}}	play_music-1401-ACTION_VIEW_PLAYLIST-1-ACTION_PICK-1_NR-ACTION_EDIT_CONTACT-1-ACTION_VIEW_CONTACT-1	3	['get_contact_info', 'send_message', 'ACTION_VIEW_PLAYLIST', 'ACTION_VIEW_CONTACT', 'ACTION_OPEN_DOCUMENT']
['turn 1: Play ms-wmv://media.server.net/file.wmv -> Playing media from ms-wmv://media.server.net/file.wmv with your default player. Enjoy!', 'turn 2: Trim ms-wmv://media.server.net/file.wmv from 10 seconds to 1 minute and mute the audio. -> Your video has been trimmed (10s–60s) and muted. Check out the edited file here: content://media/edited_file_004.wmv.', 'turn 3: I require a full summary of the contact details from /contacts/adam. -> Complete summary for /contacts/adam:\nName: Adam Brown\nPhone: (212) 555-0101\nEmail: adam.brown@domain.com\nAddress: 200 Elm Street, New York, NY 10001', 'turn 4: Dial (212) 555-0101 -> Initiating call to (212) 555-0101...']	Show me that contact	Show me /contacts/adam	{'plan': 'ACTION_VIEW_CONTACT', 'arguments': {'contact_uri': '/contacts/adam'}}	play_video-1436-ACTION_EDIT_VIDEO-1-get_contact_info-1_NR-dial-1-ACTION_VIEW_CONTACT-1	3	['ACTION_SET_RINGTONE', 'ACTION_OPEN_DOCUMENT', 'ACTION_VIEW_CONTACT', 'ACTION_OPEN_CONTENT', 'ACTION_VIEW_EVENT']
['turn 1: Please take a photo and let the system decide where to save it. -> Got it. Photo taken and stored at content://media/internal/photos/IMG_20230615_100200.jpg.', 'turn 2: Select a personal contact entry from my list. -> Personal contacts shown. You chose content://contacts/people/27.', 'turn 3: Add an address to content://contacts/people/27: 123 Maple Street, Springfield -> Address added: 123 Maple Street, Springfield. (content://contacts/people/27)', 'turn 4: Let me see the contact info for content://contacts/people/27. -> Showing content://contacts/people/27:\nName: Emily Clark\nPhone: +1-310-555-7890\nEmail: emily.clark@example.com\nAddress: 123 Maple Street, Springfield']	Get directions to that address	Get directions to 123 Maple Street, Springfield	{'plan': 'ACTION_NAVIGATE_TO_LOCATION', 'arguments': {'location': '123 Maple Street, Springfield'}}	ACTION_IMAGE_CAPTURE-370-ACTION_PICK-1_NR-ACTION_EDIT_CONTACT-1-ACTION_VIEW_CONTACT-1-ACTION_NAVIGATE_TO_LOCATION-1	3	['ACTION_INSERT_CONTACT', 'ACTION_NAVIGATE_TO_LOCATION', 'ACTION_VIEW_PLAYLIST', 'ACTION_VIEW_CONTACT', 'ACTION_EDIT_VIDEO']
"['turn 1: Could you let me choose a number to call from contacts? -> Certainly—displaying your contact phone numbers. Please select one to call.', 'turn 2: I need a complete summary of the contact details for /contacts/alexander. -> Complete details for /contacts/alexander:\nName: Alexander\nPhone: (404) 555-0168\nEmail: alexander@contacts.org\nAddress: 56 Pine Street, Atlanta, GA', ""turn 3: Edit /contacts/alexander's address to 123 Oak Avenue, New York, NY -> Done—the address for /contacts/alexander is now 123 Oak Avenue, New York, NY."", 'turn 4: Could you help me see which timers are operational right now? -> Active timers: [3 minutes - Pasta; 12 minutes - Study session; 8 minutes - Tea steeping]']"	Take me there	Take me to 123 Oak Avenue, New York, NY	{'plan': 'ACTION_NAVIGATE_TO_LOCATION', 'arguments': {'location': '123 Oak Avenue, New York, NY'}}	ACTION_PICK-530-get_contact_info-1_NR-ACTION_EDIT_CONTACT-1-ACTION_SHOW_TIMERS-1_NR-ACTION_NAVIGATE_TO_LOCATION-2	3	['ACTION_OPEN_CONTENT', 'ACTION_NAVIGATE_TO_LOCATION', 'ACTION_VIEW_RECENT_APPS', 'ACTION_SET_ALARM', 'ACTION_VIEW_PLAYLIST']
"[""turn 1: Could you pull my spouse's email from content://contacts/657/data/email_spouse? -> Sure, here's your spouse's email: spouse@example.net."", ""turn 2: Show spouse@example.net's domain headquarters -> No headquarters info found for the domain example.net—it’s reserved."", ""turn 3: Please add a 'Team Building' event to my calendar. It involves fun activities and brainstorming at the Office Playground, scheduled from 1700500000000 to 1700505400000. -> Success! 'Team Building'—Fun activities and brainstorming—added at Office Playground from 1700500000000 to 1700505400000. (content://calendar/event/10)"", ""turn 4: Display content://calendar/event/10's details. -> Team Building – Fun activities & brainstorming at the Office Playground on November 12, 2:00\xa0PM–3:30\xa0PM.""]"	Guide me to that place	Guide me to the Office Playground	{'plan': 'ACTION_NAVIGATE_TO_LOCATION', 'arguments': {'location': 'Office Playground'}}	get_contact_info_from_uri-1051-search_location-1-ACTION_INSERT_EVENT-1_NR-ACTION_VIEW_EVENT-1-ACTION_NAVIGATE_TO_LOCATION-1	3	['ACTION_EDIT_ALARM', 'ACTION_VIEW_CONTACT', 'web_search', 'ACTION_NAVIGATE_TO_LOCATION', 'INTENT_ACTION_STILL_IMAGE_CAMERA']
"['turn 1: Search for 500 Terry Francois Boulevard, San Francisco, CA. -> Got it: 500 Terry Francois Blvd, San Francisco, CA 94158, USA.', 'turn 2: Email 500 Terry Francois Blvd, San Francisco, CA 94158, USA to assistant@example.com and ask them to schedule a site visit. -> Message sent to assistant@example.com to schedule the site visit.', ""turn 3: Could you please create an event for a 'Client Meeting'? The discussion will be about contract details at Downtown Office from 1700600000000 to 1700603600000. -> Your calendar now includes 'Client Meeting'—Discussion about contract details at Downtown Office, 1700600000000–1700603600000. Check it here: content://calendar/event/9"", 'turn 4: Open content://calendar/event/9. -> Client Meeting – Contract details discussion at Downtown Office on November 13, 11:00\xa0AM–12:00\xa0PM.']"	Give me directions to that location	Give me directions to 500 Terry Francois Blvd, San Francisco, CA 94158, USA location	{'plan': 'ACTION_NAVIGATE_TO_LOCATION', 'arguments': {'location': '500 Terry Francois Blvd, San Francisco, CA 94158, USA'}}	search_location-1138-send_email-1-ACTION_INSERT_EVENT-1_NR-ACTION_VIEW_EVENT-1-ACTION_NAVIGATE_TO_LOCATION-1	3	['ACTION_SET_TIMER', 'ACTION_NAVIGATE_TO_LOCATION', 'ACTION_CREATE_DOCUMENT', 'ACTION_INSERT_CONTACT', 'ACTION_EDIT_DOCUMENT']
"['turn 1: Read out my alarm list, please. -> Here’s your alarm lineup: [alarm_id: 1 - 6:00 AM, Morning Run; alarm_id: 2 - 6:15 AM, Meditate; alarm_id: 3 - 6:45 AM, Breakfast; alarm_id: 4 - 7:30 AM, Office]', ""turn 2: Keep 'alarm_id: 4 - 7:30 AM, Office' at the same time but use the silent ringtone and set it without confirmation -> Alarm 4 'Office' remains at 7:30 AM with the silent ringtone enabled."", ""turn 3: Add an event named 'Dance Class' for a hip-hop session at City Dance Studio. It should start at 1700800000000 and end at 1700805400000. -> Got it! 'Dance Class' (Hip‑hop session) at City Dance Studio from 1700800000000 to 1700805400000 has been added. (content://calendar/event/8)"", 'turn 4: Where is City Dance Studio located on the map? -> You can find City Dance Studio at 33 Dance Ln, Springfield, IL 62704.']"	Direct me there	Direct me to 33 Dance Ln, Springfield, IL 62704	{'plan': 'ACTION_NAVIGATE_TO_LOCATION', 'arguments': {'location': '33 Dance Ln, Springfield, IL 62704'}}	ACTION_SHOW_ALARMS-695-ACTION_EDIT_ALARM-1-ACTION_INSERT_EVENT-1_NR-search_location-1-ACTION_NAVIGATE_TO_LOCATION-1	3	['ACTION_NAVIGATE_TO_LOCATION', 'ACTION_INSERT_EVENT', 'ACTION_VIEW_WEB_HISTORY', 'ACTION_GET_RINGTONE', 'send_message']
"['turn 1: Launch internal storage settings so I can free up some space. -> Internal storage settings opened successfully. You can now free up space.', 'turn 2: Search for a coffee shop nearby -> Got it! There’s a coffee shop called Café Aroma at 58 Maple Avenue, Springfield.', ""turn 3: Set a meeting at 58 Maple Avenue, Springfield next Monday at 10 AM titled Coffee Break with description Catch up over coffee ending at 11 AM -> All set! Your 'Coffee Break' event is scheduled next Monday, 10:00 AM–11:00 AM at 58 Maple Avenue, Springfield. Check it out: content://calendar/event/2"", 'turn 4: Could you map 58 Maple Avenue, Springfield? -> Here’s 58 Maple Avenue on the map: 58 Maple Avenue, Springfield, IL 62701, USA.']"	Get directions to that address	Get directions to 58 Maple Avenue, Springfield, IL 62701, USA address	{'plan': 'ACTION_NAVIGATE_TO_LOCATION', 'arguments': {'location': '58 Maple Avenue, Springfield, IL 62701, USA'}}	open_settings-1087-search_location-1-ACTION_INSERT_EVENT-1-search_location-1-ACTION_NAVIGATE_TO_LOCATION-1	3	['ACTION_EDIT_CONTACT', 'ACTION_SHOW_ALARMS', 'search_location', 'ACTION_SHOW_TIMERS', 'ACTION_NAVIGATE_TO_LOCATION']
['turn 1: Create an XML config file named settings.xml. -> Your XML file settings.xml is now available at content://documents/settings.xml.', 'turn 2: Boot up the digital camera app for taking a static image. -> Still image camera is up. Ready to shoot.', 'turn 3: Show me the photo I just captured -> Photo you captured moments ago: content://temp/photo131.jpg', 'turn 4: Mute content://temp/photo131.jpg -> Audio stripped from your video! Download the muted file here: content://media/edited_photo131_009.mp4.']	Save that image as a JPEG document named MyCapturedPhoto.jpg	Save content://media/edited_photo131_009.mp4 as a JPEG document named MyCapturedPhoto.jpg	{'plan': 'ACTION_CREATE_DOCUMENT', 'arguments': {'mime_type': 'image/jpeg', 'initial_name': 'MyCapturedPhoto.jpg'}}	ACTION_CREATE_DOCUMENT-14-INTENT_ACTION_STILL_IMAGE_CAMERA-1_NR-ACTION_GET_CONTENT-1-ACTION_EDIT_VIDEO-1-ACTION_CREATE_DOCUMENT-1	3	['ACTION_VIEW_WEB_HISTORY', 'ACTION_EDIT_ALARM', 'ACTION_OPEN_CONTENT', 'ACTION_IMAGE_CAPTURE', 'ACTION_CREATE_DOCUMENT']
['turn 1: Use audio 60 from documents: content://com.android.providers.media.documents/document/audio%3A60 -> Your ringtone has been set to audio ID 60 from Documents.', 'turn 2: I require the still photo function active; please start it. -> Your camera is now open for taking still photos.', 'turn 3: Get the photo I just snapped. -> Your photo is here: content://temp/photo133.jpg', 'turn 4: Trim content://temp/photo133.jpg to start at 10s and end at 1 minute -> All done! Your trimmed clip (10s–60s) is ready: content://media/edited_video_701.mp4']	Save that photo as a new JPEG document named SnappedPhoto.jpg	Save content://temp/photo133.jpg as a new JPEG document named SnappedPhoto.jpg	{'plan': 'ACTION_CREATE_DOCUMENT', 'arguments': {'mime_type': 'image/jpeg', 'initial_name': 'SnappedPhoto.jpg'}}	ACTION_SET_RINGTONE-1605-INTENT_ACTION_STILL_IMAGE_CAMERA-1_NR-ACTION_GET_CONTENT-1-ACTION_EDIT_VIDEO-1-ACTION_CREATE_DOCUMENT-1	3	['ACTION_CREATE_DOCUMENT', 'ACTION_VIEW_RECENT_APPS', 'web_search', 'ACTION_VIDEO_CAPTURE', 'ACTION_SHOW_ALARMS']
"['turn 1: Can I browse my ringtones to pick one for the timer alert? -> Certainly—browsing your ringtones now for your timer alert selection.', 'turn 2: Execute the still photo mode for snapping a picture. -> Photo mode activated. The still camera is ready.', 'turn 3: Select the last three images I captured -> All set! The last three images are ready: [content://temp/capture1.jpg, content://temp/capture2.jpg, content://temp/capture3.jpg]', ""turn 4: Combine content://temp/capture1.jpg, content://temp/capture2.jpg, content://temp/capture3.jpg into a PDF named LastThreeImages.pdf -> Here you go—'LastThreeImages.pdf' combining your photos is ready at content://documents/LastThreeImages.pdf.""]"	Save those images into a new PDF document named LastThreeCaptures.pdf	Save content://temp/capture1.jpg, content://temp/capture2.jpg, content://temp/capture3.jpg into a new PDF document named LastThreeCaptures.pdf	{'plan': 'ACTION_CREATE_DOCUMENT', 'arguments': {'mime_type': 'application/pdf', 'initial_name': 'LastThreeCaptures.pdf'}}	ACTION_GET_RINGTONE-321-INTENT_ACTION_STILL_IMAGE_CAMERA-1_NR-ACTION_GET_CONTENT-1-ACTION_CREATE_DOCUMENT-1-ACTION_CREATE_DOCUMENT-1	3	['play_video', 'ACTION_SET_ALARM', 'ACTION_CREATE_DOCUMENT', 'ACTION_VIDEO_CAPTURE', 'ACTION_SHOW_TIMERS']
"[""turn 1: Reschedule alarm 37 to 09:09, choose ringtone uri://classic, keep vibrate. -> Got it! Alarm 37 is now set for 09:09 with the 'classic' ringtone (uri://classic) and vibration enabled."", 'turn 2: I need to shoot some video footage; please open the video camera function. -> Video camera launched successfully. You can start recording your footage now.', 'turn 3: Select the footage I just recorded for sharing -> Done—here’s your latest footage, ready to share: content://camera/DCIM/VID_0456.mp4', 'turn 4: Trim content://camera/DCIM/VID_0456.mp4 from 10 seconds to 1 minute -> Your trimmed clip (00:10–01:00) is ready at content://camera/DCIM/VID_0456_trim.mp4.']"	Store that footage in a new document named SharedFootage.mp4	Store content://camera/DCIM/VID_0456_trim.mp4 in a new document named SharedFootage.mp4	{'plan': 'ACTION_CREATE_DOCUMENT', 'arguments': {'mime_type': 'video/mp4', 'initial_name': 'SharedFootage.mp4'}}	ACTION_EDIT_ALARM-1671-INTENT_ACTION_VIDEO_CAMERA-1_NR-ACTION_GET_CONTENT-1-ACTION_EDIT_VIDEO-1-ACTION_CREATE_DOCUMENT-1	3	['ACTION_OPEN_DOCUMENT', 'ACTION_CREATE_DOCUMENT', 'send_message', 'INTENT_ACTION_VIDEO_CAMERA', 'ACTION_SET_ALARM']
"['turn 1: Could you forward me the annual report at file:///annual_report.pdf to cfo@enterprise.com? -> Annual report forwarded to cfo@enterprise.com successfully.', 'turn 2: Begin the photo capturing tool on my device as a still image camera. -> Still image camera is open—ready for your picture.', 'turn 3: Choose the most recent photo from my gallery. -> On it! Selected the most recent gallery photo: content://temp/photo_latest.jpg', ""turn 4: Create a new text document named PhotoNote.txt -> Your text file 'PhotoNote.txt' has been successfully created at content://documents/PhotoNote.txt.""]"	Save that photo as a new document named PhotoCopy.jpg	Save content://temp/photo_latest.jpg as a new document named PhotoCopy.jpg	{'plan': 'ACTION_CREATE_DOCUMENT', 'arguments': {'mime_type': 'image/jpeg', 'initial_name': 'PhotoCopy.jpg'}}	send_email-1220-INTENT_ACTION_STILL_IMAGE_CAMERA-1_NR-ACTION_GET_CONTENT-1-ACTION_CREATE_DOCUMENT-1-ACTION_CREATE_DOCUMENT-1	3	['ACTION_SHOW_ALARMS', 'ACTION_IMAGE_CAPTURE', 'ACTION_CREATE_DOCUMENT', 'open_settings', 'ACTION_OPEN_CONTENT']
"[""turn 1: View 'Acoustic Morning'. -> Opening 'Acoustic Morning': Banana Pancakes; Better Together; Heartbeats."", 'turn 2: Kick off the still photo app on my device. -> Still photo mode opened successfully.', ""turn 3: Show me the latest picture from my camera roll -> All set! I've grabbed your most recent image: content://temp/last_photo.jpg"", ""turn 4: Save content://temp/last_photo.jpg as a PDF named MyLatestPhoto.pdf -> Done—I've created 'MyLatestPhoto.pdf' at content://documents/MyLatestPhoto.pdf.""]"	Save that into a PDF named CameraRollSnapshot.pdf	Save content://temp/last_photo.jpg into a PDF named CameraRollSnapshot.pdf	{'plan': 'ACTION_CREATE_DOCUMENT', 'arguments': {'mime_type': 'application/pdf', 'initial_name': 'CameraRollSnapshot.pdf'}}	ACTION_VIEW_PLAYLIST-2146-INTENT_ACTION_STILL_IMAGE_CAMERA-1_NR-ACTION_GET_CONTENT-1-ACTION_CREATE_DOCUMENT-1-ACTION_CREATE_DOCUMENT-1	3	['ACTION_VIEW_WEB_HISTORY', 'ACTION_EDIT_CONTACT', 'get_contact_info_from_uri', 'ACTION_CREATE_DOCUMENT', 'INTENT_ACTION_STILL_IMAGE_CAMERA']
"['turn 1: Invoke the video camera software. -> Video camera software is up and running.', 'turn 2: I need to open the camera in photo mode. Please launch the still image camera. -> Ready to take pictures—still image camera is now open.', 'turn 3: Select the photo I just took. -> Here’s the shot you just took: content://temp/latest_shot.jpg', ""turn 4: Create a new PDF document named LatestShot.pdf and put content://temp/latest_shot.jpg there. -> Your PDF 'LatestShot.pdf' is now ready at content://documents/LatestShot.pdf.""]"	Trim that video starting at 10000ms	Trim content://temp/latest_shot.jpg starting at 10000ms	{'plan': 'ACTION_EDIT_VIDEO', 'arguments': {'video_uri': 'content://temp/latest_shot.jpg', 'edit_options': {'start_time': 10000}}}	INTENT_ACTION_VIDEO_CAMERA-902-INTENT_ACTION_STILL_IMAGE_CAMERA-1_NR-ACTION_GET_CONTENT-1-ACTION_CREATE_DOCUMENT-1-ACTION_EDIT_VIDEO-1	3	['ACTION_EDIT_VIDEO', 'ACTION_VIEW_CONTACT', 'ACTION_OPEN_CONTENT', 'play_video', 'INTENT_ACTION_VIDEO_CAMERA']
['turn 1: Load the details for the workshop scheduled in event 1234. -> Marketing Workshop – July 20, 2024 at 9:30 AM in Innovation Center, Room 210.', 'turn 2: Commence the still picture camera so I can snap a shot. -> Your camera is open in photo mode—ready to snap!', 'turn 3: Pick the shot I just captured -> Here’s the photo you just took: content://temp/recent_photo.jpg', 'turn 4: Trim content://temp/recent_photo.jpg from 5 to 30 seconds -> Your clip from 5s to 30s is ready for preview: content://media/edited_video_708.mp4']	Trim that video to the first 15 seconds	Trim content://media/edited_video_708.mp4 to the first 15 seconds	{'plan': 'ACTION_EDIT_VIDEO', 'arguments': {'video_uri': 'content://media/edited_video_708.mp4', 'edit_options': {'start_time': 0, 'end_time': 15000}}}	ACTION_VIEW_EVENT-1799-INTENT_ACTION_STILL_IMAGE_CAMERA-1_NR-ACTION_GET_CONTENT-1-ACTION_EDIT_VIDEO-1-ACTION_EDIT_VIDEO-1	3	['dial', 'ACTION_INSERT_CONTACT', 'ACTION_EDIT_CONTACT', 'ACTION_EDIT_VIDEO', 'ACTION_SET_ALARM']
['turn 1: Invoke the video camera software. -> Video camera software is up and running.', 'turn 2: I need to open the camera in photo mode. Please launch the still image camera. -> Ready to take pictures—still image camera is now open.', 'turn 3: Select the photo I just took. -> Here’s the shot you just took: content://temp/latest_shot.jpg', 'turn 4: Open content://temp/latest_shot.jpg -> Displaying content://temp/latest_shot.jpg now.']	Trim that video to 1 minute with no audio	Trim content://temp/latest_shot.jpg to 1 minute with no audio	{'plan': 'ACTION_EDIT_VIDEO', 'arguments': {'video_uri': 'content://temp/latest_shot.jpg', 'edit_options': {'start_time': 0, 'end_time': 60000, 'mute': True}}}	INTENT_ACTION_VIDEO_CAMERA-902-INTENT_ACTION_STILL_IMAGE_CAMERA-1_NR-ACTION_GET_CONTENT-1-ACTION_OPEN_CONTENT-1-ACTION_EDIT_VIDEO-1	3	['ACTION_NAVIGATE_TO_LOCATION', 'ACTION_CREATE_DOCUMENT', 'ACTION_OPEN_CONTENT', 'get_contact_info', 'ACTION_EDIT_VIDEO']
"[""turn 1: Could you display the content of my sent folder? -> Displaying sent items: to victor@example.com - 'System Update'; to wanda@example.com - 'Team Lunch'; to xander@example.com - 'Client Meeting Notes'."", 'turn 2: Please open the app that lets me record videos on my phone. -> Sure thing—your video camera is now open. Go ahead and record.', 'turn 3: Start recording the video. -> Your video has been recorded and saved to content://media/external/video/media/1001.', 'turn 4: Trim content://media/external/video/media/1001 to the first 15 seconds. -> Your video is now a 15-second clip. You can play it here: content://media/external/video/media/1001_trim15s.mp4']"	Trim that video to the segment from 5 seconds to 30 seconds	Trim content://media/external/video/media/1001_trim15s.mp4 to the segment from 5 seconds to 30 seconds	{'plan': 'ACTION_EDIT_VIDEO', 'arguments': {'video_uri': 'content://media/external/video/media/1001_trim15s.mp4', 'edit_options': {'start_time': 5000, 'end_time': 30000}}}	ACTION_VIEW_SENT_EMAILS-1972-INTENT_ACTION_VIDEO_CAMERA-1_NR-ACTION_VIDEO_CAPTURE-1-ACTION_EDIT_VIDEO-1-ACTION_EDIT_VIDEO-1	3	['ACTION_EDIT_DOCUMENT', 'ACTION_NAVIGATE_TO_LOCATION', 'launch_application', 'ACTION_EDIT_VIDEO', 'play_video']
"[""turn 1: I'd like to pull together several text files for analysis. -> Opening text file selector—feel free to choose multiple documents."", 'turn 2: Activate the video camera function on my mobile, please. -> Video camera activated. Ready whenever you are.', 'turn 3: Record video camera for me. -> Video has been captured and saved here: content://media/external/video/media/1004.', 'turn 4: Trim content://media/external/video/media/1004 between 5 and 20 seconds. -> Here’s the segment you requested (5–20s): content://media/external/video/media/1004_5-20s.mp4']"	Trim that video from 5 seconds to 15 seconds and mute it	Trim content://media/external/video/media/1004 from 5 seconds to 15 seconds and mute it	{'plan': 'ACTION_EDIT_VIDEO', 'arguments': {'video_uri': 'content://media/external/video/media/1004', 'edit_options': {'start_time': 5000, 'end_time': 15000, 'mute': True}}}	ACTION_GET_CONTENT-202-INTENT_ACTION_VIDEO_CAMERA-1_NR-ACTION_VIDEO_CAPTURE-1-ACTION_EDIT_VIDEO-1-ACTION_EDIT_VIDEO-1	3	['ACTION_EDIT_VIDEO', 'launch_application', 'ACTION_IMAGE_CAPTURE', 'ACTION_VIEW_PLAYLIST', 'get_contact_info_from_uri']
